sentences,filename
"Risk Factors, Page 22 102-16 Values, principles, standards and norms of behavior Performance Report, Our mission and values, Page 6 Code of Conduct 102-17 Mechanisms for advice and concerns about ethics Advice Line 102-18 Governance structure Proxy Statement Governance overview 102-19 Delegating authority Proxy Statement 102-20 Executive-level responsibility for economic, environmental and social topicsPerformance Report, Our ESG strategy, Page 8 Proxy Statement 102-21 Consulting stakeholders on economic, environmental and social topicsPerformance Report, Our ESG strategy, Page 8 Performance Report Appendix, Stakeholder engagement, Page 56 102-22 Composition of the highest governance body and its committeesProxy Statement 102-23 Chair of the highest governance body Proxy Statement 102-24 Nominating and selecting the highest governance body Proxy Statement 102-25 Conflicts of interest Code of Conduct 102-26 Role of highest governance body in setting purpose, values and strategyProxy Statement 102-27 Collective knowledge of highest governance body Proxy Statement 102-28 Evaluating the highest governance body’s performance Proxy Statement 69 2021 Performance ReportIntroduction Transforming care Investing in our people Accelerating possibilities Protecting the environment Creating value responsibly Appendix Stakeholder engagement Metrics summary Global Reporting Initiative (GRI) index Sustainability Accounting Standards Board (SASB) index United Nations Sustainable Development Goals (SDGs) Indicator Description Response 102-29 Identifying and managing economic, environmental and social impactsForm 10-K, Item 1. Business, Page 3 Performance Report, Our ESG strategy, Page 8 102-30 Effectiveness of risk management processes Proxy Statement Performance Report, Risk management and global security, Page 53 102-31 Review of economic, environmental and social topics See 102-29 102-32 Highest governance body’s role in sustainability reporting Proxy Statement 102-33 Communicating critical concerns Proxy Statement 102-34 Nature and total number of critical concerns Form 10-K, Item 1A.",2021_boston_scientific_performance_report.pdf
"Risk Factors, Page 22 102-35 Remuneration policies Proxy Statement 102-36 Process for determining remuneration Proxy Statement 102-37 Stakeholders’ involvement in remuneration Proxy Statement 102-38 Annual total compensation ratio Proxy Statement 102-39 Percentage increase in annual total compensation ratio Proxy Statement 102-40 List of stakeholder groups See 102-21 102-41 Collective bargaining agreements Human Rights, Collective Bargaining 102-42 Identifying and selecting stakeholders See 102-21 102-43 Approach to stakeholder engagement See 102-21 102-44 Key topics and concerns raised Performance Report, Our ESG strategy, Page 8 102-45 Entities included in the consolidated financial statements Form 10-K, Exhibit 21 102-46 Defining report content and topic boundaries Performance Report, Table of contents, Page 3 102-47 List of material topics Performance Report, Our ESG strategy, Page 8 102-48 Restatements of information Throughout Performance Report and Performance Report Appendix 102-49 Changes in reporting Throughout Performance Report and Performance Report Appendix 102-50 Reporting period Data in the Performance Report covers the period between January 1, 2020, and December 31, 2020, unless otherwise indicated 70 2021 Performance ReportIntroduction Transforming care Investing in our people Accelerating possibilities Protecting the environment Creating value responsibly Appendix Stakeholder engagement Metrics summary Global Reporting Initiative (GRI) index Sustainability Accounting Standards Board (SASB) index United Nations Sustainable Development Goals (SDGs) Indicator Description Response 102-51 Date of most recent report 4/15/2021 2020 Annual Performance Report 102-52 Reporting cycle Annual 102-53 Contact point for questions regarding the report Investor Relations 102-54 Claims of reporting in accordance with the GRI Standards Performance Report, Table of contents, Page 3 102-55 GRI content index Performance Report Appendix 102-56 External assurance This report has not been independently verified.",2021_boston_scientific_performance_report.pdf
"GRI 200 201-1 Direct economic value generated and distributed Form 10-K, Item 8.",2021_boston_scientific_performance_report.pdf
"Financial Statements & Supplementary Data, Page 70 Performance Report, Boston Scientific: 2021 at a glance, Page 7 201-2 Financial implications and other risks and opportunities due to climate changeForm 10-K, Item 1A.",2021_boston_scientific_performance_report.pdf
"Risk Factors, Page 35 Performance Report, Managing climate risk, Page 45 201-3 Defined benefit plan obligations and other retirement plansForm 10-K, Item 15.",2021_boston_scientific_performance_report.pdf
"Exhibits and Financial Statement Schedules Note S, Page 130 202-1 Ratios of standard entry level wage by gender compared to local minimum wageLabor and Human Rights, Commitment to Labor Initiatives or Standards 203-1 Infrastructure investments and services supported Form 10-K, Item 1.",2021_boston_scientific_performance_report.pdf
"Marketing and Sales, Page 10 203-2 Significant indirect economic impacts Performance Report, Transforming care, Page 13 Performance Report, Investing in our people, Page 20 Performance Report, Accelerating possibilities, Page 31 Performance Report, Protecting the environment, Page 39 Performance Report, Creating value responsibly, Page 48 204-1 Proportion of spending on local suppliers Performance Report, Keeping our supply chain resilient and reliable, Page 52 205-1 Operations assessed for risks related to corruption Anti-Corruption & Governance 205-2 Communication and training about anti-corruption policies and proceduresPerformance Report, Compliance, ethics and integrity, Page 50 206-1 Legal actions for anti-competitive behavior, anti-trust and monopoly practicesForm 10-K, Note K. Commitments and Contingencies, Page 113 71 2021 Performance ReportIntroduction Transforming care Investing in our people Accelerating possibilities Protecting the environment Creating value responsibly Appendix Stakeholder engagement Metrics summary Global Reporting Initiative (GRI) index Sustainability Accounting Standards Board (SASB) index United Nations Sustainable Development Goals (SDGs) Indicator Description Response GRI 300 302-1 Energy consumption within the organization Performance Report, GEMS KPIs, Page 41 Performance Report Appendix, Metrics summary 302-3 Energy intensity Performance Report, GEMS KPIs, Page 41 Performance Report Appendix, Metrics summary 302-4 Reduction of energy consumption Performance Report, GEMS KPIs, Page 41 Performance Report Appendix, Metrics summary 302-5 Reductions in energy requirements of products and servicesPerformance Report, GEMS KPIs, Page 41 Performance Report, Advancing product stewardship, Page 46 Performance Report Appendix, Metrics summary 303-1 Water withdrawal Performance Report Appendix, Metrics summary 303-2 Water discharge Performance Report Appendix, Metrics summary 303-3 Water consumption Performance Report Appendix, Metrics summary 305-1 Direct (Scope 1) GHG emissions Performance Report Appendix, Metrics summary 305-2 Energy indirect (Scope 2) GHG emissions Performance Report Appendix, Metrics summary 305-5 Reduction of GHG emissions Performance Report, Protecting the environment, Page 39 Performance Report Appendix, Metrics summary 306-1 Water discharge by quality and destination Performance Report Appendix, Metrics summary 306-2 Waste by type and disposal method Performance Report Appendix, Metrics summary 306-3 Significant spills No significant spills for 2021 306-4 Transport of hazardous waste Performance Report Appendix, Metrics summary 307-1 Non-compliance with environmental laws and regulation Performance Report Appendix, Metrics summary 308-1 New suppliers that were screened using environmental criteriaPerformance Report, Creating value responsibly, Page 48 72 2021 Performance ReportIntroduction Transforming care Investing in our people Accelerating possibilities Protecting the environment Creating value responsibly Appendix Stakeholder engagement Metrics summary Global Reporting Initiative (GRI) index Sustainability Accounting Standards Board (SASB) index United Nations Sustainable Development Goals (SDGs) Indicator Description Response GRI 400 401-1 New employee hires and employee turnover Performance Report Appendix, Metrics summary 401-2 Benefits provided to full-time employees that are not provided to temporary or part-time employeesBenefits 401-3 Parental leave Benefits 403-2 Types of injury and rates of injury, occupational diseases, lost days, and absenteeism and number of work-related fatalitiesPerformance Report Appendix, Metrics summary 404-1 Average hours of training per year per employee Performance Report Appendix, Metrics summary 404-2 Programs for upgrading employee skills and transition assistance programsPerformance Report, Investing in our people, Page 20 404-3 Percentage of employees receiving regular performance and career development reviewsPerformance Report, Investing in our people, Page 20 405-1 Diversity of governance bodies and employees Proxy Statement Performance Appendix, Metrics summary 405-2 Ratio of basic salary and remuneration of women to men Performance Report, Investing in our people, Page 20 Equal Pay for Equal Work 406-1 Incidents of discrimination and corrective actions taken Compliance and Ethics 407-1 Operations and suppliers in which the right to freedom of association and collective bargaining may be at riskHuman Rights 408-1 Operations and suppliers at significant risk for incidence of child laborHuman Rights 409-1 Operations and suppliers at significant risk for incidence of forced or compulsory laborHuman Rights 411-1 Incidents of violations involving rights of indigenous peoplesHuman Rights 73 2021 Performance ReportIntroduction Transforming care Investing in our people Accelerating possibilities Protecting the environment Creating value responsibly Appendix Stakeholder engagement Metrics summary Global Reporting Initiative (GRI) index Sustainability Accounting Standards Board (SASB) index United Nations Sustainable Development Goals (SDGs) Indicator Description Response 412-1 Operations that have been subject to human rights reviews or impact assessmentsHuman Rights 412-2 Employee training on human rights policies or procedures Human Rights 413-1 Operations with local community engagement, impact assessments and development programsPerformance Report, Supporting our communities, Page 36 Community Engagement 414-1 New suppliers that were screened using social criteria Performance Report, Creating value responsibly, Page 48 415-1 Political contributions Political Contributions 416-1 Assessment of the health and safety impacts of product and service categoriesPerformance Report, Ensuring quality, health and safety, Page 17 416-2 Incidents of non-compliance concerning the health and safety impacts of products and servicesPerformance Report, Ensuring quality, health and safety, Page 17 417-1 Requirements for product and service information and labelingPerformance Report, Ensuring quality, health and safety, Page 17 Performance Report, Advancing product stewardship, Page 46 419-1 Non-compliance with laws and regulations in the social and economic areaBoston Scientific adheres to all compliance requirements, see compliance references throughout the Performance Report and BostonScientific.com 74 2021 Performance ReportIntroduction Transforming care Investing in our people Accelerating possibilities Protecting the environment Creating value responsibly Appendix Stakeholder engagement Metrics summary Global Reporting Initiative (GRI) index Sustainability Accounting Standards Board (SASB) index United Nations Sustainable Development Goals (SDGs) Topic Accounting metric Code Response Affordability and pricingRatio of weighted average rate of net price increases (for all products) to the annual increase in the U.S. Consumer Price IndexHC-MS-240a.1 Not currently disclosed Description of how price information for each product is disclosed to customers or to their agentsHC-MS-240a.2 Form 10-K, Health Care Policies and Reimbursement, Pages 13-14 Product safety Number of recalls issued, total units recalled HC-MS-250a.1 Class I recalls: 3 Class II recalls: 8 Total units recalled: 47,430 List of products listed in the FDA's MedWatch Safety Alerts for Human Medical Products databaseHC-MS-250a.2 FDA's MedWatch Safety Alerts for Human Medical Products database Number of fatalities related to products as reported in the FDA Manufacturer and User Facility Device ExperienceHC-MS-250a.3 FDA Manufacturer and User Facility Device Experience (MAUDE) database Number of FDA enforcement actions taken in response to violations of current Good Manufacturing Practices (cGMP), by typeHC-MS-250a.4 0 in 2021 Ethical marketing Total amount of monetary losses as a result of legal proceedings associated with false marketing claimsHC-MS-270a.1 $0 in 2021 Description of code of ethics governing promotion of off-label use of productsHC-MS-270a.2 Code of Conduct, Page 40; Performance Report, Creating value responsibly, Page 48Sustainability Accounting Standards Board (SASB) index SASB is an independent standards-setting organization dedicated to improving the effectiveness and comparability of corporate disclosure on ESG factors.",2021_boston_scientific_performance_report.pdf
"The following table summarizes how our existing reporting is guided by recommended disclosure topics and accounting metrics for the Medical Equipment and Supplies industry standard, and includes references to our 2021 Performance Report, 2021 Form 10-K and other documents available on BostonScientific.com.",2021_boston_scientific_performance_report.pdf
"75 2021 Performance ReportIntroduction Transforming care Investing in our people Accelerating possibilities Protecting the environment Creating value responsibly Appendix Stakeholder engagement Metrics summary Global Reporting Initiative (GRI) index Sustainability Accounting Standards Board (SASB) index United Nations Sustainable Development Goals (SDGs) Topic Accounting metric Code Response Product design and lifecycle managementDiscussion of process to assess and manage environmental and human health considerations associated with chemicals in products, and meet demand for sustainable productsHC-MS-410a.1 Boston Scientific’s commitment to innovation and patient health extends beyond the surgical suite by managing the environmental and human health impact of chemicals in our products through design, manufacture and use.",2021_boston_scientific_performance_report.pdf
Our design and supplier management processes assess and manage relevant environmental and chemical requirements.,2021_boston_scientific_performance_report.pdf
"We work with our suppliers to ensure material compliance of all purchased goods and components, allowing us to make responsible material and chemical choices for the design and manufacture of our products.",2021_boston_scientific_performance_report.pdf
"Performance Report, Advancing product stewardship, Page 46 Total amount of products accepted for take-back and reused, recycled or donated, broken down by: (1) devices and equipment (2) suppliesHC-MS-410a.2 Within participating customers: • 65% of LithoVue™ systems recycled in the United States in 2021 • 39% of EXALT™ Model D systems recycled in the United States in 2021 Performance Report, Advancing product stewardship, Page 46 Supply chain managementPercentage of (1) entity's facilities and (2) Tier I suppliers' facilities participating in third-party audit programs for manufacturing and product qualityHC-MS-430a.1 All Boston Scientific medical device manufacturing facilities are audited by external regulators or applicable authorities.",2021_boston_scientific_performance_report.pdf
"A majority of our direct suppliers are ISO certified (for example ISO 9001 or ISO 13485), as applicable, and demonstrate compliance and quality through certification audits.",2021_boston_scientific_performance_report.pdf
"Form 10-K, Quality Assurance, Page 13 Description of efforts to maintain traceability within the distribution chainHC-MS-430a.2 Boston Scientific maintains traceability within the manufacturing and distribution chain through either serial or batch control of finished products.",2021_boston_scientific_performance_report.pdf
"We: • Leverage product identification technologies, such as barcoding identification to track the information of products • Utilize enterprise resource planning (ERP) solutions to support identification and control of products once they leave manufacturing sites — including supporting specific patient tracking if required.",2021_boston_scientific_performance_report.pdf
"Our ERP solutions ensure compliance with regularity, quality and customs control requirements Description of the management of risks associated with the use of critical materialsHC-MS-430a.3 Form 10-K, Manufacturing and Raw Materials, page 11 Performance Report, Cr eating value responsibly, Page 48 Business ethics Total amount of monetary losses as a result of legal proceedings associated with bribery or corruptionHC-MS-510a.1 $0 in 2021 Description of code of ethics governing interactions with health care professionalsHC-MS-510a.2 Code of Conduct, Page 32 Performance Report, Creating value responsibly, Page 48 Activity metrics Code Response Number of units sold by product category HC-MS-000.A Not currently disclosed 76 2021 Performance ReportIntroduction Transforming care Investing in our people Accelerating possibilities Protecting the environment Creating value responsibly Appendix Stakeholder engagement Metrics summary Global Reporting Initiative (GRI) index Sustainability Accounting Standards Board (SASB) index United Nations Sustainable Development Goals (SDGs) Transforming care Investing in our people Accelerating possibilities Protecting the environment Creating value responsibly United Nations Sustainable Development Goals (SDGs) The United Nations Sustainable Development Goals (SDGs) are a set of 17 global goals with the aim to end poverty, fight inequality and injustice and tackle climate change by 2030.",2021_boston_scientific_performance_report.pdf
The following table summarizes how our reporting aligns with the SDGs.,2021_boston_scientific_performance_report.pdf
More information on our priorities can also be found in Our ESG strategy .,2021_boston_scientific_performance_report.pdf
77 2021 Performance ReportIntroduction Transforming care Investing in our people Accelerating possibilities Protecting the environment Creating value responsibly Appendix Stakeholder engagement Metrics summary Global Reporting Initiative (GRI) index Sustainability Accounting Standards Board (SASB) index United Nations Sustainable Development Goals (SDGs) Cautionary Statement Regarding Forward-Looking Statements This report contains forward-looking statements within the meaning of Section 27A of the Securities Act of 1933 and Section 21E of the Securities Exchange Act of 1934.,2021_boston_scientific_performance_report.pdf
"Forward-looking statements may be identified by words like “anticipate,” “expect,” “project,” “believe,” “plan,” “may,” “estimate,” “intend” and similar words.",2021_boston_scientific_performance_report.pdf
"These forward-looking statements are based on our beliefs, assumptions and estimates using information available to us at the time and are not intended to be guarantees of future events or performance.",2021_boston_scientific_performance_report.pdf
"These forward-looking statements include, among other things, statements regarding our expected net sales; reported, operational and organic revenue growth rates; reported and adjusted EPS for the second quarter and full year 2022; our financial performance; our business and environmental, social and governance (ESG) plans, performance and goals; product performance; and the impact of the COVID-19 pandemic on the company’s results of operations.",2021_boston_scientific_performance_report.pdf
"If our underlying assumptions turn out to be incorrect, or if certain risks or uncertainties materialize, actual results could vary materially from the expectations and projections expressed or implied by our forward-looking statements.",2021_boston_scientific_performance_report.pdf
"These factors, in some cases, have affected and in the future (together with other factors) could affect our ability to implement our business strategy and may cause actual results to differ materially from those contemplated by the statements expressed in this report.",2021_boston_scientific_performance_report.pdf
"As a result, readers are cautioned not to place undue reliance on any of our forward-looking statements.",2021_boston_scientific_performance_report.pdf
"Risks and uncertainties that may cause such differences include, among other things: the impact of the ongoing COVID-19 pandemic on our operations and financial results; future U.S. and global economic, political, competitive, reimbursement and regulatory conditions; manufacturing, distribution and supply chain disruptions and cost increases; disruptions caused by cybersecurity events; disruptions caused by extreme weather or other climate change-related events; labor shortages and increases in labor costs; new product introductions; expected procedural volumes; the closing and integration of acquisitions; demographic trends; intellectual property rights; litigation; financial market conditions; the execution and effect of our business strategy, including our cost-savings and growth initiatives; and future business decisions made by us and our competitors.",2021_boston_scientific_performance_report.pdf
"New risks and uncertainties may arise from time to time and are difficult to predict, including those that have emerged or have increased in significance or likelihood as a result of the COVID-19 pandemic.",2021_boston_scientific_performance_report.pdf
All of these factors are difficult or impossible to predict accurately and many of them are beyond our control.,2021_boston_scientific_performance_report.pdf
"For a further list and description of these and other important risks and uncertainties that may affect our future operations, see Part I, Item 1A — Risk Factors in our most recent Annual Report on Form 10-K filed with the Securities and Exchange Commission, which we may update in Part II, Item 1A — Risk Factors in Quarterly Reports on Form 10-Q we have filed or will file hereafter.",2021_boston_scientific_performance_report.pdf
"We disclaim any intention or obligation to publicly update or revise any forward-looking statements to reflect any change in our expectations or in events, conditions or circumstances on which those expectations may be based, or that may affect the likelihood that actual results will differ from those contained in the forward-looking statements.",2021_boston_scientific_performance_report.pdf
This cautionary statement is applicable to all forward-looking statements contained in this report.,2021_boston_scientific_performance_report.pdf
All images are the property of Boston Scientific.,2021_boston_scientific_performance_report.pdf
All trademarks are the property of their respective owners.,2021_boston_scientific_performance_report.pdf
© 2022 Boston Scientific Corporation or its affiliates.,2021_boston_scientific_performance_report.pdf
All rights reserved.,2021_boston_scientific_performance_report.pdf
PR2021,2021_boston_scientific_performance_report.pdf
"2019 Boston Scientific Performance Report Foreword April 13, 2020 As we publish this report, the world is facing unprecedented challenges amid the COVID - 19 pandemic.",2019_Boston_Scientific_Performance_Report.pdf
"During this uncertain time, our priority is to protect and aid the health and safety of our employees, our physician customers and their patients.",2019_Boston_Scientific_Performance_Report.pdf
That has always meant ensuring that o ur life - changing devices and therapies would be available when needed.,2019_Boston_Scientific_Performance_Report.pdf
"Now, it also means finding new and creative ways to support the frontline healthcar e p roviders working tirelessly to address the COVID - 19 pandemic.",2019_Boston_Scientific_Performance_Report.pdf
We will continue to make decisions guided by our core values to support our global community.,2019_Boston_Scientific_Performance_Report.pdf
"To help meet the urgent needs of healthcare providers, we have contributed to COVID - 19 relief efforts globally through monetary and supply donations, and by providing engineering and manufacturing expertise and resources.",2019_Boston_Scientific_Performance_Report.pdf
This includes donations of personal protective equipment and me dical equipment to local hospitals and government agencies.,2019_Boston_Scientific_Performance_Report.pdf
"The company is also providing support to children, families and the most vulnerable through d irect financial contributions to community and global non - profit organizations including Project HOPE and International Federation of Red Cross and Red Crescent Societies .",2019_Boston_Scientific_Performance_Report.pdf
It will take time for nations and local communities to heal from the devastating and wide - ranging impact of this complex situati on.,2019_Boston_Scientific_Performance_Report.pdf
"At Boston Scientific, we have always found our purpose in working alongside healthcare providers to solve some of healthcare’s toughest challenges.",2019_Boston_Scientific_Performance_Report.pdf
