sentences,filename
"Many people who were impacted by Hurricane Maria in September 2017 continued to benefit from this fund in 2018, with Boston Scientific employees and the company donating $810,000 in 2018, adding to the more than $4 million given in 2017.",Boston_Scientific_Performance_Report_2018.pdf
"Possibility Grants In 2018, Boston Scientific offered Massachusetts and Minnesota employees the opportunity to nominate local non-profits for Possibility Grants intended to help solve a significant problem in a local community.",Boston_Scientific_Performance_Report_2018.pdf
"Ten award winners received a total of nearly $14,000 to support projects and programs including a new indoor arena for a therapeutic horseback riding program for young adults with special needs, a middle school garden and compost program, and new computers for a teen crisis center.",Boston_Scientific_Performance_Report_2018.pdf
"GIVING BACK TO OUR COMMUNITIES In 2018, our global network of Boston Scientific employee volunteers raised awareness through more than 600 community engagement events in 33 countries.",Boston_Scientific_Performance_Report_2018.pdf
We have an awards program to recognize outstanding employee volunteers and received more than 250 nominations highlighting the work of employees who are making a difference through culturally and locally relevant community service.,Boston_Scientific_Performance_Report_2018.pdf
We also help communities in need through the Boston Scientific Employee Matching Gifts Program and the Employee Disaster Relief Fund.,Boston_Scientific_Performance_Report_2018.pdf
"Through our Employee Matching Gifts Program, employees can contribute to a cause they care about with Boston Scientific matching their gift.",Boston_Scientific_Performance_Report_2018.pdf
"In 2018, we provided $8.9 million in charitable contributions to support communities around the world, targeted mostly to health and education efforts.",Boston_Scientific_Performance_Report_2018.pdf
"In addition, we provided over $72 million in funding for research and education efforts across a wide category of health and disease Living Our Caring Value: 43,000+ hours volunteering in our communities 8,500+ employee volunteers around the world 600+ employee volunteering events worldwide Boston Scientific volunteers in Maple Grove, Minnesota, participated in an event called Free Bikes for Kids to benefit local children.",Boston_Scientific_Performance_Report_2018.pdf
"BOSTON SCIENTIFIC 2018 PERFORMANCE REPORT p.42 OUR PRACTICES OUR PRACTICES BOSTON SCIENTIFIC 2018 PERFORMANCE REPORT p.43 As we work together to advance science for life, the quality and safety of our products and services is our top priority.",Boston_Scientific_Performance_Report_2018.pdf
"We are committed to applying safe, ethical and sustainable business practices in all that we do to make a meaningful difference in the lives of patients and their families.",Boston_Scientific_Performance_Report_2018.pdf
"WORKING RESPONSIBLY We work responsibly to research, develop, man- ufacture and deliver our innovative products with our commitment to strong corporate governance, impeccable ethics and compliance with industry regulations.",Boston_Scientific_Performance_Report_2018.pdf
GOVERNANCE Boston Scientific is committed to doing business with integrity and honesty.,Boston_Scientific_Performance_Report_2018.pdf
"An ethical workplace and governing structure begins with our Board of OUR PRACTICES Directors and executive leadership, who oversee the implementation of guidelines to ensure we act ethically in our business practices, comply with local tax and business laws and regulations, and remain transparent in our reporting.",Boston_Scientific_Performance_Report_2018.pdf
"All of our employees are responsible for applying these guidelines to interactions with customers, suppliers and investors, and in the communities in which we operate.",Boston_Scientific_Performance_Report_2018.pdf
Our Board maintains charters for governing its committees.,Boston_Scientific_Performance_Report_2018.pdf
"The current committees of the Board are the Audit Committee, Executive Compensation and Human Resources Committee, Finance Committee, and Nominating and Governance Committee.",Boston_Scientific_Performance_Report_2018.pdf
A nominating and governance committee reviews our Board composition and committee membership annually to ensure it reflects the needs of our diverse stakeholders.,Boston_Scientific_Performance_Report_2018.pdf
Risk management is essential to our governance.,Boston_Scientific_Performance_Report_2018.pdf
"Our Board oversees an Enterprise Risk Management program, which identifies strategic, operational, financial, legal and compliance risks so we can anticipate and adapt to potential challenges.",Boston_Scientific_Performance_Report_2018.pdf
"We continually evaluate our corporate governance guidelines, committee charters and Code of Conduct, taking into consideration relevant laws, regulations and listing requirements, as well as best practices suggested by recognized governance authorities.",Boston_Scientific_Performance_Report_2018.pdf
"OUR PRACTICES BOSTON SCIENTIFIC 2018 PERFORMANCE REPORT p.44 COMPLIANCE, ETHICS AND INTEGRITY Our company values underpin our commitment to ethical and honest business practices in everything we do.",Boston_Scientific_Performance_Report_2018.pdf
"Our employees are expected to: Act honestly and ethically in all company matters Protect the privacy of patients, customers and employees Treat each other with respect and fairness Hold each other accountable to ensure quality in all that we do The Global Compliance team, led by our chief compliance officer, supports the company’s world- wide culture of compliance and ethics through partnerships and collaboration with commercial team members and other key stakeholders.",Boston_Scientific_Performance_Report_2018.pdf
The chief compliance officer reports quarterly to the audit committee of the Board of Directors.,Boston_Scientific_Performance_Report_2018.pdf
"Code of Conduct for Employees and Channel Partners Boston Scientific strives to comply with applicable laws in every relationship, every day.",Boston_Scientific_Performance_Report_2018.pdf
Our Code of Conduct is the foundation for our existing policies and must be read and fully understood by every employee.,Boston_Scientific_Performance_Report_2018.pdf
"Additionally, we have multiple training curriculums which are required for all employees.",Boston_Scientific_Performance_Report_2018.pdf
"Our Code of Conduct training curriculum provides ongoing education to employees on our policies, corruption and compliance-related risks, and resources for asking questions and reporting concerns.",Boston_Scientific_Performance_Report_2018.pdf
"It also features real-life, scenario-based content.Our U.S.",Boston_Scientific_Performance_Report_2018.pdf
"Customer Interactions training provides guidance on the laws, policies, principles and processes for interacting with healthcare professionals licensed to practice in the U. S. Our anti-corruption training course reviews the compliance requirements for interacting with healthcare professionals, public officials and other third parties, such as our channel partners (e.g., distributors, dealers and agents) outside of the U.S. Our Channel Partner Code of Conduct sets forth expectations for our channel partners (i.e., distributors, dealers and agents) doing business on our behalf.",Boston_Scientific_Performance_Report_2018.pdf
All channel partners annually certify adherence to the Boston Scientific and Channel Partner Codes of Conduct as part of on-boarding or renewal procedures as well as complete mandatory training.,Boston_Scientific_Performance_Report_2018.pdf
"Boston Scientific requires channel partners to abide by anti-bribery and anti-corruption laws, such as the U.S. Foreign Corrupt Practices Act, the U.K.",Boston_Scientific_Performance_Report_2018.pdf
Bribery Act and other national laws.,Boston_Scientific_Performance_Report_2018.pdf
"We monitor and support our channel partners through our Third Party Program, which includes on-site auditing and other procedures that validate channel partners’ compliance with our requirements.",Boston_Scientific_Performance_Report_2018.pdf
"Compliance Program We have a comprehensive compliance program to prevent, detect and respond, if needed, to conduct that does not align to our Code of Conduct.",Boston_Scientific_Performance_Report_2018.pdf
"Our program also includes periodic assessments of our compliance program’s effectiveness and an annual risk assessment, using internal and external inputs, to determine strategic focus areas across all elements of our compliance program.",Boston_Scientific_Performance_Report_2018.pdf
"Boston Scientific Advice Line We encourage employees to ask questions and report concerns, including anything that conflicts with our Code of Conduct, through our advice line, which is operated by a third party and available 24 hours a day in multiple languages.",Boston_Scientific_Performance_Report_2018.pdf
"Our Non-Retaliation Policy prohibits any form of retaliation, direct or indirect, against an individual who raises a concern in good faith.",Boston_Scientific_Performance_Report_2018.pdf
"This policy extends to anyone who assists with, or cooperates in, an investigation or report of misconduct.EMPLOYEE EXPECTATIONS: Act honestly and ethically.",Boston_Scientific_Performance_Report_2018.pdf
"Protect privacy of patients, customers and employees.",Boston_Scientific_Performance_Report_2018.pdf
Be respectful and fair.,Boston_Scientific_Performance_Report_2018.pdf
"Hold each other accountable, to ensure quality in all we do.",Boston_Scientific_Performance_Report_2018.pdf
OUR PRACTICES BOSTON SCIENTIFIC 2018 PERFORMANCE REPORT p.45 DEVELOPING INNOVATIVE PRODUCTS It takes an unwavering focus to deliver life-changing treatments.,Boston_Scientific_Performance_Report_2018.pdf
"We foster an environment of creativity to transform new ideas into breakthrough services and solutions that create value for patients, customers and employees.",Boston_Scientific_Performance_Report_2018.pdf
"Our teams collaborate internally and externally to solve the challenges that matter most, always with a focus on patients.",Boston_Scientific_Performance_Report_2018.pdf
"Our Global Approach to Innovation Boston Scientific new product development teams follow the Product Life Cycle Process (PLCP), a global process that integrates business, technical and quality system tasks to drive innovative product ideas from strategy through commercialization to product end-of-life.",Boston_Scientific_Performance_Report_2018.pdf
"This methodology helps us share experience and knowledge across the company and ensures a consistent, quality-focused approach to new products and services.",Boston_Scientific_Performance_Report_2018.pdf
"To better meet the needs of patients and customers in global markets, we have research and development sites in the United States, European Union, Costa Rica, India and China.",Boston_Scientific_Performance_Report_2018.pdf
These sites help us closely align our R&D teams designing products with our manufacturing teams building products.,Boston_Scientific_Performance_Report_2018.pdf
"In addition, our R&D Centers of Excellence help us share expertise and capabilities across our global product development network.",Boston_Scientific_Performance_Report_2018.pdf
Pre-Clinical Sciences Boston Scientific conducts pre-clinical research to investigate and demonstrate the safety and efficacy of our medical device products prior to human clinical trials and use.,Boston_Scientific_Performance_Report_2018.pdf
"To ensure excellence in our pre-clinical research and science, our policies set standards to be certain that we are consistently pursuing product efficacy, fulfilling regulatory requirements and engaging in essential training.",Boston_Scientific_Performance_Report_2018.pdf
"At times, to ensure we meet our obligations of safety in new products and therapies, animal testing is utilized and serves as an important component of our research and development efforts.",Boston_Scientific_Performance_Report_2018.pdf
The FDA may require evidence from pre-clinical testing prior to commencing human clinical trials.,Boston_Scientific_Performance_Report_2018.pdf
"We are committed to the humane care and treatment of laboratory animals, and use alternative testing whenever such methods are feasible, scientifically valid and appropriate.",Boston_Scientific_Performance_Report_2018.pdf
"Our pre-clinical research personnel are highly trained with multiple certifications and our facilities meet or exceed applicable laws and regulatory authority requirements, guidelines and standards.",Boston_Scientific_Performance_Report_2018.pdf
"Finally, we are routinely audited by our own internal experts and relevant government agencies including FDA, USDA and AAALAC.",Boston_Scientific_Performance_Report_2018.pdf
Clinical Trials Advancing our product pipeline to include new and expanded indications requires a commitment to leading transformative and innovative science.,Boston_Scientific_Performance_Report_2018.pdf
Clinical trials are critical to our assurance that the products we offer are of the highest quality and safety.,Boston_Scientific_Performance_Report_2018.pdf
"We conduct trials in accordance with international and national regulatory requirements with dedication to our quality systems, which are designed for legal and regulatory compliance, as well as for enhancing delivery of global trial operations.",Boston_Scientific_Performance_Report_2018.pdf
"In 2018, we invested in operational enhancements that will prepare our trials for compliance with the General Data Protection Regulation, E.U.",Boston_Scientific_Performance_Report_2018.pdf
Medical Device Regulation and Risk-Based Monitoring as well as additional enhancements to drive ISO (International Standards Organization) and operational excellence.,Boston_Scientific_Performance_Report_2018.pdf
"CLINICAL STUDIES AT A GLANCE: There were 150 active clinical studies in 2018, including more than 55,000 patients globally.Recognize Development Excellence is an annual Boston Scientific program that recognizes and rewards cross-functional teams who develop meaningful innovations for patients, customers and company.Now in its fourth year, the Boston Scientific Connected Patient Challenge is an open competition to promote the development of meaningful innovation to address complex healthcare challenges.",Boston_Scientific_Performance_Report_2018.pdf
"The 2018 competition, co-sponsored by Google Cloud, focused on the role of the Internet of Things in influencing patient outcomes.",Boston_Scientific_Performance_Report_2018.pdf
"The winner, XcellCure, a startup biotechnology company, developed the AmiAware cardiac microarray concept to detect early warning signs of a heart attack in patients with chest pain.",Boston_Scientific_Performance_Report_2018.pdf
The award enabled the company to further develop the platform and clinical strategy.,Boston_Scientific_Performance_Report_2018.pdf
Boston Scientific leaders demonstrate their commitment to innovation though the ImagineIF Innovation Fund.,Boston_Scientific_Performance_Report_2018.pdf
Employees are encouraged to participate in a venture-style contest that solicits breakthrough ideas across the organization.,Boston_Scientific_Performance_Report_2018.pdf
This program helps to continuously reinforce our meaningful innovation core value.,Boston_Scientific_Performance_Report_2018.pdf
"Since the 2014 launch, we’ve funded more than 50 projects.",Boston_Scientific_Performance_Report_2018.pdf
"Focus on Innovation Celebrating Our Teams Recognizing Development Excellence Improving Patient Care with Digital Health OUR PRACTICES BOSTON SCIENTIFIC 2018 PERFORMANCE REPORT p.46RECOGNITION FOR INNOVATION EXCELLENCE IN 2018 Forbes Most Innovative Companies: Boston Scientific named to Forbes' list of The World's Most Innovative Companies Clarivate: Boston Scientific recognized for the third consecutive year as a Derwent Top 100 Global Innovator by Clarivate Analytics Prix Galien: The Boston Scientific WATCHMAN™ Left Atrial Appendage Closure (LAAC) Device received the Prix Galien USA 2018 Award for Best Medical Technology, one of the global health innovation industry’s most prized honors Every employee makes an impact on the quality of patient care and has an opportunity to innovate so that we can keep improving.",Boston_Scientific_Performance_Report_2018.pdf
We will never be satisfied with the status quo.,Boston_Scientific_Performance_Report_2018.pdf
OUR PRACTICES BOSTON SCIENTIFIC 2018 PERFORMANCE REPORT p.47 Collaborating on Solutions to Improve Patient Care The Boston Scientific ADVANTICS™ Innovative Healthcare Solutions portfolio helps customers solve complex challenges.,Boston_Scientific_Performance_Report_2018.pdf
"Using clinical and operational expertise, our team works together with cardiovascular staff to improve the patient experience, grow their Structural Heart programs and optimize cardiovascular lab performance.",Boston_Scientific_Performance_Report_2018.pdf
"Recent collaborations include: A 300+ bed hospital that offers advanced services in cardiovascular medicine where we identified improvement opportunities within the Structural Heart program, including increasing patient access to care and efficiency of care.",Boston_Scientific_Performance_Report_2018.pdf
"As a result, the hospital has been able to treat more patients who benefited from a streamlined referral process and operational improvements.",Boston_Scientific_Performance_Report_2018.pdf
A 500+ bed hospital where we facilitated same-day discharges for patients who under - went percutaneous coronary intervention (PCI).,Boston_Scientific_Performance_Report_2018.pdf
"Within 12 months, more than 30 percent of patients who would have previously required an overnight stay were discharged the same day and able to recover in the comfort of their own homes.",Boston_Scientific_Performance_Report_2018.pdf
"This resulted in decreased costs and increased inpatient bed capacity.QUALITY AND SAFETY Quality is integrated into every aspect of our work to ensure we design, test, manufacture and distribute high-quality, safe and effective devices.",Boston_Scientific_Performance_Report_2018.pdf
"Our commitment to quality begins with our Quality Policy, a one-line statement that is highly visible in our facilities: “I improve the quality of patient care and all things Boston Scientific.” This commitment is supported by Quality Systems Basics training for all Boston Scientific employees.",Boston_Scientific_Performance_Report_2018.pdf
"The following key elements are included in our approach to quality: A Quality Master Plan that helps us strategically plan and prioritize quality improvement projects that emphasize prevention and will lead to higher quality products, with better patient outcomes and fewer customer complaints A strategy we call Best4, with the goal of delivering industry-leading performance in (1) compliance, (2) outcomes, (3) efficiency and (4) agility A Global Quality System that integrates customer feedback and regulatory requirements into our processesFocus on Quality: Connecting our teams to customers and patients Annual employee events are held at Boston Scientific sites to celebrate the impact our work has on improving the quality of patient care.",Boston_Scientific_Performance_Report_2018.pdf
"The theme of these events is “Everyone Makes an Impact,” reinforcing the importance of every employee’s role.",Boston_Scientific_Performance_Report_2018.pdf
"Patients and physicians attend as guest speakers to share personal experiences, and employees participate in activities to reaffirm their commitment to the Boston Scientific Quality Policy.",Boston_Scientific_Performance_Report_2018.pdf
"OUR PRACTICES BOSTON SCIENTIFIC 2018 PERFORMANCE REPORT p.48 Our Quality Mission, ""We exceed expectations with customer-centric quality solutions that transform patient lives,"" is at the forefront of our product development process and complements our Quality Policy.",Boston_Scientific_Performance_Report_2018.pdf
"Our Global Design Controls process, integrated with Risk Management and Usability Engineering helps us leverage complex technologies to create safe and effective solutions.",Boston_Scientific_Performance_Report_2018.pdf
We use an iterative process that centers on the needs of the final user at every stage of design and development.,Boston_Scientific_Performance_Report_2018.pdf
Our employees are encouraged to spend time outside our offices to observe procedures and talk to patients as well as healthcare providers.,Boston_Scientific_Performance_Report_2018.pdf
A key aspect of product quality includes the materials used in our manufacturing processes.,Boston_Scientific_Performance_Report_2018.pdf
"Boston Scientific has globally harmonized processes and systems to provide an efficient, flexible and comprehensive approach to compliance with medical, environmental and other material regulations.",Boston_Scientific_Performance_Report_2018.pdf
This includes component material and device material assessment.,Boston_Scientific_Performance_Report_2018.pdf
We carefully select the materials used in our products as well as our suppliers so that we can provide safe and effective solutions.,Boston_Scientific_Performance_Report_2018.pdf
"Our teams continually monitor and comply with global regulations to ensure our products continue to meet all applicable requirements.Continually Improving with Quality Initiatives Each year we undertake several targeted quality and compliance initiatives to ensure ongoing compliance with changing global industry regulations, while also focusing on continuously improving our products.",Boston_Scientific_Performance_Report_2018.pdf
Highlights of our 2018 accomplishments include: Implemented a global design controls process that fully integrates usability engineering and risk management for effective new product develop- ment as well as customer-centric product designs.,Boston_Scientific_Performance_Report_2018.pdf
Enabled innovation and expansion into new technologies with the launch of our new Global Process for Digital Health Development and Validation.,Boston_Scientific_Performance_Report_2018.pdf
Adapted to the evolving regulatory environment with programs to implement General Data Protection Regulation (GDPR) and continued to prepare for the European Union Medical Device Regulation (MDR).,Boston_Scientific_Performance_Report_2018.pdf
Executed enterprise training for both initiatives and implemented new policies and procedure updates to ensure compliance.,Boston_Scientific_Performance_Report_2018.pdf
"Invested in advancements in Post Market Quality assurance , including implementation of a global complaint management system that will enable continued evolution in post market surveillance.",Boston_Scientific_Performance_Report_2018.pdf
Launched Workstation Built-in Quality prevention program to enable quality at the source where the product is being built.,Boston_Scientific_Performance_Report_2018.pdf
"Implemented new lab management system for our Pathology franchise that provides end-to-end specimen processing and traceability with slide printing, barcode scanning technology and enhanced quality control processes.",Boston_Scientific_Performance_Report_2018.pdf
"SUSTAINABLE SUPPLY CHAIN With approximately 15,000 life-changing products, our manufacturing and supply chain teams play a critical role in ensuring that we plan, source, manufacture and distribute a reliable supply of high-quality products to meet our customers’ evolving needs.",Boston_Scientific_Performance_Report_2018.pdf
"To guide our work, we use a strategic quality process to prioritize, execute and monitor manufacturing and supply chain efforts.",Boston_Scientific_Performance_Report_2018.pdf
The process enables our global teams to work toward a common set of objectives.,Boston_Scientific_Performance_Report_2018.pdf
Maintaining the highest-quality component supply requires a rigorous supply chain and supplier risk-management approach.,Boston_Scientific_Performance_Report_2018.pdf
Our sourcing team monitors supplier risk level to ensure that we partner with long-term suppliers that share our customer focus.,Boston_Scientific_Performance_Report_2018.pdf
Our supply chain team facilitates planning for Boston Scientific products across divisions and regions.,Boston_Scientific_Performance_Report_2018.pdf
Both teams enable our network of manufacturing plants and global distribution centers to provide the right product at the right place and the right time.,Boston_Scientific_Performance_Report_2018.pdf
Partnering to Set Industry Standards for Quality and Compliance We collaborate with trade associations and regulatory bodies around the world to set new standards in quality and to anticipate and address changing regulatory guidelines.,Boston_Scientific_Performance_Report_2018.pdf
"We are committed to having patient-focused, high-performing quality systems and helping influence industry and regulatory approaches to quality.In the U.S., we participate in the Case for Quality Voluntary Improvement Program, a multi-year initiative led by the U.S. Food and Drug Administration (FDA) in conjunction with the Medical Device Innovation Consortium (MDIC) to improve product quality using best practices, standards, tools and metrics.",Boston_Scientific_Performance_Report_2018.pdf
"In 2017, we were one of the first companies invited to participate in the agency’s Voluntary Medical Device Manufacturing and Product Quality Program.",Boston_Scientific_Performance_Report_2018.pdf
