sentences,filename
Bost on Scientific 2019 Performance Report 45Feature Patient HighlightA Message to Our StockholdersFinancial HighlightsOur Mission and Core ValuesBoston Scientific at a GlanceBoston Scientific by the NumbersCorporate Social ResponsibilityOur Patients Our People Our Planet Our Practices Non-GAAP Reconciliations A critical challenge for us as a global medical device manufacturer is to deliver on our promise to customers and patients while caring for the planet.,2019_Boston_Scientific_Performance_Report.pdf
"The way we do our jobs each day contributes to reducing our environmental impacts, achieving carbon neutrality and improving supply chain sustainability.",2019_Boston_Scientific_Performance_Report.pdf
"We are making measurable progress toward shaping a better future for our planet by proactively addressing energy consumption, carbon emissions, waste management and water use.",2019_Boston_Scientific_Performance_Report.pdf
"The Boston Scientific Environment, Health and Safety (EHS) Policy outlines our high environmental standards and is central to the work of our newly established EHS Center of Excellence.",2019_Boston_Scientific_Performance_Report.pdf
"We rigorously measure, assess and report progress toward our EHS goals globally.",2019_Boston_Scientific_Performance_Report.pdf
"Across all operations and key distribution locations, we strive to meet and exceed International Organiza - tion for Standardization (ISO) standards for environmental management systems.",2019_Boston_Scientific_Performance_Report.pdf
"In 2019, our newest manufacturing location in Penang, Malaysia achieved ISO 14001:2015 certification.",2019_Boston_Scientific_Performance_Report.pdf
"Of the 16 Boston Scientific sites that have earned this certification, 13 facilities achieved zero non-conformances during the 2019 audit cycle.Our Global Energy Management System (GEMS) helps ensure that we meet ambitious energy reduction and greenhouse gas (GHG) reduction targets using the C3 strategy (Cut, Convert, Compensate).",2019_Boston_Scientific_Performance_Report.pdf
"Developed in collaboration with the National University of Ireland, Galway (NUI Galway), GEMS focuses on cutting energy use, converting to renewable energy resources instead of fossil fuels and compensating with carbon offset projects where needed.",2019_Boston_Scientific_Performance_Report.pdf
"Our advances through GEMS earned Boston Scientific and NUI Galway recognition as finalists for the 2019 US-Ireland Research Innovation Awards, a joint initiative of the Royal Irish Academy and the American Chamber of Commerce, Ireland.",2019_Boston_Scientific_Performance_Report.pdf
"We are continually monitoring progress through GEMS and our teams are working to meet or exceed the following targets with the overall goal of achieving carbon neutrality by 2030: 50 percent renewable electricity by 2021 100 percent renewable electricity by 2024 90 percent renewable energy (all sources) by 2027Our Planet “ W orking in the healthcare space, we have the privilege to help advance science and improve patient health, but we also have the responsibility to do this work in a sustainable manner that enriches communities.",2019_Boston_Scientific_Performance_Report.pdf
"We’ve set aggressive environmental goals to do our part to help shape a better future for our planet, and we’re holding ourselves accountable.” — Brad Sorenson, Senior Vice President, Boston Scientific Manufacturing and Supply Chain Our targets to achieve carbon neutrality by 2030: 50% renewable electricity by 2021 100% renewable electricity by 2024 90% renewable energy (all sources) by 2027 Bost on Scientific 2019 Performance Report 46The GEMS methodology is implemented through our global energy team, including representatives from each Boston Scientific manufacturing and main distribution sites.",2019_Boston_Scientific_Performance_Report.pdf
"We measure our performance through these GEMS key performance indicators (KPIs): 20 15 20 16 20 17 20 18 20 19 Carbon F ootprint Total amount of Scope 1 and Scope 2 GHG emissions emitted into the 118,327 108,694 94,946 85,127 84,778 (MT CO2eq) atmosphere from manufacturing and distribution sites.",2019_Boston_Scientific_Performance_Report.pdf
Measured in metric tons of carbon equivalent.,2019_Boston_Scientific_Performance_Report.pdf
Ener gy Use (kWh) Total energy Boston Scientific consumes annually to manufacture 3 70M 367M 364M 352M 368M our products.,2019_Boston_Scientific_Performance_Report.pdf
Ener gy Use kWh/$K Total normalized energy Boston Scientific consumes annually to 4 9 44 40 36 34 Revenue manufacture our products.,2019_Boston_Scientific_Performance_Report.pdf
EM3 An energy management maturity model to establish where in the 2.7 3.2 3.6 3.7 3.9 “energy journey” each manufacturing site resides on a scale from 1 to 5 (Minimal > Emerging > Developing > Advancing > Leading).,2019_Boston_Scientific_Performance_Report.pdf
Gr een Real Estate Percentage of Boston Scientific real estate that is independently 27% 28% 32% 37% 45% (% of total) certified for energy efficiency by industry-leading programs such as LEED for design and Energy Star or ISO50001 for building operations.,2019_Boston_Scientific_Performance_Report.pdf
"R enewable Energy Percentage of total energy consumed, generated from renewable – – – 5% 11% (% of total) energy sources, with Boston Scientific owning the renewable attributes.",2019_Boston_Scientific_Performance_Report.pdf
"Cleaner Ener gy Energy produced from fossil fuels, but based on high-efficiency 6% 7% 9% 9% 11% (% of total) technologies such as combined heat and power (CHP) in comparison to conventional power generation.",2019_Boston_Scientific_Performance_Report.pdf
"Feature Patient HighlightA Message to Our StockholdersFinancial HighlightsOur Mission and Core ValuesBoston Scientific at a GlanceBoston Scientific by the NumbersCorporate Social ResponsibilityOur Patients Our People Our Planet Our Practices Non-GAAP Reconciliations Bost on Scientific 2019 Performance Report 47Feature Patient HighlightA Message to Our StockholdersFinancial HighlightsOur Mission and Core ValuesBoston Scientific at a GlanceBoston Scientific by the NumbersCorporate Social ResponsibilityOur Patients Our People Our Planet Our Practices Non-GAAP Reconciliations Climate Change By addressing the company’s energy consumption, carbon emissions and environmental design, we are reducing our climate impacts.",2019_Boston_Scientific_Performance_Report.pdf
Striving for Carbon Neutrality Boston Scientific is committed to achieving carbon neutrality across our manufacturing and key distribution sites by 2030.,2019_Boston_Scientific_Performance_Report.pdf
Carbon neutrality means achieving net zero carbon emissions associated with manufacturing operations and energy use by balancing the amount of carbon released with an equal amount removed or compensated.,2019_Boston_Scientific_Performance_Report.pdf
"Increased levels of carbon dioxide and other GHG emissions in the atmosphere are closely tied to climate change, and achieving carbon neutrality will significantly reduce our contribution to this pressing issue.",2019_Boston_Scientific_Performance_Report.pdf
Leading in Energy Certification Sustainability is a critical objective for our global facilities' teams as we focus on improving existing sites and developing new construction in an environmentally responsible manner.,2019_Boston_Scientific_Performance_Report.pdf
Leadership in Energy and Environmental Design (LEED) is an internationally recognized certification program for the environmental performance and sustainable design of buildings.,2019_Boston_Scientific_Performance_Report.pdf
"Boston Scientific now has 14 LEED-certified buildings on campuses in the United States, Central America, Europe and Asia, including our San Jose Baytech site in California, which achieved LEED certification in 2019.",2019_Boston_Scientific_Performance_Report.pdf
"In Sweden, our Helsingborg Office achieved ""Miljöbyggnad” Silver certification from the Sweden Green Building Council, Sweden's largest organization for sustainable community building.",2019_Boston_Scientific_Performance_Report.pdf
Continual improvement in the energy performance of our manufacturing operations has earned ISO certification for five of our manufacturing locations.,2019_Boston_Scientific_Performance_Report.pdf
The company’s two Costa Rica manufacturing sites in Coyol and Heredia have been carbon-neutral since 2016 and received ISO 50001:2011 certification the following year.,2019_Boston_Scientific_Performance_Report.pdf
"In 2019, Boston Scientific facilities in Clonmel, Cork and Galway, Ireland achieved ISO 50001:2018 certification.",2019_Boston_Scientific_Performance_Report.pdf
"Our distribution center in Kerkrade, Netherlands maintained its 3rd Lean & Green Star certification, first awarded in 2018 by Europe’s leading program for sustainable logistics.",2019_Boston_Scientific_Performance_Report.pdf
We are one of only nine companies in Europe to receive this award for carbon emissions reduction.,2019_Boston_Scientific_Performance_Report.pdf
"In total, Boston Scientific operates 4.3 million square feet of independently certified green real estate that supports our energy performance and sustainability goals, representing 45 percent of our footprint worldwide.",2019_Boston_Scientific_Performance_Report.pdf
We have committed to achieving carbon neutrality in all of our manufacturing and key distribution sites by 2030.,2019_Boston_Scientific_Performance_Report.pdf
"LEEDing Locations 45% of our global footprint worldwide is green real estate United States San Jose Baytech, California LEED Silver Maple Grove, Minnesota LEED Silver / LEED Certified Marlborough, Massachusetts LEED Gold / LEED Certified Quincy, Massachusetts LEED Silver / LEED Certified Central America Coyol, Costa Rica LEED Silver / ISO 50001:2011 Heredia, Costa Rica ISO 50001:2011 Europe Clonmel, Ireland ISO 50001:2018 Cork, Ireland ISO 50001:2018 Galway, Ireland ISO 50001:2018 Kerkrade, Netherlands LEED Silver / Lean and Green Helsingborg, Sweden Miljöbyggnad Silver Asia Beijing, China LEED Silver / LEED Certified Shanghai, China LEED Silver Penang, Malaysia LEED Silver Singapor e LEED Silver Bost on Scientific 2019 Performance Report 48Feature Patient HighlightA Message to Our StockholdersFinancial HighlightsOur Mission and Core ValuesBoston Scientific at a GlanceBoston Scientific by the NumbersCorporate Social ResponsibilityOur Patients Our People Our Planet Our Practices Non-GAAP Reconciliations Investing in Renewable Energy Our work to reduce GHG emissions includes investing in renewable energy.",2019_Boston_Scientific_Performance_Report.pdf
"At two of the company's locations in Massachusetts, we have onsite solar installations that generated a combined total of 3.1 million kilowatt-hours of renewable electricity in 2019, resulting in savings of nearly 1,000 metric tons of GHG emissions.",2019_Boston_Scientific_Performance_Report.pdf
"At our Marlborough headquarters and Quincy distribution center, solar energy was responsible for 46 percent and 45 percent of the electricity required to operate, respectively.",2019_Boston_Scientific_Performance_Report.pdf
"Also in Massachusetts, Boston Scientific became the anchor business customer for a new 12.9-megawatt community solar development, a project involving large and small businesses and residential households that will increase access to clean energy across the state.We continue to make progress toward our goal of purchasing 100 percent renewable electricity by 2024.",2019_Boston_Scientific_Performance_Report.pdf
"In 2019, our three manufacturing sites in Ireland marked their first full year of operating with certified 100 percent renewable electricity.",2019_Boston_Scientific_Performance_Report.pdf
"Over the course of the year, renewable energy accounted for 11 percent of our energy purchased.",2019_Boston_Scientific_Performance_Report.pdf
"In addition, we executed a virtual power purchase agreement for 100 percent renewable electricity for our U.S. energy needs.",2019_Boston_Scientific_Performance_Report.pdf
"Environmental Impact As a company with a global footprint and global impact, we have a responsibility to carefully manage the materials in our products and packaging, the resources used to manufacture and transport them and what happens to any waste generated.",2019_Boston_Scientific_Performance_Report.pdf
We measure waste generation and water use at our major manufacturing and distribution facilities through the implementation of ISO 14001:2015.,2019_Boston_Scientific_Performance_Report.pdf
"The Boston Scientific plant in Malaysia achieved ISO 14001:2015 certification in 2019, and we now have 16 sites certified to this standard.",2019_Boston_Scientific_Performance_Report.pdf
Waste Management Sustainable waste management continues to be a significant priority for Boston Scientific.,2019_Boston_Scientific_Performance_Report.pdf
We have adopted international best practices and research-based protocols as our teams work to continually make greater progress.,2019_Boston_Scientific_Performance_Report.pdf
"In 2019, we recycled 80 percent — 8,943 metric tons — of total solid waste.",2019_Boston_Scientific_Performance_Report.pdf
The company’s operations and primary distribution sites recycled or recovered 54 percent of hazardous and regulated waste generated.,2019_Boston_Scientific_Performance_Report.pdf
We also diverted 95 percent of solid waste from landfills.,2019_Boston_Scientific_Performance_Report.pdf
"In addition, we almost met our 10-year environmental goal of an 81 percent recycling rate.",2019_Boston_Scientific_Performance_Report.pdf
"In 2019, we evaluated our efforts and committed to a 2030 goal of achieving TRUE Zero Waste Certification for our operations and key distribution sites.",2019_Boston_Scientific_Performance_Report.pdf
This certification will create a framework for minimizing non-hazardous solid wastes and maximizing efficiency in the company’s use of resources.,2019_Boston_Scientific_Performance_Report.pdf
"Solar installment at Boston Scientific global headquarters in Marlborough, MassachusettsClearway Energy Group community solar project in Massachusetts Bost on Scientific 2019 Performance Report 49 Feature Patient HighlightA Message to Our StockholdersFinancial HighlightsOur Mission and Core ValuesBoston Scientific at a GlanceBoston Scientific by the NumbersCorporate Social ResponsibilityOur Patients Our People Our Planet Our Practices Non-GAAP Reconciliations Conserving Water We understand the importance of water as a shared resource.",2019_Boston_Scientific_Performance_Report.pdf
"While Boston Scientific operations are not water-intensive, we are committed to minimizing consumption and being prepared for environmental challenges such as water scarcity.",2019_Boston_Scientific_Performance_Report.pdf
"In 2019, we conducted an assessment of water- related risks and opportunities at all manufacturing and central distribution sites based on local water stress and intensity of water use.",2019_Boston_Scientific_Performance_Report.pdf
"Using the World Resources Institute Aqueduct — a global water risk-mapping tool — we determined that 11 locations are at low overall water-related risk, and six facilities are in the low-to-medium water-related risk category.",2019_Boston_Scientific_Performance_Report.pdf
This effort will expand in 2020 to include the company’s significant commercial operations.,2019_Boston_Scientific_Performance_Report.pdf
Water usage at our manufacturing and major distribution centers is predominantly associated with headcount; only 25 percent of our consumption is associated with production processes.,2019_Boston_Scientific_Performance_Report.pdf
"Even with a 12.5 percent increase in headcount in 2019, we consumed marginally less water than in 2018.",2019_Boston_Scientific_Performance_Report.pdf
"Over the past 10 years, we have reduced water consumption by 30 percent.Recognitions for Sustainability Leadership FTSE4Good Constituent: Boston Scientific earned 2019 certification in the FTSE4Good Corporate Social Responsibility Index, which measures the performance of companies demonstrating strong Environmental, Social and Governance (ESG) practices.",2019_Boston_Scientific_Performance_Report.pdf
"Chelsea Santucci Greenovation Awards: Boston Scientific sites in Dorado and Maple Grove were honored for their environmental performance and sustainability efforts by Kimberly-Clark Professional.Double Wins: Greenovation Award Our teams in Dorado, Puerto Rico and Maple Grove, Minnesota received 2019 Chelsea Santucci Greenovation Awards for results they achieved as participants in RightCycle, the first large-scale recycling program for non-hazardous laboratory and industrial waste.",2019_Boston_Scientific_Performance_Report.pdf
"Through an intensive effort to collect previously hard-to-recycle nitrile gloves, the Boston Scientific team in Dorado diverted 12,385 pounds of gloves from local landfills and won Greenovation honors for the second year in a row.",2019_Boston_Scientific_Performance_Report.pdf
"In Maple Grove, our employees collected enough nontraditional waste — gloves as well as single-use garments, hoods and boot covers — to divert 35,500 pounds of waste from landfills, winning Greenovation recognition for the fifth consecutive year.",2019_Boston_Scientific_Performance_Report.pdf
"The Greenovation awards were established in 2013 and renamed in 2015 in honor of Chelsea Santucci, a former Kimberly-Clark Professional employee who was instrumental in creating the RightCycle program before dying of cancer at age 26.",2019_Boston_Scientific_Performance_Report.pdf
"Ariel Gonzalez, Boston Scientific EHS manager in Dorado, Puerto Rico, receiving the Greenovation Award from Daniel Perez, Kimberly-Clark representative.30% decrease in water consumption* 80% of total solid waste recycled 95% of solid waste diverted from landfills *Compared to 2009 baseline Bost on Scientific 2019 Performance Report 50 Feature Patient HighlightA Message to Our StockholdersFinancial HighlightsOur Mission and Core ValuesBoston Scientific at a GlanceBoston Scientific by the NumbersCorporate Social ResponsibilityOur Patients Our People Our Planet Our Practices Non-GAAP Reconciliations Green Team Environmental Sustainability Initiatives Boston Scientific Green Team initiatives are inspired and led by employees across the globe.",2019_Boston_Scientific_Performance_Report.pdf
"Every year, they organize and implement projects focused on reducing the company’s environmental footprint and improving the communities where our people live and work.",2019_Boston_Scientific_Performance_Report.pdf
Their efforts help to strengthen our business practices while raising environmental awareness and supporting local partners dedicated to caring for our planet.,2019_Boston_Scientific_Performance_Report.pdf
Our Green Teams continued to embrace sustainability in 2019.,2019_Boston_Scientific_Performance_Report.pdf
"In Kerkrade, Netherlands , employees collected plastic lids and donated the recycling refunds to the Royal Dutch Guide Dog Foundation (KNGF Geleidehonden).",2019_Boston_Scientific_Performance_Report.pdf
"Milan, Italy employees organized an initiative to eliminate complimentary water bottles from workplace common areas.",2019_Boston_Scientific_Performance_Report.pdf
"Similarly, we eliminated water bottles in meeting rooms and kitchens in all of our Latin America sales offices.",2019_Boston_Scientific_Performance_Report.pdf
"The Warsaw, Poland Green Team led an effort to install water dispensers for employees and organized a World Environment Day that included a cleanup day at a local park.",2019_Boston_Scientific_Performance_Report.pdf
"Environmental Wins in Minnesota A newly organized Green Team in Minnetonka, Minnesota made its mark with a series of projects.",2019_Boston_Scientific_Performance_Report.pdf
"They started an onsite volunteer garden, successfully implemented a campaign to eliminate onsite disposable cup use and held a first annual “Ec olympics” to educate employees about the environment.",2019_Boston_Scientific_Performance_Report.pdf
"In May, the team completed a utility-funded energy audit that resulted in an initial 5 percent reduction in electricity use and 17 percent decrease in natural gas use.",2019_Boston_Scientific_Performance_Report.pdf
"The Minnesota Safety Council recognized the team’s efforts with a Meritorious Achievement Award.Cork Green Team Takes to the Shores With the 2019 motto “Our Planet, Our Waters,” the Cork, Ireland Green Team members focused on making local shorelines cleaner and safer.",2019_Boston_Scientific_Performance_Report.pdf
"The team partnered with the Cork Water Harbour Keepers to offer an employee education program about the environmental impact of single-use plastics, then organized volunteers for two local cleanup events.",2019_Boston_Scientific_Performance_Report.pdf
"At the Blackrock Shoreline Clean in June, they picked up litter along a stretch of shore especially popular with walkers and runners.",2019_Boston_Scientific_Performance_Report.pdf
"In August, at Carrigrenan beach in Little Island — where water pollution can make swimming unsafe — they turned out with family and friends to clear the high volume of waste washed ashore.Clean and Green in Valencia The Boston Scientific Green Team in Valencia, California devoted their time to support two ambitious ecosystem initiatives.",2019_Boston_Scientific_Performance_Report.pdf
"In Santa Clarita, they joined the volunteer ranks of the 10th annual Earth Arbor Day tree-planting crews, taking shovels to the ground at the city’s Central Park to plant 10 eight-foot trees.",2019_Boston_Scientific_Performance_Report.pdf
"In Santa Monica, the Valencia Green Team worked alongside more than 13,500 volunteers for the 35th annual Coastal Cleanup Day, an effort that diverted 30,165 pounds of waste from the aquatic ecosystems of oceans and waterways.",2019_Boston_Scientific_Performance_Report.pdf
"Keeping Our Planet Clean In 2019, Boston Scientific employees volunteered their time to support efforts to preserve beaches and habitats and protect local ecosystems.",2019_Boston_Scientific_Performance_Report.pdf
Green Teams also developed environmental education campaigns and introduced additional green practices within the company.,2019_Boston_Scientific_Performance_Report.pdf
"Bost on Scientific 2019 Performance Report 51 Feature Patient HighlightA Message to Our StockholdersFinancial HighlightsOur Mission and Core ValuesBoston Scientific at a GlanceBoston Scientific by the NumbersCorporate Social ResponsibilityOur Patients Our People Our Planet Our Practices Non-GAAP Reconciliations Our P ractices 52 Compliance, Ethics and Integrity 55 Developing Innov ative Products 57 Innov ation Initiatives 58 Quality and Safety 61 Sustainable Supply Chain 62 Responsible Marketing 62 Customer Relationship Management 63 Packaging and Labeling 64 Supporting Small Business and Supplier Diversity Boston Scientific employees help inspire the next generation of innovators through the Little Doctors program in Guangzhou, China.Every day, Boston Scientific is... committing to responsible practices.",2019_Boston_Scientific_Performance_Report.pdf
"Bost on Scientific 2019 Performance Report 52Feature Patient HighlightA Message to Our StockholdersFinancial HighlightsOur Mission and Core ValuesBoston Scientific at a GlanceBoston Scientific by the NumbersCorporate Social ResponsibilityOur Patients Our People Our Planet Our Practices Non-GAAP Reconciliations Our business practices support and ensure our company’s worldwide focus on quality, safety and sustainability as we deliver meaningful innovations that make a difference in patients' lives.",2019_Boston_Scientific_Performance_Report.pdf
We operate with a culture of integrity; we believe in strong corporate governance; and we insist on impeccable ethics and regulatory compliance.,2019_Boston_Scientific_Performance_Report.pdf
"Compliance, Ethics and Integrity Boston Scientific employees have a shared commitment to: Act honestly and ethically in all company matters Protect the privacy of patients, customers and employees Treat one another with respect and fairness Hold one another accountable to ensure quality in all that we do Our Global Compliance team provides employees with the resources and training they need to do business with integrity, treat customers and suppliers fairly, and report ethics concerns when they arise.",2019_Boston_Scientific_Performance_Report.pdf
"Led by our Chief Compliance Officer, the team collaborates across the company to monitor our activities and performance.",2019_Boston_Scientific_Performance_Report.pdf
"The Chief Compliance Officer reports quarterly to the Audit Committee of our Board of Directors and more frequently as needed.Code of Conduct for Employees and Channel Partners Every Boston Scientific employee is required to read and understand our Code of Conduct, which is the foundation for all of our business practices and relationships.",2019_Boston_Scientific_Performance_Report.pdf
Employees also complete multiple mandatory training curriculums that explain company policies and corruption- and compliance-related risks and point them to resources where they can report concerns.,2019_Boston_Scientific_Performance_Report.pdf
Our training offers scenario-based content to help prepare people to respond ethically to issues that may arise in their daily work.,2019_Boston_Scientific_Performance_Report.pdf
"The global marketplace in which we compete is advancing rapidly, and our workforces in many countries are continually adapting to new developments in technology, public policies and the environment.",2019_Boston_Scientific_Performance_Report.pdf
