sentences,filename
"Experienced people leaders Leadership development focuses on people-leadership effectiveness, cultural continuity, and organizational effectiveness, so that leaders at all levels have the capabilities and knowledge that they and their teams need to succeed.Product Delivering quality work output from a teamProcessEnsuring Intuitive business processes and practices allow for the best workPeopleAttracting, developing, and retaining our people People Leadership Success Model Leadership role profiles 32 of 56 Intuitive Sustainability Report 2020Talent and workplace experience PN 1074653-US RevA 01/2021Our Global Talent Management team transitioned much of our leadership training from in-person sessions to remote learning with the emergence of COVID-19 in 2020.",ISRG_2020.pdf
Our scaled learning platform of on-demand and virtual classroom learning eliminates travel and allows employees worldwide to access development at their convenience.,ISRG_2020.pdf
"Employee-support surveys To check in with our employees during this unusual year, we developed, fielded, and assessed the results from a series of employee-support surveys.",ISRG_2020.pdf
The surveys allowed us to capture the pulse of employees and understand their needs as they adjusted to ongoing changes in their home and work lives.,ISRG_2020.pdf
"The survey results informed our COVID-19 IMT and leadership teams that responded by developing new resources and programs, and adjusting and adapting existing policies and processes to help employees during this time.",ISRG_2020.pdf
Two examples of programs developed as a result of these surveys included two meeting-free Wednesdays each month and a series of employee well-being virtual learning and sharing opportunities.,ISRG_2020.pdf
Annual performance reviews We have robust annual global performance review processes for reviewing all employees’ performance and pay.,ISRG_2020.pdf
"To support our managers, we train them on conducting effective performance reviews and making compensation recommendations, which take into consideration market pay data and performance, as well as experience in an employee’s respective role.",ISRG_2020.pdf
Our highly engaged employees completed over 98% of their self-evaluations during our annual performance review process in the spring of 2020.,ISRG_2020.pdf
"Commitment to pay equity At Intuitive, assuring fair and equitable pay is integral to our commitment to our employees.",ISRG_2020.pdf
Our executive team and board of directors strongly support this commitment.,ISRG_2020.pdf
We conduct pay-equity reviews annually to help us understand whether our compensation structure is appropriate and to identify what improvements can be made.,ISRG_2020.pdf
"In addition, we utilize a robust inspection process with an independent consulting firm for gender and ethnicity, hiring, promotion, and wage equity to determine whether any statistically significant pay differences exist between women and men, and between minorities and nonminorities.",ISRG_2020.pdf
"If pay disparities are identified, we conduct further evaluation to determine whether remedial adjustments are appropriate, and we address them by making any such adjustments.",ISRG_2020.pdf
"In addition, employees can raise issues regarding pay equity with their manager, their human resources partner, or confidentially through our anonymous reporting helpline.",ISRG_2020.pdf
Our commitment to pay equity is embodied in our statement found at https://www.intuitive.com/en-us/about-us/company/legal/governance .,ISRG_2020.pdf
"98% Employee performance self-evaluation completion rate in 202033 of 56 Intuitive Sustainability Report 2020Talent and workplace experience PN 1074653-US RevA 01/2021University Hiring Program (UHP) Every year, we look forward to welcoming several dozen college students to our paid summer internship program and co-op rotation program, which we collectively call our University Hiring Program.",ISRG_2020.pdf
"Our UHP provides undergraduate, graduate, and doctoral students with the opportunity to learn from and work with one of our teams for several weeks.",ISRG_2020.pdf
"The program gives the company access to a rich and diverse pool of top-quality talent, resulting in many interns and co-ops deciding to return as full-time members of our team after graduation.",ISRG_2020.pdf
"With more than 100 students lined up to join us for the summer in 2020 and the pandemic still limiting travel and requiring most of our teams to work from home, we upheld our commitment by accommodating as many interns as possible.",ISRG_2020.pdf
"Our UHP team moved to transition the program to a virtual format, finding ways for this year’s students to work, learn, and socialize remotely.",ISRG_2020.pdf
We were able to deliver project-based internship experiences to 87% of our planned interns.,ISRG_2020.pdf
"We provided multiple events, both educational and social, and matched students into small teams that met regularly throughout the summer.",ISRG_2020.pdf
"Our annual exhibit day, which showcases each summer intern’s accomplishments, became a video presentation library.",ISRG_2020.pdf
"We also offered a series of career development trainings and certificates to another 11% of our planned interns, doing our best to support this year’s exceptionally talented group.",ISRG_2020.pdf
“My internship with Intuitive was such a memorable experience.,ISRG_2020.pdf
A lot of this is due to the University Hiring Program team crafting an incredibly engaging and educative internship experience.,ISRG_2020.pdf
This is also despite them having to completely shift the nature of the program.” Imo Eguakhide 2020 Instructional Design Intern Class of 2020 #WeAreIntuitive Happy National Intern Day!,ISRG_2020.pdf
"Thank you to the interns and co-ops of our University Hiring Program.21 Number of UHP events throughout the summer34 of 56 Intuitive Sustainability Report 2020 PN 1074653-US RevA 01/2021Creating stronger communities35 of 56 Intuitive Sustainability Report 2020Creating stronger communities PN 1074653-US RevA 01/2021With the events of 2020, we increased our efforts to positively impact our customers, employees, and communities.",ISRG_2020.pdf
"Our employees, passionate about actively engaging in the COVID-19 response efforts, stepped up and made a difference throughout the year.",ISRG_2020.pdf
Giving back: the Intuitive Foundation The Intuitive Foundation is a nonprofit organization established and funded by Intuitive in 2018.,ISRG_2020.pdf
"Since its founding, the Intuitive Foundation has been dedicated to promoting health, advancing education, and reducing human suffering.",ISRG_2020.pdf
"As a rule, the foundation supports outreach programs financially while we provide the volunteers and mentors from within our company.",ISRG_2020.pdf
The events of 2020 inspired Intuitive employee volunteers to further support the foundation’s work on several key initiatives.,ISRG_2020.pdf
The foundation’s multifaceted response to the COVID-19 pandemic was a major focus in 2020.,ISRG_2020.pdf
"Early on, foundation efforts included making donations to provide PPE in China, where COVID-19 first emerged.",ISRG_2020.pdf
"As the pandemic started to impact Santa Clara County and other parts of the U.S., our company and the foundation began working with the Silicon Valley Leadership Group (SVLG) to identify ways to collaborate with local companies and mount a coordinated response.",ISRG_2020.pdf
Hundreds of global Intuitive employee volunteers supported this effort by contributing to various foundation-driven efforts that included producing PPE such as face shields and cloth face masks; exploring ideas for improving manufacturing processes for ventilators and the sterilization of N95 respirators; and developing new protective tools to help those on the front lines of the pandemic.,ISRG_2020.pdf
More than 1.1 million face shields We collaborated with the foundation and with the SVLG’s COVID-19 Aid Coalition’s local consortium of 11 hospitals in developing emergency-use product specifications for the types of PPE most needed in Santa Clara County.,ISRG_2020.pdf
These specifications enabled purchasing experts in Silicon Valley companies to properly source medical supplies they could donate to hospitals and use to protect company employees.,ISRG_2020.pdf
"We didn’t stop at specifications, as we recognized that our company and the Intuitive Foundation could work together to create and assemble face shields for donation.",ISRG_2020.pdf
The Intuitive Foundation funded the materials for our employees to create face shields on socially distanced temporary manufacturing lines in our Sunnyvale and Connecticut offices.,ISRG_2020.pdf
We donated our employees’ time and expertise to turn these materials into face shields.,ISRG_2020.pdf
"From April through mid-July, hundreds of our employees stepped up to work on the PPE assembly lines.",ISRG_2020.pdf
"A friendly competition developed between our locations, with teams vying to see who could assemble the most face shields per shift, an effort that provided our employees with a way to give back and support their communities.",ISRG_2020.pdf
Do-it-yourself kits with materials to put together 100 face shields were created as an expansion of the initial effort.,ISRG_2020.pdf
"U.S.-based employees signed up to receive and assemble these kits, often with their families, then donated their completed face shields to people and organizations within their communities.",ISRG_2020.pdf
"Over 22,000 face shields were assembled at home by families and over 88,000 were assembled by our office teams.",ISRG_2020.pdf
"After the teams and family assembly pilots, we repurposed manufacturing lines in our Mexicali, Mexico, facility to reach the goal of assembling more than 1 million face shields for donation to those most in need of PPE.",ISRG_2020.pdf
This required that our Mexicali team convert a warehouse and production lines to allow for COVID-19 safety protocols and identify employee volunteers to manufacture these face shields.,ISRG_2020.pdf
The major efforts undertaken to produce a million face shields reflect the heart and dedication of our Mexicali team.,ISRG_2020.pdf
"36 of 56 Intuitive Sustainability Report 2020Creating stronger communities PN 1074653-US RevA 01/202122,000+ Face shields assembled at home by families 88,000+ Face shields assembled by our office teams37 of 56 Intuitive Sustainability Report 2020Creating stronger communities PN 1074653-US RevA 01/2021Once the face shields were available for donation, a small cross-functional distribution team worked to help the foundation identify recipients for these larger quantities of face shields.",ISRG_2020.pdf
"The team identified organizations globally and sent donations to those states, countries, and entities most impacted by the pandemic, including where our company has a significant presence.",ISRG_2020.pdf
"In the end, the foundation donated over 108,000 face shields to various healthcare and government agencies in Mexicali, Mexico; over 31,000 to the Agence du Don en Nature in France; over 50,000 to the U.S. Department of Veterans Affairs, and more than 273,000 face shields to Native American tribes within the U.S., including the Apache, Cherokee, Comanche, Crow, Navajo, Sioux, Zuni, and many other tribes.",ISRG_2020.pdf
"These larger organizations identified specific healthcare recipients for the face shields, distributing them to facilities with the greatest need.",ISRG_2020.pdf
"Cotton face masks The Intuitive Foundation worked with a team of our employee volunteers who sourced materials for creating the developed specifications, and connected with contract manufacturers to produce more than 56,000 cotton face masks for donation.",ISRG_2020.pdf
Another team of employee volunteers made cotton face masks at home for local donation.,ISRG_2020.pdf
"An additional employee-volunteer team coordinated testing of mask and mask-insert materials to meet protective standards for healthcare workers in higher-acuity settings, such as hospitals and eldercare facilities.",ISRG_2020.pdf
Our volunteer distribution team identified recipients for the face masks and worked diligently to deliver the protective gear to those most in need.,ISRG_2020.pdf
"56,000+ Cotton face masks 49,000+ N95 respirator masks 1.1 million+ Face shieldsIntuitive Foundation donations in 2020* *As of December 31, 2020.38 of 56 Intuitive Sustainability Report 2020Creating stronger communities PN 1074653-US RevA 01/2021Other donations We donated existing PPE from our Sunnyvale and Atlanta labs, which went immediately to local hospitals in early April.",ISRG_2020.pdf
"We worked with the Intuitive Foundation and Fosun Pharma in China to help secure and distribute over 49,000 N95 respirator masks in the U.S.",ISRG_2020.pdf
"The foundation continues to coordinate our employees’ donations around the response effort, engage with medical device leaders to explore new technologies, and connect PPE to hospitals and healthcare facilities in need.",ISRG_2020.pdf
"Direct financial contributions The Intuitive Foundation established several matching campaigns for our employees’ monetary donations throughout 2020, oriented around different issues and areas of interest.",ISRG_2020.pdf
"These fundraising campaigns included a global COVID-19 relief fund established in early 2020 with an initial focus on China and expanded in the spring to include regional funds for Europe; Asia, including India and Japan; and the U.S.",ISRG_2020.pdf
"The foundation also provided special matching for several initiatives, including a “Towards Racial Justice” fundraising campaign and wildfire relief campaigns for Australia and California.",ISRG_2020.pdf
"With wildfires, hurricanes, and the pandemic affecting so many, it is often easy to miss the needs of the most vulnerable of our neighbors who are disproportionately affected by these disasters.",ISRG_2020.pdf
"Recognizing the unique strain these events put upon those already struggling, our company and the Intuitive Foundation continued to support Sunnyvale Community Services (SCS), a local nonprofit that provided area students with new backpacks stocked with school supplies, nutritious food, and gift cards to purchase new shoes.",ISRG_2020.pdf
"With the COVID-19 pandemic creating economic hardship and increased need, our company and the foundation helped SCS meet its 2020 goal of 2,000 backpacks, up from 1,700 in 2019.",ISRG_2020.pdf
"In 2020, the Intuitive Foundation provided sizable donations to the following organizations: · Sunnyvale Cares – A small-business and nonprofit assistance grant program · Second Harvest of Silicon Valley – One of the nation’s largest food banks · Sunnyvale Community Services· SVLG where funds went to the Santa Clara County Emergency Operations Center in support of 11 local hospitals, as well as sister counties and agencies $2.8 million+* Donated from all Intuitive Foundation monetary giving programs $1.4 million+* Through employee contributions $1.2 million+* Through matching gifts $64,000+* Through credits *Figures provided are as of Dec. 31, 2020 and may not be inclusive of all matching for donations made at year end.39 of 56 Intuitive Sustainability Report 2020Creating stronger communitiesGlobal Surgical Training Challenge PN 1074653-US RevA 01/2021Expanding access to healthcare Global Surgical Training Challenge (GSTC) With the pandemic spotlighting the need to improve distance learning for physical skills, the Intuitive Foundation collaborated with MIT Solve and Nesta Challenges to launch the GSTC in July.",ISRG_2020.pdf
This global contest calls on innovators to develop training modules that teach surgical procedures and techniques in low-resource settings.,ISRG_2020.pdf
"The contest supports the development of lower-cost, validated, simulation-based surgical training.",ISRG_2020.pdf
"The challenge consists of three phases spread over two years, with a purse of up to $5 million, including an up-to $1 million prize at the end.",ISRG_2020.pdf
It began with a series of MIT-hosted Solveathon virtual workshops to build multidisciplinary teams in low- and middle-income countries (LMICs) in five global regions to strengthen their GSTC applications.,ISRG_2020.pdf
"In December 2020, the top teams received discovery award grants to develop and test early prototype modules.",ISRG_2020.pdf
"Up to five teams will compete in the second phase, with finalist awards to be announced at the end of 2021.",ISRG_2020.pdf
"At each stage, winning surgical simulation modules are appropriately validated by a physician, innovator, and healthcare educator panel of judges.",ISRG_2020.pdf
Da Vinci Research Kit (dVRK) The Intuitive Foundation supports telerobotic surgery research efforts by sponsoring hardware from retired first-generation da Vinci surgical systems that can be used to assemble research platforms for exploring innovative new concepts in minimally-invasive surgery through its dVRK program.,ISRG_2020.pdf
"This shared research platform supports collaboration across university groups to stimulate and accelerate research in the field.Angola ArgentinaAustraliaBrazilBurkina FasoCameroonCanadaChileColombiaDominicaEcuadorEthiopiaGermanyGhanaGreeceGuatemalaGuyanaIndiaIrelandItalyJapanJordanKenyaLiberaMalawiMexicoMongoliaNigeriaNorwayRwandaSouth AfricaSpainSwitzerlandTaiwanUgandaUkraineUnited KingdomUnited StatesVietnamZambiaZimbabwe In 36 universities across 11 countries40 of 56 Intuitive Sustainability Report 2020Creating stronger communities PN 1074653-US RevA 01/2021Foothill College emergency medical technician (EMT) certification support In keeping with its mission to promote health and advance education, the Intuitive Foundation embarked on a program to help Foothill College provide training and certification testing for students working to become emergency medical technicians (EMTs).",ISRG_2020.pdf
"COVID-19 restrictions on in-person education had an intense impact on students pursuing EMT certification, a career path that relies heavily on hands-on, experiential instruction and skill assessment.",ISRG_2020.pdf
"In particular, students preparing to undergo certification exams in the spring of 2020 missed the opportunity to complete the psychomotor portion of the test, which requires that students prove they can perform skills such as clearing airways, controlling bleeding, setting broken bones, and other proficiency demonstrations.",ISRG_2020.pdf
"The Intuitive Foundation team sought new ways to train and test EMTs, beginning with examining the traditional teaching and testing methods of the required psychomotor skills.",ISRG_2020.pdf
The team brought an understanding of our company’s SimNow simulation surgeon training techniques and technologies to the challenge of reimagining EMT training and testing.,ISRG_2020.pdf
EMT program instructors helped the team understand the details of the actions an instructor needs to see when assessing a student’s ability to perform specific skills.,ISRG_2020.pdf
"After exploring camera views from different locations and angles focused on hands, feet, face, and from above, instructors found they gained a fuller picture of students’ actions than in-person assessments previously allowed.",ISRG_2020.pdf
The foundation team and the EMT instructors then began building a catalog of skills for remote training and assessments.,ISRG_2020.pdf
"As COVID-19 continues to impact our communities and education system, helping Foothill College continue their EMT program in a virtual, distance-learning environment adds much-needed healthcare professionals to the front lines of care.",ISRG_2020.pdf
The first class using this model will launch in January 2021.,ISRG_2020.pdf
"Once the program is fully developed, the foundation hopes to make the EMT training and testing model available via an open-source platform to institutions throughout the country.",ISRG_2020.pdf
"Catherine Mohr with her daughter, supported the Foothill College EMT program.41 of 56 Intuitive Sustainability Report 2020Creating stronger communities PN 1074653-US RevA 01/2021STEM education The Intuitive Foundation provides continued support of programs that empower young people of all backgrounds to participate in robotics-centered events to inspire their education in science, technology, engineering, and math (STEM).",ISRG_2020.pdf
"In 2020, the foundation sponsored teams participating in For Inspiration and Recognition of Science and Technology (FIRST) Robotics competitions across the globe.",ISRG_2020.pdf
The foundation’s participation in the program increased by 176% to include 127 teams across four countries when compared to the 2019 program support.,ISRG_2020.pdf
"While the COVID-19 pandemic prevented many teams from competing, several teams continued to build their robots and explore robotics technology through remote learning and collaboration platforms.",ISRG_2020.pdf
"In February, our U.K. team hosted a group of students at our new Oxford, England, office for a facility tour, presentations, and demonstrations of the da Vinci surgical system and SimNow simulation.",ISRG_2020.pdf
"A local television station broadcasted the event, with speakers that included a urology surgeon and a leader from our U.K. office.",ISRG_2020.pdf
A favorite activity gave students the chance to use the da Vinci surgical system to grasp tiny rings and a five-pence piece.,ISRG_2020.pdf
Outreach initiatives The Intuitive Foundation engages with professional societies and nonprofits to create internships and support leadership development for underrepresented student populations.,ISRG_2020.pdf
"While the foundation provides financial support for these outreach programs, our employees volunteer their time to serve as mentors, instructors, and judges, as well as other needed roles.",ISRG_2020.pdf
Health Career Collaborative: The Health Career Collaborative is a national program that connects mentors with high school students from diverse backgrounds to encourage study in healthcare fields.,ISRG_2020.pdf
The Intuitive Foundation established a 10-site pilot to bring a mobile da Vinci surgical system to high schools in low-income areas.,ISRG_2020.pdf
Our engineer volunteers gave two-hour presentations to various class sizes demonstrating medical-device engineering skills.,ISRG_2020.pdf
This program was presented at three sites before the pandemic required pivoting to a virtual environment.,ISRG_2020.pdf
"In 2020, a total of more than 500 students participated in this program in schools across the U.S. Technovation challenge: Technovation supports two collaborative competitions designed to solve real-world problems through technology.",ISRG_2020.pdf
"One competition empowers young women (ages 10 to 18), and the other brings together families, schools, and mentors.",ISRG_2020.pdf
"Our employee volunteers provide mentoring, collaboration, instruction, and judging for the Technovation Girls competitions.",ISRG_2020.pdf
"Working in teams of five, girls code a mobile app that addresses a problem in their local community.",ISRG_2020.pdf
"In 2020, 29 employee volunteers served as judges and provided constructive feedback to several of the teams competing while the Intuitive Foundation provided funding to support the program.“Inspiring young people to understand the world- leading and unrivaled opportunities that exist in Oxfordshire is a key aspect of our work.",ISRG_2020.pdf
"By supporting our transformative technologies tour, Intuitive not only brought cutting-edge medical technology to ambitious teenagers, but also helped them to understand that dreams can become a reality.",ISRG_2020.pdf
"We are extremely grateful to Intuitive.” Rob Panting Communications Manager Oxford Local Enterprise Partnership(OxLEP) Ltd 500+ Health Career Collaborative participants in 2020 29 Intuitive volunteers support Technovation competitions42 of 56 Intuitive Sustainability Report 2020 PN 1074653-US RevA 01/2021Creating stronger communities Stanford blood drives The COVID-19 pandemic increased the need for blood donations, and core to our mission, our Sunnyvale-based team continues to respond positively to support the Stanford Blood Center (SBC).",ISRG_2020.pdf
"We started the year with a successful drive in early March, before shelter-in-place orders postponed the remainder of our 2020 drives.",ISRG_2020.pdf
"We had increased our average-units goal to 52 from 40 for 2020, and SBC collected 50 units and added eight first-time Intuitive donors during the March event.",ISRG_2020.pdf
"That brings us to more than 4,200 patients impacted since our program began.",ISRG_2020.pdf
"Our support of the SBC continues despite COVID-19, and we continue to encourage employees to make donations at their local blood donation centers until we can resume on-site blood drive collections.",ISRG_2020.pdf
Employee-driven community grants The Intuitive Foundation offered grants to support innovative programs initiated by our employees that would have positive impact in local communities.,ISRG_2020.pdf
"Employees from our Swiss office came together to propose grants for Zoe4life, providing holiday gifts to 120 children with cancer and their families.",ISRG_2020.pdf
"By working together, six employees pooled their grant requests to increase the impact of the gifts sent to each of these families through the Zoe4life program.",ISRG_2020.pdf
"Corporate social responsibility in India In April, we established our corporate social responsibility (CSR) policy in India and formed our India CSR working committee of employee volunteers called Ek Prayaas (meaning 'an endeavor') by summer’s end.",ISRG_2020.pdf
