sentences,filename
"The all-virtual onboarding program dives deeper into our history, culture, employee resource groups, sustainability, and Intuitive Foundation activities to promote earlier awareness of, and engagement with, various employee programs.",ISRG_2021.pdf
"Our annual global performance review cycle continued to see high levels of engagement, with more than 97% of employees completing self-evaluations.",ISRG_2021.pdf
"As managers and employees continue to leverage the upgraded performance management system that rolled out across 2019 and 2020, we saw the recorded overall delivery of manager feedback increase by 5% in 2021 to 86%.",ISRG_2021.pdf
"This year-end review is an opportunity for our employees and managers to capture critical milestones, recognize achievements from the previous year, and engage in future-focused conversations on what success looks like going forward.",ISRG_2021.pdf
"While we hold our employees and leaders accountable for completing this important activity, as a company, we are dedicated to the continued evolution of performance management in support of continuous alignment, on-going feedback, and employee development.",ISRG_2021.pdf
"Inclusion and diversity (I&D) At Intuitive, we are committed to empowering our employees and customers from every background to fully contribute toward our shared purpose—to expand the potential of physicians to heal without constraints.",ISRG_2021.pdf
"We believe that inclusion, diversity, and fair treatment should be integral to how we engage and support our employees, communities, and customers.97+% Employee performance self-evaluation completion rate in 2021 21 of 53 Intuitive Sustainability Report 2021 PN1074653-01-US RevB 1/2022A four-part strategy guides our progress: • Diverse workforce: Increase leader and employee representation to fuel innovation and better mirror our customers and their patients.",ISRG_2021.pdf
"This includes diverse talent sourcing, strengthening our hiring process rigor and training, and thoughtful succession and talent planning.",ISRG_2021.pdf
"• Inclusive experience: Help employees from all backgrounds feel welcome, supported, and valued.",ISRG_2021.pdf
"This includes supporting our employee resource groups (ERGs) for underrepresented identities, providing inclusion training and education, enhancing leader support, and considering all employees’ needs in areas such as facilities and benefits.",ISRG_2021.pdf
"• Fair practices: Openly share progress and continuously improve our people practices in areas such as representation, pay equity, and promotions.",ISRG_2021.pdf
"• Industry engagement: Engage with our customers and their patients, our employees, communities, suppliers, and other stakeholders to drive positive change.",ISRG_2021.pdf
"From an inclusion and diversity perspective, 2021 was a year of listening carefully to determine where we are, identify gaps, set strategy, and build infrastructure.",ISRG_2021.pdf
Key to our strategy was the August hire of a vice president of global inclusion and diversity to spearhead our I&D initiatives in partnership with our I&D Council.,ISRG_2021.pdf
"We made progress in I&D education and training to help employees expand inclusion efforts in recruitment, workplace culture, and leadership.",ISRG_2021.pdf
"We also added resources in people analytics and talent acquisition, strengthened our support for ERGs, and improved hiring and employee development programs.",ISRG_2021.pdf
Our 2021 employee experience survey contained a set of questions to help us further assess and evolve our I&D multiyear strategic roadmap and better understand the workplace experience of our diverse workforce.,ISRG_2021.pdf
We engaged a team of I&D consultants that deeply explored the experiences of our employees through focus groups and interviews.,ISRG_2021.pdf
"They listened intently to understand where we are today, what we are doing well, and how we can make improvements.",ISRG_2021.pdf
"As a result, we have a robust roadmap of opportunities to be incorporated into our future strategic plans.",ISRG_2021.pdf
"We have committed to publishing population metrics in this report annually, disclosing our global gender representation, people of color representation within the U.S., and 3-year trends associated with each.",ISRG_2021.pdf
"This year, as part of our effort to expand management diversity, we added our leadership population metrics.",ISRG_2021.pdf
We use the data we collect to inform decisions that will move us toward greater inclusion.,ISRG_2021.pdf
Employee resource groups Our ERGs are volunteer-led groups that provide community and support for employees from underrepresented backgrounds.,ISRG_2021.pdf
"We have six ERGs serving employee communities that include those identifying as women, Black, Asian/Pacific Islander, veterans, LGBTQ+, and those having a disability.",ISRG_2021.pdf
We have experienced strong growth and engagement among these organizations with activities ranging from recruitment and employee development initiatives to educational speaker series events.,ISRG_2021.pdf
Following are a few select highlights of the many inclusive actions taken by our ERGs throughout 2021.,ISRG_2021.pdf
"9,600 + employee engagements at ERG events in 202122 of 53 Intuitive Sustainability Report 2021 PN1074653-01-US RevB 1/2022Women Intuitive Network (WIN) In 2021, our WIN ERG and our I&D Council piloted a women’s leadership development program to develop and support women being considered for advancement.",ISRG_2021.pdf
The process began with identifying high-potential women through a cross-business nomination process.,ISRG_2021.pdf
The candidates then entered a program to build their leadership skills and address some of the common headwinds women face in business.,ISRG_2021.pdf
"Intuitive Pan-Asian Community (InPAC) In June, following highly publicized hate crimes in the U.S., our InPAC team engaged employees across our ERG community to collaborate in presenting a global One Intuitive Vigil to express solidarity with the Asian American Pacific Islander (AAPI) community within and beyond our company.",ISRG_2021.pdf
"The vigil grew into a larger conversation about how we can support one another across our global community and how to access the health and wellness resources, including mental health and resilience, available to employees.",ISRG_2021.pdf
"* As of December 31, 2021.† As self-d isclosed.",ISRG_2021.pdf
"See additional detail on page 46.Gender metrics Race/ethnicity metrics36% Female representation on our board of directors 201933.2% 202033.6% 202135.6%Female representation across all levels (Globally) * 201917.3% 202019.4% 202122.9%Female representation at or above the VP level (Globally) * 201929.0% 202028.1% 202130.1%Female representation at director and manager levels (Globally) * 201949.7% 202050.7% 202152.7%People of color representation across all levels (U.S. only) * 201916.7% 202017.8% 202120.4%People of color representation at or above the VP level (U.S. only) * 201940.0% 202041.0% 202143.9%People of color representation at director and manager levels (U.S. only) * 27% People of color representation on our board of directors†23 of 53 Intuitive Sustainability Report 2021 PN1074653-01-US RevB 1/2022Veterans Engaged for Teamwork and Support (VETS) ERG At Intuitive, our VETS ERG is dedicated to improving the health, welfare, and career opportunities of employees who served in any branch of the U.S. military and those who remain active in the National Guard or military reserves.",ISRG_2021.pdf
"The group, which welcomes military-affiliated Intuitive employees and their allies, inspires camaraderie and expands members’ potential through recruitment, development, and service.",ISRG_2021.pdf
Our VETS ERG engaged with our government affairs and patient advocacy teams to sponsor a midsummer virtual event hosted by ZERO – The End of Prostate Cancer ( zerocancer.org ).,ISRG_2021.pdf
The event was titled “What Veterans Need to Know About Prostate Cancer and How to Get Care in Their Community.” It provided education on prostate cancer and how to access prostate cancer screening and treatment within the Veterans Health Administration or through the VA Community Care Network.,ISRG_2021.pdf
"6,100 + ZERO webinar recording views* * As of October 26 , 2021.VETS members taking supplies to help support communities impacted by Hurricane Ida in Louisiana.24 of 53 Intuitive Sustainability Report 2021 PN1074653-01-US RevB 1/2022Enhancing the workplace experience Commitment to pay equity At Intuitive, we encourage our employees to strive to pursue and achieve the highest standards of performance for themselves, their colleagues, patients, customers, and shareholders.",ISRG_2021.pdf
"Our policy is to employ, retain, promote, and otherwise treat all employees based on merit, qualifications, and competence, regardless of an employee’s gender, race/ethnicity, or any other protected characteristic.",ISRG_2021.pdf
Fair and equitable pay is integral to our commitment to our employees; and our executive team and our board of directors strongly support this commitment.,ISRG_2021.pdf
We conduct pay equity reviews regularly to help us understand whether our compensation structure is appropriate and identify what improvements can be made.,ISRG_2021.pdf
"In addition, we utilize a robust inspection process with an independent consulting firm for gender and race/ethnicity, hiring, promotion and wage equity to determine whether any statistically significant pay differences exist between gender identities, and between the various race/ethnicity categories.",ISRG_2021.pdf
"If pay disparities are identified, we conduct further evaluation to determine whether remedial adjustments are appropriate.",ISRG_2021.pdf
"In addition, employees can raise issues regarding pay equity with their manager, their human resources partner, or confidentially through our anonymous reporting helpline.",ISRG_2021.pdf
Our commitment to pay equity is embodied in our statement found here.,ISRG_2021.pdf
43:1 Ratio of the annual total CEO compensation to the annual total compensation of the median employee for 202025 of 53 Intuitive Sustainability Report 2021 PN1074653-01-US RevB 1/2022Future ways of working The pandemic set in motion internal processes to rethink how we work.,ISRG_2021.pdf
One of the markers of sustainability is the ability to adapt to a future where work does not default to an office or production environment.,ISRG_2021.pdf
"While work for many has shifted outside a 9 a.m. to 5 p.m. window, five days a week in an office, the disruption from COVID-19 created an opportunity for changes that could strengthen our culture and appeal to a diverse group of new employees.",ISRG_2021.pdf
"In June, a future ways of working survey specifically gathered employee input into how we can retain our world-class talent moving forward.",ISRG_2021.pdf
"Our future ways of working team helped to redefine job classifications to include fully remote and hybrid work arrangements, setting new expectations around how we work.",ISRG_2021.pdf
We surveyed employees for their ideas around how work could evolve during and after the pandemic.,ISRG_2021.pdf
"Inputs resulted in more outdoor working spaces, self-service information technology (IT) equipment procurement, on-demand mental health care and resilience resources, ergonomics review and new furniture choices for those working from home, new scheduling systems for reserving on-site workspaces, and more thoughtful approaches to facility cleaning and access to common areas.",ISRG_2021.pdf
Employees working remotely placed orders through our internal websites for direct delivery to their homes.,ISRG_2021.pdf
"Keeping in mind employee health and safety, Intuitive has prepared for a post-pandemic future where employees can return to an Intuitive workspace with peace of mind.",ISRG_2021.pdf
"With many employees working from home for much of 2021, the advantages of increased flexibility became clearer.",ISRG_2021.pdf
That insight informed planning that incorporates more flexible arrangements into job descriptions and team work processes going forward.,ISRG_2021.pdf
Offering different ways to work aims to help attract and retain world-class talent without sacrificing the connectivity some teams require.,ISRG_2021.pdf
"Surveys of employees addressing future ways of working reinforced the value of in-person collaboration for building alignment and community, strengthening our beliefs and values, uncovering innovative opportunities, and maximizing productivity.",ISRG_2021.pdf
"26 of 53 Intuitive Sustainability Report 2021 PN1074653-01-US RevB 1/2022On-site work safety Citing the resurgence of COVID-19 in the U.S., in September, our future ways of working and COVID-19 response teams joined to announce a delay in fully reopening our U.S. facilities until early 2022.",ISRG_2021.pdf
"The announcement included support for strategic, on-site, in-person activities and gatherings with meeting and event protocols in place to help minimize the exposure risk.",ISRG_2021.pdf
"Each Intuitive location manages overall safety with guidance based on regional, country, and local regulations and best practices.",ISRG_2021.pdf
"Investments in building upgrades and facility safety improvements in 2021 included improved-efficiency HVAC filters and restrooms equipped with touchless faucets, toilets, towel dispensers, and door kickplates, where possible.",ISRG_2021.pdf
We also increased cleaning frequency for restrooms and common areas.,ISRG_2021.pdf
Mexicali employee health and safety Our Mexicali manufacturing team established a multidisciplinary ergonomics committee to help maintain low injury rates.,ISRG_2021.pdf
"The committee identified 12 improvements for 2021 related to posture, work positioning, and repetitive motion.",ISRG_2021.pdf
We instituted those improvements and initiated two programs based on similar programs used at our Sunnyvale location.,ISRG_2021.pdf
"The first is a seven-minute warm-up and stretching program at the start of, and at intervals during, every shift.",ISRG_2021.pdf
"In addition, we introduced a task rotation program that moves technicians to a new task every two hours.",ISRG_2021.pdf
Both programs help to limit repetitive stress injuries by reducing the length of time employees remain in one position repeating the same motions.,ISRG_2021.pdf
Mexicali safety committees and community health Intuitive has always emphasized the importance of being agile and responsive to our environment.,ISRG_2021.pdf
This is particularly important when it comes to ensuring and investing in the health and safety of employees.,ISRG_2021.pdf
And it is paramount in our international facilities and manufacturing environments that needed to stay operational and continue manufacturing our products throughout the challenges of the last several years.,ISRG_2021.pdf
"Our Mexicali team took immediate steps to establish employee committees, which met up to three times a week, providing us with a direct link to hearing the needs of our employees.",ISRG_2021.pdf
"These committees reviewed safety protocols, informed by Mexico’s Ministry of Health, and sent feedback to the facility leadership team related to health and safety compliance.",ISRG_2021.pdf
"As protocols were implemented or changed, we kept employees up to date through communication campaigns and required each employee to complete online training that included educational videos.",ISRG_2021.pdf
"By maintaining open lines of communication between employees and leadership, establishing employee committees, and enforcing health and safety protocols, we remained operational and limited COVID-19 exposure at our facilities.",ISRG_2021.pdf
"* Rolling 12 months as of December 31, 2021 for North America manufacturing locations only, rate per 100 employees, calculated as reported to U.S. Occupational Health and Safety Administrat ion (OSHA)0.08 Lost time incident rate (LTIR)* 1.19 Total recordable incident rate (TRIR) *27 of 53 Intuitive Sustainability Report 2021 PN1074653-01-US RevB 1/2022Facilitated through the local industrial business association, our Mexicali team also assisted other companies in the region to stay open and running.",ISRG_2021.pdf
We developed a thorough checklist based on the Ministry of Health’s COVID-19 health guidelines that was shared with a dozen other manufacturing companies.,ISRG_2021.pdf
The checklist and on-site inspections conducted by our employees helped enable these companies to pass federal inspections and remain operational.,ISRG_2021.pdf
"We were also able to share our best practices with local universities, so that schools could stay open for staff, even when school was not in session.",ISRG_2021.pdf
The industry association honored our work with an award for our contributions.,ISRG_2021.pdf
We are grateful for the opportunity to connect with fellow companies in the manufacturing industry community and support the economic strength of the Mexicali region.,ISRG_2021.pdf
University collaboration in Mexicali We believe in supporting our employees and the communities where we live and work.,ISRG_2021.pdf
Building sustainable growth also means being responsible stewards of the growth and success of those around us and the environments we have the privilege to live and work in.,ISRG_2021.pdf
This includes engaging with local universities to introduce students to our company and provide opportunities for professional work experience.,ISRG_2021.pdf
Our Mexicali team started an intern program three years ago.,ISRG_2021.pdf
"This year, they collaborated directly with a nearby university’s engineering program on a real-world Intuitive project.",ISRG_2021.pdf
The students engaged with our equipment engineering team to solve a warehouse space and process challenge.,ISRG_2021.pdf
"Students, employee mentors, and teachers developed various proposals to address the issue.",ISRG_2021.pdf
The collaborative team then built the selected proposal.,ISRG_2021.pdf
"Our Mexicali team has worked with multiple universities over the last few years to provide students with exposure to Intuitive, the types of work we do, and mentorship opportunities.",ISRG_2021.pdf
We believe that it is critical to invest in our communities and the students who live and study there.,ISRG_2021.pdf
"28 of 53 Intuitive Sustainability Report 2021 PN1074653-01-US RevB 1/2022Awards and recognition At Intuitive, we strive to integrate human needs with technology’s potential.",ISRG_2021.pdf
"To that end, our diverse teams come together to innovate on the design and user experience of our various products, processes, and communications.",ISRG_2021.pdf
"From needs identification to designing for usability, prototyping to testing, story development to film making, our teams—including industrial, interaction, graphics, user experience, brand, creative, and multimedia specialists —strive to help advance minimally invasive care via our products, services, and experiences.",ISRG_2021.pdf
"In addition, we continue to be recognized as a great place to work by Glassdoor and receive other recognition for our valued engagement with our customers, employees, communities, and stakeholders.",ISRG_2021.pdf
"Throughout 2021, we are proud of our talented teams and their work that has been recognized for its impact.",ISRG_2021.pdf
"“On behalf of Intuitive, we are thrilled to receive the SF Design Week award for our design system.",ISRG_2021.pdf
"This is a wonderful testimony to the importance of design/UX and the dedication Intuitive teams put into creating great user experiences.” John WhiteSenior Visual Design Manager Intuitive Design/UX TeamMedical Design Excellence Awards (MDEA) • Bronze for our da Vinci SP system in the ER and OR Tools, Equipment, and Supplies category • Bronze for our Ion system in the Radiological, Imaging, and Electromechanical Devices category Brand Film Awards: Honorable mention in the Healthcare category: Best creation of awareness of a healthcare issue or disease/condition in regulated markets for our film, “The Future Is Intuitive” Gold Telly Award in the Branded Content: Science and Technology category for Intuitive and Freethink’s video, “Robotic Surgery Unlocks a New Era of Medicine” The 2021 San Francisco Design Week Award for Systems Design.",ISRG_2021.pdf
Our design system provides a foundational language of design components and guidelines within a shared library.,ISRG_2021.pdf
The system serves a wide range of designers creating products and services for healthcare professionals in demanding working environments.,ISRG_2021.pdf
"2021 GOOD DESIGN Award: Interactive Media for The Intuitive Design System | 2020#41 Glassdoor’s Best Places to Work 2021 #64 Glassdoor’s Top CEOs for 202129 of 53 Intuitive Sustainability Report 2021 PN1074653-01-US RevB 1/2022Creating stronger communitiesThroughout 2021, we continued to increase our efforts to positively and sustainably impact our customers, employees, and communities.",ISRG_2021.pdf
Our community-based programs include efforts directly supported by Intuitive and those supported in collaboration with the Intuitive Foundation.,ISRG_2021.pdf
"With a mission to reduce the global burden of disease and suffering through philanthropy, research, and education aimed at better outcomes for patients everywhere, the Intuitive Foundation focuses its efforts on clinical research; emerging enabling technologies; ideas and methods that reduce variability and improve access to healthcare; tools and support for the next generation of engineers, physicians, and care teams; and philanthropic giving.",ISRG_2021.pdf
30 of 53 Intuitive Sustainability Report 2021 PN1074653-01-US RevB 1/2022Intuitive community programs Taiwan personal protective equipment (PPE) donations We are committed to positively impacting communities around the world.,ISRG_2021.pdf
"This means working with and assisting those working in the healthcare space who continue to be challenged, especially with shortages of necessary PPE for hospitals.",ISRG_2021.pdf
"Building on our 2020 efforts that included completion of an $85 million customer financial relief program, in 2021, we launched a program to purchase and donate over 43,000 N95 masks to hospitals across Taiwan.",ISRG_2021.pdf
These masks are being distributed to 36 hospitals over several months.,ISRG_2021.pdf
"Social responsibility in India To both oversee and execute corporate social responsibility (CSR) activities, Intuitive employee volunteers in India formed a working team named Ek Prayaas.",ISRG_2021.pdf
"The team focused their efforts on education in late 2020, identifying Agastya International Foundation (AIF) as a recipient of our support.",ISRG_2021.pdf
AIF is a Bangalore-based education trust and nonprofit organization founded in 1999.,ISRG_2021.pdf
"AIF’s activities spread across 21 states in India, supporting 250,000 teachers, and reaching 13 million children.",ISRG_2021.pdf
"AIF’s mission is “to spark curiosity, nurture creativity, and instill confidence” in economically disadvantaged children and government school teachers by bringing imaginative and innovative hands-on science education, and project-based and peer-to-peer learning to schools, towns, and villages across India.",ISRG_2021.pdf
Ek Prayaas sponsored an AIF education kit consisting of 15 activities.,ISRG_2021.pdf
"With Intuitive India’s donation, the AIF team developed 800 education kits and identified two districts, Kolar and Tumkur, which have many underserved government schools.",ISRG_2021.pdf
These kits were distributed to 675 schools and 156 young-instructor leaders (active students who are keen to learn and have the ability to teach other students).,ISRG_2021.pdf
We received overwhelming positive feedback from both teachers and children.,ISRG_2021.pdf
"In 2021 and 2022, we are sponsoring the distribution of over 500 Young Instructor Leader kits in areas near Bangalore.",ISRG_2021.pdf
“It is an excellent initiative by Intuitive supported by AIF.,ISRG_2021.pdf
I always believed that experiential is more impactful for children; the education kit sponsored by Intuitive is helping us fulfill that requirement in our school.,ISRG_2021.pdf
My students are eager to learn the process of experiment and curious to know the outcome.,ISRG_2021.pdf
"This is the right age to spark curiosity amongst children, which sets a strong foundation for the future.",ISRG_2021.pdf
Government schools like ours may not otherwise have access to such material.,ISRG_2021.pdf
"We want to express our heartfelt gratitude to the organization for considering our school.” Mr. Shekar M Shettihalli Middle School teacher Tumkur16,800 Masks distributed to Taiwan * * As of December 15, 2021.31 of 53 Intuitive Sustainability Report 2021 PN1074653-01-US RevB 1/2022Community programs in collaboration with the Intuitive Foundation Building on programs launched during, and in some cases, before the pandemic, the Intuitive Foundation continued to make progress aligned with its mission, including the creation of several matching fundraising campaigns for employee donations to promote health, advance education, boost sustainability, and reduce human suffering.",ISRG_2021.pdf
The foundation is a nonprofit organization established by Intuitive in 2018 and funded by Intuitive.,ISRG_2021.pdf
"Museum projects In collaboration with the foundation, Intuitive donated a da Vinci system to the Edinburgh Surgeons’ Hall Museums to be part of the new Body Voyager exhibition.",ISRG_2021.pdf
The da Vinci system will be a focal point in the new exhibition galleries.,ISRG_2021.pdf
Visitors to the exhibit will be able to participate in a simulated robotic-assisted surgical procedure experience.,ISRG_2021.pdf
