sentences,filename
2021 SUSTAINABILITY REPORT ENVIRONMENTAL | SOCIAL | GOVERNANCECOMPANY PROFILE Corporate Overview .................................................................. 2 Mission and Guiding Principles.,3821-1-glbl-en-2021-sustainability-report-interactive.pdf
"................................................. 2 Our Sustainability Commitment ................................................ 2 Our Approach to ESG ................................................................. 3 COVID -19 ................................................................................... 5 ENVIRONMENTAL Environmental Risk Management Policy .................................... 6 Compliance ........................................................................... 6 Continuous Improvement ...................................................... 6 Business Integration .............................................................. 6 Environment & Climate Change ............................................. 6 Health & Safety ...................................................................... 6 Communication & Education ................................................. 6 Environmental Targets .............................................................. 7 SOCIAL Talent ........................................................................................ 8 Culture Promises ....................................................................... 8 Team Member Engagement ....................................................... 8 Performance Management ........................................................ 8 Learning and Development ....................................................... 9 Global Mentoring Program ........................................................ 9 Virtual Work Support ................................................................ 9 Team Member Recognition ........................................................ 9 Talent Acquisition ...................................................................... 9 Early Career / Development Rotational Programs ...................... 9 Global Mentoring Program ........................................................ 9 Diversity, Equity & Inclusion .................................................... 10 Health, Safety & Wellness ........................................................ 10 Pay Equity ................................................................................ 10 Collective Bargaining ............................................................... 11 Discrimination Policy ................................................................ 11 Product Quality ........................................................................ 11 Supplier Code of Conduct ........................................................ 12 Supplier Social Responsibility Audits ....................................... 12 Supplier Diligence ................................................................... 12 Supplier Quality Audits ............................................................ 12Supplier Diversity Policy .......................................................... 13 Management of Risks Associated with Use of Critical Materials ................................................................. 13 Animal Testing Policy ............................................................... 13 Clinical Trial Program ............................................................... 13 Clinical Trial Transparency ....................................................... 14 Grants, Donations and Funding ............................................... 14 Zimmer Biomet Foundation ................................................. 14 Zimmer Biomet Medical Missions ........................................ 15 Zimmer Biomet Corporate Grants ........................................ 15 Advancing Diversity, Equity and Inclusion ........................... 16 Access to Healthcare ............................................................... 16 Movement is Life .................................................................. 16 Patient Privacy and Data Security ............................................ 17 Privacy ................................................................................ 17 Data Security ....................................................................... 17 Data Usage .......................................................................... 17 Ownership ........................................................................... 17 Cybersecurity .......................................................................... 18 GOVERNANCE Corporate Governance ............................................................ 19 Audit Committee ................................................................. 19 Compensation and Management Development Committee .19 Corporate Governance Committee ...................................... 20 Quality, Regulatory and Technology Committee .................. 20 Executive Compensation ......................................................... 20 Ethical Business Conduct ......................................................... 20 Countering Corruption ............................................................ 21 Whistleblower Program ........................................................... 22 Ethical Marketing .................................................................... 23 Zimmer Biomet’s Statement of Engagement on Public Policy Issues ............................................................ 23 How Zimmer Biomet Engages .................................................. 24 Industry Groups and Trade Associations .................................. 25 Political Contributions ............................................................. 25 2020 Sustainability Accounting Standards Board Index ............................................................................. 26Table of Contents *The disclosures in this report are for WholeCo Zimmer Biomet including Dental & Spine segment3 CEO INTRODUCTION Every day, the Zimmer Biomet team works towards our mission of alleviating pain and improving quality of life for people around the world.",3821-1-glbl-en-2021-sustainability-report-interactive.pdf
We also work toward being a responsible corporate citizen.,3821-1-glbl-en-2021-sustainability-report-interactive.pdf
"This Sustainability Report describes our annual accomplishments in developing a more sustainable business, reducing waste and use of natural resources, and improving the environmental performance of our operations.",3821-1-glbl-en-2021-sustainability-report-interactive.pdf
It also describes our commitment to the highest standards of patient safety and quality in our products and services and to world-class integrity and ethical business practices.,3821-1-glbl-en-2021-sustainability-report-interactive.pdf
"In 2021, we continued to make strong progress against our sustainability commitments.",3821-1-glbl-en-2021-sustainability-report-interactive.pdf
"As a company, we are increasingly focused on advancing these initiatives and even more ambitious about what we can achieve, together.",3821-1-glbl-en-2021-sustainability-report-interactive.pdf
"On behalf of all of us at Zimmer Biomet, I thank you for your support.",3821-1-glbl-en-2021-sustainability-report-interactive.pdf
I look forward to continuing to share our progress with you as we move ahead.,3821-1-glbl-en-2021-sustainability-report-interactive.pdf
"Bryan Hanson Chairman, President and CEO, Zimmer Biomet Corporate Overview Zimmer Biomet is a global medical technology leader with a comprehensive portfolio designed to maximize mobility and improve health.",3821-1-glbl-en-2021-sustainability-report-interactive.pdf
"We seamlessly transform the patient experience through our innovative products and suite of integrated digital and robotic technologies that leverage data, analytics and artificial intelligence.",3821-1-glbl-en-2021-sustainability-report-interactive.pdf
"With more than 90 years of trusted leadership and proven expertise, Zimmer Biomet is positioned to deliver the highest quality solutions to patients and providers.",3821-1-glbl-en-2021-sustainability-report-interactive.pdf
Our legacy continues to come to life today through our progressive culture of evolution and innovation.,3821-1-glbl-en-2021-sustainability-report-interactive.pdf
"For more information about our product portfolio, our operations in more than 25 countries and sales in more than 100 countries, or about joining our team, visit www.zimmerbiomet.com or follow Zimmer Biomet on Twitter at www.twitter.com/zimmerbiomet .Our Mission Alleviate pain and improve the quality of life for people around the world.",3821-1-glbl-en-2021-sustainability-report-interactive.pdf
Guiding Principles • Respect the contributions and perspectives of all team members.,3821-1-glbl-en-2021-sustainability-report-interactive.pdf
"• Commit to the highest standards of patient safety, quality and integrity.",3821-1-glbl-en-2021-sustainability-report-interactive.pdf
• Focus our resources in areas where we will make a difference.,3821-1-glbl-en-2021-sustainability-report-interactive.pdf
• Ensure our return is equivalent to the value we provide our customers and patients.,3821-1-glbl-en-2021-sustainability-report-interactive.pdf
• Give back to our communities and people in need.,3821-1-glbl-en-2021-sustainability-report-interactive.pdf
Our Sustainability Commitment Zimmer Biomet is committed to being a good corporate citizen.,3821-1-glbl-en-2021-sustainability-report-interactive.pdf
"Our global team is dedicated to sustainable practices across the entire spectrum of the environmental, social and governance platform.",3821-1-glbl-en-2021-sustainability-report-interactive.pdf
COMPANY PROFILE 2OUR APPROACH TO ESG We take a comprehensive and proactive approach to ESG.,3821-1-glbl-en-2021-sustainability-report-interactive.pdf
"Our Board’s Corporate Governance Committee oversees current and emerging political, social, environmental, corporate citizenship and public policy issues for the Company.",3821-1-glbl-en-2021-sustainability-report-interactive.pdf
"At the team member level, we have established a functional ESG Working Group, comprised of team members spanning multiple divisions of the organization, including Human Resources, Operations, Environmental, Health, Safety and Sustainability, Quality, Finance, Accounting, Investor Relations, Communications, Government Affairs, Legal and Compliance.",3821-1-glbl-en-2021-sustainability-report-interactive.pdf
The ESG Working Group meets monthly to discuss Zimmer Biomet’s ESG initiatives and identifies ways we can enhance our ESG disclosures.,3821-1-glbl-en-2021-sustainability-report-interactive.pdf
"Our CEO and CFO receive monthly updates on our ESG progress, while at the Board level, the Corporate Governance Committee receives quarterly reports.",3821-1-glbl-en-2021-sustainability-report-interactive.pdf
We proactively engage with ratings agencies and investors to inform our ESG processes and provide the appropriate level of transparency while using third party auditing and benchmarking to pinpoint areas for continuous improvement.,3821-1-glbl-en-2021-sustainability-report-interactive.pdf
"3COMPANY AWARDS 45 COVID-19 The COVID-19 pandemic has significantly affected Zimmer Biomet’s financial results, but has not impacted the quality, safety and efficacy of our products.",3821-1-glbl-en-2021-sustainability-report-interactive.pdf
"Prior to COVID-19, Zimmer Biomet developed comprehensive crisis response plans and initiated contingency drills – including for pandemic events – across our operations.",3821-1-glbl-en-2021-sustainability-report-interactive.pdf
This exercise helped prepare our business and create enhanced disaster recovery plans that have been a significant benefit throughout our response to COVID-19.,3821-1-glbl-en-2021-sustainability-report-interactive.pdf
"Throughout 2021, we continued to aggressively secure our global supply chain and manage the unique challenges presented by each new COVID-19 wave.",3821-1-glbl-en-2021-sustainability-report-interactive.pdf
"Due to these efforts, we continued to serve our customers without compromising product quality and safety.All of our manufacturing sites and distribution centers continued to operate throughout 2021 with enhanced safety protocols.",3821-1-glbl-en-2021-sustainability-report-interactive.pdf
Our vigilance and commitment to health and safety ensured our team members in each region had what they needed to operate in a safe environment and meet our operational commitments.,3821-1-glbl-en-2021-sustainability-report-interactive.pdf
Our enhanced safety protocols were openly shared with suppliers to further secure our supply chain.,3821-1-glbl-en-2021-sustainability-report-interactive.pdf
"Most Zimmer Biomet team members who were not directly responsible for or involved in manufacturing operations and the supply chain worked from home as an added safety measure to reduce risk of infection and secure the supply chain.6Environmental Risk Management Policy Consistent with Zimmer Biomet’s Mission, Code of Business Conduct and Ethics ( https:/ /www.zimmerbiomet.com/ en/about-us/our-impact.html ), and the Environmental, Health, Safety, and Sustainability (EHSS) vision, we are committed to our policy of conducting business in a safe and environmentally sustainable manner that promotes the health of our employees, customers, community and the environment, specifically fighting climate change.",3821-1-glbl-en-2021-sustainability-report-interactive.pdf
The purpose of our Environmental Risk Management Policy is to implement the principles of the EHSS programs while implementing and sustaining global best practices.,3821-1-glbl-en-2021-sustainability-report-interactive.pdf
Corporate and regional standards exist to support these principles.,3821-1-glbl-en-2021-sustainability-report-interactive.pdf
This policy applies to all locations worldwide and provides uniform guidance for Zimmer Biomet EHSS teams to manage and monitor risk within our global manufacturing and distribution processes.,3821-1-glbl-en-2021-sustainability-report-interactive.pdf
"The EHSS Management System delivers six main outcomes, as follows: Compliance We comply with, and often exceed the requirements of, all applicable EHSS laws, regulations, Company EHSS standards and other requirements to which we subscribe related to all EHSS subject matter and risks.",3821-1-glbl-en-2021-sustainability-report-interactive.pdf
We conduct frequent audits and implement best practices to maintain compliance with these requirements.,3821-1-glbl-en-2021-sustainability-report-interactive.pdf
"Continuous Improvement Zimmer Biomet establishes EHSS goals, objectives and targets across our global business and strives to continually improve our performance and publicly report on our progress.",3821-1-glbl-en-2021-sustainability-report-interactive.pdf
"Our EHSS standards establish controls and promote a positive EHSS culture.Business Integration We integrate EHSS principles into business decisions to proactively ensure the health and safety of our employees and communities, while also promoting environmentally sustainable practices.",3821-1-glbl-en-2021-sustainability-report-interactive.pdf
"Specifically, we require that an EHSS evaluation be integrated into product design, manufacturing and distribution business processes and services that will reduce EHSS risks, improve performance throughout our operations, products and packaging across their lifecycle, and promote pollution prevention.",3821-1-glbl-en-2021-sustainability-report-interactive.pdf
"Environment & Climate Change To minimize our impact on the environment and address climate change, we minimize waste and emissions, reuse and recycle materials, promote renewable energy use, reduce greenhouse gas emissions, and conserve energy and water wherever feasible.",3821-1-glbl-en-2021-sustainability-report-interactive.pdf
Health & Safety Zimmer Biomet EHSS establishes health and safety standards that promote a safe and healthy workplace by striving continuously to reduce hazards and risks to prevent workplace injuries and illnesses.,3821-1-glbl-en-2021-sustainability-report-interactive.pdf
"Communication & Education Zimmer Biomet EHSS communicates our Environmental Health and Safety Policy to employees, customers, shareholders, suppliers, community and other stakeholders.",3821-1-glbl-en-2021-sustainability-report-interactive.pdf
"Zimmer Biomet EHSS standards, procedures and other resources enable employees to implement this policy and share best practices to promote continuous improvement and enhance environmental, health and safety performance.",3821-1-glbl-en-2021-sustainability-report-interactive.pdf
ENVIRONMENTAL Environmental Targets The environmental issues facing the world and the threat of climate change warrant an urgent and immediate response.,3821-1-glbl-en-2021-sustainability-report-interactive.pdf
"In 2020, Zimmer Biomet publicly committed to setting science-based targets, which in 2021 were approved through the Science Based Target Initiative.",3821-1-glbl-en-2021-sustainability-report-interactive.pdf
https:/ /sciencebasedtargets.org/companies-taking- action#table We are committed to reducing absolute scope 1 and 2 greenhouse gas (GHG) emissions 55% by 2030 from a 2017 base year.,3821-1-glbl-en-2021-sustainability-report-interactive.pdf
We have also committed to reduce absolute scope 3 GHG emissions from purchased goods and services to 15% by 2030 from a 2019 base year.,3821-1-glbl-en-2021-sustainability-report-interactive.pdf
"More than 40% of our supply chain responded to our request for GHG emission disclosures in 2021, our first year of focus on scope 3, furthering our efforts to reduce our carbon footprint.",3821-1-glbl-en-2021-sustainability-report-interactive.pdf
"Furthermore, in July 2021, a large-scale solar farm, Prospero II, for which Zimmer Biomet negotiated a Virtual Power Purchase Agreement (VPPA), went into commercial operation.",3821-1-glbl-en-2021-sustainability-report-interactive.pdf
The renewable energy generated from the solar farm will offset 100% of our North American electrical load.,3821-1-glbl-en-2021-sustainability-report-interactive.pdf
"In the second half of 2021, the renewable energy generated for Zimmer Biomet was more than 5,474MWh, which equates to nearly 39,000 Metric Tons of CO2 emissions reduction, or 28% reduction of Zimmer Biomet’s scope 1 and 2 GHG emissions.",3821-1-glbl-en-2021-sustainability-report-interactive.pdf
"This amount of emissions reduction is equivalent to nearly 19,500 metric tons of coal burned.",3821-1-glbl-en-2021-sustainability-report-interactive.pdf
We continue to pursue renewable energies in other regions throughout the world to advance our commitment to becoming a recognized leader within the environmental space.,3821-1-glbl-en-2021-sustainability-report-interactive.pdf
"We have also outfitted all major manufacturing and distribution sites globally with LED lighting, which is more energy efficient than conventional bulbs.",3821-1-glbl-en-2021-sustainability-report-interactive.pdf
"In addition, we actively participate in the Carbon Disclosure Project (CDP), with a Climate Change 2021 ranking of B, and a 2021 Supplier Engagement Rating of A-; you can see our grades here.",3821-1-glbl-en-2021-sustainability-report-interactive.pdf
"The Supplier Engagement Rating assesses performance on governance, targets, scope 3 emissions, and value chain engagement in the CDP Climate change questionnaire.",3821-1-glbl-en-2021-sustainability-report-interactive.pdf
Zimmer Biomet considers engagement of our supply chain a key part of our environmental leadership strategy.The following chart shows our scope 1 and 2 GHG emissions.,3821-1-glbl-en-2021-sustainability-report-interactive.pdf
Source: Zimmer Biomet internal invoice data and third party sources.,3821-1-glbl-en-2021-sustainability-report-interactive.pdf
"Additionally, we are proud that 10 of our major manufacturing and distribution sites are now zero waste to landfill, and we continue to look for ways to increase recycling as we reduce our landfill waste.",3821-1-glbl-en-2021-sustainability-report-interactive.pdf
The following chart details our waste streams for our global operations.,3821-1-glbl-en-2021-sustainability-report-interactive.pdf
"Since 201 1, Zimmer Biomet has been a corporate sponsor of ACRES Land Trust, Indiana’s oldest and largest membership- based nonprofit land conservation organization.",3821-1-glbl-en-2021-sustainability-report-interactive.pdf
"ACRES protects more than 7 ,200 acres of forests, wetlands, grasslands and unique geological features in more than 1 15 nature preserves, many of which are open to the public.",3821-1-glbl-en-2021-sustainability-report-interactive.pdf
78 Talent One of Zimmer Biomet’s core strategic pillars is our commitment to being a “Best and Preferred Place to Work” and we advance that priority through a comprehensive and integrated approach.,3821-1-glbl-en-2021-sustainability-report-interactive.pdf
Below are highlights of our 2021 achievements in this area.,3821-1-glbl-en-2021-sustainability-report-interactive.pdf
Culture Promises Our Culture Promises describe a shared commitment to deliver on our mission and build a stronger Zimmer Biomet.,3821-1-glbl-en-2021-sustainability-report-interactive.pdf
Shape Tomorrow is our promise to keep our eyes on the future and create opportunities to move the business forward.,3821-1-glbl-en-2021-sustainability-report-interactive.pdf
Ignite Collaboration reminds us that we are coming together as one Zimmer Biomet to collaborate and create winning outcomes.,3821-1-glbl-en-2021-sustainability-report-interactive.pdf
Focus to Win is a promise that we will maximize our impact for patients and colleagues by working with clarity and focus.,3821-1-glbl-en-2021-sustainability-report-interactive.pdf
These promises help us to work together to make Zimmer Biomet a Best and Preferred Place to Work.,3821-1-glbl-en-2021-sustainability-report-interactive.pdf
"Team Member Engagement Through the implementation of a comprehensive engagement strategy, we are engaging team members frequently for a more holistic view of the team member experience as we strive to be a Best and Preferred Place to Work.",3821-1-glbl-en-2021-sustainability-report-interactive.pdf
"We use the valuable insights gained through our annual team member engagement survey, frequent “pulse checks”, and onboarding and exit surveys to inform our priorities and improve our team members’ experience.",3821-1-glbl-en-2021-sustainability-report-interactive.pdf
"Our surveys assess five key drivers of engagement, including purpose, culture, leadership, personal growth and belonging.",3821-1-glbl-en-2021-sustainability-report-interactive.pdf
"In 2021, we implemented quarterly performance check- ins between managers and team members, creating opportunities to align on priorities and report progress on key milestones.",3821-1-glbl-en-2021-sustainability-report-interactive.pdf
Managers are also encouraged to provide coaching and feedback during these valuable conversations.,3821-1-glbl-en-2021-sustainability-report-interactive.pdf
"As a result, team members reported significant improvement in engagement with their managers.",3821-1-glbl-en-2021-sustainability-report-interactive.pdf
"In response to our company-wide 2020 engagement survey results, we implemented a global, social recognition platform.",3821-1-glbl-en-2021-sustainability-report-interactive.pdf
"As a result, team members also reported improved satisfaction with the recognition they receive for their work.",3821-1-glbl-en-2021-sustainability-report-interactive.pdf
"As the COVID-19 pandemic continues, team members reported the need to do even more to nurture well- being and deliver transparent communication, both of which have been prioritized by our leadership team and included in our 2022 action plans.",3821-1-glbl-en-2021-sustainability-report-interactive.pdf
We believe it is critically important to keep our team members engaged through frequent and transparent communication.,3821-1-glbl-en-2021-sustainability-report-interactive.pdf
"This is accomplished through town hall meetings, video and written messages and various other channels.",3821-1-glbl-en-2021-sustainability-report-interactive.pdf
"To stay connected throughout the COVID-19 pandemic, our Chief Executive Officer kept team members informed of our priorities, financial results, management response and team member health and safety through frequent video messages and written communications.",3821-1-glbl-en-2021-sustainability-report-interactive.pdf
"Performance Management In 2021, we worked to further embed our new framework and approach to performance management, which is branded internally as “Performance Connections”.",3821-1-glbl-en-2021-sustainability-report-interactive.pdf
"In addition to the quarterly check-ins mentioned above, we formalized the mid-year Career Check-In through which team members align opportunities to learn, develop, and grow with their ambitions for the next step(s) in their career.",3821-1-glbl-en-2021-sustainability-report-interactive.pdf
"As part of this, team members create a talent profile that captures details of their professional resume and document a career plan that outlines next steps as a focal discussion point in ongoing check-ins with their manager.",3821-1-glbl-en-2021-sustainability-report-interactive.pdf
SOCIAL 9 Learning and Development We support the learning and development needs of the organization through a number of instructor/virtual training courses.,3821-1-glbl-en-2021-sustainability-report-interactive.pdf
