sentences,filename
"We are currently working to establish 2026 representation goals for women and POC at all levels of the organization, guided by internal data and external benchmarking.",sustainability-report-2020.pdf
"Core to Zimmer Biomet’s values is our commitment to stand together against hatred, discrimination and injustice, and we advance these values through our actions and investments.",sustainability-report-2020.pdf
"With this in mind, we have committed to the following initiatives to drive and accelerate change both within our own organization and around the globe.",sustainability-report-2020.pdf
"We have shared these commitments publicly and are tracking our progress against them: • Engage our more than 20,000 global team members in cultural awareness and inclusion programming.",sustainability-report-2020.pdf
• Invest $1 million and provide executive sponsorship to support ongoing programs and elevate the impact of our employee resource groups (ERGs).,sustainability-report-2020.pdf
"• Commit at least $5 million over five years through the Zimmer Biomet Foundation to nonprofit organizations dedicated to combating racism and supporting diversity, equality and justice.",sustainability-report-2020.pdf
"The Zimmer Biomet Foundation is an independent, nonprofit organization established in 2018 to address the needs of our global community.",sustainability-report-2020.pdf
"• Match, through the Zimmer Biomet Foundation, employee financial contributions to non-profit organizations, including those dedicated to combating racism and supporting diversity, equality and justice.",sustainability-report-2020.pdf
• Expand our student and early career internship programs to attract and develop more Black leaders.,sustainability-report-2020.pdf
"• Continue our financial support of Movement is Life, a multidisciplinary coalition seeking to eliminate racial, ethnic and gender disparities in muscle and joint health.",sustainability-report-2020.pdf
Employee Resource Groups (ERGs) Zimmer Biomet’s team members reflect the global communities in which we live and work.,sustainability-report-2020.pdf
"ERGs are trusted groups of team members who create a space of belonging for all team members and drive innovative business solutions in support of the Zimmer Biomet Mission and diversity, equity and inclusion strategy.",sustainability-report-2020.pdf
Zimmer Biomet’s continued investment in our ERGs has resulted in the elevation to global scale.,sustainability-report-2020.pdf
"The global ERG program relaunched in March 2021 with strong participation from team members across the globe and with keynote speakers including our Chief Executive Officer, Chief Operating Officer and Chief Human Resources Officer, as well as our newly confirmed ERG leaders.",sustainability-report-2020.pdf
"The new ERG strategy, aligned to drive business results and team member engagement, was released during the relaunch.",sustainability-report-2020.pdf
"With a focused strategy and leaders who believe deeply in the work, we will move forward in the journey together to make Zimmer Biomet a Best and Preferred Place to Work.",sustainability-report-2020.pdf
"Employee Engagement We greatly value our team members’ input and, to that end, we conduct comprehensive employee engagement surveys that ultimately inform our actions towards improving our team member experience and engagement.",sustainability-report-2020.pdf
"The surveys attempt to assess five drivers of engagement, including purpose, culture, leadership, personal growth and belonging.",sustainability-report-2020.pdf
The results of surveys and commensurate action plans are shared with our Board of Directors and with all global team members.,sustainability-report-2020.pdf
We believe it is critically important to keep our team members engaged through frequent and transparent communication.,sustainability-report-2020.pdf
"This is accomplished through town hall meetings, video and written messages, news and recognition on our intranet site, and various other channels.",sustainability-report-2020.pdf
"To stay connected throughout the COVID-19 pandemic, our Chief Executive Officer kept team members informed of our priorities, financial results, management response and employee health and safety through frequent video messages and written communications.",sustainability-report-2020.pdf
"Health, Safety & Wellness The physical and mental health, financial well-being and work/life balance of our team members is vital to accomplishing our Mission and achieving our goals.",sustainability-report-2020.pdf
"We sponsor wellness programs designed to enhance physical, financial and mental well-being, and encourage participation in these programs through regular communications, educational sessions and other incentives.",sustainability-report-2020.pdf
We are also acutely focused on the health and safety of our team members in the workplace.,sustainability-report-2020.pdf
"Our environmental, health and safety team constantly monitors various metrics to ensure we are providing the safest environment in which to work.",sustainability-report-2020.pdf
"In 2020, our Total Recordable Incident Rate was 0.27 and our Lost Time Incident Rate was 0.1 1.9Work/Life Balance Zimmer Biomet recognizes that a healthy balance in work and life is vital.",sustainability-report-2020.pdf
Our full-time team members receive paid holidays and paid time off that is based on length of service.,sustainability-report-2020.pdf
"When life events occur, such as the birth or adoption of a child or the loss of a loved one, team members receive paid time off to focus on their families.",sustainability-report-2020.pdf
We have also rolled out a Virtual Workplace Program that enables designated part-time and full-time team members to effectively work remotely.,sustainability-report-2020.pdf
Team members must be in a position designated by the Company as eligible for virtual work.,sustainability-report-2020.pdf
"In making that determination, the Company considered the requirements of the role, the cost of supporting the virtual work arrangement, nature of the work, required technology support and other relevant factors.",sustainability-report-2020.pdf
"Team members must be in good standing, meaning they have demonstrated satisfactory performance, in order to be eligible for a virtual work arrangement.",sustainability-report-2020.pdf
"Pay Equity We are committed to our pay equity process, with annual pay equity reviews conducted since 2016, following the merger of Zimmer and Biomet.",sustainability-report-2020.pdf
"Our comprehensive pay equity review covers pay, promotions and new hire practices.",sustainability-report-2020.pdf
"This includes various types of pay, such as base salary, bonus, long-term incentives and new hire sign-on awards (cash or equity).",sustainability-report-2020.pdf
"Prior to 2019, the pay equity review was focused on gender differences, with any identified pay issue also being reviewed for ethnicity against similarly situated positions.",sustainability-report-2020.pdf
"Starting in 2019, we further enhanced our analysis to review pay differences by gender, age, ethnicity and location.",sustainability-report-2020.pdf
Each year we assess our analysis capabilities to identify areas of opportunity.,sustainability-report-2020.pdf
Human Resources coordinates the Company’s process to address any issues identified from the pay equity analysis.,sustainability-report-2020.pdf
Individuals identified in the annual pay equity review continue to have their annual progress monitored in order to ensure that any pay issues are resolved.Benefits We review our benefits each plan year considering both our team member population as well as market benefit practices to ensure we are competitive in our offerings.,sustainability-report-2020.pdf
"Over the last six years, we have focused on key areas for women, family and individual health: • For women’s health, we continue to offer key preventative services and for mothers, we provide opportunities to help support and transition back to the workforce.",sustainability-report-2020.pdf
• Team members and their families are assisted through many stages of life for a family.,sustainability-report-2020.pdf
"In 2019, we increased Infertility benefits and the number of Parental Leave days while continuing to provide child care discounts at multiple day care facilities.",sustainability-report-2020.pdf
"• We understand our team members have individualized needs and we offer programs to support them such as employee assistance programs (EAP) counseling, as well as benefits such as transgender surgery/medical benefits which started in January 2017 .",sustainability-report-2020.pdf
• We continue to assess the above key areas annually and adjust offerings as needed to support our team members.,sustainability-report-2020.pdf
"Collective Bargaining Zimmer Biomet has more than 20,000 active team members globally, approximately 200 of which are affiliated with a U.S. collective bargaining agreement.",sustainability-report-2020.pdf
Discrimination Policy Zimmer Biomet is an equal opportunity employer and is fully committed to a policy of treating all of our team members and job applicants equally.,sustainability-report-2020.pdf
"We take all reasonable steps to employ, train and promote team members on the basis of their experience, abilities and qualifications without regard to race, color, ethnic origin, nationality, national origin, religion or belief, sex, sexual orientation, gender reassignment, age, marital or civil partnership status or disability.",sustainability-report-2020.pdf
"The Company also takes all reasonable steps to provide a work environment in which all team members are treated with respect and dignity and that is free of harassment based upon an employee’s race, color, ethnic origin, nationality, national origin, religion or belief, sex, sexual orientation, gender reassignment, age, marital or civil partnership status or disability.",sustainability-report-2020.pdf
"Zimmer Biomet does not condone any form of harassment, whether engaged in by team members or by outside third parties who do business with the Company.",sustainability-report-2020.pdf
10Product Quality Zimmer Biomet is committed to best-in-class product quality and the robustness of our Quality Management System.,sustainability-report-2020.pdf
Every site has a stringent internal quality audit program.,sustainability-report-2020.pdf
"In addition, we have an independent corporate quality audit program and are frequently audited by external regulatory bodies such as the U.S. Food and Drug Administration (FDA) and other competent authorities around the world.",sustainability-report-2020.pdf
"Corporate audit and external audit results are closely monitored and reported at regular management review meetings, and the Company maintains a detailed set of key performance indicators in the quality area.",sustainability-report-2020.pdf
"In addition, the Quality, Regulatory and Technology Committee of the Board of Directors receives a comprehensive quality presentation at each quarterly meeting.",sustainability-report-2020.pdf
We have multiple manufacturing sites proactively participating in the Medical Device Innovation Consortium and the FDA Case for Quality Voluntary Improvement program.,sustainability-report-2020.pdf
"For more information on this program, visit https:/ /www.fda.gov/medical-devices/quality-and- compliance-medical-devices/case-quality Furthermore, we have a stringent supply chain monitoring program inclusive of quality, delivery and cost measures.",sustainability-report-2020.pdf
"In recent years, Zimmer Biomet has made substantial progress on quality system enhancements and remediation across our network.",sustainability-report-2020.pdf
"As of June 2021, the Company has only one pending FDA Warning Letter, which pertains to our Warsaw, Indiana North Campus facility.",sustainability-report-2020.pdf
"The 2012 Ponce, Puerto Rico FDA Warning Letter was successfully cleared in 2020 after multiple positive follow-up FDA inspections.",sustainability-report-2020.pdf
"While the Warning Letter at the Warsaw North facility remains active, following an FDA re-inspection in 2020, the FDA classified the site as Voluntary Action Indicated, or VAI.",sustainability-report-2020.pdf
We have made significant investments in Quality Management System remediation and upgrades over the past four years.,sustainability-report-2020.pdf
"While these enhancements continue, we are very encouraged that these efforts have already resulted in a 60 percent reduction in FDA product recalls during that time.",sustainability-report-2020.pdf
"YearClass 1 RecallsClass 2 RecallsClass 3 RecallsForms 483 ReceivedWarning Letters Received 2016 1 40 1 3 1 2017 1 62 0 7 0 2018 1 48 0 3 1 2019 1 24 0 3 0 2020 0 21 0 1 0We are advancing automation in manufacturing, quality systems and inspection and measurement methods such as Manufacturing Execution System (MES), Design Controls and Risk Management Software (The Vault), and InfinityQS.",sustainability-report-2020.pdf
We have rolled out the Quality Begins With Me program across the entire Zimmer Biomet network.,sustainability-report-2020.pdf
"This is a structured culture enhancement program with a mission to promote a blame free culture of driving proper behaviors, empowering team members to promote operational excellence and creating a singular binding focus on quality and compliance improvements.",sustainability-report-2020.pdf
The program is intended to drive flawless execution to achieve doing things right the first time and every time.,sustainability-report-2020.pdf
We implemented Class A and Operational Excellence initiatives across all of our manufacturing sites to drive a continuous improvement culture and manufacturing and supply chain excellence.,sustainability-report-2020.pdf
"As evidence of this effort, Oliver Wight has certified Class A in our Ireland sites and we have moved to self-implementation and certification in the remaining facilities.",sustainability-report-2020.pdf
"For more information, visit https:/ /www.oliverwight-americas.com/services/class-a- standard-for-business-excellence/ We have implemented Green Belt and Black Belt employee certification programs aimed at teaching and utilizing essential LEAN tools to drive waste reduction through continuous improvement, as well as to drive out variation by applying Define, Measure, Analyze, Improve and Control (DMAIC) problem-solving methodology and to make data- driven decisions through proven quality tools and statistical methods.",sustainability-report-2020.pdf
We are also working toward compliance and certification with the European Union Medical Device Regulation standards by 2024.,sustainability-report-2020.pdf
Supplier Code of Conduct Zimmer Biomet strives to achieve and maintain the highest possible standards of corporate integrity and ethical behavior.,sustainability-report-2020.pdf
We expect that our suppliers will conduct their business not only in a lawful manner but also in compliance with the same high standards of integrity and ethics.,sustainability-report-2020.pdf
"In order to establish guidelines for such standards, Zimmer Biomet has instituted a Code of Supplier Conduct, available at https:/ /www.zimmerbiomet.com/content/dam/zimmer- biomet/sourcing/Zimmer-Biomet-Supplier-Code-of- Conduct.pdf 11At a minimum, suppliers must conduct business in accordance with all applicable country, state and local laws and regulations covering the jurisdictions in which they operate, including, without limitation, laws relating to employment, human rights, the environment, health and safety and trade.",sustainability-report-2020.pdf
Each supplier is to comply with the commercial best practices of the supplier’s industry.,sustainability-report-2020.pdf
Zimmer Biomet reserves the right to decline to deal with suppliers who do not comply with the law or our standards.,sustainability-report-2020.pdf
Zimmer Biomet also has taken steps to ensure that slavery and human trafficking is not taking place in our supply chains or any parts of our business operations through the UK Modern Slavery Act of 2015 and the California Transparency in Supply Chains Act of 2010. https:/ /www.zimmerbiomet.com/content/dam/zimmer- biomet/homepage/CA%20Transparency%20and%20 UK%20MSA%20Statement.pdf Supplier Social Responsibility Audits Zimmer Biomet conducts social responsibility audits with all new suppliers in high risk regions and on existing suppliers every three years.,sustainability-report-2020.pdf
Forty-seven suppliers were audited in 2019 with no major findings.,sustainability-report-2020.pdf
Social Responsibility audits are planned every three years; the next round of audits will occur in 2022.,sustainability-report-2020.pdf
"Supplier Diligence For all new proposed international suppliers, due diligence investigations are conducted by the Zimmer Biomet Compliance team to make sure the third party is not on any watch lists.",sustainability-report-2020.pdf
This global due diligence review starts at the front end of the request process.,sustainability-report-2020.pdf
Ongoing due diligence is conducted annually for existing suppliers.,sustainability-report-2020.pdf
Supplier Quality Audits New and existing supplier audit plans are established based on the applicable Quality Management System (QMS) requirement for the product/service the supplier provides.,sustainability-report-2020.pdf
The applicable QMS requirements are focused on FDA and International Organization for Standardization (ISO) standards.,sustainability-report-2020.pdf
"These standards include FDA 21 CFR 820 and ISO 13485. Zimmer Biomet has three global procedures detailing the process: (i) the Supplier Questionnaire is used to collect a variety of information on the supplier, including an overview of the supplier’s quality system; (ii) the Supplier Qualification Report determines which audit plan will be followed and the risk classification; and (iii) the Supplier Audit Plan details the information found during the audit and the attendees.",sustainability-report-2020.pdf
All information gathered from the auditing process is stored in a global system and accessible to all Zimmer Biomet businesses.,sustainability-report-2020.pdf
Supplier Diversity Policy We believe that a diverse supply chain strengthens our ability to carry out our Mission and improve the communities in which we live and work.,sustainability-report-2020.pdf
Zimmer Biomet’s Supplier Diversity Policy in the United States and Puerto Rico assists in establishing and maintaining business relationships with suppliers that are either certified in diverse categories by the Small Business Administration or self-certified where applicable.,sustainability-report-2020.pdf
We assign a Small Business Liaison Officer (SBLO) as an administrator for the Supplier Diversity Program.,sustainability-report-2020.pdf
"The SBLO assures that reports documenting procurement levels, broken down by supplier classification, are prepared as requested by government agencies and contract groups.",sustainability-report-2020.pdf
Annual Summary Subcontract Reports and Year End Supplementary Small Disadvantaged Business (SDB) Reports are submitted according to existing Small Business Administration and U.S. Government mandates.,sustainability-report-2020.pdf
Zimmer Biomet’s diversity reporting obligations to the U.S. Federal Government include spending in the United States and Puerto Rico in the following six diverse supplier categories annually: 1.,sustainability-report-2020.pdf
Historically Underutilized Business Zone Small Business (HUBZone) 2.,sustainability-report-2020.pdf
Service-Disabled Veteran-Owned Small Business (SDVOSB) 3.,sustainability-report-2020.pdf
Small Business (SB) 4.,sustainability-report-2020.pdf
Small Disadvantaged Business (SDB) 5.,sustainability-report-2020.pdf
Veteran-Owned Small Business (VOSB) 6.,sustainability-report-2020.pdf
Women-Owned Small Business (WOSB) 12 Management of Risks Associated with Use of Critical Materials Zimmer Biomet has a Global Supply Risk Management process.,sustainability-report-2020.pdf
"We have established a systematic approach to: • Ensure continuity of supply for goods and services • Proactively manage (identify, assess, mitigate and monitor) potential supply risks which may result in product delays and/or revenue impact to the business • Ensure that a global process is being utilized across the Zimmer Biomet Global Sourcing Organization A key component in risk monitoring is the financial impacts that might occur in raw material scarcity and/or physical disruptions of Zimmer Biomet’s own operations or in the operations of our supply chain.",sustainability-report-2020.pdf
"To mitigate these risks, Zimmer Biomet utilizes a third party to rank our top suppliers against 73 financial ratios on a scale of 1-100 to understand the overall financial health of these suppliers.",sustainability-report-2020.pdf
It is considered to have substantive strategic impact on Zimmer Biomet’s business if suppliers score below a 20 in this rating.,sustainability-report-2020.pdf
"Through a third-party vendor, the Company obtains international private company financial statements and has a greater than 85 percent success rate (and above 90 percent in certain markets) to measure the core health of a supplier out to 36 months, and predicating probability of default over 12 to 18 months via a quantitative model to generate a rating.Animal Testing Policy Zimmer Biomet’s utilization of animal testing is consistent with animal welfare acts around the world.",sustainability-report-2020.pdf
We utilize animal testing when required to demonstrate biological safety for our products that cannot be demonstrated by laboratory benchtop tests or when required to demonstrate compliance with medical device regulations.,sustainability-report-2020.pdf
"The laboratories that Zimmer Biomet engages for animal testing typically have American Association for Accreditation of Laboratory Animal Care (AAALAC) certification or have their own animal research committee (i.e., an independent review committee) to ensure compliance with national animal welfare acts.",sustainability-report-2020.pdf
Zimmer Biomet does not perform animal testing directly; the work is contracted to labs.,sustainability-report-2020.pdf
Clinical Trial Program Zimmer Biomet operates a robust global clinical research program that strives to collect meaningful clinical evidence to support our vast portfolio of products that ultimately help alleviate pain and improve the quality of life for people around the world.,sustainability-report-2020.pdf
"Our clinical research programs support the safety and effectiveness of our products, services and technologies in a compliant and transparent manner.",sustainability-report-2020.pdf
"Zimmer Biomet supported clinical trials are conducted 13 across many different programs, including sponsored multi- center global clinical trials, as well as Company supported smaller investigator initiated clinical trials.",sustainability-report-2020.pdf
Zimmer Biomet conducts studies all over the world that are managed by our global Clinical Affairs teams.,sustainability-report-2020.pdf
These teams manage our regulated and post-market studies and are located in key locations across the globe.,sustainability-report-2020.pdf
"In all instances, these programs and teams adhere to Zimmer Biomet policies and procedures that incorporate the standards set forth in the International Conference on Harmonization, the Declaration of Helsinki, Good Clinical Practice guidelines and the AdvaMed Code of Ethics.",sustainability-report-2020.pdf
"To protect the rights, safety and well-being of clinical trial participants, Zimmer Biomet has an overarching global procedure for Conducting Clinical Research Involving Human Subjects, GBL12000.",sustainability-report-2020.pdf
This procedure also ensures that the clinical research from our clinical trials is qualified and reliable and can be used by worldwide regulatory authorities.,sustainability-report-2020.pdf
"As part of our procedures, clinical trials are reviewed and approved by several cross-functional internal committees, including a Clinical Investigation Review Committee and a Clinical Research Review Committee.",sustainability-report-2020.pdf
"Clinical trials are only approved if they are scientifically sound, meet a well-defined business need and are within fair market value calculations.",sustainability-report-2020.pdf
"Clinical trial support can range from monetary funding, providing in-kind product, or even the loaning of specialized instrumentation and equipment.",sustainability-report-2020.pdf
"In addition to the internal Zimmer Biomet review and approval processes, all clinical studies are required to be reviewed and approved by an Institutional Review Board or Ethics Committee that is independent of both Zimmer Biomet and the participating investigational centers.",sustainability-report-2020.pdf
Clinical Trial Transparency Zimmer Biomet supports clinical research to foster advances in clinical knowledge and furthering medical device development related to our products and programs.,sustainability-report-2020.pdf
"As such, clinical trial transparency is required to appropriately contribute to and comply with the International Committee of Medical Journal Editors (ICMJE) initiative and Food and Drug Administration Amendments Act (FDAAA) requirements by utilizing ClinicalTrials.gov to register our active clinical studies and study results once they are available.",sustainability-report-2020.pdf
"All study results are posted, regardless of whether the trial is deemed successful or failed to meet the primary end point.",sustainability-report-2020.pdf
