sentences,filename
"We are committed to providing equal employment opportunities for all of our team members without regard to race, color, creed, religion, national origin, citizenship, gender, gender identity, sexual orientation, marital status, pregnancy, age, medical condition, disability or military or veteran status.",2019-2846-2-us-en-2019-sustainability-report-interactive.pdf
We are committed to helping our team members achieve their full potential.,2019-2846-2-us-en-2019-sustainability-report-interactive.pdf
"Our leadership team performs formal talent succession reviews annually, following the performance review process.",2019-2846-2-us-en-2019-sustainability-report-interactive.pdf
"Importantly, we offer multiple leadership training and skills development programs.",2019-2846-2-us-en-2019-sustainability-report-interactive.pdf
"Several targeted leadership programs have been developed, including the Leading@ ZB Leadership Development Program, as well as a broader set of skills development courses, including on-demand e-learning courses and open enrollment instructor-led courses.",2019-2846-2-us-en-2019-sustainability-report-interactive.pdf
"In addition, we offer financial assistance for continuing education.",2019-2846-2-us-en-2019-sustainability-report-interactive.pdf
We use surveys to monitor team member engagement.,2019-2846-2-us-en-2019-sustainability-report-interactive.pdf
"In 2019, we conducted numerous Pulse team member surveys to provide guidance for improvement on various key topics.",2019-2846-2-us-en-2019-sustainability-report-interactive.pdf
"To help identify and develop talent, we partner with a host of organizations and local non-profit entities, as well as universities, colleges and high schools.",2019-2846-2-us-en-2019-sustainability-report-interactive.pdf
We provide representation on local councils to identify current and future talent gaps and work with educational institutions to ensure that curricula are designed to train and develop skills that are needed to support the orthopedic industry.,2019-2846-2-us-en-2019-sustainability-report-interactive.pdf
"Examples include collegiate and high school co-op and intern programs, as well as machinist training.",2019-2846-2-us-en-2019-sustainability-report-interactive.pdf
We also offer a variety of development programs for new college graduates.,2019-2846-2-us-en-2019-sustainability-report-interactive.pdf
2019 Sustainability Report | 7 6 | 2019 Sustainability ReportVolunteer Activities Zimmer Biomet is dedicated to its team members and to the communities in which we live and work.,2019-2846-2-us-en-2019-sustainability-report-interactive.pdf
We encourage our team members to actively participate in volunteer organizations and projects.,2019-2846-2-us-en-2019-sustainability-report-interactive.pdf
"In 2019, team members volunteered in many activities, including Big Brothers Big Sisters, STEM Education and Robotics and United Way’s Day of Action.",2019-2846-2-us-en-2019-sustainability-report-interactive.pdf
Work/Life Balance and Wellness Zimmer Biomet recognizes that a balance in work and life is vital.,2019-2846-2-us-en-2019-sustainability-report-interactive.pdf
Our full-time team members receive paid holidays and paid time off that is based on length of service.,2019-2846-2-us-en-2019-sustainability-report-interactive.pdf
"When life events occur, such as the birth or adoption of a child or the loss of a loved one, team members receive paid time off to focus on their families.",2019-2846-2-us-en-2019-sustainability-report-interactive.pdf
"We also realize the importance of a healthy lifestyle, so we offer Wellness programs to provide team members with professional help for guidance and support.",2019-2846-2-us-en-2019-sustainability-report-interactive.pdf
"Diversity and Inclusion At Zimmer Biomet, we believe that in order to succeed, everyone must feel valued and respected.",2019-2846-2-us-en-2019-sustainability-report-interactive.pdf
Innovation is in our roots.,2019-2846-2-us-en-2019-sustainability-report-interactive.pdf
"By recognizing, supporting and drawing from a rich variety of perspectives, experiences, backgrounds, capabilities and lifestyles, we will continue to lead in innovation.",2019-2846-2-us-en-2019-sustainability-report-interactive.pdf
That is why we embrace diversity and encourage inclusion every single day.,2019-2846-2-us-en-2019-sustainability-report-interactive.pdf
"This allows us to develop products of the highest quality, transform patient care and stay at the forefront of our industry.",2019-2846-2-us-en-2019-sustainability-report-interactive.pdf
Supplier Diversity A diverse supply chain strengthens our ability to carry out our mission and improve the communities where we live and work.,2019-2846-2-us-en-2019-sustainability-report-interactive.pdf
"Annually, we report spending with certain diverse suppliers, such as the following: • Historically Underutilized Business Zone Small Business (HUBZone) • Service-Disabled Veteran-Owned Small Business (SDVOSB) • Small Business (SB) • Small Disadvantaged Business (SDB) • Veteran-Owned Small Business (VOSB) • Women-Owned Small Business (WOSB) 2019 Sustainability Report | 9 8 | 2019 Sustainability ReportRecent Awards and Recognition Medical Device and Diagnostic Industry (MD+DI) publication selected Zimmer Biomet as the 2019 Medtech Company of the Year.Computerworld named Zimmer Biomet as one of the 100 Best Places to Work in IT.",2019-2846-2-us-en-2019-sustainability-report-interactive.pdf
"Forbes recognized Zimmer Biomet in the first-ever ranking of America’s Best Employers by State, honoring the organizations liked best by employees.Zimmer Biomet China was awarded the Top Employers China certification by the Top Employers Institute (top-employers.com).",2019-2846-2-us-en-2019-sustainability-report-interactive.pdf
"Zimmer Biomet’s Warsaw, Indiana headquarters is wholly powered by renewable, green energy in compliance with the U.S. Environmental Protection Agency’s (EPA) Green Power Partnership program.In 2019, Zimmer Biomet provided grants, donations and funding for numerous educational and philanthropic projects.",2019-2846-2-us-en-2019-sustainability-report-interactive.pdf
"These included grants to support orthopedic post-graduate medical education, including funding to OMeGA Medical Grants Association.",2019-2846-2-us-en-2019-sustainability-report-interactive.pdf
"OMeGA is an independent legal entity with a singular mission: To award and administer grants for graduate orthopedic medical education through an open, accessible process designed to safeguard against potential conflicts of interest and to ensure transparency in the allocation of resources.",2019-2846-2-us-en-2019-sustainability-report-interactive.pdf
"Zimmer Biomet also provided educational grants to support independent medical education conferences that promote scientific knowledge, medical advancement and the delivery of effective healthcare.",2019-2846-2-us-en-2019-sustainability-report-interactive.pdf
"In addition, Zimmer Biomet provided grants to third party organizations for independent research to advance patient treatment designed for improved outcomes.",2019-2846-2-us-en-2019-sustainability-report-interactive.pdf
"Funding was also provided to support programs that promote diversity and multiculturalism in medical schools and in surgeon professional development, as well as industry minority initiatives to raise orthopedic treatment awareness and support higher education.",2019-2846-2-us-en-2019-sustainability-report-interactive.pdf
"One example of diversity-related funding is the support we provide to The Perry Initiative, which is committed to inspiring young women to be leaders in the fields of orthopedic surgery and engineering.",2019-2846-2-us-en-2019-sustainability-report-interactive.pdf
Zimmer Biomet was one of the host sites for local high school students to participate in a one-day hands on program to learn directly from medical professionals and engineers.,2019-2846-2-us-en-2019-sustainability-report-interactive.pdf
"Zimmer Biomet is the Founding Sponsor of Nth Dimensions, an educational non-profit organization created to help increase diversity of women and underrepresented minorities in the field of orthopedics, including pre-medical, medical students and residents.",2019-2846-2-us-en-2019-sustainability-report-interactive.pdf
"We are a corporate partner of the J. Robert Gladden Orthopaedic Society, a multi-cultural organization with a mission to increase diversity within the orthopedic profession.",2019-2846-2-us-en-2019-sustainability-report-interactive.pdf
"We also provide support to the Ruth Jackson Orthopedic Society, which is dedicated to advancing the science and practice of orthopedic surgery among women; as well as the American Association of Latino Orthopaedic Surgeons, which represents not only members of Latino descent, but all orthopedists who treat members of the Latino and Hispanic communities.",2019-2846-2-us-en-2019-sustainability-report-interactive.pdf
"2019 Sustainability Report | 11 10 | 2019 Sustainability ReportGrants, Donations and Funding FOUNDATION Zimmer Biomet created the Zimmer Biomet Foundation in late 2018 and provided initial funding in support of charitable efforts.",2019-2846-2-us-en-2019-sustainability-report-interactive.pdf
"As an independent, philanthropic and non-profit organization, the Zimmer Biomet Foundation improves the quality of life for our communities by providing resources to help: Build Healthy Communities; Advance STEM education; and Provide Disaster Relief.",2019-2846-2-us-en-2019-sustainability-report-interactive.pdf
Numerous organizations received support from the Zimmer Biomet Foundation throughout 2019. Zimmer Biomet continued to fund the Foundation with a $2 million contribution in late 2019 allowing the Foundation to continue charitable work around the country.,2019-2846-2-us-en-2019-sustainability-report-interactive.pdf
"Zimmer Biomet provided donations and funding to various organizations to support community and global projects in 2019, including: American Red Cross redcross.orgArthritis Foundation arthritis.orgBeaman Home thebeamanhome.comBig Brothers Big Sisters bbbs.org Cardinal Services cardinalservices.orgCombined Community Services combinedcommunityservices.orgKosciusko Community YMCA kcymca.orgLilly Center for Lakes & Streams lakes.grace.edu The Watershed Foundation watershedfoundation.orgUnited Way unitedway.orgWarsaw Community Schools warsaw.k12.in.us Zimmer Biomet donated orthopedic products to support more than 40 philanthropic medical mission trips in 2019 to help patients in need around the globe.",2019-2846-2-us-en-2019-sustainability-report-interactive.pdf
Zimmer Biomet continued to partner with Faith in Practice by donating a replenishment of implant inventory necessary to continually perform charitable surgeries in Guatemala.,2019-2846-2-us-en-2019-sustainability-report-interactive.pdf
"Additionally, we continue to support charitable surgeries in the U.S. by donating implants through AmeriCares and the Operation Walk USA program.",2019-2846-2-us-en-2019-sustainability-report-interactive.pdf
americares Saves lives and improves health for people affected by poverty or disaster so they can reach their full potential.,2019-2846-2-us-en-2019-sustainability-report-interactive.pdf
americares.orgFaith in Practice Committed to serving the poor of Guatemala through short-term medical mission trips that take an integrated approach to care that strives to reach those in the greatest need.,2019-2846-2-us-en-2019-sustainability-report-interactive.pdf
faithinpractice.orgOperation Walk USA Helps patients to become mobile.,2019-2846-2-us-en-2019-sustainability-report-interactive.pdf
"opwalkusa.com2019 Sustainability Report | 13 12 | 2019 Sustainability ReportGOVERNANCE Corporate Governance Zimmer Biomet is committed to good corporate governance and believes that an attentive, performing Board of Directors is a tangible competitive advantage.",2019-2846-2-us-en-2019-sustainability-report-interactive.pdf
Our Corporate Governance Guidelines ( investor.,2019-2846-2-us-en-2019-sustainability-report-interactive.pdf
"zimmerbiomet.com/corporate-governance ) assist the Board in monitoring the effectiveness of policy and decision-making both at the Board and management level, with a view to enhancing stockholder value over the long term.",2019-2846-2-us-en-2019-sustainability-report-interactive.pdf
"In the United States, we advocate for tax, financial, regulatory and other key policies on the state and federal levels.",2019-2846-2-us-en-2019-sustainability-report-interactive.pdf
"As required by U.S. law, we file mid-year contribution reports and quarterly lobbying activity reports with the United States federal government regarding these activities.",2019-2846-2-us-en-2019-sustainability-report-interactive.pdf
These reports are publicly available and can be found on the internet.,2019-2846-2-us-en-2019-sustainability-report-interactive.pdf
"2019 Sustainability Report | 13 12 | 2019 Sustainability ReportSince 2004, Zimmer Biomet has funded initiatives that focus on defining and reducing musculoskeletal disparities.",2019-2846-2-us-en-2019-sustainability-report-interactive.pdf
"Movement is Life , a multi-disciplinary coalition, partners with thought leaders and national member organizations aligned to create sustainable change in marginalized populations.",2019-2846-2-us-en-2019-sustainability-report-interactive.pdf
"The Movement is dedicated to the elimination of racial, ethnic and gender disparities in muscle and joint health by promoting physical mobility to improve quality of life among African American, Hispanic and Rural American women.",2019-2846-2-us-en-2019-sustainability-report-interactive.pdf
"Operation Change, a Movement program, is a community- based public health intervention focused on positive behavior modification in individuals who suffer from joint pain and chronic comorbid conditions such as diabetes and obesity.",2019-2846-2-us-en-2019-sustainability-report-interactive.pdf
"In 2019, this signature program expanded to five cities across the United States, focusing on ethnically- concordant programming with physical activity, health education, nutrition, motivational interviewing and language.",2019-2846-2-us-en-2019-sustainability-report-interactive.pdf
"The San Diego cohort was conducted entirely in Spanish, while the Hazard, Ky. program was multi-ethnic.",2019-2846-2-us-en-2019-sustainability-report-interactive.pdf
"As a result of the program, participants built trust and understanding around their health and built accountability with other participants.",2019-2846-2-us-en-2019-sustainability-report-interactive.pdf
"Movement is Life maintains a website, “Start Moving Start Living” which serves as a repository for culturally competent patient communication tools to raise awareness about the health risks associated with immobility in the United States.",2019-2846-2-us-en-2019-sustainability-report-interactive.pdf
"Zimmer Biomet is dedicated to improving access to musculoskeletal care for all by working through the parallel channels of patient education, policy development, community programs and provider training.",2019-2846-2-us-en-2019-sustainability-report-interactive.pdf
"In 2019, Movement is Life hosted its 10th Caucus, attracting policy makers, community advocates, academicians, healthcare professionals and patients alike; educating, engaging and facilitating collaboration amongst them.",2019-2846-2-us-en-2019-sustainability-report-interactive.pdf
"The Caucus has always included a keynote from renowned leaders: David R. Williams, Camara P .",2019-2846-2-us-en-2019-sustainability-report-interactive.pdf
"Jones, David Ansell and others to address structural racism and the long term effects it has on communities.",2019-2846-2-us-en-2019-sustainability-report-interactive.pdf
The health disparities message reached new heights in 2019 with the development of the weekly ‘Health Disparities Podcast’ available on the Movement is Life Caucus website.,2019-2846-2-us-en-2019-sustainability-report-interactive.pdf
"The landmark research paper authored with Johns Hopkins University School of Medicine entitled, “Musculoskeletal Healthcare Disparities: Influence of Patient Sex, Race, and Ethnicity on Utilization of Total Joint Arthroplasty,” was published in the Journal of Long-Term Effects of Medical Implants in 2019.",2019-2846-2-us-en-2019-sustainability-report-interactive.pdf
"The work of Movement is Life continues to evolve as we seek to empower patients, providers, policy makers and communities at large with the tools to reduce social determinants, improve individual engagement and dismantle health disparities.2019 Sustainability Report | 15 14 | 2019 Sustainability ReportEthics and Compliance We are committed to maintaining the highest ethical standards and complying with all applicable laws, regulations, company policies and industry codes.",2019-2846-2-us-en-2019-sustainability-report-interactive.pdf
We conduct our work and interact with others according to our shared values reflected in Zimmer Biomet’s Code of Business Conduct and Ethics ( investor.zimmerbiomet.com/corporate-governance ).,2019-2846-2-us-en-2019-sustainability-report-interactive.pdf
"In addition, we endorse and are committed to complying with the relevant codes for industry associations of which Zimmer Biomet is a member, including: • ABIMED Code of Conduct (Brazil) • ABIMO (Brazil) • ABRAIDI (Brazil) • AdvaMed China (China) • AdvaMed Code of Ethics (United States) • American Medical Devices and Diagnostics Manufacturers’ Association (Japan) • AMID (Mexico) • Austromed: Verhaltenskodex (Austria) • BVMed: Kodex Medizinprodukte (Germany) • CANIFARMA (Mexico) • Confindustria dispositivi medici (Italy)• EucoMed Code of Business Practice (EMEA) • Fenin Code of Ethics (Spain) • Instituto Ética Saúde (Brazil) • Korea Medical Devices Industry Association (Korea) • Mecomed Code of Ethical Business Practice (Middle East) • Medical Technology Association of India (India) • Medical Technology Industry Group (Singapore) • MedTech Europe: Code of Ethical Business Practice • MTAA Code of Practice (Australia) • MTANZ (New Zealand) • SAMED: Medical Device Code of Ethical Marketing and Business Practice (South Africa) • Thai Medical Device Technology Industry Association (Thailand)CEO and Senior Executive Compensation Our CEO and senior executives receive fixed compensation as well as short-term and long-term performance-based compensation.",2019-2846-2-us-en-2019-sustainability-report-interactive.pdf
"Applicable performance metrics and targets align executives’ interests with those of Zimmer Biomet stockholders, are approved by the Compensation and Management Development Committee of the Board of Directors and reported in our filings with the SEC, which are publicly available.Affiliations and Memberships Zimmer Biomet is a member of numerous industry and trade groups.",2019-2846-2-us-en-2019-sustainability-report-interactive.pdf
We work with these groups on a variety of issues of importance to Zimmer Biomet and the medical device industry.,2019-2846-2-us-en-2019-sustainability-report-interactive.pdf
These groups can help the industry reach consensus on policy issues and be more effective with issue advocacy.,2019-2846-2-us-en-2019-sustainability-report-interactive.pdf
"With our representatives on the boards and committees of industry groups and associations, we can voice questions or concerns we may have about policy or related activities.",2019-2846-2-us-en-2019-sustainability-report-interactive.pdf
"We are a member of many global industry and trade groups, some of which are listed below: • Advanced Medical Technology Association (AdvaMed) • American Medical Diagnostic and Device Manufacturers’ Association (Japan) • BioFlorida • Colorado BioScience Association • Healthcare Institute of New Jersey • Indiana Chamber of Commerce • Indiana Manufacturers Association • Medical Device Competitiveness Coalition (MDCC) • MedTech Europe (European Union) • U.S. Chamber of Commerce 2019 Sustainability Report | 15 14 | 2019 Sustainability Report16 | 2019 Sustainability Report ©2020 Zimmer Biomet | www.zimmerbiomet.com | 2846.2-US-en-REV 0620",2019-2846-2-us-en-2019-sustainability-report-interactive.pdf
 Sustainability Report 2018 ENVIRONMENTAL SOCIAL GOVERNANCECOMPANY PROFILE Corporate overview ......................................................................................... 1 Mission and guiding principles.,2018-2846-1-us-en-2018-sustainability-report-interactive.pdf
"....................................................................... 2 Our sustainability commitment ........................................................................ 2 ENVIRONMENTAL Environmental Health and Safety (EHS) program ............................................. 3 Goals and accomplishments ............................................................................ 4 External reporting standards ........................................................................... 5 Health and safety performance ........................................................................ 5 Environmental performance ............................................................................ 5 Supplier management ..................................................................................... 6 Manufacturing ................................................................................................ 6 Quality and product safety .............................................................................. 6 SOCIAL Talent management ...................................................................................... 7-8 Recent awards and recognition ........................................................................ 8 Volunteer activities .......................................................................................... 8 Work/life balance and wellness ....................................................................... 8 Diversity and inclusion ..................................................................................... 9 Supplier diversity ............................................................................................. 9 Grants, donations and funding .................................................................. 10 -11 GOVERNANCE Corporate governance .................................................................................... 12 Ethics and compliance .................................................................................... 13 CEO and senior executive compensation ........................................................ 13 Affiliations and memberships .......................................................................... 13TABLE OF CONTENTS 2018 Sustainability Report | 1COMPANY PROFILE Corporate overview Founded in 1927 and headquartered in Warsaw, Indiana, Zimmer Biomet is a global leader in musculoskeletal healthcare.",2018-2846-1-us-en-2018-sustainability-report-interactive.pdf
"We design, manufacture and market orthopedic reconstructive products; sports medicine, biologics, extremities and trauma products; office based technologies; spine, craniomaxillofacial and thoracic products; dental implants; and related surgical products.",2018-2846-1-us-en-2018-sustainability-report-interactive.pdf
We collaborate with healthcare professionals around the globe to advance the pace of innovation.,2018-2846-1-us-en-2018-sustainability-report-interactive.pdf
"Our products and solutions help treat patients suffering from disorders of, or injuries to, bones, joints or supporting soft tissues.",2018-2846-1-us-en-2018-sustainability-report-interactive.pdf
"Together with healthcare professionals, we help millions of people live better lives.",2018-2846-1-us-en-2018-sustainability-report-interactive.pdf
Company ProfileMission and guiding principles Our mission Alleviate pain and improve the quality of life for people around the world.,2018-2846-1-us-en-2018-sustainability-report-interactive.pdf
"Guiding principles • Respect the contributions and perspectives of all team members • Commit to the highest standards of patient safety, quality and integrity • Focus our resources in areas where we will make a difference • Ensure the Company’s return is equivalent to the value we provide our customers and patients • Give back to our communities and people in need Our sustainability commitment Zimmer Biomet is committed to being a good corporate citizen.",2018-2846-1-us-en-2018-sustainability-report-interactive.pdf
"Our global team is dedicated to sustainable practices across the entire spectrum of the environmental, social and governance platform.",2018-2846-1-us-en-2018-sustainability-report-interactive.pdf
2018 Sustainability Report | 22018 Sustainability Report | 3Environmental Health and Safety (EHS) program Zimmer Biomet exercises responsible resource stewardship by proactively identifying ways we can reduce our energy consumption and strictly adhering to water management guidelines.,2018-2846-1-us-en-2018-sustainability-report-interactive.pdf
"We reduce waste generation by recycling, reprocessing or re-using byproducts and managing waste.",2018-2846-1-us-en-2018-sustainability-report-interactive.pdf
Our team members implement LEAN manufacturing/Six Sigma principles and we provide green team training.,2018-2846-1-us-en-2018-sustainability-report-interactive.pdf
Zimmer Biomet’s Environmental Management System (EMS) is consistent with international standards.,2018-2846-1-us-en-2018-sustainability-report-interactive.pdf
