sentences,filename
"We have established a systematic approach to: • Ensure continuity of supply for goods and services • Proactively manage (identify, assess, mitigate and monitor) potential supply risks which may result in product delays and/or revenue impact to the business • Ensure that a global process is being utilized across the Zimmer Biomet Global Sourcing OrganizationA key component in risk monitoring is the financial impacts that might occur in raw material scarcity and/or physical disruptions of Zimmer Biomet’s own operations or in the operations of our supply chain.",3821-1-glbl-en-2021-sustainability-report-interactive.pdf
"To mitigate these risks, Zimmer Biomet uses a third party to rank our top suppliers against 73 financial ratios on a scale of 1-100 to understand the overall financial health of these suppliers.",3821-1-glbl-en-2021-sustainability-report-interactive.pdf
It is considered to have substantive strategic impact on Zimmer Biomet’s business if suppliers score below a 20 in this rating.,3821-1-glbl-en-2021-sustainability-report-interactive.pdf
"Through a third-party vendor, we obtain international private company financial statements and have a greater than 85% success rate (and above 90% in certain markets) to measure the core health of a supplier out to 36 months, and predicting probability of default over 12 to 18 months via a quantitative model to generate a rating.",3821-1-glbl-en-2021-sustainability-report-interactive.pdf
Animal Testing Policy Zimmer Biomet’s use of animal testing is consistent with animal welfare acts around the world.,3821-1-glbl-en-2021-sustainability-report-interactive.pdf
We use animal testing when required to demonstrate biological safety for our products that cannot be demonstrated by laboratory benchtop tests or when required to demonstrate compliance with medical device regulations.,3821-1-glbl-en-2021-sustainability-report-interactive.pdf
"The laboratories that Zimmer Biomet engages for animal testing typically have American Association for Accreditation of Laboratory Animal Care (AAALAC) certification or have their own animal research committee (i.e., an independent review committee) to ensure compliance with national animal welfare acts.",3821-1-glbl-en-2021-sustainability-report-interactive.pdf
Zimmer Biomet does not perform animal testing directly; the work is contracted to labs.,3821-1-glbl-en-2021-sustainability-report-interactive.pdf
Clinical Trial Program We operate a robust global clinical research program that strives to collect meaningful clinical evidence to support our vast portfolio of products that ultimately help alleviate pain and improve the quality of life for people around the world.,3821-1-glbl-en-2021-sustainability-report-interactive.pdf
"Our clinical research programs support the safety and effectiveness of our products, services and technologies in a compliant and transparent manner.",3821-1-glbl-en-2021-sustainability-report-interactive.pdf
"Zimmer Biomet- supported clinical trials are conducted across many different programs, including sponsored multi-center global clinical trials, as well as Company supported smaller investigator initiated clinical trials.",3821-1-glbl-en-2021-sustainability-report-interactive.pdf
Zimmer Biomet conducts studies all over the world that are managed by our global Clinical Affairs teams.,3821-1-glbl-en-2021-sustainability-report-interactive.pdf
These teams manage our regulated and post-market studies and are located in key locations across the globe.,3821-1-glbl-en-2021-sustainability-report-interactive.pdf
"In all instances, these programs and teams adhere to Zimmer Biomet policies and procedures that incorporate the standards set forth in the International Conference on Harmonization, the Declaration of Helsinki, Good Clinical Practice guidelines and the AdvaMed Code of Ethics.",3821-1-glbl-en-2021-sustainability-report-interactive.pdf
"To protect the rights, privacy, safety and well-being of clinical trial participants, Zimmer Biomet has an overarching global procedure for Conducting Clinical Research Involving Human Subjects.",3821-1-glbl-en-2021-sustainability-report-interactive.pdf
This procedure also ensures that the clinical research from our clinical trials is qualified and reliable and can be used by worldwide regulatory authorities.,3821-1-glbl-en-2021-sustainability-report-interactive.pdf
"As part of our procedures, clinical trials are reviewed and approved by several cross-functional internal committees, including a Clinical Investigation Review Committee and a Clinical Research Review Committee.",3821-1-glbl-en-2021-sustainability-report-interactive.pdf
"Clinical trials are only approved if they are scientifically sound, meet a well-defined business need and are within fair market value calculations.",3821-1-glbl-en-2021-sustainability-report-interactive.pdf
"Clinical trial support can range from monetary funding, providing in-kind product, or even the loaning of specialized instrumentation and equipment.",3821-1-glbl-en-2021-sustainability-report-interactive.pdf
"In addition to the internal Zimmer Biomet review and approval processes, all clinical studies are required to be reviewed and approved by an Institutional Review Board or Ethics Committee that is independent of both Zimmer Biomet and the participating investigational centers.",3821-1-glbl-en-2021-sustainability-report-interactive.pdf
Clinical Trial Transparency Zimmer Biomet supports clinical research to foster advances in clinical knowledge and furthering medical device development related to our products and programs.,3821-1-glbl-en-2021-sustainability-report-interactive.pdf
"As such, clinical trial transparency is required to appropriately contribute to and comply with the International Committee of Medical Journal Editors (ICMJE) initiative and Food and Drug Administration Amendments Act (FDAAA) requirements by utilizing ClinicalTrials.gov to register our active clinical studies and study results once they are available.",3821-1-glbl-en-2021-sustainability-report-interactive.pdf
"All study results are posted, regardless of whether the trial is deemed successful or failed to meet the primary end point.",3821-1-glbl-en-2021-sustainability-report-interactive.pdf
A sample listing of Zimmer Biomet clinical trials can be found at ClinicalTrials.gov .,3821-1-glbl-en-2021-sustainability-report-interactive.pdf
"Grants, Donations and Funding Zimmer Biomet Foundation Zimmer Biomet is committed to our guiding principle of giving back to our communities and people in need.",3821-1-glbl-en-2021-sustainability-report-interactive.pdf
"The Zimmer Biomet Foundation is an independent, philanthropic, nonprofit organization established in 2018 to address the needs of our global community.",3821-1-glbl-en-2021-sustainability-report-interactive.pdf
"The mission of the Zimmer Biomet Foundation is to improve the quality of life for our communities by providing resources to help: build healthy communities, advance Science, Technology, Engineering and Math (STEM) education, provide disaster relief and address healthcare disparities while advancing diversity, equity and inclusion.",3821-1-glbl-en-2021-sustainability-report-interactive.pdf
"Zimmer Biomet continued to fund the Zimmer Biomet Foundation with a large contribution in 2021, allowing for continued charitable work globally.",3821-1-glbl-en-2021-sustainability-report-interactive.pdf
"From supporting Zimmer Biomet team members’ charitable programs, to funding community efforts in line with its pillars, the Zimmer Biomet Foundation donated nearly $2.7 million in charitable grants in 2021.",3821-1-glbl-en-2021-sustainability-report-interactive.pdf
"The Zimmer Biomet Foundation continued the Team Member Relief Fund to support team members facing financial hardship due to personal or catastrophic reasons, including COVID-19.",3821-1-glbl-en-2021-sustainability-report-interactive.pdf
"Since its inception, the Fund has provided more than $1 million in relief grants to team members.",3821-1-glbl-en-2021-sustainability-report-interactive.pdf
14Zimmer Biomet Medical Missions Zimmer Biomet donated orthopedic products to support more than 15 philanthropic medical mission trips in 2021 to help patients in need around the globe.,3821-1-glbl-en-2021-sustainability-report-interactive.pdf
"Due to the ongoing pandemic, several planned medical mission trips were postponed and rescheduled for future dates.",3821-1-glbl-en-2021-sustainability-report-interactive.pdf
Zimmer Biomet continued our unique partnership with Faith in Practice by donating a replenishment of implant inventory necessary to continually perform charitable surgeries in Guatemala.,3821-1-glbl-en-2021-sustainability-report-interactive.pdf
Faith in Practice (www.faithinpractice.org) is committed to serving the poor of Guatemala through short-term medical mission trips that take an integrated approach to care that strives to reach those in the greatest need.,3821-1-glbl-en-2021-sustainability-report-interactive.pdf
"Zimmer Biomet supported many other organizations- -including One World Surgery, Bayside Medical Missions, Operation Walk, and more--to care for underprivileged patients in need in Dominican Republic, Honduras, Ecuador, Kenya and more.",3821-1-glbl-en-2021-sustainability-report-interactive.pdf
"Additionally, we continue to support charitable surgeries in the U.S. by donating implants through Americares.",3821-1-glbl-en-2021-sustainability-report-interactive.pdf
"In 2021, Americares was able to support approximately 40 charitable surgeries in the U.S. with Zimmer Biomet implants.",3821-1-glbl-en-2021-sustainability-report-interactive.pdf
Americares (www.americares.org) saves lives and improves health for people affected by poverty or disaster so they can reach their full potential.,3821-1-glbl-en-2021-sustainability-report-interactive.pdf
"In addition, the Zimmer Biomet Foundation matched team member donations to over 500 nonprofit organizations with a dollar-for-dollar match.",3821-1-glbl-en-2021-sustainability-report-interactive.pdf
"Nearly $400,000 combined from team member contributions and the Foundation match was contributed to charities in 2021.",3821-1-glbl-en-2021-sustainability-report-interactive.pdf
We proudly support team members volunteering in their communities and abroad by offering resources to match team members with volunteer opportunities and work policies that allow them to take the time to support their community.,3821-1-glbl-en-2021-sustainability-report-interactive.pdf
"For the first year collectively capturing data on the volunteer program, team members logged close to 3,000 hours of giving back to their community.",3821-1-glbl-en-2021-sustainability-report-interactive.pdf
"Some of those organizations include Feed My Starving Children, Prospect Hospice Limited, Bumbleance Ireland (Saoirse Foundation) and the United Way.",3821-1-glbl-en-2021-sustainability-report-interactive.pdf
"In addition, team members organized several collection drives to provide needed items for back- to-school efforts and help during the holidays.",3821-1-glbl-en-2021-sustainability-report-interactive.pdf
"The Zimmer Biomet Foundation created the Zimmer Biomet Scholarship Fund for dependents of team members in the U.S. For the inaugural year, 10 recipients were selected to receive $2,500 for educational costs toward college expenses.",3821-1-glbl-en-2021-sustainability-report-interactive.pdf
"The Foundation continued to contribute to COVID relief efforts through Americares, as well as match team member donations.",3821-1-glbl-en-2021-sustainability-report-interactive.pdf
Funding was provided to the Red Cross to assist with efforts following the flooding in Europe.,3821-1-glbl-en-2021-sustainability-report-interactive.pdf
"With the earthquake disaster in Haiti in 2021, Zimmer Biomet donated external fixation devices to nonprofit organizations to help patients in need.",3821-1-glbl-en-2021-sustainability-report-interactive.pdf
"Additionally, in late December 2021, we donated burn care equipment to assist with the aftermath of the Haiti fuel truck explosion.",3821-1-glbl-en-2021-sustainability-report-interactive.pdf
The Zimmer Biomet Foundation also supported the Indiana Chamber Foundation’s Accelerating Indiana Vision 2025 program.,3821-1-glbl-en-2021-sustainability-report-interactive.pdf
"The initiative has a number of important dimensions, including broadband access, urban development, K-12 STEM curricula and advancing Diversity, Equity and Inclusion.",3821-1-glbl-en-2021-sustainability-report-interactive.pdf
"The ZBF continued support of STEM- related activities through the local school system in Warsaw, Indiana, home of Zimmer Biomet’s global headquarters.",3821-1-glbl-en-2021-sustainability-report-interactive.pdf
"Zimmer Biomet Corporate Grants In 2021, Zimmer Biomet provided grants, donations and funding for numerous educational and philanthropic projects.",3821-1-glbl-en-2021-sustainability-report-interactive.pdf
"These included grants to support orthopedic post-graduate medical education, including funding to OMeGA Medical Grants Association.",3821-1-glbl-en-2021-sustainability-report-interactive.pdf
"OMeGA (www.omegamedicalgrants.org) is an independent legal entity with a singular mission: to award and administer grants for graduate orthopedic medical education through an open, accessible process designed to safeguard against potential conflicts of interest and to ensure transparency in the allocation of resources.",3821-1-glbl-en-2021-sustainability-report-interactive.pdf
"Zimmer Biomet also provided educational grants to support independent medical education conferences that promote scientific knowledge, medical advancement and the delivery of effective healthcare.",3821-1-glbl-en-2021-sustainability-report-interactive.pdf
"In addition, Zimmer Biomet provided grants to third- party organizations for independent research to advance patient treatment designed for improved outcomes.",3821-1-glbl-en-2021-sustainability-report-interactive.pdf
"1516Advancing Diversity, Equity and Inclusion The Zimmer Biomet Foundation has partnered with many nonprofit organizations to advance diversity, equity and inclusion, particularly related to disparities and career development in healthcare.",3821-1-glbl-en-2021-sustainability-report-interactive.pdf
"As part of the large-scale partnership with the National Association for the Advancement of Colored People (NAACP) to focus on expanding medical access for people of color, our funding has supported the creation of the organization’s Learning and Impact Team and seed funding to support a partnership with Brookings Institute to develop the Black Asset Index.",3821-1-glbl-en-2021-sustainability-report-interactive.pdf
"Funding was also provided to support programs that promote diversity and multiculturalism in medical schools and in surgeon professional development, as well as industry minority initiatives to raise orthopedic treatment awareness and support higher education.",3821-1-glbl-en-2021-sustainability-report-interactive.pdf
"One example of diversity-related funding is the support we provide to The Perry Initiative, which is committed to inspiring young women to be leaders in the fields of orthopedic surgery and engineering.",3821-1-glbl-en-2021-sustainability-report-interactive.pdf
"Zimmer Biomet is the Founding Sponsor of Nth Dimensions, an educational nonprofit organization created to help increase diversity of women and underrepresented minorities in the field of orthopedics, including pre- medical students, medical students and residents.",3821-1-glbl-en-2021-sustainability-report-interactive.pdf
"We are a corporate partner of the J. Robert Gladden Orthopedic Society, a multi-cultural organization with a mission to increase diversity within the orthopedic profession.",3821-1-glbl-en-2021-sustainability-report-interactive.pdf
"We also provide support to the Ruth Jackson Orthopedic Society, which is dedicated to advancing the science and practice of orthopedic surgery among women, as well as the American Association of Latino Orthopedic Surgeons, which represents not only members of Latino descent, but all orthopedists who treat members of the Latino and Hispanic communities.",3821-1-glbl-en-2021-sustainability-report-interactive.pdf
"The Zimmer Biomet Foundation also collaborated with Zimmer Biomet’s global Employee Resource Groups to support nonprofit organizations that align with the focus of each group, and enhance the positive impact we can make across all areas of inclusion.",3821-1-glbl-en-2021-sustainability-report-interactive.pdf
"NAACP https:/ /naacp.org/Nth Dimensions www.nthdimensions.org Perry Initiative https:/ /perryinitiative.org/ Ruth Jackson Orthopedic Society http:/ /www.rjos.org/ Access to Healthcare Movement is Life Since 2004, Zimmer Biomet has funded initiatives that focus on defining and reducing musculoskeletal disparities.",3821-1-glbl-en-2021-sustainability-report-interactive.pdf
"Movement is Life , a multi-disciplinary coalition, partners with thought leaders and national member organizations aligned to create sustainable change in marginalized populations.",3821-1-glbl-en-2021-sustainability-report-interactive.pdf
"The coalition is dedicated to the elimination of racial, ethnic, geographic and gender disparities in muscle and joint health by promoting physical mobility to improve quality of life among African American, Hispanic and rural women.",3821-1-glbl-en-2021-sustainability-report-interactive.pdf
"Movement is Life programs include: • Operation Change, a community-based public health intervention focused on positive behavior modification in individuals who suffer from joint pain and chronic comorbid conditions such as diabetes and obesity.",3821-1-glbl-en-2021-sustainability-report-interactive.pdf
"Due to limitations related to COVID-19, in 2021 Movement is Life created a monthly, virtual Operation Change series focused on educational topics and movement.",3821-1-glbl-en-2021-sustainability-report-interactive.pdf
• The “Start Moving Start Living” website that serves as a repository for culturally competent patient communication tools to raise awareness about the health risks associated with immobility in the United States.,3821-1-glbl-en-2021-sustainability-report-interactive.pdf
"• A “Health Disparities” podcast focused on critical issues including social determinants of health, environmental impact on marginalized communities and structural barriers to equitable healthcare.",3821-1-glbl-en-2021-sustainability-report-interactive.pdf
More than 1 10 podcasts have been recorded.,3821-1-glbl-en-2021-sustainability-report-interactive.pdf
The podcasts can be found on the Movement is Life Caucus website.,3821-1-glbl-en-2021-sustainability-report-interactive.pdf
"• A monthly virtual speaker forum to include nationally recognized experts on topics such as political determinants of health, structural bias and safety net hospitals.",3821-1-glbl-en-2021-sustainability-report-interactive.pdf
"• In 2021, Movement is Life hosted its 1 1th Caucus, attracting more than 200 participants including policy makers, community advocates, academicians, providers, healthcare professionals and patients with the goal of educating and elevating critical messaging regarding the impact of the coronavirus on marginalized communities.",3821-1-glbl-en-2021-sustainability-report-interactive.pdf
"The Caucus featured many nationally known and published speakers such as Daniel Dawes, Garth Graham, Wayne Riley and Elvis Francois to address the impact of structural racism and social determinants of health.",3821-1-glbl-en-2021-sustainability-report-interactive.pdf
"17Patient Privacy and Data Security At Zimmer Biomet, the patient is always the patient, and never the product.",3821-1-glbl-en-2021-sustainability-report-interactive.pdf
"Patient data is used to improve outcomes and create value for patients and their care teams through our algorithms, systems and products in order to support our commitment to the highest standards of patient safety, quality and integrity.",3821-1-glbl-en-2021-sustainability-report-interactive.pdf
Our commitment to protecting patient and customer data is embodied in our four Privacy and Data Security Pillars: • Privacy.,3821-1-glbl-en-2021-sustainability-report-interactive.pdf
Privacy is a fundamental human right and we maintain robust practices to help ensure that that right is protected.,3821-1-glbl-en-2021-sustainability-report-interactive.pdf
Patients and customers decide what they share with us.,3821-1-glbl-en-2021-sustainability-report-interactive.pdf
• Security.,3821-1-glbl-en-2021-sustainability-report-interactive.pdf
Zimmer Biomet protects the data that patients and customers entrust us with through strong safeguards.,3821-1-glbl-en-2021-sustainability-report-interactive.pdf
"Among other measures, we apply encryption in transit and at rest, scheduled annual security risk assessments and penetration testing by third parties.",3821-1-glbl-en-2021-sustainability-report-interactive.pdf
• Data usage.,3821-1-glbl-en-2021-sustainability-report-interactive.pdf
"We only use customer and patient data to provide the services we have agreed upon, and for purposes that are compatible with providing those services.",3821-1-glbl-en-2021-sustainability-report-interactive.pdf
• Ownership.,3821-1-glbl-en-2021-sustainability-report-interactive.pdf
We put patients and customers in control of their data and have established tools and processes that give patients easy options to exercise their rights with respect to their personal data.,3821-1-glbl-en-2021-sustainability-report-interactive.pdf
Privacy There have never been more opportunities to use information collected in the course of treatment to create innovative solutions to improve patient outcomes.,3821-1-glbl-en-2021-sustainability-report-interactive.pdf
"At the same time, the importance of protecting patient privacy has never been higher.",3821-1-glbl-en-2021-sustainability-report-interactive.pdf
Privacy is built into our products and services by design and by default.,3821-1-glbl-en-2021-sustainability-report-interactive.pdf
"By taking this approach, we accommodate privacy in an effective and user-friendly way.",3821-1-glbl-en-2021-sustainability-report-interactive.pdf
"Zimmer Biomet has engaged with OneTrust, the industry-leading privacy management solution, to embed privacy in our products and services.",3821-1-glbl-en-2021-sustainability-report-interactive.pdf
"Our mymobility® platform, for example, is supported with a dedicated portal for individuals to exercise their privacy rights, with user-friendly features such as explanatory hovertext, local-language accessibility, and automated identity verification.",3821-1-glbl-en-2021-sustainability-report-interactive.pdf
We want to make it as easy as possible for patients to communicate their privacy preferences.Data Security Zimmer Biomet implements and verifies stringent security requirements to protect data we hold for patients and customers.,3821-1-glbl-en-2021-sustainability-report-interactive.pdf
"These include a broad array of controls, including encryption, third-party penetration testing, malware defenses, access limitations and auditing.",3821-1-glbl-en-2021-sustainability-report-interactive.pdf
"We also have our compliance with security requirements arising under the Health Insurance Portability and Accountability Act (HIPAA), General Data Protection Regulation (GDPR), California Consumer Privacy Act (CCPA), LGPD (Brazil), China’s Personal Information Protection Law (PIPL) and other key data protection regulations reviewed and verified by third-party experts.",3821-1-glbl-en-2021-sustainability-report-interactive.pdf
We are transparent regarding our security controls so that customers can understand and document the ways in which their information is protected.,3821-1-glbl-en-2021-sustainability-report-interactive.pdf
"Data Usage Zimmer Biomet ensures that information is only collected, used and disclosed for permissible purposes.",3821-1-glbl-en-2021-sustainability-report-interactive.pdf
"Through our contracts with customers, notice and consent forms, and other means, we are transparent about the ways we use information to create value for patients and providers.",3821-1-glbl-en-2021-sustainability-report-interactive.pdf
"We have implemented robust policies, procedures and trainings designed to ensure that patients’ and customers’ information is being handled consistent with those statements.",3821-1-glbl-en-2021-sustainability-report-interactive.pdf
"Ownership The patient, provider and Zimmer Biomet each have rights and responsibilities regarding data collected in the course of treatment.",3821-1-glbl-en-2021-sustainability-report-interactive.pdf
"Zimmer Biomet’s customer engagements, patient consents and notices and other privacy and information security practices are designed to ensure that these rights and responsibilities are respected.Cybersecurity A strong cybersecurity program is essential in today’s business landscape and we have continued to invest in people, processes and next generation cybersecurity technology solutions to combat this evolving risk.",3821-1-glbl-en-2021-sustainability-report-interactive.pdf
Cyber threats are emerging and evolving daily so we continue to manage these cyber-risks in alignment with industry best practices and frameworks.,3821-1-glbl-en-2021-sustainability-report-interactive.pdf
"Our commitment to cybersecurity includes a programmatic approach aiming to protect the confidentiality, integrity and availability of our systems, data and products.",3821-1-glbl-en-2021-sustainability-report-interactive.pdf
