,Sentence,ESG BERT Topic 1,ESG BERT Topic 2,ESG BERT Topic 3,Mapped Criteria Topic 1,Mapped Criteria Topic 2,Mapped Criteria Topic 3
Line 506,"We are on a path to fulfilling that goal, with 1.1 million mtCO 2 contracted to date in FY22.","('Business_Model_Resilience', 0.3086445927619934)","('Management_Of_Legal_And_Regulatory_Framework', 0.10677893459796906)","('GHG_Emissions', 0.07224176079034805)","('NON-ESG', 0.3086445927619934)","('NON-ESG', 0.10677893459796906)","('NON-ESG', 0.07224176079034805)"
Line 507,Getting to carbon negative (continued) 1.1M mtCO2 removal contracted to date in FY22.,"('GHG_Emissions', 0.7862740159034729)","('Ecological_Impacts', 0.036569807678461075)","('Water_And_Wastewater_Management', 0.02831755392253399)","(['Operational Eco-Efficiency'], 0.7862740159034729)","('NON-ESG', 0.036569807678461075)","('NON-ESG', 0.02831755392253399)"
Line 508,"Looking ahead, we know that the market needs to improve the quality of carbon removal accounting, and that we need to have a clearer line of sight to affordable supply.","('Supply_Chain_Management', 0.9124202132225037)","('Product_Design_And_Lifecycle_Management', 0.01121145486831665)","('Systemic_Risk_Management', 0.009116708301007748)","([], 0.9124202132225037)","('NON-ESG', 0.01121145486831665)","('NON-ESG', 0.009116708301007748)"
Line 509,Thats why in 2021 we undertook the following projects.,"('Management_Of_Legal_And_Regulatory_Framework', 0.5253272652626038)","('Access_And_Affordability', 0.06300948560237885)","('Business_Model_Resilience', 0.05885308235883713)","([], 0.5253272652626038)","('NON-ESG', 0.06300948560237885)","('NON-ESG', 0.05885308235883713)"
Line 510,"In partnership with Carbon Direct, we published our carbon dioxide removal guidance .","('GHG_Emissions', 0.8896732330322266)","('Air_Quality', 0.021303128451108932)","('Water_And_Wastewater_Management', 0.013286176137626171)","(['Operational Eco-Efficiency'], 0.8896732330322266)","('NON-ESG', 0.021303128451108932)","('NON-ESG', 0.013286176137626171)"
Line 511,These criteria are our minimal viable specifications for the most common project types that we will consider for procurement.,"('Product_Design_And_Lifecycle_Management', 0.35684505105018616)","('Energy_Management', 0.14685095846652985)","('Supply_Chain_Management', 0.08577518165111542)","('NON-ESG', 0.35684505105018616)","('NON-ESG', 0.14685095846652985)","('NON-ESG', 0.08577518165111542)"
Line 512,We will continue to expand on our criteria as the market adapts and see this as part of our market development work.,"('Business_Model_Resilience', 0.8028485178947449)","('Systemic_Risk_Management', 0.041885849088430405)","('Supply_Chain_Management', 0.02073550783097744)","(['Human Capital Development', 'Innovation Management'], 0.8028485178947449)","('NON-ESG', 0.041885849088430405)","('NON-ESG', 0.02073550783097744)"
Line 513,We funded research by Carbon Plan to produce their lessons learned and analysis from a systematic review of 14 protocols for soil carbon offsets for buyers from projects in the voluntary market today.,"('GHG_Emissions', 0.5946574807167053)","('Management_Of_Legal_And_Regulatory_Framework', 0.1420905739068985)","('Ecological_Impacts', 0.054262448102235794)","(['Operational Eco-Efficiency'], 0.5946574807167053)","('NON-ESG', 0.1420905739068985)","('NON-ESG', 0.054262448102235794)"
Line 514,"We commissioned a re port from Lawrence Livermore National Laboratory on likely carbon removal supply and cost projections for 2030, which will be available in Q1 of 2022.","('Supply_Chain_Management', 0.630903422832489)","('Energy_Management', 0.0709800198674202)","('GHG_Emissions', 0.07024770975112915)","([], 0.630903422832489)","('NON-ESG', 0.0709800198674202)","('NON-ESG', 0.07024770975112915)"
Line 515,"We collaborated with researchers from the University of Vermont, University of Minnesota, Concordia University, and Simon Fraser University to develop and explore the climate implications of temporary carbon storage in nature as a means to inform our carbon removal strategies.","('GHG_Emissions', 0.7532534003257751)","('Physical_Impacts_Of_Climate_Change', 0.07221081107854843)","('Ecological_Impacts', 0.0543304905295372)","(['Operational Eco-Efficiency'], 0.7532534003257751)","('NON-ESG', 0.07221081107854843)","('NON-ESG', 0.0543304905295372)"
Line 516,We co-founded the Business Alliance for Scaling Climate Solutions and the carbon removal workgroup of the World Economic Forums Alliance of CEO Climate Leaders.,"('Physical_Impacts_Of_Climate_Change', 0.9344544410705566)","('GHG_Emissions', 0.012238861061632633)","('Business_Model_Resilience', 0.009228593669831753)","(['Climate Strategy'], 0.9344544410705566)","('NON-ESG', 0.012238861061632633)","('NON-ESG', 0.009228593669831753)"
Line 517,30 Driving transformation Microsoft and our partners have been investing in technologies across every industry and region to help companies face new and shifting market conditions.,"('Business_Model_Resilience', 0.4799940288066864)","('Systemic_Risk_Management', 0.2457190752029419)","('Competitive_Behavior', 0.061328355222940445)","('NON-ESG', 0.4799940288066864)","('NON-ESG', 0.2457190752029419)","('NON-ESG', 0.061328355222940445)"
Line 518,The rapid pace of this transformation has the potential to change the world for the better.,"('Business_Model_Resilience', 0.5448177456855774)","('Human_Rights_And_Community_Relations', 0.06966277956962585)","('Physical_Impacts_Of_Climate_Change', 0.058782126754522324)","(['Human Capital Development', 'Innovation Management'], 0.5448177456855774)","('NON-ESG', 0.06966277956962585)","('NON-ESG', 0.058782126754522324)"
Line 519,"The worlds climate experts agree that people, companies, industries, and nations must take urgent action to reduce carbon emissions.","('Physical_Impacts_Of_Climate_Change', 0.7763785719871521)","('GHG_Emissions', 0.11148735135793686)","('Business_Model_Resilience', 0.015473658218979836)","(['Climate Strategy'], 0.7763785719871521)","('NON-ESG', 0.11148735135793686)","('NON-ESG', 0.015473658218979836)"
Line 520,Reducing carbon emissions and addressing environmental equity require collective measures to understand and mitigate environmental impacts.,"('GHG_Emissions', 0.3936278820037842)","('Physical_Impacts_Of_Climate_Change', 0.15356364846229553)","('Ecological_Impacts', 0.11309510469436646)","('NON-ESG', 0.3936278820037842)","('NON-ESG', 0.15356364846229553)","('NON-ESG', 0.11309510469436646)"
Line 521,"Organizations need to be able to record their environmental footprint, report to stakeholders, reduce their resource usage, remove their footprint through carbon offsets or recycling, and replace high-footprint resources with low-footprint ones.","('Ecological_Impacts', 0.3309658467769623)","('Supply_Chain_Management', 0.2774645686149597)","('Product_Design_And_Lifecycle_Management', 0.09872133284807205)","('NON-ESG', 0.3309658467769623)","('NON-ESG', 0.2774645686149597)","('NON-ESG', 0.09872133284807205)"
Line 522,Product Microsoft is leading new product innovations for the benefit of our planet.,"('Product_Design_And_Lifecycle_Management', 0.9609434604644775)","('Energy_Management', 0.00426564272493124)","('Product_Quality_And_Safety', 0.0036990882363170385)","([], 0.9609434604644775)","('NON-ESG', 0.00426564272493124)","('NON-ESG', 0.0036990882363170385)"
Line 523,"With new offerings ranging from providing transparency on the footprint of our devices and services, to digital supply chains that improve business processes and reduce carbon footprints, to IoT sensors streaming real-time telemetry for predictive analytics, there is no shortage of examples of how technology can enable ambitious sustainability outcomes.","('Supply_Chain_Management', 0.9497370719909668)","('Systemic_Risk_Management', 0.006099307909607887)","('Product_Design_And_Lifecycle_Management', 0.0036752517335116863)","([], 0.9497370719909668)","('NON-ESG', 0.006099307909607887)","('NON-ESG', 0.0036752517335116863)"
Line 524,"The Microsoft Cloud for Sustainability enables companies to record, report, and reduce emissions.","('GHG_Emissions', 0.6755651235580444)","('Air_Quality', 0.10101038217544556)","('Energy_Management', 0.050516318529844284)","(['Operational Eco-Efficiency'], 0.6755651235580444)","('NON-ESG', 0.10101038217544556)","('NON-ESG', 0.050516318529844284)"
Line 525,Microsoft Cloud for Sustainability Microsoft launched the Microsoft Cloud for Sustainability in July 2021.,"('Product_Design_And_Lifecycle_Management', 0.5082228779792786)","('Business_Model_Resilience', 0.07094836235046387)","('Data_Security', 0.06538833677768707)","([], 0.5082228779792786)","('NON-ESG', 0.07094836235046387)","('NON-ESG', 0.06538833677768707)"
Line 526,"The Microsoft Cloud for Sustainability provides comprehensive, integrated, and automated sustainability management for organizations at any stage of the sustainability journey.","('Product_Design_And_Lifecycle_Management', 0.3160025477409363)","('Business_Model_Resilience', 0.28130412101745605)","('Supply_Chain_Management', 0.05957870930433273)","('NON-ESG', 0.3160025477409363)","('NON-ESG', 0.28130412101745605)","('NON-ESG', 0.05957870930433273)"
Line 527,"It is designed to streamline the process for organizations to collect data, analyze data, and turn data into insigh ts.","('Customer_Privacy', 0.787735641002655)","('Data_Security', 0.10917576402425766)","('Waste_And_Hazardous_Materials_Management', 0.009203341789543629)","(['Information Security Cybersecurity & System Availability'], 0.787735641002655)","('NON-ESG', 0.10917576402425766)","('NON-ESG', 0.009203341789543629)"
Line 528,"Companies can more effectively record, report, and reduce emissions on a path to net zero, and we plan to support water and waste tracking in the future.","('Water_And_Wastewater_Management', 0.30217647552490234)","('Waste_And_Hazardous_Materials_Management', 0.2785769999027252)","('Air_Quality', 0.13941900432109833)","('NON-ESG', 0.30217647552490234)","('NON-ESG', 0.2785769999027252)","('NON-ESG', 0.13941900432109833)"
Line 529,"Since the announcement, weve brought the Microsoft Cloud for Sustainability into a public preview period, with several customers using it to guide their sustainability strategies.","('Product_Design_And_Lifecycle_Management', 0.2987407147884369)","('Business_Model_Resilience', 0.2779046893119812)","('Supply_Chain_Management', 0.06932646036148071)","('NON-ESG', 0.2987407147884369)","('NON-ESG', 0.2779046893119812)","('NON-ESG', 0.06932646036148071)"
Line 530,"Microsoft is also serving as customer one, shaping product requirements and beginning to adopt this for our own emissions reporting.","('Air_Quality', 0.8263838291168213)","('GHG_Emissions', 0.06459883600473404)","('Energy_Management', 0.02813984639942646)","([], 0.8263838291168213)","('NON-ESG', 0.06459883600473404)","('NON-ESG', 0.02813984639942646)"
Line 531,"31 Driving transformation (continued) Delivering transparency on Microsoft product emissions While the Microsoft Cloud for Sustainability may be the first standalone sus tainability-focused product at Microsoft, its not our first work on emissions tracking and reporting.","('Air_Quality', 0.8435434103012085)","('GHG_Emissions', 0.08143596351146698)","('Energy_Management', 0.013926897197961807)","([], 0.8435434103012085)","('NON-ESG', 0.08143596351146698)","('NON-ESG', 0.013926897197961807)"
Line 532,"For more t han two years, we have pioneered tools and features to provide a close to real- time view of our products footprint, and we continue to deliver more transparency to customers.","('Product_Design_And_Lifecycle_Management', 0.9246524572372437)","('Product_Quality_And_Safety', 0.012311878614127636)","('Customer_Welfare', 0.005723442416638136)","([], 0.9246524572372437)","('NON-ESG', 0.012311878614127636)","('NON-ESG', 0.005723442416638136)"
Line 533,"The Emissions Impact Dashboard provides customers with transparency into their carbon emissions resulting from their cloud usage, making Microsoft the only cloudprovider to provide full transparency to customers across all three scopes of emissions.","('GHG_Emissions', 0.544583261013031)","('Air_Quality', 0.2642452120780945)","('Management_Of_Legal_And_Regulatory_Framework', 0.05176261067390442)","(['Operational Eco-Efficiency'], 0.544583261013031)","('NON-ESG', 0.2642452120780945)","('NON-ESG', 0.05176261067390442)"
Line 534,"Using AI and advanced analytics, the Emissions Impact Dashboard shows reduction trends for customer cloud usage over time, providing the ability to forecast cloud emissions and simplify carbon reporting.","('GHG_Emissions', 0.33988961577415466)","('Air_Quality', 0.3259515166282654)","('Energy_Management', 0.1133178249001503)","('NON-ESG', 0.33988961577415466)","('NON-ESG', 0.3259515166282654)","('NON-ESG', 0.1133178249001503)"
Line 535,It uses consistent and accurate carbon accounting to quantify the impact of Microsoft cloud services on customers environmental footprint and can compile the information into reports for voluntary or statutory reporting requirements.,"('Management_Of_Legal_And_Regulatory_Framework', 0.20695562660694122)","('Business_Model_Resilience', 0.15235333144664764)","('Physical_Impacts_Of_Climate_Change', 0.1485314816236496)","('NON-ESG', 0.20695562660694122)","('NON-ESG', 0.15235333144664764)","('NON-ESG', 0.1485314816236496)"
Line 536,This solution became generally available in Q3 2021.,"('Business_Model_Resilience', 0.28064775466918945)","('Systemic_Risk_Management', 0.20569700002670288)","('Management_Of_Legal_And_Regulatory_Framework', 0.06915117800235748)","('NON-ESG', 0.28064775466918945)","('NON-ESG', 0.20569700002670288)","('NON-ESG', 0.06915117800235748)"
Line 537,"Find out more on the Emissions Impact Dashboard The Microsoft Surface Emissions Estimator is a new, dynamic way for commercial customers to gain insight into the carbon footprint of their entire Surface device fleets.","('Air_Quality', 0.4869242310523987)","('GHG_Emissions', 0.3975767195224762)","('Energy_Management', 0.02840309403836727)","('NON-ESG', 0.4869242310523987)","('NON-ESG', 0.3975767195224762)","('NON-ESG', 0.02840309403836727)"
Line 538,The Estimator u ses state-of-the-art carbon assessment technolo gies to enable customers to get more accurate estimations of the carbon impact of the Surface devices they purchase from us.,"('GHG_Emissions', 0.6604158878326416)","('Ecological_Impacts', 0.12733519077301025)","('Water_And_Wastewater_Management', 0.02856368198990822)","(['Operational Eco-Efficiency'], 0.6604158878326416)","('NON-ESG', 0.12733519077301025)","('NON-ESG', 0.02856368198990822)"
Line 539,"Taking the customer on a journey through a Surface products lifecycle, the Estimator provides a visual indication of improvements over previous product models, highlights some of the changes made to reduce carbon emissions, and estimates carbon reductions associated with deployments of new Surface models.","('Product_Design_And_Lifecycle_Management', 0.8905671238899231)","('Energy_Management', 0.02827867493033409)","('Product_Quality_And_Safety', 0.009165970608592033)","([], 0.8905671238899231)","('NON-ESG', 0.02827867493033409)","('NON-ESG', 0.009165970608592033)"
Line 540,"Customers can learn more about the impact of Surface products on their Scope 2 and 3 emissions from the Microsoft support team, who started to use the Estimator to provide reports to commercial customers in late 2021.","('Product_Design_And_Lifecycle_Management', 0.5226119160652161)","('Energy_Management', 0.1310655027627945)","('GHG_Emissions', 0.038726117461919785)","([], 0.5226119160652161)","('NON-ESG', 0.1310655027627945)","('NON-ESG', 0.038726117461919785)"
Line 541,The Microsoft Teams Carbon Avoidance Screen posts a remote meeting summary of avoided carbon based on the distance between the organizer and the participant.,"('Management_Of_Legal_And_Regulatory_Framework', 0.2590272128582001)","('Business_Ethics', 0.15483258664608002)","('Air_Quality', 0.0961347371339798)","('NON-ESG', 0.2590272128582001)","('NON-ESG', 0.15483258664608002)","('NON-ESG', 0.0961347371339798)"
Line 542,The goal is to encourage people to use Teams remote capabilities rather than travel for meetings.,"('Energy_Management', 0.12020213901996613)","('Employee_Health_And_Safety', 0.10500070452690125)","('Customer_Privacy', 0.08116663247346878)","('NON-ESG', 0.12020213901996613)","('NON-ESG', 0.10500070452690125)","('NON-ESG', 0.08116663247346878)"
Line 543,This will pilot with a few select customers in 2022.,"('Competitive_Behavior', 0.2226545214653015)","('Business_Model_Resilience', 0.16326624155044556)","('Customer_Welfare', 0.10876037180423737)","('NON-ESG', 0.2226545214653015)","('NON-ESG', 0.16326624155044556)","('NON-ESG', 0.10876037180423737)"
Line 544,"For Windows energy usage, we are co-innovating with third parties to help inform customers about the carbon footprint associated with their computing.","('Energy_Management', 0.9780060052871704)","('Air_Quality', 0.002387462882325053)","('GHG_Emissions', 0.002225560834631324)","(['Operational Eco-Efficiency'], 0.9780060052871704)","('NON-ESG', 0.002387462882325053)","('NON-ESG', 0.002225560834631324)"
Line 545,"One partner, elow (formerly CSN Energy), was able to reduce use-phase carbon emissions up to 6 percent through a co-innovated elow Carbon App by providing guidance to users to charge their computers based on the real-time carbon intensity of the electric grid.","('GHG_Emissions', 0.6054688692092896)","('Energy_Management', 0.16498099267482758)","('Air_Quality', 0.08329267054796219)","(['Operational Eco-Efficiency'], 0.6054688692092896)","('NON-ESG', 0.16498099267482758)","('NON-ESG', 0.08329267054796219)"
Line 546,"Another, AVOB, provides more accurate energy consumption data to office workstations as well as automated mechanisms to optimize energy consumption, enabling up to a 50 percent reduction in energy usage while increasing performance and computer lifespan.","('Energy_Management', 0.9798786640167236)","('Air_Quality', 0.002223645569756627)","('Critical_Incident_Risk_Management', 0.0019577338825911283)","(['Operational Eco-Efficiency'], 0.9798786640167236)","('NON-ESG', 0.002223645569756627)","('NON-ESG', 0.0019577338825911283)"
Line 547,"Reflective of the innovation we continually pursue, some of these tools have more advanced methodologies than Microsoft currently uses for its corporate carbon disclosure.","('Management_Of_Legal_And_Regulatory_Framework', 0.9202057123184204)","('GHG_Emissions', 0.014578260481357574)","('Systemic_Risk_Management', 0.010312947444617748)","([], 0.9202057123184204)","('NON-ESG', 0.014578260481357574)","('NON-ESG', 0.010312947444617748)"
Line 548,32 Providing solutions for specific sustainability challenges We have found new opportunities to use Microsoft solutions to more sustainably manage operations.,"('Product_Design_And_Lifecycle_Management', 0.25828850269317627)","('Business_Model_Resilience', 0.25589683651924133)","('Supply_Chain_Management', 0.22514356672763824)","('NON-ESG', 0.25828850269317627)","('NON-ESG', 0.25589683651924133)","('NON-ESG', 0.22514356672763824)"
Line 549,We started with our own operations and are expanding their use beyond our direct business activities.,"('Business_Model_Resilience', 0.31444481015205383)","('Product_Design_And_Lifecycle_Management', 0.16767019033432007)","('Customer_Welfare', 0.07929069548845291)","('NON-ESG', 0.31444481015205383)","('NON-ESG', 0.16767019033432007)","('NON-ESG', 0.07929069548845291)"
Line 550,"Managing buildings and spaces Microsoft is acceler ating sustainability through Smart Places, with IoT and AI to optimize the way buildings, campuses, and cities consume and deliver resources and create efficienci es.","('Product_Design_And_Lifecycle_Management', 0.2548689544200897)","('Energy_Management', 0.21120122075080872)","('Business_Model_Resilience', 0.13690237700939178)","('NON-ESG', 0.2548689544200897)","('NON-ESG', 0.21120122075080872)","('NON-ESG', 0.13690237700939178)"
Line 551,"Based on Azure IoT, Smart Places include data-driven technologies for monitoring and managing carbon, water, and waste in buildings to turn inefficiencies into o pportunities to reduce environmental impact.","('Waste_And_Hazardous_Materials_Management', 0.8846153020858765)","('Water_And_Wastewater_Management', 0.05677570402622223)","('Air_Quality', 0.007620600052177906)","([], 0.8846153020858765)","('NON-ESG', 0.05677570402622223)","('NON-ESG', 0.007620600052177906)"
Line 552,Organizatio ns can optimize energy management and reduce carbon emissions by using predictive monitoring to help manage equipment performance and energy consumption and to explore grid-interactive efficient buildings a nd infrastructure.,"('Energy_Management', 0.9806350469589233)","('Air_Quality', 0.0021695278119295835)","('Management_Of_Legal_And_Regulatory_Framework', 0.002113842871040106)","(['Operational Eco-Efficiency'], 0.9806350469589233)","('NON-ESG', 0.0021695278119295835)","('NON-ESG', 0.002113842871040106)"
Line 553,Providing visibility ac ross supply chain Microsoft Dynamics 3 65 Supply Chain Insights breaks down data silos by connecting and taking inputs from enterprise resource planning and supply chain systems across an organization.,"('Supply_Chain_Management', 0.9509556293487549)","('Labor_Practices', 0.00454836105927825)","('Product_Design_And_Lifecycle_Management', 0.0035351025871932507)","([], 0.9509556293487549)","('NON-ESG', 0.00454836105927825)","('NON-ESG', 0.0035351025871932507)"
Line 554,"Using industry data models and AI-powered weather and environmental risk signals from Bing and third-party sources, operations can get a better view of climate-related risk to build a more resilient supply chain.","('Supply_Chain_Management', 0.8711864948272705)","('Business_Model_Resilience', 0.03154266998171806)","('Physical_Impacts_Of_Climate_Change', 0.02939608134329319)","([], 0.8711864948272705)","('NON-ESG', 0.03154266998171806)","('NON-ESG', 0.02939608134329319)"
Line 555,"For more than two years, we have pioneered tools and features to provide a close to real-time view of our products footprint, and we continue to deliver more transparency to customers.","('Product_Design_And_Lifecycle_Management', 0.9448297023773193)","('Product_Quality_And_Safety', 0.007478973362594843)","('Customer_Welfare', 0.0045328387059271336)","([], 0.9448297023773193)","('NON-ESG', 0.007478973362594843)","('NON-ESG', 0.0045328387059271336)"
Line 556,"Driving transformation (continued) Customers and partners Matching the supply and demand of carbon sequestration with AI and machine learning Project Acorn, developed by Rabobank, is a global, transparent, and technology-enabled marketplace and ecosystem for carbon sequestration.","('Supply_Chain_Management', 0.39716508984565735)","('GHG_Emissions', 0.17550605535507202)","('Energy_Management', 0.1623435765504837)","('NON-ESG', 0.39716508984565735)","('NON-ESG', 0.17550605535507202)","('NON-ESG', 0.1623435765504837)"
Line 557,The proposition facilitates agroforestry projects among smallholder farmers in developing countries that sequester carbon in biomass through tree growth; the carbon removal units that result from this represent actual sequestration.,"('GHG_Emissions', 0.8310513496398926)","('Ecological_Impacts', 0.057917434722185135)","('Water_And_Wastewater_Management', 0.016025792807340622)","(['Operational Eco-Efficiency'], 0.8310513496398926)","('NON-ESG', 0.057917434722185135)","('NON-ESG', 0.016025792807340622)"
Line 558,"To make small-size projects on an individual farmer level economically viable, Project Acorn uses remote sensing technologies, including the analysis of satellite imagery by specialized partners.","('Energy_Management', 0.35809049010276794)","('Business_Model_Resilience', 0.08518189936876297)","('GHG_Emissions', 0.05262822285294533)","('NON-ESG', 0.35809049010276794)","('NON-ESG', 0.08518189936876297)","('NON-ESG', 0.05262822285294533)"
Line 559,The architectural design was built on a Dynamics 365 platform and uses customized Azure functionality.,"('Product_Design_And_Lifecycle_Management', 0.30301573872566223)","('Business_Model_Resilience', 0.14519061148166656)","('Data_Security', 0.10328929126262665)","('NON-ESG', 0.30301573872566223)","('NON-ESG', 0.14519061148166656)","('NON-ESG', 0.10328929126262665)"
Line 560,"Optimizing offshore wind turbines with AI Algo Engines and Microsoft helped rsted, the world leader in offshore wind energy, to optimize the performance of more than 1,300 turbines on its wind farms, enabling it to fully phase out coal by 2023 and increase offshore wind capacity to 15 GW (enough for 30 million people) by 2025. rsted uses Microsoft Azure AI to determine where new turbines should be deployed.","('Energy_Management', 0.6648997068405151)","('Management_Of_Legal_And_Regulatory_Framework', 0.15762166678905487)","('GHG_Emissions', 0.025702182203531265)","(['Operational Eco-Efficiency'], 0.6648997068405151)","('NON-ESG', 0.15762166678905487)","('NON-ESG', 0.025702182203531265)"
Line 561,"Previously, the computations for the foundations alone took weeks.","('Competitive_Behavior', 0.7055837512016296)","('Management_Of_Legal_And_Regulatory_Framework', 0.06915304809808731)","('Systemic_Risk_Management', 0.037375904619693756)","([], 0.7055837512016296)","('NON-ESG', 0.06915304809808731)","('NON-ESG', 0.037375904619693756)"
Line 562,"With the cloud, that time is reduced to four to eight hours.","('Labor_Practices', 0.20002226531505585)","('Energy_Management', 0.10011087357997894)","('Competitive_Behavior', 0.06875734031200409)","('NON-ESG', 0.20002226531505585)","('NON-ESG', 0.10011087357997894)","('NON-ESG', 0.06875734031200409)"
