,Sentence,ESG BERT Topic 1,ESG BERT Topic 2,ESG BERT Topic 3,Mapped Criteria Topic 1,Mapped Criteria Topic 2,Mapped Criteria Topic 3
Line 1016,"Our com mitment: zero waste by 2030 across our direct waste footprint Increasing reuse of servers and components through Circular Centers By 2025, 90 percent of servers and components within our regional datacenter networks will be reused.","('Waste_And_Hazardous_Materials_Management', 0.9831031560897827)","('Water_And_Wastewater_Management', 0.0017657368443906307)","('Data_Security', 0.001288495259359479)","([], 0.9831031560897827)","('NON-ESG', 0.0017657368443906307)","('NON-ESG', 0.001288495259359479)"
Line 1017,"Eliminating single-use plastic By 2025, we will eliminate single-use plastics in all Microsoft primary product packaging and all IT asset packaging in our datacenters.","('Product_Design_And_Lifecycle_Management', 0.7792324423789978)","('Waste_And_Hazardous_Materials_Management', 0.0894828587770462)","('Selling_Practices_And_Product_Labeling', 0.021307285875082016)","([], 0.7792324423789978)","('NON-ESG', 0.0894828587770462)","('NON-ESG', 0.021307285875082016)"
Line 1018,"Making fully recyclable products and packaging We will design Surface devices, Xbox products and accessories, and all Microsoft product packaging to be 100 percent recyclable in OECD countries by 2030.","('Product_Design_And_Lifecycle_Management', 0.9609410762786865)","('Product_Quality_And_Safety', 0.004556847270578146)","('Selling_Practices_And_Product_Labeling', 0.004015436861664057)","([], 0.9609410762786865)","('NON-ESG', 0.004556847270578146)","('NON-ESG', 0.004015436861664057)"
Line 1019,Driving to zero waste operations We will achieve 90 percent diversion of operational waste at datacenters and campuses and 75 percent diversion for all construction and deconstruction projects by 2030.,"('Waste_And_Hazardous_Materials_Management', 0.9842720031738281)","('Water_And_Wastewater_Management', 0.0014545063022524118)","('Air_Quality', 0.0012982585467398167)","([], 0.9842720031738281)","('NON-ESG', 0.0014545063022524118)","('NON-ESG', 0.0012982585467398167)"
Line 1020,"Transforming waste accounting We will continue to improve waste data accounting to ensure accuracy, auditability, and reporting.","('Waste_And_Hazardous_Materials_Management', 0.9669722318649292)","('Data_Security', 0.002669227309525013)","('Air_Quality', 0.0025761686265468597)","([], 0.9669722318649292)","('NON-ESG', 0.002669227309525013)","('NON-ESG', 0.0025761686265468597)"
Line 1021,Investing in the future of circularity We will partner with companies around the world to drive circular economy innovation and adoption of technologies to reduce waste and reuse materials and products.,"('Product_Design_And_Lifecycle_Management', 0.5482771992683411)","('Waste_And_Hazardous_Materials_Management', 0.3041076958179474)","('Energy_Management', 0.016051577404141426)","([], 0.5482771992683411)","('NON-ESG', 0.3041076958179474)","('NON-ESG', 0.016051577404141426)"
Line 1022,"62 Our progress Circular Centers We have planned five Circular Centers, with Amsterdam open, construction underway in Boydton, Virginia, and three more to be added in Dublin, Chicago, and Singapore in 2022.","('Business_Model_Resilience', 0.23970448970794678)","('Systemic_Risk_Management', 0.07748955488204956)","('Employee_Engagement_Inclusion_And_Diversity', 0.07280593365430832)","('NON-ESG', 0.23970448970794678)","('NON-ESG', 0.07748955488204956)","('NON-ESG', 0.07280593365430832)"
Line 1023,This has projected savings of $100 million per year once fully scaled and will enable 90 percent reuse by 2025.,"('Product_Design_And_Lifecycle_Management', 0.44363832473754883)","('Energy_Management', 0.28275489807128906)","('Access_And_Affordability', 0.03716302663087845)","('NON-ESG', 0.44363832473754883)","('NON-ESG', 0.28275489807128906)","('NON-ESG', 0.03716302663087845)"
Line 1024,">15, 20 0 metric tons In FY21, we diverted more than 15,200 metric tons of solid waste otherwise headed to landfills and incinerators across our direct operational footprint.","('Waste_And_Hazardous_Materials_Management', 0.9837217926979065)","('Water_And_Wastewater_Management', 0.0014748889952898026)","('Air_Quality', 0.0014659179141744971)","([], 0.9837217926979065)","('NON-ESG', 0.0014748889952898026)","('NON-ESG', 0.0014659179141744971)"
Line 1025,"Transformed waste accounting We transformed our waste accounting using Microsoft technology, including PowerApps, Dynamics 365, and Power BI, increasing our collection of actual waste data and providing greater visibility into waste types.","('Waste_And_Hazardous_Materials_Management', 0.9838811159133911)","('Water_And_Wastewater_Management', 0.0014971222262829542)","('Data_Security', 0.0013109702849760652)","([], 0.9838811159133911)","('NON-ESG', 0.0014971222262829542)","('NON-ESG', 0.0013109702849760652)"
Line 1026,18% reduction We reduced single-use plastics in our Microsoft product packaging by 18 percent or from 5.7 percent to 4.7 percent by weight (on average) of plastic per package in FY21.,"('Product_Design_And_Lifecycle_Management', 0.8570758700370789)","('Waste_And_Hazardous_Materials_Management', 0.03409421816468239)","('Selling_Practices_And_Product_Labeling', 0.016098227351903915)","([], 0.8570758700370789)","('NON-ESG', 0.03409421816468239)","('NON-ESG', 0.016098227351903915)"
Line 1027,">90% recyclable We achieved a 97 percent recyclable Xbox Series X and S, and a 93 percent recyclable metal Surface Laptop 4, in Organization for Economic Cooperation and Development (OECD) countries per the UL methodology ECVP 2789.","('Product_Design_And_Lifecycle_Management', 0.7381271123886108)","('Energy_Management', 0.09827926009893417)","('Waste_And_Hazardous_Materials_Management', 0.030024388805031776)","([], 0.7381271123886108)","('NON-ESG', 0.09827926009893417)","('NON-ESG', 0.030024388805031776)"
Line 1028,"Recycled waste materials We introduced two new accessories that are made in part from recycled waste materials: several new Xbox Wireless Controllers, built using over 30 percent post-consumer recycled (PCR) materials; and the Ocean Plastic Mouse, which has a plastic shell made with 20 percent recycled ocean plastic.","('Waste_And_Hazardous_Materials_Management', 0.9827914834022522)","('Water_And_Wastewater_Management', 0.0019129749853163958)","('Air_Quality', 0.001184768625535071)","([], 0.9827914834022522)","('NON-ESG', 0.0019129749853163958)","('NON-ESG', 0.001184768625535071)"
Line 1029,"Zero Waste datacenters Four datacenters are Zero Waste certified, with new certifications for the San Antonio, Texas and Quincy, Washington datacenters and renewed certifications for our Boydton, Virginia and Dublin, Ireland locations.","('Waste_And_Hazardous_Materials_Management', 0.9811379909515381)","('Water_And_Wastewater_Management', 0.0020572044886648655)","('Air_Quality', 0.0019011222757399082)","([], 0.9811379909515381)","('NON-ESG', 0.0020572044886648655)","('NON-ESG', 0.0019011222757399082)"
Line 1030,Zero Waste campus roadmaps Eleven campuses now have customized roadmaps to achieve zero waste by 2030.,"('Waste_And_Hazardous_Materials_Management', 0.9833522439002991)","('Air_Quality', 0.0016280164709314704)","('Water_And_Wastewater_Management', 0.0014086164301261306)","([], 0.9833522439002991)","('NON-ESG', 0.0016280164709314704)","('NON-ESG', 0.0014086164301261306)"
Line 1031,Our Puget Sound campus has been Zero Waste certified since 2016.,"('Waste_And_Hazardous_Materials_Management', 0.9818041324615479)","('Air_Quality', 0.0016224558930844069)","('Water_And_Wastewater_Management', 0.0012991151306778193)","([], 0.9818041324615479)","('NON-ESG', 0.0016224558930844069)","('NON-ESG', 0.0012991151306778193)"
Line 1032,Invested in Rheaply We invested in circular economy startup Rheaply to help companies measure carbon emissions savings from reuse and fuel the circular economy.,"('Energy_Management', 0.6525747179985046)","('GHG_Emissions', 0.0972655713558197)","('Air_Quality', 0.08130747824907303)","(['Operational Eco-Efficiency'], 0.6525747179985046)","('NON-ESG', 0.0972655713558197)","('NON-ESG', 0.08130747824907303)"
Line 1033,A year of progress and impact to get to zero waste by 2030.,"('Waste_And_Hazardous_Materials_Management', 0.9824747443199158)","('Air_Quality', 0.0014181358274072409)","('Water_And_Wastewater_Management', 0.0013054596493020654)","([], 0.9824747443199158)","('NON-ESG', 0.0014181358274072409)","('NON-ESG', 0.0013054596493020654)"
Line 1034,"Our approach (continued) 63 Our approach (continued) Waste Table 1 Working towards our target to divert 90 percent of operational solid waste from landfills and incinerators across our owned datacenters and campuses In FY21, our diversion rate remained nearly flat from FY20, and we diverted more than 12,600 metric tons of waste from being landfilled or incinerated.","('Waste_And_Hazardous_Materials_Management', 0.9842308163642883)","('Water_And_Wastewater_Management', 0.0015276276972144842)","('Air_Quality', 0.0012750211171805859)","([], 0.9842308163642883)","('NON-ESG', 0.0015276276972144842)","('NON-ESG', 0.0012750211171805859)"
Line 1035,Employees working from home was one of the main drivers of the decrease of over 44.4 percent in total waste generated.,"('Waste_And_Hazardous_Materials_Management', 0.9830977320671082)","('Water_And_Wastewater_Management', 0.001760571845807135)","('Air_Quality', 0.0013347258791327477)","([], 0.9830977320671082)","('NON-ESG', 0.001760571845807135)","('NON-ESG', 0.0013347258791327477)"
Line 1036,a.,"('Competitive_Behavior', 0.14910615980625153)","('Management_Of_Legal_And_Regulatory_Framework', 0.07451849430799484)","('Ecological_Impacts', 0.06992918252944946)","('NON-ESG', 0.14910615980625153)","('NON-ESG', 0.07451849430799484)","('NON-ESG', 0.06992918252944946)"
Line 1037,Waste generation values and classifications have been updated for FY19 and FY20 to be consistent with data collection and estimation methodology improvements established in FY21.,"('Waste_And_Hazardous_Materials_Management', 0.9722689390182495)","('Water_And_Wastewater_Management', 0.005279046017676592)","('Air_Quality', 0.0027103980537503958)","([], 0.9722689390182495)","('NON-ESG', 0.005279046017676592)","('NON-ESG', 0.0027103980537503958)"
Line 1038,"As we continue improving our waste accounting, our reported values may change.","('Waste_And_Hazardous_Materials_Management', 0.8388814330101013)","('Management_Of_Legal_And_Regulatory_Framework', 0.026537634432315826)","('Water_And_Wastewater_Management', 0.012673110701143742)","([], 0.8388814330101013)","('NON-ESG', 0.026537634432315826)","('NON-ESG', 0.012673110701143742)"
Line 1039,"Waste Table 2 Ensuring 90 percent of servers and components for all cloud hardware will be reused by 2025 The main driver s of our reuse percentage are the functional equipment that is remarketed (either whole or parted-out), or materials that could be reused after the recycling process.","('Waste_And_Hazardous_Materials_Management', 0.9754067063331604)","('Product_Design_And_Lifecycle_Management', 0.003195675555616617)","('Water_And_Wastewater_Management', 0.0021378465462476015)","([], 0.9754067063331604)","('NON-ESG', 0.003195675555616617)","('NON-ESG', 0.0021378465462476015)"
Line 1040,"In FY21, a reduction in the volume of decommissioned assets and increase in the volume of recyclable material in the mix contributed to the overall reduction in the reuse percentage.","('Product_Design_And_Lifecycle_Management', 0.9194161891937256)","('Supply_Chain_Management', 0.01056560967117548)","('Waste_And_Hazardous_Materials_Management', 0.010225413367152214)","([], 0.9194161891937256)","('NON-ESG', 0.01056560967117548)","('NON-ESG', 0.010225413367152214)"
Line 1041,Expansion of our Circular Centers program and investments in systems and policy changes will further enable us to achieve our 90 percent reuse target of servers and components by 2025.,"('Management_Of_Legal_And_Regulatory_Framework', 0.47670772671699524)","('Product_Design_And_Lifecycle_Management', 0.19704268872737885)","('Business_Model_Resilience', 0.07233978807926178)","('NON-ESG', 0.47670772671699524)","('NON-ESG', 0.19704268872737885)","('NON-ESG', 0.07233978807926178)"
Line 1042,0% 20% 40% 60% 80% 100% Target 90% Reuse rate Base year Current year FY19 85% 87% 76% FY21 FY20 Diversion rate 77.7% 79.4% 78.4% FY19 0% 20% 40% 60% 80% 100% Target 90% FY21 FY20 Base year Current year A B C E A B C D E A B C D E D Diverted: Not diverted: Reused A Recycled Composted Landfilled Incinerated D B C E Reused a.,"('Waste_And_Hazardous_Materials_Management', 0.9206401705741882)","('Water_And_Wastewater_Management', 0.02160729095339775)","('Ecological_Impacts', 0.007276017684489489)","([], 0.9206401705741882)","('NON-ESG', 0.02160729095339775)","('NON-ESG', 0.007276017684489489)"
Line 1043,Our program and supplier data quality has consistently improved over the years.,"('Supply_Chain_Management', 0.9459975957870483)","('Business_Model_Resilience', 0.004797093570232391)","('Systemic_Risk_Management', 0.004165892023593187)","([], 0.9459975957870483)","('NON-ESG', 0.004797093570232391)","('NON-ESG', 0.004165892023593187)"
Line 1044,Access to more accurate data has helped us update our methodology for percentage reuse calculation.,"('Customer_Privacy', 0.6700135469436646)","('Data_Security', 0.09069199860095978)","('Management_Of_Legal_And_Regulatory_Framework', 0.03003380075097084)","(['Information Security Cybersecurity & System Availability'], 0.6700135469436646)","('NON-ESG', 0.09069199860095978)","('NON-ESG', 0.03003380075097084)"
Line 1045,"For consistency, previously reported years have been updated to reflect latest methodology applied to FY21.","('Management_Of_Legal_And_Regulatory_Framework', 0.3788982927799225)","('Physical_Impacts_Of_Climate_Change', 0.07363789528608322)","('Systemic_Risk_Management', 0.07241833955049515)","('NON-ESG', 0.3788982927799225)","('NON-ESG', 0.07363789528608322)","('NON-ESG', 0.07241833955049515)"
Line 1046,"64 Getting to zero waste To meet our commitment to being zero waste by 2030, we are reducing, reusing, and diverting waste in our campuses and datacenters.","('Waste_And_Hazardous_Materials_Management', 0.9841415286064148)","('Water_And_Wastewater_Management', 0.0013679617550224066)","('Air_Quality', 0.0013539658393710852)","([], 0.9841415286064148)","('NON-ESG', 0.0013679617550224066)","('NON-ESG', 0.0013539658393710852)"
Line 1047,We are also focused on keeping our products and packaging in use longer by designing for circularity.,"('Product_Design_And_Lifecycle_Management', 0.961835503578186)","('Selling_Practices_And_Product_Labeling', 0.004490488674491644)","('Product_Quality_And_Safety', 0.003570724045857787)","([], 0.961835503578186)","('NON-ESG', 0.004490488674491644)","('NON-ESG', 0.003570724045857787)"
Line 1048,Campuses and datacenters Our operations are a considerable part of our waste footprint.,"('Waste_And_Hazardous_Materials_Management', 0.9836894869804382)","('Water_And_Wastewater_Management', 0.0015863849548622966)","('Data_Security', 0.0011645633494481444)","([], 0.9836894869804382)","('NON-ESG', 0.0015863849548622966)","('NON-ESG', 0.0011645633494481444)"
Line 1049,"Getting to zero waste requires more ambitious efforts to reduce as much waste as we can, reuse products to extend use life, and recycle or compost wherever possible, as well as thinking through everything from visitor badges to server racks with circularity in mind.","('Waste_And_Hazardous_Materials_Management', 0.9841805696487427)","('Water_And_Wastewater_Management', 0.00132015161216259)","('Data_Security', 0.0012318827211856842)","([], 0.9841805696487427)","('NON-ESG', 0.00132015161216259)","('NON-ESG', 0.0012318827211856842)"
Line 1050,"Building a circular cloud At Microsoft, we have taken a first-of-a-kind approach towards designing and implementing circularity into our cloud, aligning our end-of-life dispositioning processes with an integrated plan across the entire supply chain.","('Supply_Chain_Management', 0.9293735027313232)","('Product_Design_And_Lifecycle_Management', 0.008275263011455536)","('Energy_Management', 0.006935412995517254)","([], 0.9293735027313232)","('NON-ESG', 0.008275263011455536)","('NON-ESG', 0.006935412995517254)"
Line 1051,It starts with sustainable design and responsible sourcing of an asset.,"('Product_Design_And_Lifecycle_Management', 0.9229321479797363)","('Supply_Chain_Management', 0.010841837152838707)","('Business_Model_Resilience', 0.009752713143825531)","([], 0.9229321479797363)","('NON-ESG', 0.010841837152838707)","('NON-ESG', 0.009752713143825531)"
Line 1052,"We use our assets as long as we can effectively, then reuse what we can to extend hardware life.","('Product_Design_And_Lifecycle_Management', 0.260855108499527)","('Business_Model_Resilience', 0.21946775913238525)","('Systemic_Risk_Management', 0.0841352567076683)","('NON-ESG', 0.260855108499527)","('NON-ESG', 0.21946775913238525)","('NON-ESG', 0.0841352567076683)"
Line 1053,"After decommissioning, we move towards a diversified approach, ensuring that assets are dispositioned to optimize value, security, compliance, and sustainability.","('Business_Model_Resilience', 0.5622233152389526)","('Systemic_Risk_Management', 0.2232511192560196)","('Data_Security', 0.01869773492217064)","(['Human Capital Development', 'Innovation Management'], 0.5622233152389526)","('NON-ESG', 0.2232511192560196)","('NON-ESG', 0.01869773492217064)"
Line 1054,"Over the past year, we engaged new suppliers who are able to remanufacture assets and components, effectively enabling new lifecycles for our assets.","('Supply_Chain_Management', 0.5839619040489197)","('Product_Design_And_Lifecycle_Management', 0.26961925625801086)","('Business_Model_Resilience', 0.02368922159075737)","([], 0.5839619040489197)","('NON-ESG', 0.26961925625801086)","('NON-ESG', 0.02368922159075737)"
Line 1055,"We have successfully demonstrated takeback/ buyback models with our original asset suppliers, closing the loop on assets and enabling suppliers to repurpose or reuse assets and components, returning higher financial benefits as well as significant sustainability outcomes for carbon emissions reduction and material recovery.","('Supply_Chain_Management', 0.8560203313827515)","('GHG_Emissions', 0.01765039935708046)","('Product_Design_And_Lifecycle_Management', 0.014383921399712563)","([], 0.8560203313827515)","('NON-ESG', 0.01765039935708046)","('NON-ESG', 0.014383921399712563)"
Line 1056,We have built Circular Centers inside our large datacenter campuses to intercept and process all decommissioned assets.,"('Data_Security', 0.7613106369972229)","('Customer_Privacy', 0.04257522150874138)","('Systemic_Risk_Management', 0.02242027223110199)","(['Information Security Cybersecurity & System Availability'], 0.7613106369972229)","('NON-ESG', 0.04257522150874138)","('NON-ESG', 0.02242027223110199)"
Line 1057,"These include an intelligent disposition and routing system using Azure SQL, Power BI, and Embedded Power Apps integrated with Dynamics 365, which determines the optimal route for every component, creating a plan for every part, extending useful lifecycles well beyond the datacenter, and engaging our upstream and downstream suppliers.","('Supply_Chain_Management', 0.8405845761299133)","('Product_Design_And_Lifecycle_Management', 0.026988597586750984)","('Business_Model_Resilience', 0.02173278108239174)","([], 0.8405845761299133)","('NON-ESG', 0.026988597586750984)","('NON-ESG', 0.02173278108239174)"
Line 1058,Reusing datacenter hardware via Circular Centers.,"('Data_Security', 0.2672789394855499)","('Energy_Management', 0.17493465542793274)","('Business_Model_Resilience', 0.07607872039079666)","('NON-ESG', 0.2672789394855499)","('NON-ESG', 0.17493465542793274)","('NON-ESG', 0.07607872039079666)"
Line 1059,"The Ci r cular Centers are also a significant contributor to our sp ares program, using harvested components from decommissioned assets to repair cloud hardware.","('Data_Security', 0.30762937664985657)","('Product_Design_And_Lifecycle_Management', 0.10700403898954391)","('Supply_Chain_Management', 0.09540393203496933)","('NON-ESG', 0.30762937664985657)","('NON-ESG', 0.10700403898954391)","('NON-ESG', 0.09540393203496933)"
Line 1060,"Increasingly, such approaches are creating more value and enabling greater resilience across our supply chain.","('Supply_Chain_Management', 0.9071186780929565)","('Business_Model_Resilience', 0.019315391778945923)","('Product_Design_And_Lifecycle_Management', 0.01565002091228962)","([], 0.9071186780929565)","('NON-ESG', 0.019315391778945923)","('NON-ESG', 0.01565002091228962)"
Line 1061,"Our circular cloud will enable 90 percent reuse of datacenter hardware by 2025, significantly contributing to our goal of achieving zero waste datacenters by 2030 and goal of more than 50 percent emissions reduction by 2030.","('Energy_Management', 0.529900312423706)","('Air_Quality', 0.20517677068710327)","('GHG_Emissions', 0.11857287585735321)","(['Operational Eco-Efficiency'], 0.529900312423706)","('NON-ESG', 0.20517677068710327)","('NON-ESG', 0.11857287585735321)"
Line 1062,Reusing cloud hardware via Circular Centers A critical piece of achieving our zero waste goal is managing e-waste from our growing datacenters.,"('Waste_And_Hazardous_Materials_Management', 0.9836124777793884)","('Water_And_Wastewater_Management', 0.0015267867129296064)","('Air_Quality', 0.0013470819685608149)","([], 0.9836124777793884)","('NON-ESG', 0.0015267867129296064)","('NON-ESG', 0.0013470819685608149)"
Line 1063,"Last year, we piloted a new approach to asset reuse by building a Circular Center within our Amsterdam datacenter campus, which represents 7 percent of our server capacity globally.","('Energy_Management', 0.43135929107666016)","('Data_Security', 0.1090511828660965)","('Supply_Chain_Management', 0.0619734562933445)","('NON-ESG', 0.43135929107666016)","('NON-ESG', 0.1090511828660965)","('NON-ESG', 0.0619734562933445)"
Line 1064,"We process decommissioned cloud hardware to service strategic routes, secondary markets, and suppliers, using intelligent routing software in combination with Dynamics 365.","('Supply_Chain_Management', 0.47080332040786743)","('Business_Model_Resilience', 0.08454976975917816)","('Systemic_Risk_Management', 0.08064386248588562)","('NON-ESG', 0.47080332040786743)","('NON-ESG', 0.08454976975917816)","('NON-ESG', 0.08064386248588562)"
Line 1065,90% Our circular cloud will enable 90 percent reuse of datacenter hardware by 2025.,"('Data_Security', 0.38766634464263916)","('Energy_Management', 0.14183948934078217)","('Business_Model_Resilience', 0.07936721295118332)","('NON-ESG', 0.38766634464263916)","('NON-ESG', 0.14183948934078217)","('NON-ESG', 0.07936721295118332)"
Line 1066,"65 66 Getting to zero waste (continued) Over the past year, our Amsterdam Circular Center model has achieved 83 percent reuse and 17 percent recycling of cloud hardware.","('Waste_And_Hazardous_Materials_Management', 0.9804965853691101)","('Water_And_Wastewater_Management', 0.0019038115860894322)","('Product_Design_And_Lifecycle_Management', 0.0014877670910209417)","([], 0.9804965853691101)","('NON-ESG', 0.0019038115860894322)","('NON-ESG', 0.0014877670910209417)"
Line 1067,"Based on the success of the pilot, were exp anding to five additional campuses in the US (Boydton , Chicago, Quincy), EMEA (Dublin), and APAC (Singapore) regions, and extending this model to most of our cloud computing assets.","('Management_Of_Legal_And_Regulatory_Framework', 0.164348766207695)","('Data_Security', 0.11811176687479019)","('Systemic_Risk_Management', 0.10404753684997559)","('NON-ESG', 0.164348766207695)","('NON-ESG', 0.11811176687479019)","('NON-ESG', 0.10404753684997559)"
Line 1068,"This program should achieve 90 percent reuse by 2025 with projected savings of approximately $100 million each year, once scaled.","('Product_Design_And_Lifecycle_Management', 0.36315804719924927)","('Energy_Management', 0.28398850560188293)","('Access_And_Affordability', 0.05313458666205406)","('NON-ESG', 0.36315804719924927)","('NON-ESG', 0.28398850560188293)","('NON-ESG', 0.05313458666205406)"
Line 1069,"We also sei zed opportunities to become more resilient, build better ties with communities, and increase collaboration with upstream and downstream partners.","('Business_Model_Resilience', 0.8287469148635864)","('Human_Rights_And_Community_Relations', 0.03509347513318062)","('Physical_Impacts_Of_Climate_Change', 0.016506707295775414)","(['Human Capital Development', 'Innovation Management'], 0.8287469148635864)","('NON-ESG', 0.03509347513318062)","('NON-ESG', 0.016506707295775414)"
Line 1070,"Were bridging the skills divide in our datacenter communities by supporting technical training programs at community colleges, vocational schools, and other education institutions.","('Access_And_Affordability', 0.5463404655456543)","('Employee_Engagement_Inclusion_And_Diversity', 0.19676515460014343)","('Human_Rights_And_Community_Relations', 0.03553634136915207)","([], 0.5463404655456543)","('NON-ESG', 0.19676515460014343)","('NON-ESG', 0.03553634136915207)"
Line 1071,This work depends on decommissioned and excess datacenter equipment to facilitate the hands-on labs called Datacenter Academies in datacenter communities.,"('Energy_Management', 0.37255242466926575)","('Customer_Welfare', 0.06906547397375107)","('Supply_Chain_Management', 0.06085602939128876)","('NON-ESG', 0.37255242466926575)","('NON-ESG', 0.06906547397375107)","('NON-ESG', 0.06085602939128876)"
Line 1072,Zero waste datacenters Microsoft has a goal to achieve 90 percent diversion of datacenter operational waste by 2030.,"('Waste_And_Hazardous_Materials_Management', 0.9831122756004333)","('Water_And_Wastewater_Management', 0.0016029997495934367)","('Data_Security', 0.0014065426075831056)","([], 0.9831122756004333)","('NON-ESG', 0.0016029997495934367)","('NON-ESG', 0.0014065426075831056)"
