,Sentence,ESG BERT Topic 1,ESG BERT Topic 2,ESG BERT Topic 3,Mapped Criteria Topic 1,Mapped Criteria Topic 2,Mapped Criteria Topic 3
Line 413,"With renewable operations in 38 states as of year-end 2021, we are helping states and companies across the U.","('Management_Of_Legal_And_Regulatory_Framework', 0.5589178204536438)","('Systemic_Risk_Management', 0.06757883727550507)","('Business_Model_Resilience', 0.05170160159468651)","([], 0.5589178204536438)","('NON-ESG', 0.06757883727550507)","('NON-ESG', 0.05170160159468651)"
Line 414,"S. meet renewable portfolio standards and carbon-emissions- reduction goals through the development of zero-emissions renewable energy solutions, while lowering customer bills and creating value for NextEra Energy shareholders.","('Energy_Management', 0.8127344250679016)","('Management_Of_Legal_And_Regulatory_Framework', 0.06484823673963547)","('GHG_Emissions', 0.02794378064572811)","(['Operational Eco-Efficiency', 'Electricity Generation'], 0.8127344250679016)","('NON-ESG', 0.06484823673963547)","('NON-ESG', 0.02794378064572811)"
Line 415,With approximately 50% of U.,"('Management_Of_Legal_And_Regulatory_Framework', 0.13441820442676544)","('Competitive_Behavior', 0.10261666029691696)","('Customer_Welfare', 0.08120235055685043)","('NON-ESG', 0.13441820442676544)","('NON-ESG', 0.10261666029691696)","('NON-ESG', 0.08120235055685043)"
Line 416,"S. origination market share for wind, 15% of U.","('Competitive_Behavior', 0.44232887029647827)","('Systemic_Risk_Management', 0.1874891221523285)","('Business_Model_Resilience', 0.12136967480182648)","('NON-ESG', 0.44232887029647827)","('NON-ESG', 0.1874891221523285)","('NON-ESG', 0.12136967480182648)"
Line 417,S. origination market share for universal solar and 35% of U.,"('Competitive_Behavior', 0.6132790446281433)","('Business_Model_Resilience', 0.09536425769329071)","('Systemic_Risk_Management', 0.07589979469776154)","(['Market Opportunities'], 0.6132790446281433)","('NON-ESG', 0.09536425769329071)","('NON-ESG', 0.07589979469776154)"
Line 418,"S. universal storage origination market share in 2021, NextEra Energy Resources has been a driving force in emissions reductions across the U.","('Energy_Management', 0.3636999726295471)","('GHG_Emissions', 0.26588377356529236)","('Air_Quality', 0.15938779711723328)","('NON-ESG', 0.3636999726295471)","('NON-ESG', 0.26588377356529236)","('NON-ESG', 0.15938779711723328)"
Line 419,S. power sector for three decades.,"('Management_Of_Legal_And_Regulatory_Framework', 0.3736627697944641)","('Energy_Management', 0.1605740487575531)","('Systemic_Risk_Management', 0.07777530699968338)","('NON-ESG', 0.3736627697944641)","('NON-ESG', 0.1605740487575531)","('NON-ESG', 0.07777530699968338)"
Line 420,"* To grow the worlds largest competitive clean energy company, we are focused on leveraging our competitive advantages to capitalize on what we believe is the best renewables environment in our history.","('Competitive_Behavior', 0.9146758913993835)","('Business_Model_Resilience', 0.02183014713227749)","('Systemic_Risk_Management', 0.008551542647182941)","(['Market Opportunities'], 0.9146758913993835)","('NON-ESG', 0.02183014713227749)","('NON-ESG', 0.008551542647182941)"
Line 421,"By executing our strategy, we will lead and partner with the rest of the energy industry to continue to drive North Americas clean energy future forward.","('Energy_Management', 0.8610625267028809)","('Product_Design_And_Lifecycle_Management', 0.03369603306055069)","('Management_Of_Legal_And_Regulatory_Framework', 0.015400840900838375)","(['Operational Eco-Efficiency', 'Electricity Generation'], 0.8610625267028809)","('NON-ESG', 0.03369603306055069)","('NON-ESG', 0.015400840900838375)"
Line 422,"From 2022 through 2025, NextEra Energy Resources expects to construct approximately 28 to 37 gigawatts of long-term contracted renewables projects, representing one of the largest-ever deployments of wind, solar and battery projects over a four-year period.","('Energy_Management', 0.965444803237915)","('Management_Of_Legal_And_Regulatory_Framework', 0.007336364593356848)","('GHG_Emissions', 0.003944901283830404)","(['Operational Eco-Efficiency', 'Electricity Generation'], 0.965444803237915)","('NON-ESG', 0.007336364593356848)","('NON-ESG', 0.003944901283830404)"
Line 423,"Contents Vision and strategy: Our chairman, president and CEO NextEra Energys blueprint to reach Real Zero Confronting climate change About this report NextEra Energys ESG journey Our portfolio Building the worlds leading clean energy provider Environmental Social Governance Risks and opportunities 2021-2022 awards and recognitions Conclusion Appendices * Universal solar means utility-scale projects having at least 10 MW in nameplate generating capacity.24Environmental, Social and Governance Report 2022 Executing our strategy NextEra Energy Resources renewable energy business has been built almost entirely from the ground up, and along the way we have honed several competitive advantages.","('Physical_Impacts_Of_Climate_Change', 0.9435904622077942)","('Business_Model_Resilience', 0.011213538236916065)","('GHG_Emissions', 0.006216134876012802)","(['Climate Strategy'], 0.9435904622077942)","('NON-ESG', 0.011213538236916065)","('NON-ESG', 0.006216134876012802)"
Line 424,"Contents Vision and strategy: Our chairman, president and CEO NextEra Energys blueprint to reach Real Zero Confronting climate change About this report NextEra Energys ESG journey Our portfolio Building the worlds leading clean energy provider Environmental Social Governance Risks and opportunities 2021-2022 awards and recognitions Conclusion Appendices * Universal solar means utility-scale projects having at least 10 MW in nameplate generating capacity.24Environmental, Social and Governance Report 2022 Executing our strategy NextEra Energy Resources renewable energy business has been built almost entirely from the ground up, and along the way we have honed several competitive advantages.","('Competitive_Behavior', 0.8154001235961914)","('Business_Model_Resilience', 0.05011117458343506)","('Energy_Management', 0.017883092164993286)","(['Market Opportunities'], 0.8154001235961914)","('NON-ESG', 0.05011117458343506)","('NON-ESG', 0.017883092164993286)"
Line 425,"These start with our development skills outstanding customer relationships, regulatory and permitting knowledge, the ability to design integrated renewable products, and our history of construction execution and brand recognition.","('Product_Design_And_Lifecycle_Management', 0.926263153553009)","('Business_Model_Resilience', 0.011198670603334904)","('Product_Quality_And_Safety', 0.010531490668654442)","([], 0.926263153553009)","('NON-ESG', 0.011198670603334904)","('NON-ESG', 0.010531490668654442)"
Line 426,Another key competitive advantage is scale.,"('Competitive_Behavior', 0.9546643495559692)","('Business_Model_Resilience', 0.004880479071289301)","('Systemic_Risk_Management', 0.004466257523745298)","(['Market Opportunities'], 0.9546643495559692)","('NON-ESG', 0.004880479071289301)","('NON-ESG', 0.004466257523745298)"
Line 427,NextEra Energy Resources is among the leaders in bringing new renewable energy projects online every year.,"('Energy_Management', 0.9762662649154663)","('Management_Of_Legal_And_Regulatory_Framework', 0.0035317596048116684)","('Product_Design_And_Lifecycle_Management', 0.0016777400160208344)","(['Operational Eco-Efficiency', 'Electricity Generation'], 0.9762662649154663)","('NON-ESG', 0.0035317596048116684)","('NON-ESG', 0.0016777400160208344)"
Line 428,"Our scale allows us to leverage long-term, strategic relationships with our suppliers and lenders to realize sustained cost advantages.","('Supply_Chain_Management', 0.9003021121025085)","('Business_Model_Resilience', 0.014596338383853436)","('Product_Design_And_Lifecycle_Management', 0.0112942885607481)","([], 0.9003021121025085)","('NON-ESG', 0.014596338383853436)","('NON-ESG', 0.0112942885607481)"
Line 429,"With the largest portfolio of development sites and interconnection queue positions in the industry, we believe we are uniquely positioned to execute better than any other company in our sector even in challenging market conditions.","('Systemic_Risk_Management', 0.32009097933769226)","('Competitive_Behavior', 0.2522072196006775)","('Business_Model_Resilience', 0.23420517146587372)","('NON-ESG', 0.32009097933769226)","('NON-ESG', 0.2522072196006775)","('NON-ESG', 0.23420517146587372)"
Line 430,Our teams skill set includes a deep understanding of our data and the ability to leverage that data to improve our offerings to customers.,"('Customer_Privacy', 0.3764582872390747)","('Business_Model_Resilience', 0.14090308547019958)","('Competitive_Behavior', 0.07988891750574112)","('NON-ESG', 0.3764582872390747)","('NON-ESG', 0.14090308547019958)","('NON-ESG', 0.07988891750574112)"
Line 431,"NextEra Energy Resources collects billions of data points every day from its operating wind and solar portfolio and uses that data to make smart decisions to optimize project development, maximize revenues and reduce operational costs.","('Energy_Management', 0.6207157969474792)","('Data_Security', 0.07072225958108902)","('Management_Of_Legal_And_Regulatory_Framework', 0.04435759410262108)","(['Operational Eco-Efficiency', 'Electricity Generation'], 0.6207157969474792)","('NON-ESG', 0.07072225958108902)","('NON-ESG', 0.04435759410262108)"
Line 432,"Using advanced analytics, we developed the first-of-its-kind intelligent wind and solar site-design optimization tool.","('Energy_Management', 0.4580065608024597)","('Product_Design_And_Lifecycle_Management', 0.12275280803442001)","('Supply_Chain_Management', 0.07369627803564072)","('NON-ESG', 0.4580065608024597)","('NON-ESG', 0.12275280803442001)","('NON-ESG', 0.07369627803564072)"
Line 433,"By processing large proprietary data sets from weather and resource data, land constraints and equipment characteristics this tool evaluates thousands of potential layouts to find the optimal design that maximizes value for each site.","('Supply_Chain_Management', 0.36319610476493835)","('Business_Model_Resilience', 0.22621548175811768)","('Ecological_Impacts', 0.05476650595664978)","('NON-ESG', 0.36319610476493835)","('NON-ESG', 0.22621548175811768)","('NON-ESG', 0.05476650595664978)"
Line 434,"With digital work plans and the ability to view real-time performance of the fleet, we leverage digital tools to streamline, simplify and automate labor-intensive processes, while optimizing work planning across our portfolio.","('Labor_Practices', 0.8814194202423096)","('Employee_Health_And_Safety', 0.030796905979514122)","('Supply_Chain_Management', 0.00909265037626028)","([], 0.8814194202423096)","('NON-ESG', 0.030796905979514122)","('NON-ESG', 0.00909265037626028)"
Line 435,"These efforts have allowed NextEra Energy Resources to reduce our wind O&M costs per MWh by approximately 34% since 2016, with the expectation of another 10% reduction by 2023.","('Energy_Management', 0.9722048044204712)","('Management_Of_Legal_And_Regulatory_Framework', 0.004840299487113953)","('GHG_Emissions', 0.0028335326351225376)","(['Operational Eco-Efficiency', 'Electricity Generation'], 0.9722048044204712)","('NON-ESG', 0.004840299487113953)","('NON-ESG', 0.0028335326351225376)"
Line 436,"For solar, we aim to reduce NextEra Energy Resources O&M costs per MWh by approximately 44% from 2016 to 2023.","('Energy_Management', 0.9789871573448181)","('Management_Of_Legal_And_Regulatory_Framework', 0.0028202275279909372)","('GHG_Emissions', 0.0017017608042806387)","(['Operational Eco-Efficiency', 'Electricity Generation'], 0.9789871573448181)","('NON-ESG', 0.0028202275279909372)","('NON-ESG', 0.0017017608042806387)"
Line 437,"Wind turbines are visible as the sun shines through the clouds at sunset at the Heartland Divide Wind Energy Center in Audubon, Iowa.","('Energy_Management', 0.35196468234062195)","('Management_Of_Legal_And_Regulatory_Framework', 0.15313418209552765)","('Ecological_Impacts', 0.06486495584249496)","('NON-ESG', 0.35196468234062195)","('NON-ESG', 0.15313418209552765)","('NON-ESG', 0.06486495584249496)"
Line 438,"Contents Vision and strategy: Our chairman, president and CEO NextEra Energys blueprint to reach Real Zero Confronting climate change About this report NextEra Energys ESG journey Our portfolio Building the worlds leading clean energy provider Environmental Social Governance Risks and opportunities 2021-2022 awards and recognitions Conclusion Appendices Employee Francisco Castellanos checks on the battery energy storage facilities Blythe and McCoy Energy Centers in Blythe, Calif. 25Environmental, Social and Governance Report 2022 Renewables market potential Over the past 10 years, renewable energy has shifted from a business solely driven by compliance to one that is driven by both compliance and economics.","('Physical_Impacts_Of_Climate_Change', 0.9338892698287964)","('Business_Model_Resilience', 0.012628466822206974)","('GHG_Emissions', 0.007742442190647125)","(['Climate Strategy'], 0.9338892698287964)","('NON-ESG', 0.012628466822206974)","('NON-ESG', 0.007742442190647125)"
Line 439,"Contents Vision and strategy: Our chairman, president and CEO NextEra Energys blueprint to reach Real Zero Confronting climate change About this report NextEra Energys ESG journey Our portfolio Building the worlds leading clean energy provider Environmental Social Governance Risks and opportunities 2021-2022 awards and recognitions Conclusion Appendices Employee Francisco Castellanos checks on the battery energy storage facilities Blythe and McCoy Energy Centers in Blythe, Calif. 25Environmental, Social and Governance Report 2022 Renewables market potential Over the past 10 years, renewable energy has shifted from a business solely driven by compliance to one that is driven by both compliance and economics.","('Management_Of_Legal_And_Regulatory_Framework', 0.5419625639915466)","('Systemic_Risk_Management', 0.12791062891483307)","('Business_Model_Resilience', 0.10569906234741211)","([], 0.5419625639915466)","('NON-ESG', 0.12791062891483307)","('NON-ESG', 0.10569906234741211)"
Line 440,"Today, new renewable energy resources are cheaper than the operating costs of many older, inefficient fossil generation units.","('Energy_Management', 0.978314995765686)","('Management_Of_Legal_And_Regulatory_Framework', 0.002512542065232992)","('Product_Design_And_Lifecycle_Management', 0.0020942185074090958)","(['Operational Eco-Efficiency', 'Electricity Generation'], 0.978314995765686)","('NON-ESG', 0.002512542065232992)","('NON-ESG', 0.0020942185074090958)"
Line 441,"With continued technology improvements and cost declines, we believe that by the latter part of this decade, after U.","('Systemic_Risk_Management', 0.24377702176570892)","('Energy_Management', 0.17622755467891693)","('Supply_Chain_Management', 0.1307043880224228)","('NON-ESG', 0.24377702176570892)","('NON-ESG', 0.17622755467891693)","('NON-ESG', 0.1307043880224228)"
Line 442,"S. federal tax credits phase down, new near-firm (with battery energy storage) wind will be a $25 to $32 per MWh product and new near-firm (with battery energy storage) solar will be a $30 to $37 per MWh product, continuing to be the low-cost generation alternatives.","('Energy_Management', 0.9574819207191467)","('Product_Design_And_Lifecycle_Management', 0.009136851876974106)","('Management_Of_Legal_And_Regulatory_Framework', 0.007106778211891651)","(['Operational Eco-Efficiency', 'Electricity Generation'], 0.9574819207191467)","('NON-ESG', 0.009136851876974106)","('NON-ESG', 0.007106778211891651)"
Line 443,Market estimates now anticipate the renewable energy market to grow at roughly 15% per year through the next decade and that the wind and solar share of the nations generation mix could grow from less than 13% in 2021 to about 60% in 2035.,"('Energy_Management', 0.7456215023994446)","('Management_Of_Legal_And_Regulatory_Framework', 0.08867768943309784)","('GHG_Emissions', 0.02221381850540638)","(['Operational Eco-Efficiency', 'Electricity Generation'], 0.7456215023994446)","('NON-ESG', 0.08867768943309784)","('NON-ESG', 0.02221381850540638)"
Line 444,We have conducted a scenario analysis to model the U.,"('Physical_Impacts_Of_Climate_Change', 0.3511362075805664)","('GHG_Emissions', 0.14586076140403748)","('Business_Model_Resilience', 0.11590668559074402)","('NON-ESG', 0.3511362075805664)","('NON-ESG', 0.14586076140403748)","('NON-ESG', 0.11590668559074402)"
Line 445,S. energy grid to determine how the U.,"('Energy_Management', 0.9125759601593018)","('Management_Of_Legal_And_Regulatory_Framework', 0.02309485338628292)","('GHG_Emissions', 0.010662110522389412)","(['Operational Eco-Efficiency', 'Electricity Generation'], 0.9125759601593018)","('NON-ESG', 0.02309485338628292)","('NON-ESG', 0.010662110522389412)"
Line 446,S. electric sector can achieve a 100% carbon-free electricity grid on a long-term horizon by 2050.,"('Energy_Management', 0.9166473150253296)","('Management_Of_Legal_And_Regulatory_Framework', 0.030670037493109703)","('GHG_Emissions', 0.006907931994646788)","(['Operational Eco-Efficiency', 'Electricity Generation'], 0.9166473150253296)","('NON-ESG', 0.030670037493109703)","('NON-ESG', 0.006907931994646788)"
Line 447,"Based on our analysis, we believe there is an opportunity to build approximately 3,600 GW, or more than 100 GW per year, of renewable energy and storage through 2050.","('Energy_Management', 0.9581983685493469)","('GHG_Emissions', 0.007077368907630444)","('Management_Of_Legal_And_Regulatory_Framework', 0.006583911366760731)","(['Operational Eco-Efficiency', 'Electricity Generation'], 0.9581983685493469)","('NON-ESG', 0.007077368907630444)","('NON-ESG', 0.006583911366760731)"
Line 448,"Additionally, decarbonizing the electricity sector of the economy results in excess carbon-free energy that may be converted to green hydrogen to decarbonize other sectors of the economy.","('Energy_Management', 0.7425456643104553)","('Management_Of_Legal_And_Regulatory_Framework', 0.08895218372344971)","('Systemic_Risk_Management', 0.023035436868667603)","(['Operational Eco-Efficiency', 'Electricity Generation'], 0.7425456643104553)","('NON-ESG', 0.08895218372344971)","('NON-ESG', 0.023035436868667603)"
Line 449,This creates an estimated $4 trillion investment opportunity in renewable energy plus storage through 2050.,"('Energy_Management', 0.9260544776916504)","('Management_Of_Legal_And_Regulatory_Framework', 0.023333968594670296)","('GHG_Emissions', 0.005617283750325441)","(['Operational Eco-Efficiency', 'Electricity Generation'], 0.9260544776916504)","('NON-ESG', 0.023333968594670296)","('NON-ESG', 0.005617283750325441)"
Line 450,Positioned to decarbonize the U.,"('Competitive_Behavior', 0.3965396583080292)","('Systemic_Risk_Management', 0.1829662322998047)","('Management_Of_Legal_And_Regulatory_Framework', 0.06320910155773163)","('NON-ESG', 0.3965396583080292)","('NON-ESG', 0.1829662322998047)","('NON-ESG', 0.06320910155773163)"
Line 451,S. economy NextEra Energy Resources is key to NextEra Energys leadership in the decarbonization of the power sector and other parts of the U.,"('Systemic_Risk_Management', 0.364834189414978)","('Business_Model_Resilience', 0.10598433762788773)","('Competitive_Behavior', 0.10392361879348755)","('NON-ESG', 0.364834189414978)","('NON-ESG', 0.10598433762788773)","('NON-ESG', 0.10392361879348755)"
Line 452,S. economy.,"('Systemic_Risk_Management', 0.2669188380241394)","('Business_Model_Resilience', 0.1699354648590088)","('Competitive_Behavior', 0.06986851245164871)","('NON-ESG', 0.2669188380241394)","('NON-ESG', 0.1699354648590088)","('NON-ESG', 0.06986851245164871)"
Line 453,"With our meaningful competitive advantages, we are well positioned to capitalize on this opportunity through better development and operational and customer solutions.","('Competitive_Behavior', 0.7719061970710754)","('Business_Model_Resilience', 0.08183714747428894)","('Systemic_Risk_Management', 0.025844192132353783)","(['Market Opportunities'], 0.7719061970710754)","('NON-ESG', 0.08183714747428894)","('NON-ESG', 0.025844192132353783)"
Line 454,NextEra Energy Resources focus on leading the power sectors transition to low-cost renewables is reflected in our development expectations.,"('Energy_Management', 0.9568818211555481)","('Management_Of_Legal_And_Regulatory_Framework', 0.006170656066387892)","('Product_Design_And_Lifecycle_Management', 0.00455051613971591)","(['Operational Eco-Efficiency', 'Electricity Generation'], 0.9568818211555481)","('NON-ESG', 0.006170656066387892)","('NON-ESG', 0.00455051613971591)"
Line 455,"From 2022 through 2025, NextEra Energy Resources expects to construct approximately 28 to 37 GW of long-term contracted renewables projects, representing one of the largest-ever deployments of wind, solar and battery projects over a four-year period.","('Energy_Management', 0.9454348683357239)","('Management_Of_Legal_And_Regulatory_Framework', 0.012918168678879738)","('GHG_Emissions', 0.007773983292281628)","(['Operational Eco-Efficiency', 'Electricity Generation'], 0.9454348683357239)","('NON-ESG', 0.012918168678879738)","('NON-ESG', 0.007773983292281628)"
Line 456,"In 2021, we had a record year of success, commissioning approximately 3,800 MW of renewable energy projects during the year and adding about 7,200 net MW of renewables and storage to our backlog.","('Energy_Management', 0.9631026983261108)","('Management_Of_Legal_And_Regulatory_Framework', 0.008452657610177994)","('GHG_Emissions', 0.004097267519682646)","(['Operational Eco-Efficiency', 'Electricity Generation'], 0.9631026983261108)","('NON-ESG', 0.008452657610177994)","('NON-ESG', 0.004097267519682646)"
Line 457,"Contents Vision and strategy: Our chairman, president and CEO NextEra Energys blueprint to reach Real Zero Confronting climate change About this report NextEra Energys ESG journey Our portfolio Building the worlds leading clean energy provider Environmental Social Governance Risks and opportunities 2021-2022 awards and recognitions Conclusion Appendices NextEra Energy Resources is key to NextEra Energys leadership in the decarbonization of the power sector and other parts of the U.","('Physical_Impacts_Of_Climate_Change', 0.9410738348960876)","('Business_Model_Resilience', 0.014017853885889053)","('Systemic_Risk_Management', 0.008021823130548)","(['Climate Strategy'], 0.9410738348960876)","('NON-ESG', 0.014017853885889053)","('NON-ESG', 0.008021823130548)"
Line 458,S. economy.,"('Systemic_Risk_Management', 0.2669188380241394)","('Business_Model_Resilience', 0.1699354648590088)","('Competitive_Behavior', 0.06986851245164871)","('NON-ESG', 0.2669188380241394)","('NON-ESG', 0.1699354648590088)","('NON-ESG', 0.06986851245164871)"
Line 459,"26Environmental, Social and Governance Report 2022 Our renewables backlog, as of year-end 2021, was approximately 16,600 MW, which is roughly the size our entire renewables generation portfolio was at the end of 2017 and nearly 25% larger than our backlog at year-end 2020.","('Management_Of_Legal_And_Regulatory_Framework', 0.7779648900032043)","('Systemic_Risk_Management', 0.03569137677550316)","('GHG_Emissions', 0.03163425996899605)","([], 0.7779648900032043)","('NON-ESG', 0.03569137677550316)","('NON-ESG', 0.03163425996899605)"
Line 460,"In 2021, we added approximately 2,008 MW of new wind generating capacity and 728 MW of solar generating capacity, repowered 435 MW of wind generating capacity and increased our backlog of contracted renewable development projects.","('Energy_Management', 0.8593838214874268)","('Management_Of_Legal_And_Regulatory_Framework', 0.06482583284378052)","('GHG_Emissions', 0.011444782838225365)","(['Operational Eco-Efficiency', 'Electricity Generation'], 0.8593838214874268)","('NON-ESG', 0.06482583284378052)","('NON-ESG', 0.011444782838225365)"
Line 461,We are well on our way to meeting our current development expectations for new signed contracts.,"('Management_Of_Legal_And_Regulatory_Framework', 0.8261926174163818)","('Systemic_Risk_Management', 0.0242870282381773)","('Competitive_Behavior', 0.020740747451782227)","([], 0.8261926174163818)","('NON-ESG', 0.0242870282381773)","('NON-ESG', 0.020740747451782227)"
Line 462,"Green hydrogen presents a particularly compelling new market for NextEra Energy Resources, where we have explored a number of pilot programs.","('Energy_Management', 0.8605323433876038)","('Management_Of_Legal_And_Regulatory_Framework', 0.032561294734478)","('Supply_Chain_Management', 0.016415009275078773)","(['Operational Eco-Efficiency', 'Electricity Generation'], 0.8605323433876038)","('NON-ESG', 0.032561294734478)","('NON-ESG', 0.016415009275078773)"
Line 463,"A clean energy technology company with which we have partnered has developed proprietary processes to decarbonize industrial production of hydrogen at economic prices and recently won conditional approval for an approximately $1 billion Department of Energy loan to expand its methane pyrolysis process facilities in Nebraska that produce clean hydrogen and low-emissions carbon black, which is primarily used in manufacturing tires, plastics, inks and toners, and other products.","('Energy_Management', 0.7942636609077454)","('Product_Design_And_Lifecycle_Management', 0.08414492011070251)","('GHG_Emissions', 0.01672982983291149)","(['Operational Eco-Efficiency', 'Electricity Generation'], 0.7942636609077454)","('NON-ESG', 0.08414492011070251)","('NON-ESG', 0.01672982983291149)"
