,Sentence,ESG BERT Topic 1,ESG BERT Topic 2,ESG BERT Topic 3,Mapped Criteria Topic 1,Mapped Criteria Topic 2,Mapped Criteria Topic 3
Line 1,"ENVIRONMENTAL, SOCIAL AND GOVERNANCE REPORT2022 2CONTENTS Vision and strategy: A letter from our chairman, president and CEO .  3 NextEra Energys blueprint to reach Real Zero .  5 About this report .  8 Confronting climate change .  9 NextEra Energys environmental, social and governance journey .  14 Our portfolio .  15 Building the worlds leading clean energy provider .  17 Florida Power & Light Company NextEra Energy Resources, LLC Environment al .  27 Social .  35 Governance .  48 Risks and opportunities .  52 2021-2022 awards and recognitions .  59 Conclusion .  60 Appendix A .  61 Sustainability Accounting Standards Board Metrics Appendix B .  66 Task Force on Climate-Related Financial Disclosures Appendix C .  67 Edison Electric Institute ESG/Sustainability Quantitative Metrics Appendix D .  70 United Nations Sustainable Development Goals Metrics Appendix E .  72 Emissions Data and Third-Party Emissions Assurance Statement Forward-looking statements .  73 Cover photo: The Wheatridge Renewable Energy Facility, which went online in Lexington, Ore., in March 2022, combines wind, solar and battery energy storage technology in one location.","('Physical_Impacts_Of_Climate_Change', 0.8203596472740173)","('Business_Model_Resilience', 0.05857984721660614)","('Systemic_Risk_Management', 0.02228628098964691)","(['Climate Strategy'], 0.8203596472740173)","('NON-ESG', 0.05857984721660614)","('NON-ESG', 0.02228628098964691)"
Line 2,"ENVIRONMENTAL, SOCIAL AND GOVERNANCE REPORT2022 2CONTENTS Vision and strategy: A letter from our chairman, president and CEO .  3 NextEra Energys blueprint to reach Real Zero .  5 About this report .  8 Confronting climate change .  9 NextEra Energys environmental, social and governance journey .  14 Our portfolio .  15 Building the worlds leading clean energy provider .  17 Florida Power & Light Company NextEra Energy Resources, LLC Environment al .  27 Social .  35 Governance .  48 Risks and opportunities .  52 2021-2022 awards and recognitions .  59 Conclusion .  60 Appendix A .  61 Sustainability Accounting Standards Board Metrics Appendix B .  66 Task Force on Climate-Related Financial Disclosures Appendix C .  67 Edison Electric Institute ESG/Sustainability Quantitative Metrics Appendix D .  70 United Nations Sustainable Development Goals Metrics Appendix E .  72 Emissions Data and Third-Party Emissions Assurance Statement Forward-looking statements .  73 Cover photo: The Wheatridge Renewable Energy Facility, which went online in Lexington, Ore., in March 2022, combines wind, solar and battery energy storage technology in one location.","('GHG_Emissions', 0.6388751268386841)","('Air_Quality', 0.18347802758216858)","('Management_Of_Legal_And_Regulatory_Framework', 0.03277232125401497)","(['Operational Eco-Efficiency'], 0.6388751268386841)","('NON-ESG', 0.18347802758216858)","('NON-ESG', 0.03277232125401497)"
Line 3,"ENVIRONMENTAL, SOCIAL AND GOVERNANCE REPORT2022 2CONTENTS Vision and strategy: A letter from our chairman, president and CEO .  3 NextEra Energys blueprint to reach Real Zero .  5 About this report .  8 Confronting climate change .  9 NextEra Energys environmental, social and governance journey .  14 Our portfolio .  15 Building the worlds leading clean energy provider .  17 Florida Power & Light Company NextEra Energy Resources, LLC Environment al .  27 Social .  35 Governance .  48 Risks and opportunities .  52 2021-2022 awards and recognitions .  59 Conclusion .  60 Appendix A .  61 Sustainability Accounting Standards Board Metrics Appendix B .  66 Task Force on Climate-Related Financial Disclosures Appendix C .  67 Edison Electric Institute ESG/Sustainability Quantitative Metrics Appendix D .  70 United Nations Sustainable Development Goals Metrics Appendix E .  72 Emissions Data and Third-Party Emissions Assurance Statement Forward-looking statements .  73 Cover photo: The Wheatridge Renewable Energy Facility, which went online in Lexington, Ore., in March 2022, combines wind, solar and battery energy storage technology in one location.","('Energy_Management', 0.9731167554855347)","('Management_Of_Legal_And_Regulatory_Framework', 0.0026716378051787615)","('Product_Design_And_Lifecycle_Management', 0.002263394882902503)","(['Operational Eco-Efficiency', 'Electricity Generation'], 0.9731167554855347)","('NON-ESG', 0.0026716378051787615)","('NON-ESG', 0.002263394882902503)"
Line 4,The wind component encompasses up to 300 megawatts of wind capacity produced by approximately 120 wind turbines.,"('Energy_Management', 0.8130017518997192)","('Management_Of_Legal_And_Regulatory_Framework', 0.0639103576540947)","('GHG_Emissions', 0.01891259290277958)","(['Operational Eco-Efficiency', 'Electricity Generation'], 0.8130017518997192)","('NON-ESG', 0.0639103576540947)","('NON-ESG', 0.01891259290277958)"
Line 5,"Photo left: Catch a quick glimpse of employee Jeff Elms as he appears between the solar panels during an equipment check at the Blythe and McCoy Energy Centers in Blythe, Calif.","('Energy_Management', 0.870429277420044)","('Product_Design_And_Lifecycle_Management', 0.01902593858540058)","('Management_Of_Legal_And_Regulatory_Framework', 0.014907167293131351)","(['Operational Eco-Efficiency', 'Electricity Generation'], 0.870429277420044)","('NON-ESG', 0.01902593858540058)","('NON-ESG', 0.014907167293131351)"
Line 6,"Environmental, Social and Governance Report 2022 Vision and strategy: A letter from our chairman, PRESIDENT AND CEO To all our stakeholders: It is the honor of my professional life to lead the best team in our industry at NextEra Energy.","('Human_Rights_And_Community_Relations', 0.6417593359947205)","('Management_Of_Legal_And_Regulatory_Framework', 0.07211370021104813)","('Business_Model_Resilience', 0.059889525175094604)","(['Stakeholder Engagement'], 0.6417593359947205)","('NON-ESG', 0.07211370021104813)","('NON-ESG', 0.059889525175094604)"
Line 7,Our team has a clear vision: We will help lead the decarbonization of the U.,"('Business_Model_Resilience', 0.2488093376159668)","('Management_Of_Legal_And_Regulatory_Framework', 0.2220078557729721)","('Systemic_Risk_Management', 0.15403027832508087)","('NON-ESG', 0.2488093376159668)","('NON-ESG', 0.2220078557729721)","('NON-ESG', 0.15403027832508087)"
Line 8,S. economy.,"('Systemic_Risk_Management', 0.2669188380241394)","('Business_Model_Resilience', 0.1699354648590088)","('Competitive_Behavior', 0.06986851245164871)","('NON-ESG', 0.2669188380241394)","('NON-ESG', 0.1699354648590088)","('NON-ESG', 0.06986851245164871)"
Line 9,This vision is bold even unprecedented.,"('Business_Model_Resilience', 0.21556036174297333)","('Management_Of_Legal_And_Regulatory_Framework', 0.07802505046129227)","('Competitive_Behavior', 0.06571820378303528)","('NON-ESG', 0.21556036174297333)","('NON-ESG', 0.07802505046129227)","('NON-ESG', 0.06571820378303528)"
Line 10,"Yet, its consistent with our decades-long record of performance for all our stakeholders, including our accomplishments and goals related to environmental, social and governance (ESG) that we share with you in this report.","('Human_Rights_And_Community_Relations', 0.7159930467605591)","('Business_Model_Resilience', 0.05658941715955734)","('Ecological_Impacts', 0.03663521260023117)","(['Stakeholder Engagement'], 0.7159930467605591)","('NON-ESG', 0.05658941715955734)","('NON-ESG', 0.03663521260023117)"
Line 11,"I joined this company nearly 20 years ago, and right away was given the opportunity to work on a game-changing step we took at that time to move forward to a clean energy future.","('Energy_Management', 0.5300350189208984)","('Product_Design_And_Lifecycle_Management', 0.10486006736755371)","('Business_Model_Resilience', 0.06824221462011337)","(['Operational Eco-Efficiency', 'Electricity Generation'], 0.5300350189208984)","('NON-ESG', 0.10486006736755371)","('NON-ESG', 0.06824221462011337)"
Line 12,"That transaction was the conversion of a gas turbine contract with General Electric, still one of our largest suppliers today, to a contract for wind turbines.","('Energy_Management', 0.3005216121673584)","('Management_Of_Legal_And_Regulatory_Framework', 0.18687143921852112)","('Supply_Chain_Management', 0.1557457447052002)","('NON-ESG', 0.3005216121673584)","('NON-ESG', 0.18687143921852112)","('NON-ESG', 0.1557457447052002)"
Line 13,"We made that decision because we saw something others didnt see, that renewables would soon become the low-cost generation source of choice.","('Energy_Management', 0.9191362261772156)","('Product_Design_And_Lifecycle_Management', 0.014632195234298706)","('Supply_Chain_Management', 0.010578577406704426)","(['Operational Eco-Efficiency', 'Electricity Generation'], 0.9191362261772156)","('NON-ESG', 0.014632195234298706)","('NON-ESG', 0.010578577406704426)"
Line 14,Our first-mover advantage in wind at what is now NextEra Energy Resources was soon expanded to solar.,"('Energy_Management', 0.9672020077705383)","('Management_Of_Legal_And_Regulatory_Framework', 0.006450707092881203)","('GHG_Emissions', 0.0025185449048876762)","(['Operational Eco-Efficiency', 'Electricity Generation'], 0.9672020077705383)","('NON-ESG', 0.006450707092881203)","('NON-ESG', 0.0025185449048876762)"
Line 15,"We started first with solar-thermal technology, but then photovoltaic technology came along and was a game-changer for us and for our entire economy, and our solar business began to take off.","('Energy_Management', 0.7628029584884644)","('Product_Design_And_Lifecycle_Management', 0.06660249829292297)","('Data_Security', 0.02033218927681446)","(['Operational Eco-Efficiency', 'Electricity Generation'], 0.7628029584884644)","('NON-ESG', 0.06660249829292297)","('NON-ESG', 0.02033218927681446)"
Line 16,"Over the years, NextEra Energy Resources became the largest generator of wind and solar energy in the world.","('Energy_Management', 0.9751474261283875)","('Management_Of_Legal_And_Regulatory_Framework', 0.0038420450873672962)","('Water_And_Wastewater_Management', 0.0020135012455284595)","(['Operational Eco-Efficiency', 'Electricity Generation'], 0.9751474261283875)","('NON-ESG', 0.0038420450873672962)","('NON-ESG', 0.0020135012455284595)"
Line 17,"Over this same period, Florida Power & Light Company (FPL) led its own transformation.","('Energy_Management', 0.615993320941925)","('Supply_Chain_Management', 0.05100012198090553)","('Product_Design_And_Lifecycle_Management', 0.040997229516506195)","(['Operational Eco-Efficiency', 'Electricity Generation'], 0.615993320941925)","('NON-ESG', 0.05100012198090553)","('NON-ESG', 0.040997229516506195)"
Line 18,FPL was already one of the best utilities in the nation.,"('Management_Of_Legal_And_Regulatory_Framework', 0.3069387674331665)","('Systemic_Risk_Management', 0.19825074076652527)","('Competitive_Behavior', 0.11676018685102463)","('NON-ESG', 0.3069387674331665)","('NON-ESG', 0.19825074076652527)","('NON-ESG', 0.11676018685102463)"
Line 19,"But the FPL team was not satisfied 20 years ago, and still is not satisfied today, and we have chosen to be a first mover in the utility space time and time again.","('Competitive_Behavior', 0.6805122494697571)","('Business_Model_Resilience', 0.06072833016514778)","('Systemic_Risk_Management', 0.05334913358092308)","(['Market Opportunities'], 0.6805122494697571)","('NON-ESG', 0.06072833016514778)","('NON-ESG', 0.05334913358092308)"
Line 20,FPL voluntarily reduced our reliance on foreign oil by 99% starting in 2001.,"('Management_Of_Legal_And_Regulatory_Framework', 0.5585126876831055)","('Competitive_Behavior', 0.14442229270935059)","('Systemic_Risk_Management', 0.10484561324119568)","([], 0.5585126876831055)","('NON-ESG', 0.14442229270935059)","('NON-ESG', 0.10484561324119568)"
Line 21,We were also one of the very first utilities to fully deploy smart meters across our service area and to launch a comprehensive storm hardening program to help us restore power faster after major storms and to help us improve everyday reliability.,"('Physical_Impacts_Of_Climate_Change', 0.8137206435203552)","('Critical_Incident_Risk_Management', 0.07112982124090195)","('Business_Model_Resilience', 0.021868908777832985)","(['Climate Strategy'], 0.8137206435203552)","('NON-ESG', 0.07112982124090195)","('NON-ESG', 0.021868908777832985)"
Line 22,And FPL was also the first utility to really go after renewables as a way to reduce customer bills relative to alternatives.,"('Energy_Management', 0.7489656805992126)","('Management_Of_Legal_And_Regulatory_Framework', 0.12572753429412842)","('Air_Quality', 0.016949981451034546)","(['Operational Eco-Efficiency', 'Electricity Generation'], 0.7489656805992126)","('NON-ESG', 0.12572753429412842)","('NON-ESG', 0.016949981451034546)"
Line 23,"3 We plan to decarbonize ourselves, starting at FPL, with the most ambitious goal set by any U.","('Management_Of_Legal_And_Regulatory_Framework', 0.3146449625492096)","('Competitive_Behavior', 0.1527617871761322)","('Business_Model_Resilience', 0.09364092350006104)","('NON-ESG', 0.3146449625492096)","('NON-ESG', 0.1527617871761322)","('NON-ESG', 0.09364092350006104)"
Line 24,"S. utility or power provider to date, and the sectors only one to not require carbon offsets.","('Management_Of_Legal_And_Regulatory_Framework', 0.8799160122871399)","('Energy_Management', 0.032912127673625946)","('Systemic_Risk_Management', 0.011793198063969612)","([], 0.8799160122871399)","('NON-ESG', 0.032912127673625946)","('NON-ESG', 0.011793198063969612)"
Line 25,"Our goal is to achieve Real Zero by no later than 2045 zero carbon emissions, 100% clean energy, at no incremental cost to our customers.","('Energy_Management', 0.9041637778282166)","('GHG_Emissions', 0.030987808480858803)","('Air_Quality', 0.015619701705873013)","(['Operational Eco-Efficiency', 'Electricity Generation'], 0.9041637778282166)","('NON-ESG', 0.030987808480858803)","('NON-ESG', 0.015619701705873013)"
Line 26,"John Ketchum NextEra Energys chairman, president and CEO.","('Business_Model_Resilience', 0.2881910800933838)","('Director_Removal', 0.259581983089447)","('Product_Design_And_Lifecycle_Management', 0.04922648146748543)","('NON-ESG', 0.2881910800933838)","('NON-ESG', 0.259581983089447)","('NON-ESG', 0.04922648146748543)"
Line 27,"Contents Environmental, Social and Governance Report 2022 Vision and strategy: Our chairman, president and CEO NextEra Energys blueprint to reach Real Zero Confronting climate change About this report NextEra Energys ESG journey Our portfolio Building the worlds leading clean energy provider Environmental Social Governance Risks and opportunities 2021-2022 awards and recognitions Conclusion Appendices Both FPL and NextEra Energy Resources continue to be industry leaders.","('Physical_Impacts_Of_Climate_Change', 0.9496325850486755)","('Business_Model_Resilience', 0.011926302686333656)","('Systemic_Risk_Management', 0.004923589993268251)","(['Climate Strategy'], 0.9496325850486755)","('NON-ESG', 0.011926302686333656)","('NON-ESG', 0.004923589993268251)"
Line 28,"Several years ago, both businesses invested in battery storage, which is the holy grail of renewables because it can help make wind and solar energy a nearly firm energy product.","('Energy_Management', 0.9728982448577881)","('Management_Of_Legal_And_Regulatory_Framework', 0.003568116808310151)","('Product_Design_And_Lifecycle_Management', 0.003053312422707677)","(['Operational Eco-Efficiency', 'Electricity Generation'], 0.9728982448577881)","('NON-ESG', 0.003568116808310151)","('NON-ESG', 0.003053312422707677)"
Line 29,"Today, our vision is focused on deploying even more renewables and storage, which in the future we expect to be supplemented by green hydrogen as a way to convert gas turbines to generate emissions-free baseload generation.","('GHG_Emissions', 0.4462937116622925)","('Energy_Management', 0.37003371119499207)","('Air_Quality', 0.05136997625231743)","('NON-ESG', 0.4462937116622925)","('NON-ESG', 0.37003371119499207)","('NON-ESG', 0.05136997625231743)"
Line 30,"We have built both FPL and NextEra Energy Resources through a series of toe-in-the-water investments that over time have added up to something big, a scalable platform, built from the ground up, and centered on the best opportunity set and team in the industry.","('Systemic_Risk_Management', 0.18532013893127441)","('Business_Model_Resilience', 0.17211298644542694)","('Supply_Chain_Management', 0.1655559539794922)","('NON-ESG', 0.18532013893127441)","('NON-ESG', 0.17211298644542694)","('NON-ESG', 0.1655559539794922)"
Line 31,Our vision to help decarbonize the U.,"('Business_Model_Resilience', 0.24375225603580475)","('Competitive_Behavior', 0.1337239146232605)","('Systemic_Risk_Management', 0.10542255640029907)","('NON-ESG', 0.24375225603580475)","('NON-ESG', 0.1337239146232605)","('NON-ESG', 0.10542255640029907)"
Line 32,S. economy is based upon that scalable platform and everything else that has made our company successful over at least the last 20 years.,"('Business_Model_Resilience', 0.2987922132015228)","('Systemic_Risk_Management', 0.16144441068172455)","('Competitive_Behavior', 0.14703291654586792)","('NON-ESG', 0.2987922132015228)","('NON-ESG', 0.16144441068172455)","('NON-ESG', 0.14703291654586792)"
Line 33,"We plan to achieve our vision in four ways, simultaneously: We plan to decarbonize ourselves, starting at FPL, and starting with the most ambitious goal set by any U.","('Business_Model_Resilience', 0.2995761036872864)","('Management_Of_Legal_And_Regulatory_Framework', 0.1417163908481598)","('Systemic_Risk_Management', 0.09949328750371933)","('NON-ESG', 0.2995761036872864)","('NON-ESG', 0.1417163908481598)","('NON-ESG', 0.09949328750371933)"
Line 34,"S. utility or power provider to date, and the sectors only one to not require carbon offsets.","('Management_Of_Legal_And_Regulatory_Framework', 0.8799160122871399)","('Energy_Management', 0.032912127673625946)","('Systemic_Risk_Management', 0.011793198063969612)","([], 0.8799160122871399)","('NON-ESG', 0.032912127673625946)","('NON-ESG', 0.011793198063969612)"
Line 35,"Our goal is to achieve Real Zero, meaning we will be carbon emissions free by no later than 2045.","('GHG_Emissions', 0.8306223750114441)","('Air_Quality', 0.07092615216970444)","('Energy_Management', 0.02043534442782402)","(['Operational Eco-Efficiency'], 0.8306223750114441)","('NON-ESG', 0.07092615216970444)","('NON-ESG', 0.02043534442782402)"
Line 36,"Described in our Zero Carbon Blueprint, Real Zero means exactly that: zero carbon emissions, 100% clean energy, at no incremental cost to our customers.","('Energy_Management', 0.5335161089897156)","('GHG_Emissions', 0.2865172028541565)","('Air_Quality', 0.052445948123931885)","(['Operational Eco-Efficiency', 'Electricity Generation'], 0.5335161089897156)","('NON-ESG', 0.2865172028541565)","('NON-ESG', 0.052445948123931885)"
Line 37,We plan to partner with our peer companies to help decarbonize the rest of the U.,"('Systemic_Risk_Management', 0.31160545349121094)","('Competitive_Behavior', 0.24460355937480927)","('Business_Model_Resilience', 0.10456988215446472)","('NON-ESG', 0.31160545349121094)","('NON-ESG', 0.24460355937480927)","('NON-ESG', 0.10456988215446472)"
Line 38,"S. power sector, continuing the work that NextEra Energy Resources has done with investor-owned utilities, municipalities and cooperatives over the last 20 years.","('Energy_Management', 0.9528759121894836)","('Management_Of_Legal_And_Regulatory_Framework', 0.01344206091016531)","('Water_And_Wastewater_Management', 0.003635911038145423)","(['Operational Eco-Efficiency', 'Electricity Generation'], 0.9528759121894836)","('NON-ESG', 0.01344206091016531)","('NON-ESG', 0.003635911038145423)"
Line 39,"We believe that, as we work toward our own Real Zero goal, we will further develop the capabilities that can help other power companies meet their own goals.","('Business_Model_Resilience', 0.4907222390174866)","('Product_Design_And_Lifecycle_Management', 0.06048242747783661)","('Competitive_Behavior', 0.05777595192193985)","('NON-ESG', 0.4907222390174866)","('NON-ESG', 0.06048242747783661)","('NON-ESG', 0.05777595192193985)"
Line 40,We plan to partner with companies outside the power sector to help lead the decarbonization of the rest of the U.,"('Systemic_Risk_Management', 0.5688682198524475)","('Business_Model_Resilience', 0.1124887615442276)","('Competitive_Behavior', 0.06493231654167175)","(['Risk & Crisis Management'], 0.5688682198524475)","('NON-ESG', 0.1124887615442276)","('NON-ESG', 0.06493231654167175)"
Line 41,S. economy.,"('Systemic_Risk_Management', 0.2669188380241394)","('Business_Model_Resilience', 0.1699354648590088)","('Competitive_Behavior', 0.06986851245164871)","('NON-ESG', 0.2669188380241394)","('NON-ESG', 0.1699354648590088)","('NON-ESG', 0.06986851245164871)"
Line 42,We aim to become the preferred U.,"('Product_Design_And_Lifecycle_Management', 0.19435399770736694)","('Customer_Welfare', 0.15631318092346191)","('Competitive_Behavior', 0.14477120339870453)","('NON-ESG', 0.19435399770736694)","('NON-ESG', 0.15631318092346191)","('NON-ESG', 0.14477120339870453)"
Line 43,"S. partner for renewable energy infrastructure solutions of Fortune 1000 customers that are trying to achieve their own sustainability goals, especially in sectors with high electric use or high emissions.","('Energy_Management', 0.9515750408172607)","('Management_Of_Legal_And_Regulatory_Framework', 0.007434594910591841)","('Product_Design_And_Lifecycle_Management', 0.005364521406590939)","(['Operational Eco-Efficiency', 'Electricity Generation'], 0.9515750408172607)","('NON-ESG', 0.007434594910591841)","('NON-ESG', 0.005364521406590939)"
Line 44,We plan to continue to build the nations leading competitive transmission business to help provide the backbone for the significant renewables expansion that we believe is coming.,"('Competitive_Behavior', 0.5297285318374634)","('Business_Model_Resilience', 0.20670215785503387)","('Systemic_Risk_Management', 0.05270453169941902)","(['Market Opportunities'], 0.5297285318374634)","('NON-ESG', 0.20670215785503387)","('NON-ESG', 0.05270453169941902)"
Line 45,"Many other elements of our ESG strategy are discussed throughout this report, such as the measurable progress we have made on racial equity at our company, especially over the last two years.","('Business_Model_Resilience', 0.5545282959938049)","('Systemic_Risk_Management', 0.16669711470603943)","('Employee_Engagement_Inclusion_And_Diversity', 0.03285378962755203)","([], 0.5545282959938049)","('NON-ESG', 0.16669711470603943)","('NON-ESG', 0.03285378962755203)"
Line 46,"We have also committed to additional disclosures on various metrics related to diversity, equity and inclusion.","('Employee_Engagement_Inclusion_And_Diversity', 0.97409588098526)","('Human_Rights_And_Community_Relations', 0.0023361784406006336)","('Employee_Health_And_Safety', 0.0017963926075026393)","(['Talent Attraction & Retention'], 0.97409588098526)","('NON-ESG', 0.0023361784406006336)","('NON-ESG', 0.0017963926075026393)"
Line 47,I am proud of our teams efforts and am honored to have joined a board of directors that has such a strong commitment to corporate governance and ethics and which provides oversight of every facet of NextEra Energys strategy that is reflected in this document.,"('Business_Ethics', 0.9063429236412048)","('Director_Removal', 0.018975991755723953)","('Management_Of_Legal_And_Regulatory_Framework', 0.00820819940418005)","(['Business Ethics'], 0.9063429236412048)","('NON-ESG', 0.018975991755723953)","('NON-ESG', 0.00820819940418005)"
Line 48,Our company has made many ambitious goals.,"('Business_Model_Resilience', 0.2584042251110077)","('Business_Ethics', 0.13066238164901733)","('Employee_Engagement_Inclusion_And_Diversity', 0.05944886803627014)","('NON-ESG', 0.2584042251110077)","('NON-ESG', 0.13066238164901733)","('NON-ESG', 0.05944886803627014)"
Line 49,"Some, such as reliable and affordable electric service, date from the founding of our company nearly a century ago.","('Energy_Management', 0.8360808491706848)","('Access_And_Affordability', 0.02189897932112217)","('Critical_Incident_Risk_Management', 0.021346956491470337)","(['Operational Eco-Efficiency', 'Electricity Generation'], 0.8360808491706848)","('NON-ESG', 0.02189897932112217)","('NON-ESG', 0.021346956491470337)"
Line 50,"Others, such as our new Real Zero goal, keep us focused on what we can achieve in the decades ahead.","('Business_Model_Resilience', 0.526904284954071)","('Ecological_Impacts', 0.04783071577548981)","('Competitive_Behavior', 0.04512584209442139)","([], 0.526904284954071)","('NON-ESG', 0.04783071577548981)","('NON-ESG', 0.04512584209442139)"
Line 51,Reaching each of our goals is the imperative of the most talented team in our industry.,"('Employee_Engagement_Inclusion_And_Diversity', 0.5164585709571838)","('Human_Rights_And_Community_Relations', 0.07391263544559479)","('Business_Model_Resilience', 0.060526371002197266)","(['Talent Attraction & Retention'], 0.5164585709571838)","('NON-ESG', 0.07391263544559479)","('NON-ESG', 0.060526371002197266)"
Line 52,"Over the last 20 years, and especially over the last six months, I have become even more grateful for all my colleagues who come to work every day focused on delivering even more value to our customers and who challenge themselves to make our company even better.","('Product_Design_And_Lifecycle_Management', 0.36742088198661804)","('Business_Model_Resilience', 0.24173098802566528)","('Director_Removal', 0.03382508084177971)","('NON-ESG', 0.36742088198661804)","('NON-ESG', 0.24173098802566528)","('NON-ESG', 0.03382508084177971)"
