,Sentence,ESG BERT Topic 1,ESG BERT Topic 2,ESG BERT Topic 3,Mapped Criteria Topic 1,Mapped Criteria Topic 2,Mapped Criteria Topic 3
Line 843,"To ensure safe and accessible laboratories, NextEra Energy supports development of solar research fields.","('Access_And_Affordability', 0.34992516040802)","('Employee_Health_And_Safety', 0.22136196494102478)","('Product_Quality_And_Safety', 0.052561547607183456)","('NON-ESG', 0.34992516040802)","('NON-ESG', 0.22136196494102478)","('NON-ESG', 0.052561547607183456)"
Line 844,"The facilities are collaborative with universities, community colleges and area school districts.","('Access_And_Affordability', 0.7140011787414551)","('Management_Of_Legal_And_Regulatory_Framework', 0.029595715925097466)","('Ecological_Impacts', 0.029494287446141243)","([], 0.7140011787414551)","('NON-ESG', 0.029595715925097466)","('NON-ESG', 0.029494287446141243)"
Line 845,"As part of comprehensive training programs, students, with mentoring from NextEra Energy experts, install the PV panels.","('Energy_Management', 0.9636033773422241)","('Management_Of_Legal_And_Regulatory_Framework', 0.006021926645189524)","('Product_Design_And_Lifecycle_Management', 0.004119387827813625)","(['Operational Eco-Efficiency', 'Electricity Generation'], 0.9636033773422241)","('NON-ESG', 0.006021926645189524)","('NON-ESG', 0.004119387827813625)"
Line 846,"The solar energy labs advance training and research in electrical engineering, mechanical engineering, civil engineering, environmental science, agricultural science, computer science, networking/cybersecurity, artificial intelligence, meteorological studies, supervisory controls and data acquisition, cybersecurity, photovoltaic panel installation and numerous other craft/technical disciplines.","('Data_Security', 0.3440602123737335)","('Employee_Engagement_Inclusion_And_Diversity', 0.09037533402442932)","('Business_Model_Resilience', 0.07654145359992981)","('NON-ESG', 0.3440602123737335)","('NON-ESG', 0.09037533402442932)","('NON-ESG', 0.07654145359992981)"
Line 847,"On of our collaborations is with the University of Arizona and Dine College, the oldest tribal college & university in the country, NextEra Energy is supporting the development of a solar training and research lab.","('Access_And_Affordability', 0.36458006501197815)","('Employee_Engagement_Inclusion_And_Diversity', 0.1819726526737213)","('Management_Of_Legal_And_Regulatory_Framework', 0.07839759439229965)","('NON-ESG', 0.36458006501197815)","('NON-ESG', 0.1819726526737213)","('NON-ESG', 0.07839759439229965)"
Line 848,"At the University of Nevada, Reno, students in 2021 received a firsthand look at what it takes to operate their own solar energy center.","('Energy_Management', 0.9665588736534119)","('Management_Of_Legal_And_Regulatory_Framework', 0.005540410988032818)","('Product_Design_And_Lifecycle_Management', 0.003450640244409442)","(['Operational Eco-Efficiency', 'Electricity Generation'], 0.9665588736534119)","('NON-ESG', 0.005540410988032818)","('NON-ESG', 0.003450640244409442)"
Line 849,"In addition, we awarded a $75,000 grant to the universitys Nevada Institute for Sustainability to teach the next generation of renewables engineers.","('Energy_Management', 0.18059998750686646)","('Management_Of_Legal_And_Regulatory_Framework', 0.152774840593338)","('Product_Design_And_Lifecycle_Management', 0.09338889271020889)","('NON-ESG', 0.18059998750686646)","('NON-ESG', 0.152774840593338)","('NON-ESG', 0.09338889271020889)"
Line 850,"Thanks to the donation, the university now offers a minor in sustainability, online graduate certificate programs for working professionals, and new programs for current and future students who are interested in becoming part of the growing renewable industry.","('Employee_Engagement_Inclusion_And_Diversity', 0.30572667717933655)","('Access_And_Affordability', 0.12025831639766693)","('Product_Design_And_Lifecycle_Management', 0.07909885048866272)","('NON-ESG', 0.30572667717933655)","('NON-ESG', 0.12025831639766693)","('NON-ESG', 0.07909885048866272)"
Line 851,Affordable energy Providing affordable electricity for customers is critical to supporting local economies.,"('Energy_Management', 0.9658070802688599)","('Management_Of_Legal_And_Regulatory_Framework', 0.008243218995630741)","('Product_Design_And_Lifecycle_Management', 0.0030307124834507704)","(['Operational Eco-Efficiency', 'Electricity Generation'], 0.9658070802688599)","('NON-ESG', 0.008243218995630741)","('NON-ESG', 0.0030307124834507704)"
Line 852,The typical FPL residential customer bill is significantly below the national average and among the lowest in Florida.,"('Energy_Management', 0.2326696664094925)","('Air_Quality', 0.09319745749235153)","('Critical_Incident_Risk_Management', 0.09317845106124878)","('NON-ESG', 0.2326696664094925)","('NON-ESG', 0.09319745749235153)","('NON-ESG', 0.09317845106124878)"
Line 853,"* For many years, we have worked closely with our customers experiencing hardship regarding any issues about their service or paying their bill, offering several programs designed to support customers.","('Management_Of_Legal_And_Regulatory_Framework', 0.16703814268112183)","('Customer_Privacy', 0.12888552248477936)","('Competitive_Behavior', 0.09771555662155151)","('NON-ESG', 0.16703814268112183)","('NON-ESG', 0.12888552248477936)","('NON-ESG', 0.09771555662155151)"
Line 854,"FPLs Care to Share program has provided payment support to customers in time of crisis, raising about $26 million since 1994 to help nearly 100,000 Florida families in need pay their electric bills.","('Energy_Management', 0.41577988862991333)","('Management_Of_Legal_And_Regulatory_Framework', 0.1832527071237564)","('Access_And_Affordability', 0.16128972172737122)","('NON-ESG', 0.41577988862991333)","('NON-ESG', 0.1832527071237564)","('NON-ESG', 0.16128972172737122)"
Line 855,"For decades, FPL has worked with hundreds of agencies to facilitate payment assistance for qualified customers.","('Management_Of_Legal_And_Regulatory_Framework', 0.8188682198524475)","('Business_Ethics', 0.036891527473926544)","('Competitive_Behavior', 0.02205154299736023)","([], 0.8188682198524475)","('NON-ESG', 0.036891527473926544)","('NON-ESG', 0.02205154299736023)"
Line 856,"In Northwest Florida, we support our neighbors in need of assistance with their energy bills through Project SHARE, which is administered by the Salvation Army.","('Energy_Management', 0.9072439670562744)","('Access_And_Affordability', 0.019777735695242882)","('Management_Of_Legal_And_Regulatory_Framework', 0.014447021298110485)","(['Operational Eco-Efficiency', 'Electricity Generation'], 0.9072439670562744)","('NON-ESG', 0.019777735695242882)","('NON-ESG', 0.014447021298110485)"
Line 857,FPL also has developed programs and tools designed to educate our customers about energy efficiency and help them reduce electricity use.,"('Energy_Management', 0.9806475043296814)","('Management_Of_Legal_And_Regulatory_Framework', 0.0023936487268656492)","('Product_Design_And_Lifecycle_Management', 0.0017976787639781833)","(['Operational Eco-Efficiency', 'Electricity Generation'], 0.9806475043296814)","('NON-ESG', 0.0023936487268656492)","('NON-ESG', 0.0017976787639781833)"
Line 858,"Programs like our FPL Energy Analyzer on our mobile app and the FPL Business Energy Manager empower customers and enable them to analyze, track and better understand their energy usage, in addition to providing customers a personalized plan with energy-saving tips and recommendations, including programs and rebates that may be available.","('Energy_Management', 0.9810240268707275)","('Air_Quality', 0.0020630843937397003)","('Water_And_Wastewater_Management', 0.0015030506765469909)","(['Operational Eco-Efficiency', 'Electricity Generation'], 0.9810240268707275)","('NON-ESG', 0.0020630843937397003)","('NON-ESG', 0.0015030506765469909)"
Line 859,"FPL also partners with scout troops for badge work, workshops and virtual programming in support of STEM, including the NextEra Energy Renewable Energy Patch and the FPL Florida Solar Patch.","('Access_And_Affordability', 0.3292050063610077)","('Management_Of_Legal_And_Regulatory_Framework', 0.19511286914348602)","('Energy_Management', 0.08940320461988449)","('NON-ESG', 0.3292050063610077)","('NON-ESG', 0.19511286914348602)","('NON-ESG', 0.08940320461988449)"
Line 860,We partner with Girl Scouts by funding a STEM program manager and providing STEM scholarships.,"('Employee_Engagement_Inclusion_And_Diversity', 0.4575973153114319)","('Access_And_Affordability', 0.2659192681312561)","('Human_Rights_And_Community_Relations', 0.02595348283648491)","('NON-ESG', 0.4575973153114319)","('NON-ESG', 0.2659192681312561)","('NON-ESG', 0.02595348283648491)"
Line 861,"Through the Urban League, FPL sponsors a STEM progression program that begins in eighth grade and guides youth through their high school years.","('Access_And_Affordability', 0.794369637966156)","('Employee_Engagement_Inclusion_And_Diversity', 0.06475671380758286)","('Customer_Welfare', 0.012113573029637337)","([], 0.794369637966156)","('NON-ESG', 0.06475671380758286)","('NON-ESG', 0.012113573029637337)"
Line 862,Our partnership with the Student ACES program gives students a chance to work in the growing solar industry field and receive mentorship to help them begin a promising career.,"('Employee_Engagement_Inclusion_And_Diversity', 0.6819978356361389)","('Access_And_Affordability', 0.05474856123328209)","('Employee_Health_And_Safety', 0.028577305376529694)","(['Talent Attraction & Retention'], 0.6819978356361389)","('NON-ESG', 0.05474856123328209)","('NON-ESG', 0.028577305376529694)"
Line 863,"We believe supporting education is the key to a brighter future and it is a cornerstone of our commitment to our customers, our employees and our children in the communities we serve.","('Access_And_Affordability', 0.857475757598877)","('Human_Rights_And_Community_Relations', 0.02199283055961132)","('Employee_Engagement_Inclusion_And_Diversity', 0.015260267071425915)","([], 0.857475757598877)","('NON-ESG', 0.02199283055961132)","('NON-ESG', 0.015260267071425915)"
Line 864,We strive to help develop our next generation of leaders and create opportunities for all students so they can dream of a brighter future and achieve it.,"('Employee_Engagement_Inclusion_And_Diversity', 0.6094527840614319)","('Access_And_Affordability', 0.0609482116997242)","('Human_Rights_And_Community_Relations', 0.05482914671301842)","(['Talent Attraction & Retention'], 0.6094527840614319)","('NON-ESG', 0.0609482116997242)","('NON-ESG', 0.05482914671301842)"
Line 865,"NextEra Energy also works with universities, community colleges and school districts both in and outside of Florida.","('Access_And_Affordability', 0.5025614500045776)","('Management_Of_Legal_And_Regulatory_Framework', 0.15582048892974854)","('Ecological_Impacts', 0.04182260483503342)","([], 0.5025614500045776)","('NON-ESG', 0.15582048892974854)","('NON-ESG', 0.04182260483503342)"
Line 866,"Some of NextEra Energy academic partners are researching which vegetation, including pollinators, are optimal within and outside the controlled, fenced area of a solar facility.","('Ecological_Impacts', 0.467281311750412)","('GHG_Emissions', 0.1341649293899536)","('Energy_Management', 0.05982683598995209)","('NON-ESG', 0.467281311750412)","('NON-ESG', 0.1341649293899536)","('NON-ESG', 0.05982683598995209)"
Line 867,Agrivoltaic/Solar Energy Research & Training Centers offer multidisciplinary approach to advancing coexistence of agriculture and renewable energy.,"('Energy_Management', 0.9388720989227295)","('Management_Of_Legal_And_Regulatory_Framework', 0.009026589803397655)","('Supply_Chain_Management', 0.005604951176792383)","(['Operational Eco-Efficiency', 'Electricity Generation'], 0.9388720989227295)","('NON-ESG', 0.009026589803397655)","('NON-ESG', 0.005604951176792383)"
Line 868,"Disciplines include but are not limited to, engineering, agricultural science, entomology, horticulture, renewable energy, FPL Chairman, President and CEO Eric Silagy chats with Girl Scout entrepreneurs about cookies and more during the commissioning of the Cotton Creek Solar Energy Center in Escambia County in Northwest Florida.","('Ecological_Impacts', 0.7013847827911377)","('Access_And_Affordability', 0.05691457539796829)","('Management_Of_Legal_And_Regulatory_Framework', 0.036143939942121506)","([], 0.7013847827911377)","('NON-ESG', 0.05691457539796829)","('NON-ESG', 0.036143939942121506)"
Line 869,"Contents Vision and strategy: Our chairman, president and CEO NextEra Energys blueprint to reach Real Zero Confronting climate change About this report NextEra Energys ESG journey Our portfolio Building the worlds leading clean energy provider Environmental Social Governance Risks and opportunities 2021-2022 awards and recognitions Conclusion Appendices *Data does not include Gulf Power.45Environmental, Social and Governance Report 2022 FPLs demand-side management efforts through 2021 have resulted in a cumulative summer peak reduction of nearly 5,500 MW and an estimated cumulative energy savings of approximately 95,489 gigawatt hour (GWh).","('Physical_Impacts_Of_Climate_Change', 0.9434993267059326)","('Business_Model_Resilience', 0.01374342106282711)","('Systemic_Risk_Management', 0.006306988187134266)","(['Climate Strategy'], 0.9434993267059326)","('NON-ESG', 0.01374342106282711)","('NON-ESG', 0.006306988187134266)"
Line 870,"Contents Vision and strategy: Our chairman, president and CEO NextEra Energys blueprint to reach Real Zero Confronting climate change About this report NextEra Energys ESG journey Our portfolio Building the worlds leading clean energy provider Environmental Social Governance Risks and opportunities 2021-2022 awards and recognitions Conclusion Appendices *Data does not include Gulf Power.45Environmental, Social and Governance Report 2022 FPLs demand-side management efforts through 2021 have resulted in a cumulative summer peak reduction of nearly 5,500 MW and an estimated cumulative energy savings of approximately 95,489 gigawatt hour (GWh).","('Energy_Management', 0.9716018438339233)","('Management_Of_Legal_And_Regulatory_Framework', 0.0037372002843767405)","('GHG_Emissions', 0.003412243677303195)","(['Operational Eco-Efficiency', 'Electricity Generation'], 0.9716018438339233)","('NON-ESG', 0.0037372002843767405)","('NON-ESG', 0.003412243677303195)"
Line 871,This has eliminated the need to construct the equivalent of approximately 66 new 100-MW generating units.,"('Energy_Management', 0.8992305397987366)","('Management_Of_Legal_And_Regulatory_Framework', 0.01801897957921028)","('Water_And_Wastewater_Management', 0.011485106311738491)","(['Operational Eco-Efficiency', 'Electricity Generation'], 0.8992305397987366)","('NON-ESG', 0.01801897957921028)","('NON-ESG', 0.011485106311738491)"
Line 872,We also support our customers during major disruptive events.,"('Product_Design_And_Lifecycle_Management', 0.3369014263153076)","('Business_Model_Resilience', 0.12538431584835052)","('Energy_Management', 0.08271687477827072)","('NON-ESG', 0.3369014263153076)","('NON-ESG', 0.12538431584835052)","('NON-ESG', 0.08271687477827072)"
Line 873,"In 2017, FPL voluntarily suspended electrical disconnections for several months following Hurricane Irma.","('Energy_Management', 0.2783164978027344)","('Critical_Incident_Risk_Management', 0.16055655479431152)","('Physical_Impacts_Of_Climate_Change', 0.1321071833372116)","('NON-ESG', 0.2783164978027344)","('NON-ESG', 0.16055655479431152)","('NON-ESG', 0.1321071833372116)"
Line 874,"In addition, we support our customers during major disruptive events, such as the COVID-19 pandemic.","('Physical_Impacts_Of_Climate_Change', 0.3540665805339813)","('Systemic_Risk_Management', 0.16379813849925995)","('Critical_Incident_Risk_Management', 0.09082407504320145)","('NON-ESG', 0.3540665805339813)","('NON-ESG', 0.16379813849925995)","('NON-ESG', 0.09082407504320145)"
Line 875,"During the height of the pandemic, FPLs Main Street Recovery Credit Program offered eligible small businesses a monthly 10% credit on the energy charge portion of their bill.","('Systemic_Risk_Management', 0.602219820022583)","('Physical_Impacts_Of_Climate_Change', 0.10523056983947754)","('Energy_Management', 0.04204212874174118)","(['Risk & Crisis Management'], 0.602219820022583)","('NON-ESG', 0.10523056983947754)","('NON-ESG', 0.04204212874174118)"
Line 876,"For low-income residential customers, NextEra Energy committed $15 million to fund a discount program, where eligible customers who received federal assistance through the Low-Income Discount Program (LIHEAP) or the Emergency Home Energy Assistance for the Elderly Program (EHEAP) received a $20 credit on their monthly bill from December 2020 through December 2021.","('Critical_Incident_Risk_Management', 0.8311261534690857)","('Energy_Management', 0.05662251263856888)","('Air_Quality', 0.023827405646443367)","(['Risk & Crisis Management'], 0.8311261534690857)","('NON-ESG', 0.05662251263856888)","('NON-ESG', 0.023827405646443367)"
Line 877,"COVID-19 Since early 2020, the NextEra Energy team has constantly risen to meet the challenges of the COVID-19 global pandemic.","('Energy_Management', 0.21568900346755981)","('Physical_Impacts_Of_Climate_Change', 0.21101611852645874)","('Business_Model_Resilience', 0.10444313287734985)","('NON-ESG', 0.21568900346755981)","('NON-ESG', 0.21101611852645874)","('NON-ESG', 0.10444313287734985)"
Line 878,"We feel great compassion for those who have lost loved NextEra Energy Resources in 2021 broke ground on the Grand Casino Hinckley 3-MW Solar Facility, the companys first solar project developed in collaboration with the Mille Lacs Band of Ojibwe and its tribal government body.","('Energy_Management', 0.5826771855354309)","('Human_Rights_And_Community_Relations', 0.12635305523872375)","('Access_And_Affordability', 0.06297887861728668)","(['Operational Eco-Efficiency', 'Electricity Generation'], 0.5826771855354309)","('NON-ESG', 0.12635305523872375)","('NON-ESG', 0.06297887861728668)"
Line 879,"Solar energy generated at the site will power the Bands Grand Casino in Hinckley, Minn., and other customers served by the local utility.","('Energy_Management', 0.9659439325332642)","('Management_Of_Legal_And_Regulatory_Framework', 0.006405637599527836)","('GHG_Emissions', 0.003232003189623356)","(['Operational Eco-Efficiency', 'Electricity Generation'], 0.9659439325332642)","('NON-ESG', 0.006405637599527836)","('NON-ESG', 0.003232003189623356)"
Line 880,"ones to this disease, those who have contracted the COVID-19 virus and those who have experienced economic hardship.","('Labor_Practices', 0.4264322519302368)","('Employee_Health_And_Safety', 0.09721150994300842)","('Supply_Chain_Management', 0.09476859122514725)","('NON-ESG', 0.4264322519302368)","('NON-ESG', 0.09721150994300842)","('NON-ESG', 0.09476859122514725)"
Line 881,"Weve worked tirelessly to demonstrate our commitment to the communities where we live, work and play by providing innovative solutions to help our customers, while keeping our employees safe during this unprecedented time.","('Human_Rights_And_Community_Relations', 0.3847322463989258)","('Employee_Health_And_Safety', 0.32944419980049133)","('Access_And_Affordability', 0.07266493141651154)","('NON-ESG', 0.3847322463989258)","('NON-ESG', 0.32944419980049133)","('NON-ESG', 0.07266493141651154)"
Line 882,"Our corporate pandemic team continues to prioritize the safety of our team and our communities, while we continue to deliver on our commitments to customers during this pandemic and beyond.","('Critical_Incident_Risk_Management', 0.3418562114238739)","('Employee_Health_And_Safety', 0.14943094551563263)","('Physical_Impacts_Of_Climate_Change', 0.09302543103694916)","('NON-ESG', 0.3418562114238739)","('NON-ESG', 0.14943094551563263)","('NON-ESG', 0.09302543103694916)"
Line 883,"Electricity is critical to responding to the virus so first responders can help those in need, businesses can continue to operate, governments can continue to function and our customers can go about their daily lives to the greatest extent possible during this challenging time.","('Critical_Incident_Risk_Management', 0.7224574685096741)","('Access_And_Affordability', 0.08951163291931152)","('Energy_Management', 0.04720962792634964)","(['Risk & Crisis Management'], 0.7224574685096741)","('NON-ESG', 0.08951163291931152)","('NON-ESG', 0.04720962792634964)"
Line 884,Tribal/Indigenous relations Our communities include Native American tribes and Canadian Indigenous communities that may have an interest in our projects.,"('Human_Rights_And_Community_Relations', 0.9592226147651672)","('Employee_Engagement_Inclusion_And_Diversity', 0.004527977667748928)","('Labor_Practices', 0.0032257777638733387)","(['Stakeholder Engagement'], 0.9592226147651672)","('NON-ESG', 0.004527977667748928)","('NON-ESG', 0.0032257777638733387)"
Line 885,That interest may be due to tribal lands in proximity to the project location or because the tribe historically resided in the region.,"('Employee_Engagement_Inclusion_And_Diversity', 0.2597239315509796)","('Human_Rights_And_Community_Relations', 0.18970032036304474)","('Ecological_Impacts', 0.07114645838737488)","('NON-ESG', 0.2597239315509796)","('NON-ESG', 0.18970032036304474)","('NON-ESG', 0.07114645838737488)"
Line 886,"Our tribal/Indigenous relations staff supports all NextEra Energy Resources and FPL projects, including wind, solar, battery energy storage, electric transmission and natural gas infrastructure.","('Human_Rights_And_Community_Relations', 0.9428564310073853)","('Employee_Engagement_Inclusion_And_Diversity', 0.00850775558501482)","('Access_And_Affordability', 0.0054593379609286785)","(['Stakeholder Engagement'], 0.9428564310073853)","('NON-ESG', 0.00850775558501482)","('NON-ESG', 0.0054593379609286785)"
Line 887,"We work proactively with tribes to avoid and resolve issues, support tribal economic and community needs, educate internal personnel and consultants, and help support tribes energy development interests.","('Human_Rights_And_Community_Relations', 0.9433488845825195)","('Management_Of_Legal_And_Regulatory_Framework', 0.007650932762771845)","('Access_And_Affordability', 0.005516010336577892)","(['Stakeholder Engagement'], 0.9433488845825195)","('NON-ESG', 0.007650932762771845)","('NON-ESG', 0.005516010336577892)"
Line 888,"Contents Vision and strategy: Our chairman, president and CEO NextEra Energys blueprint to reach Real Zero Confronting climate change About this report NextEra Energys ESG journey Our portfolio Building the worlds leading clean energy provider Environmental Social Governance Risks and opportunities 2021-2022 awards and recognitions Conclusion Appendices 46Environmental, Social and Governance Report 2022 In 2021, two veterans and three healthcare workers and their families were surprised in Miami, Melbourne, St. Augustine, Gulf Breeze and Panama City.","('Physical_Impacts_Of_Climate_Change', 0.9391883611679077)","('Business_Model_Resilience', 0.009271170943975449)","('Systemic_Risk_Management', 0.00673395860940218)","(['Climate Strategy'], 0.9391883611679077)","('NON-ESG', 0.009271170943975449)","('NON-ESG', 0.00673395860940218)"
Line 889,"Contents Vision and strategy: Our chairman, president and CEO NextEra Energys blueprint to reach Real Zero Confronting climate change About this report NextEra Energys ESG journey Our portfolio Building the worlds leading clean energy provider Environmental Social Governance Risks and opportunities 2021-2022 awards and recognitions Conclusion Appendices 46Environmental, Social and Governance Report 2022 In 2021, two veterans and three healthcare workers and their families were surprised in Miami, Melbourne, St. Augustine, Gulf Breeze and Panama City.","('Management_Of_Legal_And_Regulatory_Framework', 0.20014670491218567)","('Ecological_Impacts', 0.1316300928592682)","('Competitive_Behavior', 0.10181507468223572)","('NON-ESG', 0.20014670491218567)","('NON-ESG', 0.1316300928592682)","('NON-ESG', 0.10181507468223572)"
Line 890,NextEra Energy Resources also supports our military during the holidays.,"('Energy_Management', 0.9546970725059509)","('Management_Of_Legal_And_Regulatory_Framework', 0.005038663744926453)","('Product_Design_And_Lifecycle_Management', 0.0047163404524326324)","(['Operational Eco-Efficiency', 'Electricity Generation'], 0.9546970725059509)","('NON-ESG', 0.005038663744926453)","('NON-ESG', 0.0047163404524326324)"
Line 891,"At Vance Airforce Base in Oklahoma, the company sponsored a Thanksgiving meal project.","('Customer_Welfare', 0.3075343668460846)","('Selling_Practices_And_Product_Labeling', 0.10123433917760849)","('Product_Design_And_Lifecycle_Management', 0.06896518915891647)","('NON-ESG', 0.3075343668460846)","('NON-ESG', 0.10123433917760849)","('NON-ESG', 0.06896518915891647)"
Line 892,"The programs are among many ways NextEra Energy supports veterans and our armed forces in areas we serve, such as Northwest Florida, a key area for the U.","('Employee_Engagement_Inclusion_And_Diversity', 0.24150671064853668)","('Employee_Health_And_Safety', 0.20987844467163086)","('Access_And_Affordability', 0.14582271873950958)","('NON-ESG', 0.24150671064853668)","('NON-ESG', 0.20987844467163086)","('NON-ESG', 0.14582271873950958)"
Line 893,S. Navy and Air Force.,"('Management_Of_Legal_And_Regulatory_Framework', 0.14987149834632874)","('Critical_Incident_Risk_Management', 0.14134973287582397)","('Air_Quality', 0.10271373391151428)","('NON-ESG', 0.14987149834632874)","('NON-ESG', 0.14134973287582397)","('NON-ESG', 0.10271373391151428)"
