,Sentence,ESG BERT Topic 1,ESG BERT Topic 2,ESG BERT Topic 3,Mapped Criteria Topic 1,Mapped Criteria Topic 2,Mapped Criteria Topic 3
Line 289,"They do not capture our growing diversity around the world, as laws on collecting race and ethnicity data differ outside of the U.","('Employee_Engagement_Inclusion_And_Diversity', 0.9732922315597534)","('Customer_Privacy', 0.0020736048463732004)","('Human_Rights_And_Community_Relations', 0.0017494698986411095)","(['Talent Attraction & Retention'], 0.9732922315597534)","('NON-ESG', 0.0020736048463732004)","('NON-ESG', 0.0017494698986411095)"
Line 290,S.,"('Product_Design_And_Lifecycle_Management', 0.09914591163396835)","('Waste_And_Hazardous_Materials_Management', 0.09464520215988159)","('Management_Of_Legal_And_Regulatory_Framework', 0.07568437606096268)","('NON-ESG', 0.09914591163396835)","('NON-ESG', 0.09464520215988159)","('NON-ESG', 0.07568437606096268)"
Line 291,Representation data compares December 2020 to December 2021.,"('Management_Of_Legal_And_Regulatory_Framework', 0.48738333582878113)","('Director_Removal', 0.09109475463628769)","('Employee_Engagement_Inclusion_And_Diversity', 0.07905890047550201)","('NON-ESG', 0.48738333582878113)","('NON-ESG', 0.09109475463628769)","('NON-ESG', 0.07905890047550201)"
Line 292,Note that last years report reflected October 2020 data.,"('Management_Of_Legal_And_Regulatory_Framework', 0.5420682430267334)","('Business_Model_Resilience', 0.06038278341293335)","('Systemic_Risk_Management', 0.04547058418393135)","(['Responsibility of Content'], 0.5420682430267334)","('NON-ESG', 0.06038278341293335)","('NON-ESG', 0.04547058418393135)"
Line 293,We will report based on December numbers moving forward.,"('Business_Model_Resilience', 0.2085748165845871)","('Physical_Impacts_Of_Climate_Change', 0.16130690276622772)","('Systemic_Risk_Management', 0.15811383724212646)","('NON-ESG', 0.2085748165845871)","('NON-ESG', 0.16130690276622772)","('NON-ESG', 0.15811383724212646)"
Line 294,"The 2021 numbers account for approximately 10,000 full-time streaming employees globally for women, and 7,300 full-time streaming employees in the U.","('Labor_Practices', 0.8647948503494263)","('Employee_Engagement_Inclusion_And_Diversity', 0.04658966884016991)","('Employee_Health_And_Safety', 0.011941454373300076)","(['Labor Practice Indicators'], 0.8647948503494263)","('NON-ESG', 0.04658966884016991)","('NON-ESG', 0.011941454373300076)"
Line 295,S. for the race/ethnicity numbers.,"('Employee_Engagement_Inclusion_And_Diversity', 0.9585102796554565)","('Customer_Privacy', 0.004223754163831472)","('Human_Rights_And_Community_Relations', 0.003626991529017687)","(['Talent Attraction & Retention'], 0.9585102796554565)","('NON-ESG', 0.004223754163831472)","('NON-ESG', 0.003626991529017687)"
Line 296,"The numbers do not include certain employees engaged in content production, some of whom are part-time or temporary, and whose numbers fluctuate throughout the year.31Social Inclusion On-screen: The Netflix Fund for Creative Equity Stories like The Harder They Fall, Never Have I Ever, Gentefied, Love on the Spectrum, Pray Away, Yasuke , and Squid Game broaden representationenabling more people to see their lives and cultures reflected on screen.","('Employee_Engagement_Inclusion_And_Diversity', 0.9304811954498291)","('Labor_Practices', 0.010012142360210419)","('Employee_Health_And_Safety', 0.008182266727089882)","(['Talent Attraction & Retention'], 0.9304811954498291)","('NON-ESG', 0.010012142360210419)","('NON-ESG', 0.008182266727089882)"
Line 297,And many of our films and series have been honored by the industry.,"('Management_Of_Legal_And_Regulatory_Framework', 0.38064074516296387)","('Competitive_Behavior', 0.07482989132404327)","('Business_Ethics', 0.07322907447814941)","('NON-ESG', 0.38064074516296387)","('NON-ESG', 0.07482989132404327)","('NON-ESG', 0.07322907447814941)"
Line 298,"Netflix led in nominations for the 2021 NAACP Image Awards, which honors the accomplishments of people of color in television, music, literature, and film in the U.","('Employee_Engagement_Inclusion_And_Diversity', 0.9283252954483032)","('Human_Rights_And_Community_Relations', 0.010051977820694447)","('Employee_Health_And_Safety', 0.006608865689486265)","(['Talent Attraction & Retention'], 0.9283252954483032)","('NON-ESG', 0.010051977820694447)","('NON-ESG', 0.006608865689486265)"
Line 299,S. Netflix secured 17 nominations for the 2021 GLAAD Media Awards honoring LGBTQ+ representation in U.,"('Employee_Engagement_Inclusion_And_Diversity', 0.9545276761054993)","('Human_Rights_And_Community_Relations', 0.006745792459696531)","('Employee_Health_And_Safety', 0.002982513513416052)","(['Talent Attraction & Retention'], 0.9545276761054993)","('NON-ESG', 0.006745792459696531)","('NON-ESG', 0.002982513513416052)"
Line 300,S. TV and film.,"('Management_Of_Legal_And_Regulatory_Framework', 0.12501654028892517)","('Product_Design_And_Lifecycle_Management', 0.09377512335777283)","('Business_Model_Resilience', 0.08773273974657059)","('NON-ESG', 0.12501654028892517)","('NON-ESG', 0.09377512335777283)","('NON-ESG', 0.08773273974657059)"
Line 301,"However, for decades, historically underrepresented communities have been either defined by a single story or worse, entirely absent from our screens.","('Employee_Engagement_Inclusion_And_Diversity', 0.34024736285209656)","('Competitive_Behavior', 0.15456311404705048)","('Business_Ethics', 0.10338711738586426)","('NON-ESG', 0.34024736285209656)","('NON-ESG', 0.15456311404705048)","('NON-ESG', 0.10338711738586426)"
Line 302,Research shows that more perspectives behind the camera leads to better representation in front of the camera.,"('Employee_Engagement_Inclusion_And_Diversity', 0.5759672522544861)","('Customer_Privacy', 0.04674716293811798)","('Human_Rights_And_Community_Relations', 0.03485928848385811)","(['Talent Attraction & Retention'], 0.5759672522544861)","('NON-ESG', 0.04674716293811798)","('NON-ESG', 0.03485928848385811)"
Line 303,So last year we created the Netflix Fund for Creative Equity to help create new opportunities for underrepresented communities within the entertainment industry.,"('Employee_Engagement_Inclusion_And_Diversity', 0.8255612850189209)","('Competitive_Behavior', 0.019807277247309685)","('Business_Ethics', 0.0186496339738369)","(['Talent Attraction & Retention'], 0.8255612850189209)","('NON-ESG', 0.019807277247309685)","('NON-ESG', 0.0186496339738369)"
Line 304,"The fund includes a commitment of $100M dollars over five years to help develop a strong, diverse pipeline of creatives around the world.","('Employee_Engagement_Inclusion_And_Diversity', 0.5693716406822205)","('Access_And_Affordability', 0.05649908259510994)","('Business_Model_Resilience', 0.053799837827682495)","(['Talent Attraction & Retention'], 0.5693716406822205)","('NON-ESG', 0.05649908259510994)","('NON-ESG', 0.053799837827682495)"
Line 305,"In our first 12 months, we worked with over 25 organizations globally - committing $14.5M towards programs that help identify, train and provide work placements for underrepresented creatives around the world.","('Employee_Engagement_Inclusion_And_Diversity', 0.818368673324585)","('Access_And_Affordability', 0.01943361759185791)","('Business_Ethics', 0.015416710637509823)","(['Talent Attraction & Retention'], 0.818368673324585)","('NON-ESG', 0.01943361759185791)","('NON-ESG', 0.015416710637509823)"
Line 306,"Of that, over $5M is specifically to support women.","('Access_And_Affordability', 0.4969284236431122)","('Human_Rights_And_Community_Relations', 0.1394607573747635)","('Employee_Engagement_Inclusion_And_Diversity', 0.06396949291229248)","('NON-ESG', 0.4969284236431122)","('NON-ESG', 0.1394607573747635)","('NON-ESG', 0.06396949291229248)"
Line 307,"Several of these programs have already enabled new filmmakers to hone their craft by providing them with mentorship and development, as well as an opportunity to create short films.","('Access_And_Affordability', 0.30434170365333557)","('Employee_Engagement_Inclusion_And_Diversity', 0.29615214467048645)","('Human_Rights_And_Community_Relations', 0.041239868849515915)","('NON-ESG', 0.30434170365333557)","('NON-ESG', 0.29615214467048645)","('NON-ESG', 0.041239868849515915)"
Line 308,"While were still early on in this work, were committed to helping build a legacy of inclusion in the industry.","('Employee_Engagement_Inclusion_And_Diversity', 0.9497553706169128)","('Human_Rights_And_Community_Relations', 0.008061414584517479)","('Access_And_Affordability', 0.005692749749869108)","(['Talent Attraction & Retention'], 0.9497553706169128)","('NON-ESG', 0.008061414584517479)","('NON-ESG', 0.005692749749869108)"
Line 309,You can find more information about the programs and partners we are supporting here.,"('Access_And_Affordability', 0.3013114035129547)","('Human_Rights_And_Community_Relations', 0.2755982577800751)","('Management_Of_Legal_And_Regulatory_Framework', 0.09261543303728104)","('NON-ESG', 0.3013114035129547)","('NON-ESG', 0.2755982577800751)","('NON-ESG', 0.09261543303728104)"
Line 310,Photo credit: Ryan Tian32Social It is crucial to increase the opportunities available for writers from under-represented backgrounds in the interest of up-skilling a new generation of industry leaders and including all Australians as a critical part of the national story.,"('Employee_Engagement_Inclusion_And_Diversity', 0.9198700785636902)","('Business_Model_Resilience', 0.010544752702116966)","('Human_Rights_And_Community_Relations', 0.006542997434735298)","(['Talent Attraction & Retention'], 0.9198700785636902)","('NON-ESG', 0.010544752702116966)","('NON-ESG', 0.006542997434735298)"
Line 311,Co-Curious is thrilled to be a recipient of Netflixs fund for creative equity and look forward to welcoming a new group of talented writers to the upcoming program.,"('Employee_Engagement_Inclusion_And_Diversity', 0.648370623588562)","('Management_Of_Legal_And_Regulatory_Framework', 0.04478038102388382)","('Business_Ethics', 0.025246504694223404)","(['Talent Attraction & Retention'], 0.648370623588562)","('NON-ESG', 0.04478038102388382)","('NON-ESG', 0.025246504694223404)"
Line 312,"Annabel Davis :: CEO, Co-Curious We had a discussion about how important it was to create a possibility for creatives from Africa to receive bursary support to attend institutions like AFDA.","('Management_Of_Legal_And_Regulatory_Framework', 0.7148268818855286)","('Access_And_Affordability', 0.0782494768500328)","('Business_Ethics', 0.030202485620975494)","(['Responsibility of Content'], 0.7148268818855286)","('NON-ESG', 0.0782494768500328)","('NON-ESG', 0.030202485620975494)"
Line 313,I cannot express how pleased I am to read the press release and see the African countries list from which students can make applications for bursary funding.,"('Management_Of_Legal_And_Regulatory_Framework', 0.8013193011283875)","('Access_And_Affordability', 0.043871380388736725)","('Business_Ethics', 0.01902575045824051)","(['Responsibility of Content'], 0.8013193011283875)","('NON-ESG', 0.043871380388736725)","('NON-ESG', 0.01902575045824051)"
Line 314,"Dr. Christopher John :: Social Responsibility and Funding Officer, South Africa: AFDA Thanks to a unique partnership with Netflix, the Academy of Italian Cinema Board, and the team working on this remarkable initiative, we are making an immediate tangible impact, introducing new bright female talents to high-level networking opportunities and work.","('Employee_Engagement_Inclusion_And_Diversity', 0.4837792217731476)","('Human_Rights_And_Community_Relations', 0.27677223086357117)","('Access_And_Affordability', 0.05816177278757095)","('NON-ESG', 0.4837792217731476)","('NON-ESG', 0.27677223086357117)","('NON-ESG', 0.05816177278757095)"
Line 315,Becoming maestres mentees are stepping into their careers with the support of Italian established filmmakers among recent David DI Donatello nominees and winners.,"('Employee_Engagement_Inclusion_And_Diversity', 0.2654672861099243)","('Management_Of_Legal_And_Regulatory_Framework', 0.18494929373264313)","('Competitive_Behavior', 0.060625117272138596)","('NON-ESG', 0.2654672861099243)","('NON-ESG', 0.18494929373264313)","('NON-ESG', 0.060625117272138596)"
Line 316,"Piera Detassis :: President and Artistic Director, Accademia del Cinema Italiano Our partnership with Netflix is fundamental to our collective goal of expanding inclusive and meaningful representation in the industry by developing the pipeline.","('Employee_Engagement_Inclusion_And_Diversity', 0.5571146011352539)","('Competitive_Behavior', 0.11648919433355331)","('Management_Of_Legal_And_Regulatory_Framework', 0.04684198647737503)","(['Talent Attraction & Retention'], 0.5571146011352539)","('NON-ESG', 0.11648919433355331)","('NON-ESG', 0.04684198647737503)"
Line 317,We are proud of the opportunity this collaboration has provided to support women of color and amplify intersectional narratives.,"('Employee_Engagement_Inclusion_And_Diversity', 0.9702786207199097)","('Human_Rights_And_Community_Relations', 0.0023022752720862627)","('Competitive_Behavior', 0.0021464915480464697)","(['Talent Attraction & Retention'], 0.9702786207199097)","('NON-ESG', 0.0023022752720862627)","('NON-ESG', 0.0021464915480464697)"
Line 318,"Benjamin Lopez :: Executive Director, National Association of Latino Independent Producers33Social Gender (Global): Women now make up 51.7% of our global workforce, up from 48.7% in 2020.","('Employee_Engagement_Inclusion_And_Diversity', 0.9043198227882385)","('Labor_Practices', 0.027655966579914093)","('Director_Removal', 0.0058330390602350235)","(['Talent Attraction & Retention'], 0.9043198227882385)","('NON-ESG', 0.027655966579914093)","('NON-ESG', 0.0058330390602350235)"
Line 319,"This includes 6.9% growth of women directors and above, totaling 51.1%.","('Employee_Engagement_Inclusion_And_Diversity', 0.47769787907600403)","('Director_Removal', 0.1084817424416542)","('Labor_Practices', 0.10744135826826096)","('NON-ESG', 0.47769787907600403)","('NON-ESG', 0.1084817424416542)","('NON-ESG', 0.10744135826826096)"
Line 320,"Race/Ethnicity (US): Half of our US workforce (50.5%) is made up of people from one or more historically excluded ethnic and/or racial backgrounds, including Asian, Black, Hispanic or Latino/a/x, Middle Eastern or North African, Native American, and Pacific Islander.","('Employee_Engagement_Inclusion_And_Diversity', 0.9731420278549194)","('Employee_Health_And_Safety', 0.0018341416725888848)","('Customer_Privacy', 0.0017859636573120952)","(['Talent Attraction & Retention'], 0.9731420278549194)","('NON-ESG', 0.0018341416725888848)","('NON-ESG', 0.0017859636573120952)"
Line 321,* Thats up from 46.8% in 2020.,"('Management_Of_Legal_And_Regulatory_Framework', 0.310019850730896)","('Energy_Management', 0.14907047152519226)","('Competitive_Behavior', 0.05004187300801277)","('NON-ESG', 0.310019850730896)","('NON-ESG', 0.14907047152519226)","('NON-ESG', 0.05004187300801277)"
Line 322,The number of US Black employees increased from 8.6% to 10.7% - and Black leadership (directors and above) increased from 10.9% to 13.3%.,"('Employee_Engagement_Inclusion_And_Diversity', 0.8628271818161011)","('Director_Removal', 0.03511078283190727)","('Labor_Practices', 0.011601692996919155)","(['Talent Attraction & Retention'], 0.8628271818161011)","('NON-ESG', 0.03511078283190727)","('NON-ESG', 0.011601692996919155)"
Line 323,"The number of US Hispanic or Latino/a/x employees increased slightly from 7.9% to 8.6%, and US Hispanic or Latino/a/x leadership (directors and above) grew from 4.3% to 4.4%.","('Employee_Engagement_Inclusion_And_Diversity', 0.9587522149085999)","('Director_Removal', 0.0033603620249778032)","('Business_Model_Resilience', 0.0029238280840218067)","(['Talent Attraction & Retention'], 0.9587522149085999)","('NON-ESG', 0.0033603620249778032)","('NON-ESG', 0.0029238280840218067)"
Line 324,"Senior leadership: Of the 22 leaders in our senior leadership team, ten (45.0%) are women and five (22.7%) are US leaders from one or more historically excluded ethnic and/or racial backgrounds.","('Employee_Engagement_Inclusion_And_Diversity', 0.9729788303375244)","('Human_Rights_And_Community_Relations', 0.00224672956392169)","('Business_Model_Resilience', 0.0019091047579422593)","(['Talent Attraction & Retention'], 0.9729788303375244)","('NON-ESG', 0.00224672956392169)","('NON-ESG', 0.0019091047579422593)"
Line 325,You can see how this data compares to the 2020 calendar year in the charts below.,"('Management_Of_Legal_And_Regulatory_Framework', 0.23968437314033508)","('Physical_Impacts_Of_Climate_Change', 0.1744385063648224)","('Business_Model_Resilience', 0.11240769922733307)","('NON-ESG', 0.23968437314033508)","('NON-ESG', 0.1744385063648224)","('NON-ESG', 0.11240769922733307)"
Line 326,Weve also published our EEO-1 reports we submit to the US Department of Labor publicly here on our investor site.,"('Labor_Practices', 0.9519876837730408)","('Management_Of_Legal_And_Regulatory_Framework', 0.005829548463225365)","('Employee_Health_And_Safety', 0.003814214374870062)","(['Labor Practice Indicators'], 0.9519876837730408)","('NON-ESG', 0.005829548463225365)","('NON-ESG', 0.003814214374870062)"
Line 327,"These reports look a bit different from the numbers above because they include people who dont work for Netflix full-time, for example part-time or temporary employees on our TV and film productions, for which numbers fluctuate throughout the year.","('Labor_Practices', 0.9020038843154907)","('Employee_Health_And_Safety', 0.016535673290491104)","('Employee_Engagement_Inclusion_And_Diversity', 0.012328225187957287)","(['Labor Practice Indicators'], 0.9020038843154907)","('NON-ESG', 0.016535673290491104)","('NON-ESG', 0.012328225187957287)"
Line 328,Inclusion Inside Netflix: Progress Since Our First Report Our members come from many different countries and cultures and to entertain them we need a workplace thats equally diverse.,"('Employee_Engagement_Inclusion_And_Diversity', 0.9700981974601746)","('Human_Rights_And_Community_Relations', 0.0028388446662575006)","('Employee_Health_And_Safety', 0.0022943690419197083)","(['Talent Attraction & Retention'], 0.9700981974601746)","('NON-ESG', 0.0028388446662575006)","('NON-ESG', 0.0022943690419197083)"
Line 329,"Last January, we dove deep into everything were doing on inclusion in the company by publishing Netflixs first inclusion report.","('Employee_Engagement_Inclusion_And_Diversity', 0.9448778033256531)","('Human_Rights_And_Community_Relations', 0.007017785217612982)","('Business_Model_Resilience', 0.005075402557849884)","(['Talent Attraction & Retention'], 0.9448778033256531)","('NON-ESG', 0.007017785217612982)","('NON-ESG', 0.005075402557849884)"
Line 330,We published an update in February 2022 on our progress in the 2021 calendar year.,"('Management_Of_Legal_And_Regulatory_Framework', 0.43068426847457886)","('Business_Model_Resilience', 0.11882000416517258)","('Physical_Impacts_Of_Climate_Change', 0.0862392708659172)","('NON-ESG', 0.43068426847457886)","('NON-ESG', 0.11882000416517258)","('NON-ESG', 0.0862392708659172)"
Line 331,"Netflix grew from about 8,000 to 10,000 full-time streaming employees globally in 2021.","('Labor_Practices', 0.5935401320457458)","('Employee_Engagement_Inclusion_And_Diversity', 0.1232314482331276)","('Director_Removal', 0.036753661930561066)","(['Labor Practice Indicators'], 0.5935401320457458)","('NON-ESG', 0.1232314482331276)","('NON-ESG', 0.036753661930561066)"
Line 332,"In the US where we collect and report race and ethnicity data we grew from 6,300 to 7,300 employees.","('Employee_Engagement_Inclusion_And_Diversity', 0.9671950936317444)","('Customer_Privacy', 0.003422559704631567)","('Employee_Health_And_Safety', 0.0024214698933064938)","(['Talent Attraction & Retention'], 0.9671950936317444)","('NON-ESG', 0.003422559704631567)","('NON-ESG', 0.0024214698933064938)"
Line 333,* 34Social35Social 36Social 37Social We still have more work to do to increase representation of historically marginalized groups.,"('Human_Rights_And_Community_Relations', 0.39789462089538574)","('Competitive_Behavior', 0.18760792911052704)","('Labor_Practices', 0.13772574067115784)","('NON-ESG', 0.39789462089538574)","('NON-ESG', 0.18760792911052704)","('NON-ESG', 0.13772574067115784)"
Line 334,"Were expanding inclusive hiring training for recruiters and managers, creating access for emerging talent by adding three Hispanic Serving Institutions (HSIs) and more HBCUs (totaling four) to our pipeline programs, and finding new ways to diversify our executive and company networks.","('Employee_Engagement_Inclusion_And_Diversity', 0.9564043283462524)","('Business_Model_Resilience', 0.0040189181454479694)","('Customer_Welfare', 0.003699573688209057)","(['Talent Attraction & Retention'], 0.9564043283462524)","('NON-ESG', 0.0040189181454479694)","('NON-ESG', 0.003699573688209057)"
Line 335,"While increasing representation is important, its only part of the work.","('Competitive_Behavior', 0.39451977610588074)","('Employee_Engagement_Inclusion_And_Diversity', 0.0717506855726242)","('Business_Ethics', 0.05783405154943466)","('NON-ESG', 0.39451977610588074)","('NON-ESG', 0.0717506855726242)","('NON-ESG', 0.05783405154943466)"
Line 336,So we continue to build an inclusive workplace where everyone can thrive.,"('Employee_Engagement_Inclusion_And_Diversity', 0.9036334156990051)","('Human_Rights_And_Community_Relations', 0.01814529486000538)","('Employee_Health_And_Safety', 0.010970662347972393)","(['Talent Attraction & Retention'], 0.9036334156990051)","('NON-ESG', 0.01814529486000538)","('NON-ESG', 0.010970662347972393)"
Line 337,The strategy we laid out in our first inclusion report remains the same.,"('Employee_Engagement_Inclusion_And_Diversity', 0.9223135709762573)","('Business_Model_Resilience', 0.009676534682512283)","('Human_Rights_And_Community_Relations', 0.009663024917244911)","(['Talent Attraction & Retention'], 0.9223135709762573)","('NON-ESG', 0.009676534682512283)","('NON-ESG', 0.009663024917244911)"
Line 338,"First, were improving our culture of inclusion and belonging.","('Employee_Engagement_Inclusion_And_Diversity', 0.9596781134605408)","('Human_Rights_And_Community_Relations', 0.004467060789465904)","('Employee_Health_And_Safety', 0.003330037696287036)","(['Talent Attraction & Retention'], 0.9596781134605408)","('NON-ESG', 0.004467060789465904)","('NON-ESG', 0.003330037696287036)"
Line 339,"This past year, we: Conducted our annual compensation review to ensure pay equity across the company, Progressed inclusions trainings across all our offices, most recently launching an internal leadership initiative on how to lead inclusively, Continued offering inclusive benefits, including gender-inclusive parental leave, transgender and non-binary care in our US health plans, and family-forming support for employees regardless of marital status, gender, or sexual orientation, and Supported our growing employee resource group program around the world.","('Employee_Engagement_Inclusion_And_Diversity', 0.975159764289856)","('Employee_Health_And_Safety', 0.002793418476358056)","('Access_And_Affordability', 0.0015856497921049595)","(['Talent Attraction & Retention'], 0.975159764289856)","('NON-ESG', 0.002793418476358056)","('NON-ESG', 0.0015856497921049595)"
Line 340,"This past year, we: Conducted our annual compensation review to ensure pay equity across the company, Progressed inclusions trainings across all our offices, most recently launching an internal leadership initiative on how to lead inclusively, Continued offering inclusive benefits, including gender-inclusive parental leave, transgender and non-binary care in our US health plans, and family-forming support for employees regardless of marital status, gender, or sexual orientation, and Supported our growing employee resource group program around the world.","('Access_And_Affordability', 0.30644550919532776)","('Human_Rights_And_Community_Relations', 0.22737279534339905)","('Ecological_Impacts', 0.06255873292684555)","('NON-ESG', 0.30644550919532776)","('NON-ESG', 0.22737279534339905)","('NON-ESG', 0.06255873292684555)"
Line 341,"Last year, we held 90 virtual learning workshops on inclusion topics ranging from accessibility on service to understanding US Latino/a/x representation on-screen.","('Employee_Engagement_Inclusion_And_Diversity', 0.9445221424102783)","('Access_And_Affordability', 0.00884025078266859)","('Human_Rights_And_Community_Relations', 0.005687587894499302)","(['Talent Attraction & Retention'], 0.9445221424102783)","('NON-ESG', 0.00884025078266859)","('NON-ESG', 0.005687587894499302)"
Line 342,"These workshops help employees look at every decision with an inclusion lens, asking questions like, whose voice is missing?","('Employee_Engagement_Inclusion_And_Diversity', 0.8999959230422974)","('Human_Rights_And_Community_Relations', 0.013386835344135761)","('Competitive_Behavior', 0.008543993346393108)","(['Talent Attraction & Retention'], 0.8999959230422974)","('NON-ESG', 0.013386835344135761)","('NON-ESG', 0.008543993346393108)"
Line 343,Who is being excluded?,"('Competitive_Behavior', 0.2526375353336334)","('Employee_Engagement_Inclusion_And_Diversity', 0.2053975611925125)","('Business_Ethics', 0.0827149972319603)","('NON-ESG', 0.2526375353336334)","('NON-ESG', 0.2053975611925125)","('NON-ESG', 0.0827149972319603)"
Line 344,Are we portraying this authentically?,"('Competitive_Behavior', 0.12090349942445755)","('Human_Rights_And_Community_Relations', 0.10747074335813522)","('Business_Ethics', 0.09045663475990295)","('NON-ESG', 0.12090349942445755)","('NON-ESG', 0.10747074335813522)","('NON-ESG', 0.09045663475990295)"
