,Sentence,ESG BERT Topic 1,ESG BERT Topic 2,ESG BERT Topic 3,Mapped Criteria Topic 1,Mapped Criteria Topic 2,Mapped Criteria Topic 3
Line 726,The scope of environmental data presented in this report includes operations that we control.,"('Business_Model_Resilience', 0.29045429825782776)","('Physical_Impacts_Of_Climate_Change', 0.10210754722356796)","('Energy_Management', 0.09688826650381088)","('NON-ESG', 0.29045429825782776)","('NON-ESG', 0.10210754722356796)","('NON-ESG', 0.09688826650381088)"
Line 727,"Where energy data is not available, estimations based on regional energy intensity factors are used.","('Energy_Management', 0.9786170125007629)","('Management_Of_Legal_And_Regulatory_Framework', 0.0025866401847451925)","('Air_Quality', 0.0021690570283681154)","(['Operational Eco-Efficiency'], 0.9786170125007629)","('NON-ESG', 0.0025866401847451925)","('NON-ESG', 0.0021690570283681154)"
Line 728,"Where water and waste data is not available, estimations based on existing data is used.","('Water_And_Wastewater_Management', 0.9272463917732239)","('Waste_And_Hazardous_Materials_Management', 0.030083738267421722)","('Energy_Management', 0.003688558004796505)","([], 0.9272463917732239)","('NON-ESG', 0.030083738267421722)","('NON-ESG', 0.003688558004796505)"
Line 729,27.,"('Management_Of_Legal_And_Regulatory_Framework', 0.17488446831703186)","('Competitive_Behavior', 0.12589751183986664)","('Business_Ethics', 0.09894800931215286)","('NON-ESG', 0.17488446831703186)","('NON-ESG', 0.12589751183986664)","('NON-ESG', 0.09894800931215286)"
Line 730,Spend-based analysis is currently unable to separate upstream and downstream transportation and distribution.,"('Management_Of_Legal_And_Regulatory_Framework', 0.19672460854053497)","('Water_And_Wastewater_Management', 0.1382434070110321)","('GHG_Emissions', 0.11465476453304291)","('NON-ESG', 0.19672460854053497)","('NON-ESG', 0.1382434070110321)","('NON-ESG', 0.11465476453304291)"
Line 731,Figures presented in upstream transportation and distribution represent both upstream and downstream emissions.,"('GHG_Emissions', 0.9031621813774109)","('Air_Quality', 0.023501142859458923)","('Energy_Management', 0.011993886902928352)","(['Operational Eco-Efficiency'], 0.9031621813774109)","('NON-ESG', 0.023501142859458923)","('NON-ESG', 0.011993886902928352)"
Line 732,28.,"('Management_Of_Legal_And_Regulatory_Framework', 0.2906574308872223)","('Business_Ethics', 0.08392424136400223)","('Competitive_Behavior', 0.07798443734645844)","('NON-ESG', 0.2906574308872223)","('NON-ESG', 0.08392424136400223)","('NON-ESG', 0.07798443734645844)"
Line 733,Emissions associated with end-of-life treatment and sold products is relevant.,"('Product_Design_And_Lifecycle_Management', 0.9619525074958801)","('Selling_Practices_And_Product_Labeling', 0.004684063605964184)","('Product_Quality_And_Safety', 0.0040940409526228905)","([], 0.9619525074958801)","('NON-ESG', 0.004684063605964184)","('NON-ESG', 0.0040940409526228905)"
Line 734,The methodology used to determine the emissions for this category is in progress.,"('GHG_Emissions', 0.7094695568084717)","('Air_Quality', 0.14887334406375885)","('Energy_Management', 0.03964778035879135)","(['Operational Eco-Efficiency'], 0.7094695568084717)","('NON-ESG', 0.14887334406375885)","('NON-ESG', 0.03964778035879135)"
Line 735,29.,"('Management_Of_Legal_And_Regulatory_Framework', 0.1889604926109314)","('Competitive_Behavior', 0.13740412890911102)","('Business_Ethics', 0.10067729651927948)","('NON-ESG', 0.1889604926109314)","('NON-ESG', 0.13740412890911102)","('NON-ESG', 0.10067729651927948)"
Line 736,"Value includes Scope 1, 2 and Scope 3 (categories 1, 2, 3, 4, 5, 6, 7 and 8).","('Systemic_Risk_Management', 0.28425467014312744)","('Competitive_Behavior', 0.15761859714984894)","('Business_Model_Resilience', 0.12752258777618408)","('NON-ESG', 0.28425467014312744)","('NON-ESG', 0.15761859714984894)","('NON-ESG', 0.12752258777618408)"
Line 737,"Emissions from other categories are already captured in the customers Scope 1, 2 and downstream Scope 3 and therefore not included.","('GHG_Emissions', 0.8713930249214172)","('Air_Quality', 0.061973653733730316)","('Management_Of_Legal_And_Regulatory_Framework', 0.00924320425838232)","(['Operational Eco-Efficiency'], 0.8713930249214172)","('NON-ESG', 0.061973653733730316)","('NON-ESG', 0.00924320425838232)"
Line 738,30.,"('Management_Of_Legal_And_Regulatory_Framework', 0.2140141725540161)","('Competitive_Behavior', 0.09767056256532669)","('Business_Ethics', 0.0870036855340004)","('NON-ESG', 0.2140141725540161)","('NON-ESG', 0.09767056256532669)","('NON-ESG', 0.0870036855340004)"
Line 739,"Environmental attribute certificates retired include unbundled Green-e certified Renewable Energy Certifications and EECS AIB Guarantees of Origin to match electricity usage in the US, Canada and Europe, respectively.","('Energy_Management', 0.8588283061981201)","('Management_Of_Legal_And_Regulatory_Framework', 0.06265081465244293)","('Product_Design_And_Lifecycle_Management', 0.010297361761331558)","(['Operational Eco-Efficiency'], 0.8588283061981201)","('NON-ESG', 0.06265081465244293)","('NON-ESG', 0.010297361761331558)"
Line 740,31.,"('Management_Of_Legal_And_Regulatory_Framework', 0.20312461256980896)","('Competitive_Behavior', 0.1377391517162323)","('Business_Ethics', 0.099784716963768)","('NON-ESG', 0.20312461256980896)","('NON-ESG', 0.1377391517162323)","('NON-ESG', 0.099784716963768)"
Line 741,Zero waste is defined as the diversion of at least 90% of nonhazardous waste from landfill and incineration to energy.,"('Waste_And_Hazardous_Materials_Management', 0.985002338886261)","('Water_And_Wastewater_Management', 0.001282739220187068)","('Data_Security', 0.0011981024872511625)","([], 0.985002338886261)","('NON-ESG', 0.001282739220187068)","('NON-ESG', 0.0011981024872511625)"
Line 742,Sites are certified by a third party.,"('Management_Of_Legal_And_Regulatory_Framework', 0.21429455280303955)","('Director_Removal', 0.08015353977680206)","('Product_Quality_And_Safety', 0.07716765999794006)","('NON-ESG', 0.21429455280303955)","('NON-ESG', 0.08015353977680206)","('NON-ESG', 0.07716765999794006)"
Line 743,*This indicator or set of indicators is being included in this report for the first time.,"('Management_Of_Legal_And_Regulatory_Framework', 0.5588889122009277)","('Systemic_Risk_Management', 0.13472826778888702)","('Human_Rights_And_Community_Relations', 0.03415462374687195)","([], 0.5588889122009277)","('NON-ESG', 0.13472826778888702)","('NON-ESG', 0.03415462374687195)"
Line 744,This metric has gone through a limited assurance process.,"('Management_Of_Legal_And_Regulatory_Framework', 0.4953339993953705)","('Systemic_Risk_Management', 0.07995735853910446)","('Competitive_Behavior', 0.06613806635141373)","('NON-ESG', 0.4953339993953705)","('NON-ESG', 0.07995735853910446)","('NON-ESG', 0.06613806635141373)"
Line 745,"Description Unit 2021 Recycle Metric tons 154 Offsite wastewater treatment Metric tons 18 Incinerations with and without waste to energy Metric tons 24,136 Landfill Metric tons 467Environment continued53 2021 Corporate Social Responsibility Report thermofisher.com/csrAppendix 1 UN Sustainable Development Goals At Thermo Fisher, we support the UN 2030 Agenda .","('Waste_And_Hazardous_Materials_Management', 0.9589124321937561)","('Water_And_Wastewater_Management', 0.011761496774852276)","('Air_Quality', 0.0032330763060599566)","([], 0.9589124321937561)","('NON-ESG', 0.011761496774852276)","('NON-ESG', 0.0032330763060599566)"
Line 746,"The following table is not intended to be an exhaustive list of our contributions to the Sustainable Development Goals (SDGs), but rather provides highlights for some of the goals where we have identified a strong strategic alignment.","('Human_Rights_And_Community_Relations', 0.6110128164291382)","('Business_Model_Resilience', 0.09348602592945099)","('Ecological_Impacts', 0.04497823864221573)","([], 0.6110128164291382)","('NON-ESG', 0.09348602592945099)","('NON-ESG', 0.04497823864221573)"
Line 747,Sustainable Development GoalsStrategic alignment 2021 featured contributions Ensure healthy lives and promote well-being for all at all ages.,"('Access_And_Affordability', 0.47235170006752014)","('Employee_Health_And_Safety', 0.24645213782787323)","('Human_Rights_And_Community_Relations', 0.04108520597219467)","('NON-ESG', 0.47235170006752014)","('NON-ESG', 0.24645213782787323)","('NON-ESG', 0.04108520597219467)"
Line 748,"Our Mission is to enable our customers to make the world healthier, cleaner and safer.","('Product_Design_And_Lifecycle_Management', 0.6940763592720032)","('Product_Quality_And_Safety', 0.0982104241847992)","('Customer_Welfare', 0.04377280920743942)","([], 0.6940763592720032)","('NON-ESG', 0.0982104241847992)","('NON-ESG', 0.04377280920743942)"
Line 749,Our products and services are designed to contribute to the health and well-being of humanity and benefit society globally.,"('Product_Design_And_Lifecycle_Management', 0.847034752368927)","('Product_Quality_And_Safety', 0.026469191536307335)","('Customer_Welfare', 0.01970583386719227)","([], 0.847034752368927)","('NON-ESG', 0.026469191536307335)","('NON-ESG', 0.01970583386719227)"
Line 750,"We see particular alignment with target 3b, which supports the research and development of vaccines and medicines and provides access to affordable essential medicines and vaccines.","('Access_And_Affordability', 0.4642625153064728)","('Selling_Practices_And_Product_Labeling', 0.11337005347013474)","('Customer_Welfare', 0.11098082363605499)","('NON-ESG', 0.4642625153064728)","('NON-ESG', 0.11337005347013474)","('NON-ESG', 0.11098082363605499)"
Line 751,Thermo Fisher is committed to accelerating the discovery of solutions that can deliver more equitable health outcomes for society.,"('Access_And_Affordability', 0.6144629120826721)","('Employee_Health_And_Safety', 0.10573054105043411)","('Human_Rights_And_Community_Relations', 0.06809113174676895)","([], 0.6144629120826721)","('NON-ESG', 0.10573054105043411)","('NON-ESG', 0.06809113174676895)"
Line 752,"In 2021, we were among the launch partners for the Bespoke Gene Therapy Consortium.","('Ecological_Impacts', 0.19749920070171356)","('Access_And_Affordability', 0.15406107902526855)","('Customer_Welfare', 0.09133663773536682)","('NON-ESG', 0.19749920070171356)","('NON-ESG', 0.15406107902526855)","('NON-ESG', 0.09133663773536682)"
Line 753,"Together with the National Institutes of Health, US Food and Drug Administration (FDA), and industry and nonprofit partners, we are advancing the development of gene therapies to help fill the unmet medical needs of patients with rare diseases.","('Access_And_Affordability', 0.32533738017082214)","('Product_Quality_And_Safety', 0.11216873675584793)","('Customer_Welfare', 0.11069103330373764)","('NON-ESG', 0.32533738017082214)","('NON-ESG', 0.11216873675584793)","('NON-ESG', 0.11069103330373764)"
Line 754,"While a single rare disease affects small numbers of people, rare diseases collectively affect an estimated 300 million people globally.","('Employee_Health_And_Safety', 0.30203136801719666)","('Systemic_Risk_Management', 0.09850757569074631)","('Business_Model_Resilience', 0.05753155052661896)","('NON-ESG', 0.30203136801719666)","('NON-ESG', 0.09850757569074631)","('NON-ESG', 0.05753155052661896)"
Line 755,Our Company is uniquely positioned to play a role in advancing global health equity.,"('Systemic_Risk_Management', 0.3505176603794098)","('Business_Model_Resilience', 0.1366712599992752)","('Competitive_Behavior', 0.09643641114234924)","('NON-ESG', 0.3505176603794098)","('NON-ESG', 0.1366712599992752)","('NON-ESG', 0.09643641114234924)"
Line 756,"Joining forces with customers and communities, we leverage our capabilities to help remove obstacles to healthcare in line with our Mission and our commitment to serving science and society.","('Human_Rights_And_Community_Relations', 0.7077808380126953)","('Access_And_Affordability', 0.09848258644342422)","('Employee_Engagement_Inclusion_And_Diversity', 0.03210996836423874)","([], 0.7077808380126953)","('NON-ESG', 0.09848258644342422)","('NON-ESG', 0.03210996836423874)"
Line 757,"With harmonized and equitable pricing, we have supported over 100 low- and middle-income countries and global health partners that otherwise lacked access to affordable diagnostic testing at scale.","('Access_And_Affordability', 0.23718976974487305)","('Competitive_Behavior', 0.2214389443397522)","('Management_Of_Legal_And_Regulatory_Framework', 0.09629881381988525)","('NON-ESG', 0.23718976974487305)","('NON-ESG', 0.2214389443397522)","('NON-ESG', 0.09629881381988525)"
Line 758,"During the second major COVID-19 wave in India, we took several actions to support the local response to an unprecedented health crisis.","('Critical_Incident_Risk_Management', 0.8908149003982544)","('Employee_Health_And_Safety', 0.04310744255781174)","('Physical_Impacts_Of_Climate_Change', 0.010056261904537678)","(['Risk & Crisis Management'], 0.8908149003982544)","('NON-ESG', 0.04310744255781174)","('NON-ESG', 0.010056261904537678)"
Line 759,This included partnering with UNICEF and the Government of India to scale in- country capacity.,"('Management_Of_Legal_And_Regulatory_Framework', 0.3064608871936798)","('Access_And_Affordability', 0.28126582503318787)","('Human_Rights_And_Community_Relations', 0.18905381858348846)","('NON-ESG', 0.3064608871936798)","('NON-ESG', 0.28126582503318787)","('NON-ESG', 0.18905381858348846)"
Line 760,"We installed 97 Thermo Scientific KingFisher Flex instruments for nucleic acid, protein and cell purification, and our facility in Bengaluru ramped up production of a COVID-19 test specifically for India.","('GHG_Emissions', 0.23754964768886566)","('Customer_Welfare', 0.1621657758951187)","('Ecological_Impacts', 0.1044110581278801)","('NON-ESG', 0.23754964768886566)","('NON-ESG', 0.1621657758951187)","('NON-ESG', 0.1044110581278801)"
Line 761,"Through our Foundation for Science, we also provided $10 million in philanthropic and in-kind product support.","('Product_Design_And_Lifecycle_Management', 0.6922152042388916)","('Management_Of_Legal_And_Regulatory_Framework', 0.057252999395132065)","('Customer_Welfare', 0.04373737424612045)","([], 0.6922152042388916)","('NON-ESG', 0.057252999395132065)","('NON-ESG', 0.04373737424612045)"
Line 762,Additional information on our Global Health Equity efforts is available on pages 37 and 38 of this report.,"('Access_And_Affordability', 0.34207215905189514)","('Systemic_Risk_Management', 0.12033374607563019)","('Product_Quality_And_Safety', 0.05774734914302826)","('NON-ESG', 0.34207215905189514)","('NON-ESG', 0.12033374607563019)","('NON-ESG', 0.05774734914302826)"
Line 763,Ensure inclusive and equitable quality education and promote lifelong learning opportunities for all.,"('Access_And_Affordability', 0.7545778751373291)","('Employee_Engagement_Inclusion_And_Diversity', 0.06011904031038284)","('Human_Rights_And_Community_Relations', 0.02599272131919861)","([], 0.7545778751373291)","('NON-ESG', 0.06011904031038284)","('NON-ESG', 0.02599272131919861)"
Line 764,We are helping to ignite the spark that will inspire the next generation of innovators.,"('Business_Model_Resilience', 0.6315501928329468)","('Product_Design_And_Lifecycle_Management', 0.09797652065753937)","('Supply_Chain_Management', 0.03303547576069832)","(['Human Capital Development', 'Innovation Management'], 0.6315501928329468)","('NON-ESG', 0.09797652065753937)","('NON-ESG', 0.03303547576069832)"
Line 765,"As an industry leader, we are committed to helping young people discover science, ensuring continued interest in science, technology, engineering and mathematics (STEM) subjects for future generations Our signature STEM education programs connect students and colleagues through hands-on and team-based activities that highlight our technologies, foster curiosity in STEM careers and demonstrate how our Company influences the world.","('Employee_Engagement_Inclusion_And_Diversity', 0.7792689204216003)","('Access_And_Affordability', 0.0350913368165493)","('Product_Design_And_Lifecycle_Management', 0.023287378251552582)","(['Talent Attraction & Retention'], 0.7792689204216003)","('NON-ESG', 0.0350913368165493)","('NON-ESG', 0.023287378251552582)"
Line 766,"To amplify our STEM impact, we continue to invest in and leverage our Foundation for Science, supporting groups that are underrepresented in STEM fields.","('Employee_Engagement_Inclusion_And_Diversity', 0.3613441586494446)","('Access_And_Affordability', 0.139129176735878)","('Business_Model_Resilience', 0.06329088658094406)","('NON-ESG', 0.3613441586494446)","('NON-ESG', 0.139129176735878)","('NON-ESG', 0.06329088658094406)"
Line 767,"As the world leader in serving science, one of our greatest opportunities is to help build a life sciences sector that more fully represents our diverse society.","('Employee_Engagement_Inclusion_And_Diversity', 0.797064483165741)","('Business_Model_Resilience', 0.041731856763362885)","('Human_Rights_And_Community_Relations', 0.018860146403312683)","(['Talent Attraction & Retention'], 0.797064483165741)","('NON-ESG', 0.041731856763362885)","('NON-ESG', 0.018860146403312683)"
Line 768,"Our STEM partners help us deliver on our commitment to inspire a new generation of innovators through top-tier STEM programming that spans a range of models, from mobile learning to innovation labs.","('Employee_Engagement_Inclusion_And_Diversity', 0.3031734824180603)","('Business_Model_Resilience', 0.2038727104663849)","('Product_Design_And_Lifecycle_Management', 0.071006640791893)","('NON-ESG', 0.3031734824180603)","('NON-ESG', 0.2038727104663849)","('NON-ESG', 0.071006640791893)"
Line 769,"These efforts not only support students, but also provide our colleagues with rewarding volunteer opportunities.","('Employee_Health_And_Safety', 0.30172237753868103)","('Employee_Engagement_Inclusion_And_Diversity', 0.25326547026634216)","('Access_And_Affordability', 0.12250534445047379)","('NON-ESG', 0.30172237753868103)","('NON-ESG', 0.25326547026634216)","('NON-ESG', 0.12250534445047379)"
Line 770,Our flagship partners include the Boys & Girls Clubs of America (BGCA) and the China Youth Development Foundation (CYDF).,"('Access_And_Affordability', 0.3561509847640991)","('Employee_Engagement_Inclusion_And_Diversity', 0.25674110651016235)","('Human_Rights_And_Community_Relations', 0.050247158855199814)","('NON-ESG', 0.3561509847640991)","('NON-ESG', 0.25674110651016235)","('NON-ESG', 0.050247158855199814)"
Line 771,Additional information about our efforts in advancing STEM education is available on pages 33 through 35 of this report.,"('Access_And_Affordability', 0.6130315661430359)","('Employee_Engagement_Inclusion_And_Diversity', 0.1057407557964325)","('Customer_Welfare', 0.02827010676264763)","([], 0.6130315661430359)","('NON-ESG', 0.1057407557964325)","('NON-ESG', 0.02827010676264763)"
Line 772,"54 2021 Corporate Social Responsibility Report thermofisher.com/csrSustainable Development GoalsStrategic alignment 2021 featured contributions Promote sustained, inclusive and sustainable economic growth, full and productive employment and decent work for all.","('Human_Rights_And_Community_Relations', 0.9359585642814636)","('Access_And_Affordability', 0.008786422200500965)","('Labor_Practices', 0.008247796446084976)","([], 0.9359585642814636)","('NON-ESG', 0.008786422200500965)","('NON-ESG', 0.008247796446084976)"
Line 773,"We provide fulfilling careers across the globe, ensuring equity and opportunity for those historically underrepresented in the STEM industry specifically or the workforce generally.","('Employee_Engagement_Inclusion_And_Diversity', 0.9412441849708557)","('Employee_Health_And_Safety', 0.006672300864011049)","('Business_Model_Resilience', 0.004206095356494188)","(['Talent Attraction & Retention'], 0.9412441849708557)","('NON-ESG', 0.006672300864011049)","('NON-ESG', 0.004206095356494188)"
Line 774,Our collaborative and inclusive culture helps our colleagues connect and grow as one global team.,"('Employee_Engagement_Inclusion_And_Diversity', 0.8333020210266113)","('Human_Rights_And_Community_Relations', 0.04990053549408913)","('Employee_Health_And_Safety', 0.015106146223843098)","(['Talent Attraction & Retention'], 0.8333020210266113)","('NON-ESG', 0.04990053549408913)","('NON-ESG', 0.015106146223843098)"
Line 775,"Across our global footprint, we take a localized approach to economic development and job creation.","('Employee_Engagement_Inclusion_And_Diversity', 0.3573499619960785)","('Human_Rights_And_Community_Relations', 0.14350949227809906)","('Employee_Health_And_Safety', 0.0767170637845993)","('NON-ESG', 0.3573499619960785)","('NON-ESG', 0.14350949227809906)","('NON-ESG', 0.0767170637845993)"
Line 776,"In 2021, Thermo Fisher was awarded a $192.5 million contract by the US Department of Defense.","('Management_Of_Legal_And_Regulatory_Framework', 0.30209073424339294)","('Energy_Management', 0.12388581782579422)","('Supply_Chain_Management', 0.10679947584867477)","('NON-ESG', 0.30209073424339294)","('NON-ESG', 0.12388581782579422)","('NON-ESG', 0.10679947584867477)"
Line 777,"For this project, our Company is co-investing with the US government to build a new, state-of-the-art, energy-efficient manufacturing facility in a community in North Carolina.","('Energy_Management', 0.9762570858001709)","('Air_Quality', 0.002578869927674532)","('Management_Of_Legal_And_Regulatory_Framework', 0.0024010606575757265)","(['Operational Eco-Efficiency'], 0.9762570858001709)","('NON-ESG', 0.002578869927674532)","('NON-ESG', 0.0024010606575757265)"
Line 778,"It will create hundreds of manufacturing, entry-level and management jobs in the region and, over time, has the potential for future expansion across a variety of high-demand product lines.","('Product_Design_And_Lifecycle_Management', 0.9609694480895996)","('Customer_Welfare', 0.004480273928493261)","('Product_Quality_And_Safety', 0.0036515770480036736)","([], 0.9609694480895996)","('NON-ESG', 0.004480273928493261)","('NON-ESG', 0.0036515770480036736)"
Line 779,Our Code of Business Conduct and Ethics and Global Equal Employment Opportunity and Human Rights Policy are examples of the several policies that reinforce treating our colleagues with the dignity and respect they deserve.,"('Human_Rights_And_Community_Relations', 0.7616353631019592)","('Labor_Practices', 0.06908940523862839)","('Employee_Engagement_Inclusion_And_Diversity', 0.03386123478412628)","([], 0.7616353631019592)","('NON-ESG', 0.06908940523862839)","('NON-ESG', 0.03386123478412628)"
Line 780,"This commitment to fair and safe work experiences also extends to our suppliersthrough our Supplier Code of Conductwhere we set expectations for them to operate with integrity and to embed good practices and responsible policies, including combating modern slavery and human trafficking.","('Supply_Chain_Management', 0.29291680455207825)","('Labor_Practices', 0.19067828357219696)","('Business_Ethics', 0.16850696504116058)","('NON-ESG', 0.29291680455207825)","('NON-ESG', 0.19067828357219696)","('NON-ESG', 0.16850696504116058)"
Line 781,"We understand that some of the brightest minds are just at the beginning of their careers, which is why we invest in meaningful early talent attraction and acquisition programs and create working opportunities for students who will become the next generation of scientists, engineers, functional business leaders and general managers.","('Employee_Engagement_Inclusion_And_Diversity', 0.8544463515281677)","('Business_Model_Resilience', 0.012413395568728447)","('Director_Removal', 0.012171151116490364)","(['Talent Attraction & Retention'], 0.8544463515281677)","('NON-ESG', 0.012413395568728447)","('NON-ESG', 0.012171151116490364)"
Line 782,"Each year, we hire over 500 colleagues in the early stages of their careers for our best-in-class programs, which include dynamic opportunities for high school and collegiate internships, co-op programs, apprenticeships, leadership development programs in nine functional areas and various full-time roles.","('Employee_Engagement_Inclusion_And_Diversity', 0.8831861615180969)","('Access_And_Affordability', 0.01694919355213642)","('Employee_Health_And_Safety', 0.009724335744976997)","(['Talent Attraction & Retention'], 0.8831861615180969)","('NON-ESG', 0.01694919355213642)","('NON-ESG', 0.009724335744976997)"
Line 783,Additional information about our talent and diversity and inclusion (D&I) practices is available on pages 22 through 28 of this report.,"('Employee_Engagement_Inclusion_And_Diversity', 0.9752933382987976)","('Employee_Health_And_Safety', 0.002031901618465781)","('Human_Rights_And_Community_Relations', 0.0017614855896681547)","(['Talent Attraction & Retention'], 0.9752933382987976)","('NON-ESG', 0.002031901618465781)","('NON-ESG', 0.0017614855896681547)"
Line 784,"Build resilient infrastructure, promote inclusive and sustainable industrialization and foster innovation.","('Business_Model_Resilience', 0.8743754029273987)","('Product_Design_And_Lifecycle_Management', 0.013518827967345715)","('Physical_Impacts_Of_Climate_Change', 0.012638662941753864)","(['Human Capital Development', 'Innovation Management'], 0.8743754029273987)","('NON-ESG', 0.013518827967345715)","('NON-ESG', 0.012638662941753864)"
Line 785,One of the pillars of our growth strategy is high-impact innovation through which we deliver groundbreaking technologies.,"('Product_Design_And_Lifecycle_Management', 0.65324866771698)","('Business_Model_Resilience', 0.08799721300601959)","('Supply_Chain_Management', 0.03919151797890663)","([], 0.65324866771698)","('NON-ESG', 0.08799721300601959)","('NON-ESG', 0.03919151797890663)"
