,Sentence,ESG BERT Topic 1,ESG BERT Topic 2,ESG BERT Topic 3,Mapped Criteria Topic 1,Mapped Criteria Topic 2,Mapped Criteria Topic 3
Line 490,Thermo Fishers ability to supply and support labs in over 100 developing countries makes them a key partner for us in addressing public health needs.,"('Access_And_Affordability', 0.6769303679466248)","('Critical_Incident_Risk_Management', 0.06124025583267212)","('Human_Rights_And_Community_Relations', 0.057296376675367355)","([], 0.6769303679466248)","('NON-ESG', 0.06124025583267212)","('NON-ESG', 0.057296376675367355)"
Line 491,"Alan Staple Vice President & Head of Global Markets Team, Clinton Health Access Initiative 38In-kind support Our product donation program amplifies our STEM and GHE initiatives worldwide.","('Product_Design_And_Lifecycle_Management', 0.7226580381393433)","('Selling_Practices_And_Product_Labeling', 0.07009799778461456)","('Customer_Welfare', 0.055553924292325974)","([], 0.7226580381393433)","('NON-ESG', 0.07009799778461456)","('NON-ESG', 0.055553924292325974)"
Line 492,"In 2021, key in-kind donations were valued at $22 million and largely benefited the US and Asia-Pacific region.","('Management_Of_Legal_And_Regulatory_Framework', 0.7220891714096069)","('Human_Rights_And_Community_Relations', 0.06204329803586006)","('Access_And_Affordability', 0.032949298620224)","([], 0.7220891714096069)","('NON-ESG', 0.06204329803586006)","('NON-ESG', 0.032949298620224)"
Line 493,"Through our collaboration with the Clinton Health Access Initiative, Thermo Fisher supported the in-kind distribution of more than 400,000 COVID-19 test kits in Vietnam, Cambodia, Senegal and Mozambique.","('Access_And_Affordability', 0.8500576019287109)","('Product_Quality_And_Safety', 0.02571745589375496)","('Customer_Welfare', 0.011613214388489723)","([], 0.8500576019287109)","('NON-ESG', 0.02571745589375496)","('NON-ESG', 0.011613214388489723)"
Line 494,"To read more about our community impact strategy, please visit our CSR webpage .","('Human_Rights_And_Community_Relations', 0.8763294816017151)","('Business_Model_Resilience', 0.020142875611782074)","('Access_And_Affordability', 0.013215607963502407)","([], 0.8763294816017151)","('NON-ESG', 0.020142875611782074)","('NON-ESG', 0.013215607963502407)"
Line 495,"Responding to COVID-19 in India In the spring of 2021, Thermo Fisher quickly responded to support our colleagues and the citizens of India as the COVID-19 virus surged throughout the country.","('Data_Security', 0.21303771436214447)","('Physical_Impacts_Of_Climate_Change', 0.16469138860702515)","('Systemic_Risk_Management', 0.07574526220560074)","('NON-ESG', 0.21303771436214447)","('NON-ESG', 0.16469138860702515)","('NON-ESG', 0.07574526220560074)"
Line 496,We took a holistic approach in supporting the local response to this unprecedented health crisis.,"('Critical_Incident_Risk_Management', 0.9235652089118958)","('Employee_Health_And_Safety', 0.018186094239354134)","('Access_And_Affordability', 0.010241973213851452)","(['Risk & Crisis Management'], 0.9235652089118958)","('NON-ESG', 0.018186094239354134)","('NON-ESG', 0.010241973213851452)"
Line 497,Our first priority was the well-being of our in-country colleagues.,"('Human_Rights_And_Community_Relations', 0.6858759522438049)","('Access_And_Affordability', 0.11991413682699203)","('Employee_Health_And_Safety', 0.04076956957578659)","([], 0.6858759522438049)","('NON-ESG', 0.11991413682699203)","('NON-ESG', 0.04076956957578659)"
Line 498,"As we addressed their needs, our facility in Bengaluru also ramped up production of a COVID-19 test we had previously launched specifically for India as part of our global health equity work.","('Access_And_Affordability', 0.6767197251319885)","('Product_Quality_And_Safety', 0.0353771448135376)","('Customer_Welfare', 0.030505288392305374)","([], 0.6767197251319885)","('NON-ESG', 0.0353771448135376)","('NON-ESG', 0.030505288392305374)"
Line 499,"To help strengthen broader community systems, we directed more than $1 million in philanthropic support to local nongovernmental and nonprofit organizations that directly served those affected by the second wave of the virus.","('Human_Rights_And_Community_Relations', 0.7670807838439941)","('Access_And_Affordability', 0.12753072381019592)","('Management_Of_Legal_And_Regulatory_Framework', 0.01126413606107235)","([], 0.7670807838439941)","('NON-ESG', 0.12753072381019592)","('NON-ESG', 0.01126413606107235)"
Line 500,"And because our products and expertise are our most valuable assets to the pandemic response, we provided an additional $9 million in COVID-19 testing products, personal protective equipment and other critical supplies.","('Product_Design_And_Lifecycle_Management', 0.7241916060447693)","('Employee_Health_And_Safety', 0.04698663577437401)","('Product_Quality_And_Safety', 0.04046594724059105)","([], 0.7241916060447693)","('NON-ESG', 0.04698663577437401)","('NON-ESG', 0.04046594724059105)"
Line 501,A special component of our humanitarian response was our collaboration with our global colleagues.,"('Critical_Incident_Risk_Management', 0.9225565195083618)","('Human_Rights_And_Community_Relations', 0.01216243114322424)","('Employee_Health_And_Safety', 0.010718956589698792)","(['Risk & Crisis Management'], 0.9225565195083618)","('NON-ESG', 0.01216243114322424)","('NON-ESG', 0.010718956589698792)"
Line 502,"In response to their compassion and eagerness to help, we established an internal India COVID Relief Fund through which colleagues could support vetted nonprofits responding on the frontlines.","('Human_Rights_And_Community_Relations', 0.36943259835243225)","('Employee_Health_And_Safety', 0.16829238831996918)","('Access_And_Affordability', 0.13252569735050201)","('NON-ESG', 0.36943259835243225)","('NON-ESG', 0.16829238831996918)","('NON-ESG', 0.13252569735050201)"
Line 503,"As a Company, we amplified their generous donations with a 200% match, contributing another $250,000 to the funds raised.","('Management_Of_Legal_And_Regulatory_Framework', 0.5257670879364014)","('Director_Removal', 0.06861858814954758)","('Human_Rights_And_Community_Relations', 0.055549416691064835)","([], 0.5257670879364014)","('NON-ESG', 0.06861858814954758)","('NON-ESG', 0.055549416691064835)"
Line 504,Feature storyUnited States The Just Project is our US-based health equity initiative supporting Black communities disproportionately impacted by the pandemic.,"('Access_And_Affordability', 0.5474469661712646)","('Human_Rights_And_Community_Relations', 0.10853548347949982)","('Employee_Health_And_Safety', 0.06766510754823685)","([], 0.5474469661712646)","('NON-ESG', 0.10853548347949982)","('NON-ESG', 0.06766510754823685)"
Line 505,"Through this initiative, we provided comprehensive support to establish a robust and sustainable lab network that now allows over 60 HBCUs to provide students and faculty with free COVID-19 testing directly.","('Access_And_Affordability', 0.6509041786193848)","('Employee_Engagement_Inclusion_And_Diversity', 0.046468980610370636)","('Product_Quality_And_Safety', 0.03359229117631912)","([], 0.6509041786193848)","('NON-ESG', 0.046468980610370636)","('NON-ESG', 0.03359229117631912)"
Line 506,"These labs, certified in line with national quality regulatory requirements, have the potential to support evolving diagnostic needs and scientific research programs well into the future.","('Management_Of_Legal_And_Regulatory_Framework', 0.7524684071540833)","('Access_And_Affordability', 0.058862749487161636)","('Product_Quality_And_Safety', 0.040459517389535904)","([], 0.7524684071540833)","('NON-ESG', 0.058862749487161636)","('NON-ESG', 0.040459517389535904)"
Line 507,"In 2021, we extended our support of the Just Project for another school year, bringing our commitment to more than $30 million in donated diagnostic instruments, test kits and related supplies since we launched in 2020.","('Access_And_Affordability', 0.17003516852855682)","('Product_Design_And_Lifecycle_Management', 0.14381633698940277)","('Energy_Management', 0.09337984770536423)","('NON-ESG', 0.17003516852855682)","('NON-ESG', 0.14381633698940277)","('NON-ESG', 0.09337984770536423)"
Line 508,"Honduras In 2021, the United States Agency for International Development notified us that our donation of Applied Biosystems TaqPath COVID-19 CE-IVD kits to Honduras was at risk of being underutilized because many of the technicians in the countrys public laboratory network lacked access to quality training.","('Employee_Engagement_Inclusion_And_Diversity', 0.3131681978702545)","('Access_And_Affordability', 0.14558762311935425)","('Product_Quality_And_Safety', 0.10730855911970139)","('NON-ESG', 0.3131681978702545)","('NON-ESG', 0.14558762311935425)","('NON-ESG', 0.10730855911970139)"
Line 509,We stepped in to provide in-person training and 24/7 remote support that ensured labs remained operational and empowered technicians to perform and transfer knowledge independently.,"('Employee_Engagement_Inclusion_And_Diversity', 0.36693087220191956)","('Employee_Health_And_Safety', 0.13111302256584167)","('Access_And_Affordability', 0.12229762226343155)","('NON-ESG', 0.36693087220191956)","('NON-ESG', 0.13111302256584167)","('NON-ESG', 0.12229762226343155)"
Line 510,"As a result, over 200,000 tests were performed, and this engagement has paved the way for a deeper partnership with the public laboratory network of Honduras, establishing a collaboration that will extend beyond the pandemic.","('Access_And_Affordability', 0.17658883333206177)","('Physical_Impacts_Of_Climate_Change', 0.12428683787584305)","('Air_Quality', 0.10227896273136139)","('NON-ESG', 0.17658883333206177)","('NON-ESG', 0.12428683787584305)","('NON-ESG', 0.10227896273136139)"
Line 511,"Pasteur Institute in Ho Chi Minh City, Vietnam: 270,000 tests National Institute of Public Health, Cambodia: 24,000 tests Central de Medicamentos e Artigos Medicos National Institute of Health, Mozambique: 40,000 tests Ministry of Health, Senegal: 70,000 tests $22Min total in-kind donations22 38Environment At Thermo Fisher, we recognize the inextricable link between a healthy planet and healthy people.","('Access_And_Affordability', 0.34453511238098145)","('Employee_Health_And_Safety', 0.17195840179920197)","('Human_Rights_And_Community_Relations', 0.1160045713186264)","('NON-ESG', 0.34453511238098145)","('NON-ESG', 0.17195840179920197)","('NON-ESG', 0.1160045713186264)"
Line 512,"As the world leader in serving science, we support the urgent calls for action from scientists around the world to address climate change.","('Physical_Impacts_Of_Climate_Change', 0.9487834572792053)","('Business_Model_Resilience', 0.009119037538766861)","('GHG_Emissions', 0.006459505297243595)","(['Climate Strategy'], 0.9487834572792053)","('NON-ESG', 0.009119037538766861)","('NON-ESG', 0.006459505297243595)"
Line 513,"Our approach to the environment goes hand in hand with our Mission to enable our customers to make the world healthier, cleaner and safer.","('Product_Design_And_Lifecycle_Management', 0.46498048305511475)","('Product_Quality_And_Safety', 0.1313779056072235)","('Employee_Health_And_Safety', 0.11401454359292984)","('NON-ESG', 0.46498048305511475)","('NON-ESG', 0.1313779056072235)","('NON-ESG', 0.11401454359292984)"
Line 514,We leverage our culture of continuous improvement and the 4i Values embodied by our colleagues to identify and deliver new solutions through our operations and value chain.,"('Business_Model_Resilience', 0.7497237324714661)","('Supply_Chain_Management', 0.05168504640460014)","('Product_Design_And_Lifecycle_Management', 0.04220219701528549)","(['Human Capital Development', 'Innovation Management'], 0.7497237324714661)","('NON-ESG', 0.05168504640460014)","('NON-ESG', 0.04220219701528549)"
Line 515,"While working to reduce our impact on the planet, we are also actively supporting the sustainability ambitions of our customers with a focus on: 04 Climate Product designWater Waste40 2021 Corporate Social Responsibility Report thermofisher.com/csrClimate The worlds leading scientists have sent a clear message that urgent action is needed to avoid the worst impacts of climate change.","('Physical_Impacts_Of_Climate_Change', 0.9381456971168518)","('Business_Model_Resilience', 0.012032060883939266)","('GHG_Emissions', 0.005710600409656763)","(['Climate Strategy'], 0.9381456971168518)","('NON-ESG', 0.012032060883939266)","('NON-ESG', 0.005710600409656763)"
Line 516,"In 2021, we announced our commitment to becoming net-zero by 2050 and joined the Business Ambition for 1.5C campaign led by the Science Based Targets initiative.","('Business_Model_Resilience', 0.3477391302585602)","('GHG_Emissions', 0.1678687185049057)","('Energy_Management', 0.06416432559490204)","('NON-ESG', 0.3477391302585602)","('NON-ESG', 0.1678687185049057)","('NON-ESG', 0.06416432559490204)"
Line 517,"This aligns our climate strategy and goals with the Paris Agreement, expanding on our existing 2030 target to reduce Scope 1 and 2 emissions by 30% compared to 2018.","('Physical_Impacts_Of_Climate_Change', 0.48439499735832214)","('GHG_Emissions', 0.29675862193107605)","('Business_Model_Resilience', 0.051281657069921494)","('NON-ESG', 0.48439499735832214)","('NON-ESG', 0.29675862193107605)","('NON-ESG', 0.051281657069921494)"
Line 518,"To round out our approach, we also established a near-term target for our indirect Scope 3 emissions.","('GHG_Emissions', 0.8679425120353699)","('Air_Quality', 0.05024139955639839)","('Energy_Management', 0.017425350844860077)","(['Operational Eco-Efficiency'], 0.8679425120353699)","('NON-ESG', 0.05024139955639839)","('NON-ESG', 0.017425350844860077)"
Line 519,"Investing in a high-impact plan Making 2021 even more transformative, we enhanced strategic investments in staffing, reevaluating and resourcing our climate program to support the design and implementation of our net-zero roadmap.","('Physical_Impacts_Of_Climate_Change', 0.5931148529052734)","('Business_Model_Resilience', 0.2527320384979248)","('Systemic_Risk_Management', 0.018901392817497253)","(['Climate Strategy'], 0.5931148529052734)","('NON-ESG', 0.2527320384979248)","('NON-ESG', 0.018901392817497253)"
Line 520,"As this roadmap continues to develop, we are supporting a strategic mix of emissions reduction actions that will deliver a positive impact at scale.","('GHG_Emissions', 0.708423376083374)","('Air_Quality', 0.12782737612724304)","('Energy_Management', 0.052296996116638184)","(['Operational Eco-Efficiency'], 0.708423376083374)","('NON-ESG', 0.12782737612724304)","('NON-ESG', 0.052296996116638184)"
Line 521,"The key components of our framework include: Energy & emissions Scope 1 and Scope 2 emissions In 2021, we achieved a 12% reduction in absolute Scope 1 and Scope 2 emissions compared to our 2018 baseline.","('GHG_Emissions', 0.7873373627662659)","('Air_Quality', 0.1249958723783493)","('Energy_Management', 0.015533346682786942)","(['Operational Eco-Efficiency'], 0.7873373627662659)","('NON-ESG', 0.1249958723783493)","('NON-ESG', 0.015533346682786942)"
Line 522,This progress places us ahead of schedule toward our 2030 target despite the considerable expansion of our global capacity and infrastructure throughout 2020 and 2021.,"('Business_Model_Resilience', 0.22776708006858826)","('Energy_Management', 0.13281811773777008)","('Management_Of_Legal_And_Regulatory_Framework', 0.12429605424404144)","('NON-ESG', 0.22776708006858826)","('NON-ESG', 0.13281811773777008)","('NON-ESG', 0.12429605424404144)"
Line 523,"Over the past year of operational growth alone, our Scope 1 and Scope 2 carbon intensity equalled 16 metric tons of carbon dioxide per million USD in revenue, down from 19 in 2020 and 27 prior to the pandemic.","('GHG_Emissions', 0.865029513835907)","('Energy_Management', 0.02170768566429615)","('Management_Of_Legal_And_Regulatory_Framework', 0.0189609844237566)","(['Operational Eco-Efficiency'], 0.865029513835907)","('NON-ESG', 0.02170768566429615)","('NON-ESG', 0.0189609844237566)"
Line 524,Increased procurement of renewable electricity was the primary driver of these reductions.,"('Energy_Management', 0.9178791046142578)","('Management_Of_Legal_And_Regulatory_Framework', 0.03511722758412361)","('GHG_Emissions', 0.006036654580384493)","(['Operational Eco-Efficiency'], 0.9178791046142578)","('NON-ESG', 0.03511722758412361)","('NON-ESG', 0.006036654580384493)"
Line 525,See the Data summary for a complete list of indicators.,"('Systemic_Risk_Management', 0.3883202373981476)","('Management_Of_Legal_And_Regulatory_Framework', 0.1497161090373993)","('Access_And_Affordability', 0.047015730291604996)","('NON-ESG', 0.3883202373981476)","('NON-ESG', 0.1497161090373993)","('NON-ESG', 0.047015730291604996)"
Line 526,"In 2021, we completed energy assessments at our largest manufacturing facilities that represent 40% of our Scope 1 and Scope 2 footprint.","('Energy_Management', 0.8603643774986267)","('Supply_Chain_Management', 0.02599426545202732)","('Product_Design_And_Lifecycle_Management', 0.02297379821538925)","(['Operational Eco-Efficiency'], 0.8603643774986267)","('NON-ESG', 0.02599426545202732)","('NON-ESG', 0.02297379821538925)"
Line 527,"The findings uncovered opportunities to eliminate over 80,000 metric tons of carbon dioxide, approximately 25% of our fossil fuel- related emissions.","('GHG_Emissions', 0.8573192954063416)","('Air_Quality', 0.047964345663785934)","('Energy_Management', 0.02176007628440857)","(['Operational Eco-Efficiency'], 0.8573192954063416)","('NON-ESG', 0.047964345663785934)","('NON-ESG', 0.02176007628440857)"
Line 528,"Over the coming year, several of these projects will be implemented and additional site energy assessments completed to plan our Transitioning away from fossil fuels and high- impact refrigerants in our operationsEngaging with our suppliers to amplify collective progressSourcing renewable electricity across our operations transition away from fossil fuels.","('Energy_Management', 0.9523411989212036)","('Management_Of_Legal_And_Regulatory_Framework', 0.007761348504573107)","('Product_Design_And_Lifecycle_Management', 0.004943466279655695)","(['Operational Eco-Efficiency'], 0.9523411989212036)","('NON-ESG', 0.007761348504573107)","('NON-ESG', 0.004943466279655695)"
Line 529,Renewable electricity procurement is critical to our near-term strategy.,"('Energy_Management', 0.8799392580986023)","('Supply_Chain_Management', 0.01964144967496395)","('Management_Of_Legal_And_Regulatory_Framework', 0.016082610934972763)","(['Operational Eco-Efficiency'], 0.8799392580986023)","('NON-ESG', 0.01964144967496395)","('NON-ESG', 0.016082610934972763)"
Line 530,"We achieved a new record in 2021, with 22% of global electricity coming from renewable sources, a 69% increase over the prior year.","('Energy_Management', 0.9627314209938049)","('Management_Of_Legal_And_Regulatory_Framework', 0.008671761490404606)","('Water_And_Wastewater_Management', 0.002714849542826414)","(['Operational Eco-Efficiency'], 0.9627314209938049)","('NON-ESG', 0.008671761490404606)","('NON-ESG', 0.002714849542826414)"
Line 531,More than 60 Thermo Fisher sites have now achieved 100% renewable electricity.,"('Energy_Management', 0.9656539559364319)","('Management_Of_Legal_And_Regulatory_Framework', 0.006893547251820564)","('GHG_Emissions', 0.0028863102197647095)","(['Operational Eco-Efficiency'], 0.9656539559364319)","('NON-ESG', 0.006893547251820564)","('NON-ESG', 0.0028863102197647095)"
Line 532,Our approach is centered around the concept of additionalityor directly supporting the development of new renewable generation sources.,"('Energy_Management', 0.8934876322746277)","('Product_Design_And_Lifecycle_Management', 0.033610958606004715)","('Management_Of_Legal_And_Regulatory_Framework', 0.010524151846766472)","(['Operational Eco-Efficiency'], 0.8934876322746277)","('NON-ESG', 0.033610958606004715)","('NON-ESG', 0.010524151846766472)"
Line 533,We do this by adding renewable systems at our sites and leveraging long- term power purchasing agreements (PPAs) Scope 1 and 2 emissions23 2021 2020 2019 2018 0 3012%12%2030 target % reduction from 2018 baseline0%1%with new wind and solar facilities.,"('Energy_Management', 0.7049993276596069)","('GHG_Emissions', 0.11283985525369644)","('Management_Of_Legal_And_Regulatory_Framework', 0.07203274965286255)","(['Operational Eco-Efficiency'], 0.7049993276596069)","('NON-ESG', 0.11283985525369644)","('NON-ESG', 0.07203274965286255)"
Line 534,"As part of our strategy, we have registered with the Energize program .","('Business_Model_Resilience', 0.3663777709007263)","('Management_Of_Legal_And_Regulatory_Framework', 0.11428353935480118)","('Access_And_Affordability', 0.07520810514688492)","('NON-ESG', 0.3663777709007263)","('NON-ESG', 0.11428353935480118)","('NON-ESG', 0.07520810514688492)"
Line 535,"Energize is a unique, sector-wide initiative aiming to increase access to renewable energy within the pharmaceutical supply chain.","('Energy_Management', 0.9328871369361877)","('Supply_Chain_Management', 0.018425583839416504)","('Product_Design_And_Lifecycle_Management', 0.006537002976983786)","(['Operational Eco-Efficiency'], 0.9328871369361877)","('NON-ESG', 0.018425583839416504)","('NON-ESG', 0.006537002976983786)"
Line 536,"By 2030 , reduce greenhouse gas emissions by 30% from 2018 baselineScope 1 By 2027 , 90% of suppliers by spend set science- based targets By 2050 , achieve net-zero emissionsScope 2 Scope 3Our climate goals41In 2021, we announced our first fossil fuel-free manufacturing facility in Germering, Germany.","('GHG_Emissions', 0.965796947479248)","('Air_Quality', 0.0068540628999471664)","('Ecological_Impacts', 0.002847340889275074)","(['Operational Eco-Efficiency'], 0.965796947479248)","('NON-ESG', 0.0068540628999471664)","('NON-ESG', 0.002847340889275074)"
Line 537,"Best explained by site leader Omar Castillo, [Operating without fossil fuels] is a result of many steps we took over a period of several years.","('Energy_Management', 0.877449095249176)","('GHG_Emissions', 0.01600128784775734)","('Management_Of_Legal_And_Regulatory_Framework', 0.01587163284420967)","(['Operational Eco-Efficiency'], 0.877449095249176)","('NON-ESG', 0.01600128784775734)","('NON-ESG', 0.01587163284420967)"
Line 538,"Over the last decade, Omar and his team examined where they could leverage opportunities to make the facility more energy efficient and environmentally friendly.","('Energy_Management', 0.9465732574462891)","('Product_Design_And_Lifecycle_Management', 0.012205680832266808)","('Management_Of_Legal_And_Regulatory_Framework', 0.004592144396156073)","(['Operational Eco-Efficiency'], 0.9465732574462891)","('NON-ESG', 0.012205680832266808)","('NON-ESG', 0.004592144396156073)"
Line 539,"To eliminate fossil fuels entirely, they used several readily available technologies to achieve their goal, including geothermal heating and cooling, heat recovery and a rooftop solar system.","('Energy_Management', 0.9723023772239685)","('Product_Design_And_Lifecycle_Management', 0.003184097120538354)","('Water_And_Wastewater_Management', 0.002384965308010578)","(['Operational Eco-Efficiency'], 0.9723023772239685)","('NON-ESG', 0.003184097120538354)","('NON-ESG', 0.002384965308010578)"
Line 540,"Last year the electricity supply was transitioned to 100% renewables, meaning the facility now generates zero greenhouse gas emissions.","('GHG_Emissions', 0.9693487286567688)","('Ecological_Impacts', 0.004660129547119141)","('Management_Of_Legal_And_Regulatory_Framework', 0.002774786902591586)","(['Operational Eco-Efficiency'], 0.9693487286567688)","('NON-ESG', 0.004660129547119141)","('NON-ESG', 0.002774786902591586)"
Line 541,"For Thermo Fisher, this achievement demonstrates that operating without fossil fuels is possible in a manufacturing setting.","('Energy_Management', 0.8785860538482666)","('Product_Design_And_Lifecycle_Management', 0.02100873365998268)","('GHG_Emissions', 0.012865145690739155)","(['Operational Eco-Efficiency'], 0.8785860538482666)","('NON-ESG', 0.02100873365998268)","('NON-ESG', 0.012865145690739155)"
Line 542,The work completed by the Germering team has been shared with other facilities across the globe to further accelerate the Companys plans to achieve net-zero.,"('Energy_Management', 0.18475890159606934)","('Supply_Chain_Management', 0.1012103408575058)","('Business_Model_Resilience', 0.09606421738862991)","('NON-ESG', 0.18475890159606934)","('NON-ESG', 0.1012103408575058)","('NON-ESG', 0.09606421738862991)"
Line 543,The Germering team has already set their sights on another goal.,"('Business_Model_Resilience', 0.3501306176185608)","('Systemic_Risk_Management', 0.09417146444320679)","('Competitive_Behavior', 0.0649542436003685)","('NON-ESG', 0.3501306176185608)","('NON-ESG', 0.09417146444320679)","('NON-ESG', 0.0649542436003685)"
Line 544,"The next steps involve making our products and logistics more environmentally sustainable, said Omar.","('Product_Design_And_Lifecycle_Management', 0.9632079601287842)","('Product_Quality_And_Safety', 0.003844842314720154)","('Business_Model_Resilience', 0.0026500674430280924)","([], 0.9632079601287842)","('NON-ESG', 0.003844842314720154)","('NON-ESG', 0.0026500674430280924)"
Line 545,"This includes, for example, procurement of environmentally preferable parts for manufacturing, energy-efficient product transportation and recyclable products.","('Product_Design_And_Lifecycle_Management', 0.9642337560653687)","('Energy_Management', 0.004543277435004711)","('Product_Quality_And_Safety', 0.0032047724816948175)","([], 0.9642337560653687)","('NON-ESG', 0.004543277435004711)","('NON-ESG', 0.0032047724816948175)"
