,Sentence,ESG BERT Topic 1,ESG BERT Topic 2,ESG BERT Topic 3,Mapped Criteria Topic 1,Mapped Criteria Topic 2,Mapped Criteria Topic 3
Line 262,We are dedicated to fostering and cultivating robust processes and practices around: 22 2021 Corporate Social Responsibility Report thermofisher.com/csrDiversity & inclusionOur incredible global team Our colleagues are our greatest advantage.,"('Human_Rights_And_Community_Relations', 0.936790943145752)","('Business_Model_Resilience', 0.006102462764829397)","('Access_And_Affordability', 0.005218966398388147)","([], 0.936790943145752)","('NON-ESG', 0.006102462764829397)","('NON-ESG', 0.005218966398388147)"
Line 263,"They bring remarkable talent and dedication to their work each day, and the past two years have been no different.","('Employee_Engagement_Inclusion_And_Diversity', 0.4798647463321686)","('Human_Rights_And_Community_Relations', 0.06032068282365799)","('Employee_Health_And_Safety', 0.05888501927256584)","('NON-ESG', 0.4798647463321686)","('NON-ESG', 0.06032068282365799)","('NON-ESG', 0.05888501927256584)"
Line 264,"Throughout the pandemic, the commitment of our colleagues has allowed Thermo Fisher to continue to meet customer needs and accelerate our Companys growth.","('Business_Model_Resilience', 0.21694700419902802)","('Systemic_Risk_Management', 0.18330968916416168)","('Physical_Impacts_Of_Climate_Change', 0.127164825797081)","('NON-ESG', 0.21694700419902802)","('NON-ESG', 0.18330968916416168)","('NON-ESG', 0.127164825797081)"
Line 265,Our success would not have been possible without every colleagues contributions to making a positive impact on the world.,"('Human_Rights_And_Community_Relations', 0.6187108755111694)","('Business_Model_Resilience', 0.0712917372584343)","('Access_And_Affordability', 0.045389093458652496)","([], 0.6187108755111694)","('NON-ESG', 0.0712917372584343)","('NON-ESG', 0.045389093458652496)"
Line 266,"To acknowledge this, we have invested more than $1 billion in special Pandemic Response Recognition Payments throughout 2020 and 2021.","('Physical_Impacts_Of_Climate_Change', 0.3965475559234619)","('Critical_Incident_Risk_Management', 0.29739853739738464)","('Systemic_Risk_Management', 0.053686972707509995)","('NON-ESG', 0.3965475559234619)","('NON-ESG', 0.29739853739738464)","('NON-ESG', 0.053686972707509995)"
Line 267,"Excluding our most senior leaders, all colleagues were issued cash awards in March, July and October 2021 with amounts based on a percentage of base pay.","('Labor_Practices', 0.6517434120178223)","('Management_Of_Legal_And_Regulatory_Framework', 0.1324792355298996)","('Business_Ethics', 0.06447850912809372)","([], 0.6517434120178223)","('NON-ESG', 0.1324792355298996)","('NON-ESG', 0.06447850912809372)"
Line 268,"Additionally, colleagues at certain organizational levels were granted a stock option award.","('Employee_Engagement_Inclusion_And_Diversity', 0.19658386707305908)","('Competitive_Behavior', 0.16041387617588043)","('Labor_Practices', 0.15263712406158447)","('NON-ESG', 0.19658386707305908)","('NON-ESG', 0.16041387617588043)","('NON-ESG', 0.15263712406158447)"
Line 269,"Our success as a Company is directly connected to our ability to attract and retain the best and brightest talent, welcoming them to a work environment where colleague differences are celebrated and supported.","('Employee_Engagement_Inclusion_And_Diversity', 0.8750007152557373)","('Business_Model_Resilience', 0.011317325755953789)","('Employee_Health_And_Safety', 0.008919467218220234)","(['Talent Attraction & Retention'], 0.8750007152557373)","('NON-ESG', 0.011317325755953789)","('NON-ESG', 0.008919467218220234)"
Line 270,"By actively fostering an inclusive workplace culture, our colleagues feel they belong, which empowers them to contribute, collaborate and innovate.","('Employee_Engagement_Inclusion_And_Diversity', 0.9354270696640015)","('Human_Rights_And_Community_Relations', 0.012671532109379768)","('Employee_Health_And_Safety', 0.006837819702923298)","(['Talent Attraction & Retention'], 0.9354270696640015)","('NON-ESG', 0.012671532109379768)","('NON-ESG', 0.006837819702923298)"
Line 271,"To continue solving the worlds greatest challenges, we must reflect the diversity of our communities, customers and suppliers.","('Supply_Chain_Management', 0.7384589314460754)","('Employee_Engagement_Inclusion_And_Diversity', 0.04429010674357414)","('Product_Design_And_Lifecycle_Management', 0.037255819886922836)","(['Supply Chain Management'], 0.7384589314460754)","('NON-ESG', 0.04429010674357414)","('NON-ESG', 0.037255819886922836)"
Line 272,"In striving to elevate the voices of all colleagues, we are also committed to facilitating access to the resources, programs and internal Company networks that will nurture their individual success.","('Human_Rights_And_Community_Relations', 0.26725009083747864)","('Access_And_Affordability', 0.15647661685943604)","('Employee_Engagement_Inclusion_And_Diversity', 0.13529586791992188)","('NON-ESG', 0.26725009083747864)","('NON-ESG', 0.15647661685943604)","('NON-ESG', 0.13529586791992188)"
Line 273,"Our diversity & inclusion (D&I) strategy is embedded in every stage of the colleague experiencefrom recruiting and hiring to training, development and long-term career and succession planning.","('Employee_Engagement_Inclusion_And_Diversity', 0.9739809036254883)","('Employee_Health_And_Safety', 0.00195785122923553)","('Business_Model_Resilience', 0.0018283488461747766)","(['Talent Attraction & Retention'], 0.9739809036254883)","('NON-ESG', 0.00195785122923553)","('NON-ESG', 0.0018283488461747766)"
Line 274,"The strategic framework that guides our progress fosters an inclusive organizational culture, reinforces our infrastructure to ensure equitable practices and activates personal accountability for all to contribute to our success.","('Employee_Engagement_Inclusion_And_Diversity', 0.5504463911056519)","('Human_Rights_And_Community_Relations', 0.19115018844604492)","('Business_Model_Resilience', 0.04410420358181)","(['Talent Attraction & Retention'], 0.5504463911056519)","('NON-ESG', 0.19115018844604492)","('NON-ESG', 0.04410420358181)"
Line 275,"Lisa Britt Senior Vice President, Chief Human Resources Officer, Thermo Fisher ScientificWe are so thankful for our incredible global team.","('Business_Model_Resilience', 0.4159688651561737)","('Supply_Chain_Management', 0.0913754254579544)","('Employee_Engagement_Inclusion_And_Diversity', 0.07564081251621246)","('NON-ESG', 0.4159688651561737)","('NON-ESG', 0.0913754254579544)","('NON-ESG', 0.07564081251621246)"
Line 276,The special recognition payments we provided to our colleagues are an acknowledgment of the extraordinary role they have played in enabling our customers and driving Company performance throughout the pandemic.,"('Business_Model_Resilience', 0.31029701232910156)","('Systemic_Risk_Management', 0.30792051553726196)","('Human_Rights_And_Community_Relations', 0.06472058594226837)","('NON-ESG', 0.31029701232910156)","('NON-ESG', 0.30792051553726196)","('NON-ESG', 0.06472058594226837)"
Line 277,"The success they helped us achieve made it possible for us to make additional investments in our colleagues, celebrating their unwavering commitment to delivering on our Mission during an unprecedented time.","('Human_Rights_And_Community_Relations', 0.246648371219635)","('Business_Model_Resilience', 0.23978325724601746)","('Management_Of_Legal_And_Regulatory_Framework', 0.08319908380508423)","('NON-ESG', 0.246648371219635)","('NON-ESG', 0.23978325724601746)","('NON-ESG', 0.08319908380508423)"
Line 278,"91,770 colleagues globally102021 2020 2019 50.0% 33.4% 16.6%51.6% 32.8% 15.6%52.0% 32.3% 15.7%Colleague population by region Americas Europe, Middle East, Africa Asia Pacific23Five years of progress Our five-year D&I strategic plan has served as our roadmap and guided our progress since 2017.","('Business_Model_Resilience', 0.7656641602516174)","('Employee_Engagement_Inclusion_And_Diversity', 0.02814134769141674)","('Physical_Impacts_Of_Climate_Change', 0.02313491702079773)","(['Human Capital Development', 'Innovation Management'], 0.7656641602516174)","('NON-ESG', 0.02814134769141674)","('NON-ESG', 0.02313491702079773)"
Line 279,"Over this time, we have continued to strengthen our culture of inclusion, embracing diversity as an essential aspect of fulfilling our Mission.","('Employee_Engagement_Inclusion_And_Diversity', 0.9738156795501709)","('Human_Rights_And_Community_Relations', 0.002023949520662427)","('Employee_Health_And_Safety', 0.001997794024646282)","(['Talent Attraction & Retention'], 0.9738156795501709)","('NON-ESG', 0.002023949520662427)","('NON-ESG', 0.001997794024646282)"
Line 280,"Globally, we have increased the representation of women in executive management roles by 7.2% from 2017 to 2021.","('Employee_Engagement_Inclusion_And_Diversity', 0.9095430374145508)","('Labor_Practices', 0.020474806427955627)","('Director_Removal', 0.011321140453219414)","(['Talent Attraction & Retention'], 0.9095430374145508)","('NON-ESG', 0.020474806427955627)","('NON-ESG', 0.011321140453219414)"
Line 281,"Over the same period, US representation of women increased by 1% and racially and ethnically diverse colleagues by 6.2%, including in executive management roles by 8.9% and 2.3%, respectively.11B Representation11 Global colleague population US colleague population 2020 2021 Women in our total colleague population 41.3 %41.5 % Women in executive management roles11B30.2 %1235.1 % Women in leadership roles11A 37.1 %1238.3 % Racially and ethnically diverse people in our total colleague population 37.4 %1239.1 % Racially and ethnically diverse people in executive management roles11B 22.2 %1223.2 % Racially and ethnically diverse people in leadership roles11A 28.3 %1230.3 %Implemented improvements to the hiring process to achieve fairer outcomes by leveraging technology to reduce potential biasFrom 2017, increased US representation of racially and ethnically diverse colleagues in our workforce by 6.2%, including a 2.3% increase in executive management roles11B2021From 2017, increased global representation of women in executive management roles by 7.2%11B 2020Strengthened our culture by designing colleague education modules on the topics of unconscious bias and belonging, and by launching a program to facilitate manager-led discussions on racial inequities Invested in restructuring and scaling the D&I organization to embed experts within the different businesses and functions to support leaders in accelerating impact 2019Increased external partnerships to improve representation through initiatives focused on hiring and empowering diverse talent 2017Gained an enhanced understanding of the demographics of our workforce through tools like our annual Employee Involvement SurveyAdditional details on our D&I and talent indicators can be found in the Data summary .58.8% 40.4%57.6% 40.2%56.6% 40.5%From 2017, launched more than 150 new chapters of Business Resource Groups (formerly Employee Resource Groups), which create community and elevate the voices and perspectives of colleagues across the Company 2018Established targeted recruitment and development strategies to strengthen hiring and retention 2021 3.0% 2020 2.3% 2019 0.8%Male Female UndisclosedHighlights along our D&I journey From 2017, increased US representation of women in our workforce by 1%, including an 8.9% increase in executive management roles11B24 2021 Corporate Social Responsibility Report thermofisher.com/csrCulture Thermo Fishers 4i Values of Integrity, Intensity, Innovation and Involvement are the foundation of our culture and fundamental to our continued growth.","('Employee_Engagement_Inclusion_And_Diversity', 0.9745477437973022)","('Employee_Health_And_Safety', 0.0018337622750550508)","('Business_Model_Resilience', 0.0018235358875244856)","(['Talent Attraction & Retention'], 0.9745477437973022)","('NON-ESG', 0.0018337622750550508)","('NON-ESG', 0.0018235358875244856)"
Line 282,"Over the same period, US representation of women increased by 1% and racially and ethnically diverse colleagues by 6.2%, including in executive management roles by 8.9% and 2.3%, respectively.11B Representation11 Global colleague population US colleague population 2020 2021 Women in our total colleague population 41.3 %41.5 % Women in executive management roles11B30.2 %1235.1 % Women in leadership roles11A 37.1 %1238.3 % Racially and ethnically diverse people in our total colleague population 37.4 %1239.1 % Racially and ethnically diverse people in executive management roles11B 22.2 %1223.2 % Racially and ethnically diverse people in leadership roles11A 28.3 %1230.3 %Implemented improvements to the hiring process to achieve fairer outcomes by leveraging technology to reduce potential biasFrom 2017, increased US representation of racially and ethnically diverse colleagues in our workforce by 6.2%, including a 2.3% increase in executive management roles11B2021From 2017, increased global representation of women in executive management roles by 7.2%11B 2020Strengthened our culture by designing colleague education modules on the topics of unconscious bias and belonging, and by launching a program to facilitate manager-led discussions on racial inequities Invested in restructuring and scaling the D&I organization to embed experts within the different businesses and functions to support leaders in accelerating impact 2019Increased external partnerships to improve representation through initiatives focused on hiring and empowering diverse talent 2017Gained an enhanced understanding of the demographics of our workforce through tools like our annual Employee Involvement SurveyAdditional details on our D&I and talent indicators can be found in the Data summary .58.8% 40.4%57.6% 40.2%56.6% 40.5%From 2017, launched more than 150 new chapters of Business Resource Groups (formerly Employee Resource Groups), which create community and elevate the voices and perspectives of colleagues across the Company 2018Established targeted recruitment and development strategies to strengthen hiring and retention 2021 3.0% 2020 2.3% 2019 0.8%Male Female UndisclosedHighlights along our D&I journey From 2017, increased US representation of women in our workforce by 1%, including an 8.9% increase in executive management roles11B24 2021 Corporate Social Responsibility Report thermofisher.com/csrCulture Thermo Fishers 4i Values of Integrity, Intensity, Innovation and Involvement are the foundation of our culture and fundamental to our continued growth.","('Employee_Engagement_Inclusion_And_Diversity', 0.9763898849487305)","('Employee_Health_And_Safety', 0.0017872616881504655)","('Business_Model_Resilience', 0.0015889693750068545)","(['Talent Attraction & Retention'], 0.9763898849487305)","('NON-ESG', 0.0017872616881504655)","('NON-ESG', 0.0015889693750068545)"
Line 283,"Over the same period, US representation of women increased by 1% and racially and ethnically diverse colleagues by 6.2%, including in executive management roles by 8.9% and 2.3%, respectively.11B Representation11 Global colleague population US colleague population 2020 2021 Women in our total colleague population 41.3 %41.5 % Women in executive management roles11B30.2 %1235.1 % Women in leadership roles11A 37.1 %1238.3 % Racially and ethnically diverse people in our total colleague population 37.4 %1239.1 % Racially and ethnically diverse people in executive management roles11B 22.2 %1223.2 % Racially and ethnically diverse people in leadership roles11A 28.3 %1230.3 %Implemented improvements to the hiring process to achieve fairer outcomes by leveraging technology to reduce potential biasFrom 2017, increased US representation of racially and ethnically diverse colleagues in our workforce by 6.2%, including a 2.3% increase in executive management roles11B2021From 2017, increased global representation of women in executive management roles by 7.2%11B 2020Strengthened our culture by designing colleague education modules on the topics of unconscious bias and belonging, and by launching a program to facilitate manager-led discussions on racial inequities Invested in restructuring and scaling the D&I organization to embed experts within the different businesses and functions to support leaders in accelerating impact 2019Increased external partnerships to improve representation through initiatives focused on hiring and empowering diverse talent 2017Gained an enhanced understanding of the demographics of our workforce through tools like our annual Employee Involvement SurveyAdditional details on our D&I and talent indicators can be found in the Data summary .58.8% 40.4%57.6% 40.2%56.6% 40.5%From 2017, launched more than 150 new chapters of Business Resource Groups (formerly Employee Resource Groups), which create community and elevate the voices and perspectives of colleagues across the Company 2018Established targeted recruitment and development strategies to strengthen hiring and retention 2021 3.0% 2020 2.3% 2019 0.8%Male Female UndisclosedHighlights along our D&I journey From 2017, increased US representation of women in our workforce by 1%, including an 8.9% increase in executive management roles11B24 2021 Corporate Social Responsibility Report thermofisher.com/csrCulture Thermo Fishers 4i Values of Integrity, Intensity, Innovation and Involvement are the foundation of our culture and fundamental to our continued growth.","('Employee_Engagement_Inclusion_And_Diversity', 0.9624573588371277)","('Competitive_Behavior', 0.0033216369338333607)","('Business_Model_Resilience', 0.0031741501297801733)","(['Talent Attraction & Retention'], 0.9624573588371277)","('NON-ESG', 0.0033216369338333607)","('NON-ESG', 0.0031741501297801733)"
Line 284,"Over the same period, US representation of women increased by 1% and racially and ethnically diverse colleagues by 6.2%, including in executive management roles by 8.9% and 2.3%, respectively.11B Representation11 Global colleague population US colleague population 2020 2021 Women in our total colleague population 41.3 %41.5 % Women in executive management roles11B30.2 %1235.1 % Women in leadership roles11A 37.1 %1238.3 % Racially and ethnically diverse people in our total colleague population 37.4 %1239.1 % Racially and ethnically diverse people in executive management roles11B 22.2 %1223.2 % Racially and ethnically diverse people in leadership roles11A 28.3 %1230.3 %Implemented improvements to the hiring process to achieve fairer outcomes by leveraging technology to reduce potential biasFrom 2017, increased US representation of racially and ethnically diverse colleagues in our workforce by 6.2%, including a 2.3% increase in executive management roles11B2021From 2017, increased global representation of women in executive management roles by 7.2%11B 2020Strengthened our culture by designing colleague education modules on the topics of unconscious bias and belonging, and by launching a program to facilitate manager-led discussions on racial inequities Invested in restructuring and scaling the D&I organization to embed experts within the different businesses and functions to support leaders in accelerating impact 2019Increased external partnerships to improve representation through initiatives focused on hiring and empowering diverse talent 2017Gained an enhanced understanding of the demographics of our workforce through tools like our annual Employee Involvement SurveyAdditional details on our D&I and talent indicators can be found in the Data summary .58.8% 40.4%57.6% 40.2%56.6% 40.5%From 2017, launched more than 150 new chapters of Business Resource Groups (formerly Employee Resource Groups), which create community and elevate the voices and perspectives of colleagues across the Company 2018Established targeted recruitment and development strategies to strengthen hiring and retention 2021 3.0% 2020 2.3% 2019 0.8%Male Female UndisclosedHighlights along our D&I journey From 2017, increased US representation of women in our workforce by 1%, including an 8.9% increase in executive management roles11B24 2021 Corporate Social Responsibility Report thermofisher.com/csrCulture Thermo Fishers 4i Values of Integrity, Intensity, Innovation and Involvement are the foundation of our culture and fundamental to our continued growth.","('Employee_Engagement_Inclusion_And_Diversity', 0.9706450700759888)","('Employee_Health_And_Safety', 0.002732537453994155)","('Business_Model_Resilience', 0.002244017319753766)","(['Talent Attraction & Retention'], 0.9706450700759888)","('NON-ESG', 0.002732537453994155)","('NON-ESG', 0.002244017319753766)"
Line 285,"Over the same period, US representation of women increased by 1% and racially and ethnically diverse colleagues by 6.2%, including in executive management roles by 8.9% and 2.3%, respectively.11B Representation11 Global colleague population US colleague population 2020 2021 Women in our total colleague population 41.3 %41.5 % Women in executive management roles11B30.2 %1235.1 % Women in leadership roles11A 37.1 %1238.3 % Racially and ethnically diverse people in our total colleague population 37.4 %1239.1 % Racially and ethnically diverse people in executive management roles11B 22.2 %1223.2 % Racially and ethnically diverse people in leadership roles11A 28.3 %1230.3 %Implemented improvements to the hiring process to achieve fairer outcomes by leveraging technology to reduce potential biasFrom 2017, increased US representation of racially and ethnically diverse colleagues in our workforce by 6.2%, including a 2.3% increase in executive management roles11B2021From 2017, increased global representation of women in executive management roles by 7.2%11B 2020Strengthened our culture by designing colleague education modules on the topics of unconscious bias and belonging, and by launching a program to facilitate manager-led discussions on racial inequities Invested in restructuring and scaling the D&I organization to embed experts within the different businesses and functions to support leaders in accelerating impact 2019Increased external partnerships to improve representation through initiatives focused on hiring and empowering diverse talent 2017Gained an enhanced understanding of the demographics of our workforce through tools like our annual Employee Involvement SurveyAdditional details on our D&I and talent indicators can be found in the Data summary .58.8% 40.4%57.6% 40.2%56.6% 40.5%From 2017, launched more than 150 new chapters of Business Resource Groups (formerly Employee Resource Groups), which create community and elevate the voices and perspectives of colleagues across the Company 2018Established targeted recruitment and development strategies to strengthen hiring and retention 2021 3.0% 2020 2.3% 2019 0.8%Male Female UndisclosedHighlights along our D&I journey From 2017, increased US representation of women in our workforce by 1%, including an 8.9% increase in executive management roles11B24 2021 Corporate Social Responsibility Report thermofisher.com/csrCulture Thermo Fishers 4i Values of Integrity, Intensity, Innovation and Involvement are the foundation of our culture and fundamental to our continued growth.","('Employee_Engagement_Inclusion_And_Diversity', 0.6734411716461182)","('Human_Rights_And_Community_Relations', 0.11426765471696854)","('Business_Ethics', 0.030081825330853462)","(['Talent Attraction & Retention'], 0.6734411716461182)","('NON-ESG', 0.11426765471696854)","('NON-ESG', 0.030081825330853462)"
