,Sentence,ESG BERT Topic 1,ESG BERT Topic 2,ESG BERT Topic 3,Mapped Criteria Topic 1,Mapped Criteria Topic 2,Mapped Criteria Topic 3
Line 643,"Germany, Dallas and the Philippines virtually mentored and tutored students and showed them what its like to be an engineer at TI.","('Access_And_Affordability', 0.5148907899856567)","('Employee_Engagement_Inclusion_And_Diversity', 0.11986333131790161)","('Management_Of_Legal_And_Regulatory_Framework', 0.03273119032382965)","([], 0.5148907899856567)","('NON-ESG', 0.11986333131790161)","('NON-ESG', 0.03273119032382965)"
Line 644,Europe and Asia addressed environmental concerns and helped clean up parks and neighborhoods during World Cleanup Day.,"('Ecological_Impacts', 0.1702423244714737)","('Human_Rights_And_Community_Relations', 0.15926004946231842)","('Water_And_Wastewater_Management', 0.13751669228076935)","('NON-ESG', 0.1702423244714737)","('NON-ESG', 0.15926004946231842)","('NON-ESG', 0.13751669228076935)"
Line 645,"Human resources partnered with Girl Scouts of Northeast Texas to support the organizations increased emphasis on diversity and inclusion with three skills-based volunteering projects focused on recruiting, onboarding and employee engagement.","('Employee_Engagement_Inclusion_And_Diversity', 0.975011944770813)","('Employee_Health_And_Safety', 0.002063586376607418)","('Human_Rights_And_Community_Relations', 0.0020110877230763435)","(['Talent Attraction & Retention'], 0.975011944770813)","('NON-ESG', 0.002063586376607418)","('NON-ESG', 0.0020110877230763435)"
Line 646,"For more information about how we manage community citizenship, see Local communities and indicator 201-1 in the GRI Index and Education engagement.","('Human_Rights_And_Community_Relations', 0.9494046568870544)","('Employee_Engagement_Inclusion_And_Diversity', 0.004346574656665325)","('Access_And_Affordability', 0.0034952983260154724)","(['Environmental Policy & Management Systems'], 0.9494046568870544)","('NON-ESG', 0.004346574656665325)","('NON-ESG', 0.0034952983260154724)"
Line 647,"23 Values are based on Independent Sector, an independent organization that estimates the value of each volunteer hour in 2021 at $29.95.300 250 200 150 100 50 0Volunteer hoursThousands of hours 2017 2018 2019 2020 2021173.4234.6273.3 156.9 119.5 6 5 4 3 2 1 0Value of volunteer hours 2017 2018 2019 2020 2021$4.3$5.9$7.4 $4.5Million $78 $3.6Volunteering45 Texas Instruments 2022 2021 Corporate Citizenship Report TABLE OF CONTENTS CEO LETTER TI AT A GLANCE OUR COMMITMENT RESPONSIBLE BUSINESS PRACTICES WORKPLACE GIVING & VOLUNTEERING APPENDICES ENVIRONMENTAL SUSTAINABILITY Global week of impact TIs employee-led community involvement teams joined together during the holiday season, focused on gratitude and giving, to volunteer and give back to build stronger communities.","('Employee_Health_And_Safety', 0.26867440342903137)","('Labor_Practices', 0.107415109872818)","('Employee_Engagement_Inclusion_And_Diversity', 0.10195162892341614)","('NON-ESG', 0.26867440342903137)","('NON-ESG', 0.107415109872818)","('NON-ESG', 0.10195162892341614)"
Line 648,"23 Values are based on Independent Sector, an independent organization that estimates the value of each volunteer hour in 2021 at $29.95.300 250 200 150 100 50 0Volunteer hoursThousands of hours 2017 2018 2019 2020 2021173.4234.6273.3 156.9 119.5 6 5 4 3 2 1 0Value of volunteer hours 2017 2018 2019 2020 2021$4.3$5.9$7.4 $4.5Million $78 $3.6Volunteering45 Texas Instruments 2022 2021 Corporate Citizenship Report TABLE OF CONTENTS CEO LETTER TI AT A GLANCE OUR COMMITMENT RESPONSIBLE BUSINESS PRACTICES WORKPLACE GIVING & VOLUNTEERING APPENDICES ENVIRONMENTAL SUSTAINABILITY Global week of impact TIs employee-led community involvement teams joined together during the holiday season, focused on gratitude and giving, to volunteer and give back to build stronger communities.","('Human_Rights_And_Community_Relations', 0.7858608365058899)","('Access_And_Affordability', 0.061763156205415726)","('Employee_Health_And_Safety', 0.028480134904384613)","(['Environmental Policy & Management Systems'], 0.7858608365058899)","('NON-ESG', 0.061763156205415726)","('NON-ESG', 0.028480134904384613)"
Line 649,"Across the globe, they expressed thanks to those who keep us healthy and safe, and made life a little easier for those facing hardships, helping our neighbors in areas many of us take for granted.","('Employee_Health_And_Safety', 0.7134823203086853)","('Access_And_Affordability', 0.07238618284463882)","('Human_Rights_And_Community_Relations', 0.0634327158331871)","([], 0.7134823203086853)","('NON-ESG', 0.07238618284463882)","('NON-ESG', 0.0634327158331871)"
Line 650,"Essential workers at hospital systems and fire stations in northern California and in Dallas, Texas, were shown appreciation through meals, thank you notes and goody bags for the superhero efforts they made throughout the year to keep our communities safe and healthy.","('Employee_Health_And_Safety', 0.9068294763565063)","('Critical_Incident_Risk_Management', 0.0333000048995018)","('Labor_Practices', 0.009639437310397625)","([], 0.9068294763565063)","('NON-ESG', 0.0333000048995018)","('NON-ESG', 0.009639437310397625)"
Line 651,"Global volunteering efforts focused on our most vulnerable neighbors -- children, the elderly, the hungry and the unsheltered.","('Access_And_Affordability', 0.7689208388328552)","('Human_Rights_And_Community_Relations', 0.07979276776313782)","('Employee_Health_And_Safety', 0.029794087633490562)","([], 0.7689208388328552)","('NON-ESG', 0.07979276776313782)","('NON-ESG', 0.029794087633490562)"
Line 652,"TIers worked with local partners to ensure that hundreds of children and young adults in Germany, the Philippines, Texas and Utah received gifts, books and meals.","('Access_And_Affordability', 0.8457273244857788)","('Product_Quality_And_Safety', 0.012077581137418747)","('Energy_Management', 0.011304601095616817)","([], 0.8457273244857788)","('NON-ESG', 0.012077581137418747)","('NON-ESG', 0.011304601095616817)"
Line 653,"Senior citizens in Portland, Maine, and Sugarland, Texas, received basic home and hygiene items and notes of encouragement from our employees.","('Employee_Health_And_Safety', 0.511664867401123)","('Waste_And_Hazardous_Materials_Management', 0.14874865114688873)","('Product_Quality_And_Safety', 0.051421262323856354)","([], 0.511664867401123)","('NON-ESG', 0.14874865114688873)","('NON-ESG', 0.051421262323856354)"
Line 654,"In Japan, teams collected food items for food-insecure families near our Miho manufacturing site.","('Product_Design_And_Lifecycle_Management', 0.18982218205928802)","('Customer_Welfare', 0.15965060889720917)","('Supply_Chain_Management', 0.11523597687482834)","('NON-ESG', 0.18982218205928802)","('NON-ESG', 0.15965060889720917)","('NON-ESG', 0.11523597687482834)"
Line 655,"In Sherman, Texas, TIers fulfilled wish-list items for local charities who work with previously incarcerated youth and victims of domestic abuse.","('Access_And_Affordability', 0.3917199671268463)","('Employee_Health_And_Safety', 0.17950554192066193)","('Human_Rights_And_Community_Relations', 0.10664479434490204)","('NON-ESG', 0.3917199671268463)","('NON-ESG', 0.17950554192066193)","('NON-ESG', 0.10664479434490204)"
Line 656,"And in Tucson and Dallas, TIers and their families transformed more than 600 rocks into messages of kindness and encouragement for schools and homeless shelters.","('Access_And_Affordability', 0.6108202934265137)","('Employee_Health_And_Safety', 0.09817531704902649)","('Human_Rights_And_Community_Relations', 0.08557546138763428)","([], 0.6108202934265137)","('NON-ESG', 0.09817531704902649)","('NON-ESG', 0.08557546138763428)"
Line 657,Notice regarding forward-looking statements This communication includes forward-looking statements intended to qualify for the safe harbor from liability established by the Private Securities Litigation Reform Act of 1995.,"('Management_Of_Legal_And_Regulatory_Framework', 0.6800369024276733)","('Business_Ethics', 0.15332932770252228)","('Competitive_Behavior', 0.040144335478544235)","([], 0.6800369024276733)","('NON-ESG', 0.15332932770252228)","('NON-ESG', 0.040144335478544235)"
Line 658,"These forward- looking statements generally can be identified by phrases such as TI or its management believes, expects, anticipates, foresees, forecasts, estimates or other words or phrases of similar import.","('Business_Model_Resilience', 0.2928379476070404)","('Systemic_Risk_Management', 0.26794883608818054)","('Management_Of_Legal_And_Regulatory_Framework', 0.07850255072116852)","('NON-ESG', 0.2928379476070404)","('NON-ESG', 0.26794883608818054)","('NON-ESG', 0.07850255072116852)"
Line 659,"Similarly, statements herein that describe TIs business strategy, outlook, objectives, plans, intentions or goals are forward-looking statements.","('Business_Model_Resilience', 0.7707998156547546)","('Physical_Impacts_Of_Climate_Change', 0.03311937302350998)","('Director_Removal', 0.02283523418009281)","(['Human Capital Development', 'Innovation Management'], 0.7707998156547546)","('NON-ESG', 0.03311937302350998)","('NON-ESG', 0.02283523418009281)"
Line 660,All such forward-looking statements are subject to certain risks and uncertainties that could cause actual results to differ materially from those in forward-looking statements.,"('Systemic_Risk_Management', 0.8920667767524719)","('Competitive_Behavior', 0.020537909120321274)","('Business_Ethics', 0.017175287008285522)","([], 0.8920667767524719)","('NON-ESG', 0.020537909120321274)","('NON-ESG', 0.017175287008285522)"
Line 661,"For a more detailed discussion of these factors, see the risk factors discussion in the first quarter of 2021 form 10-Q, filed with the SEC.","('Systemic_Risk_Management', 0.905148446559906)","('Business_Model_Resilience', 0.023936888203024864)","('Physical_Impacts_Of_Climate_Change', 0.01392480731010437)","([], 0.905148446559906)","('NON-ESG', 0.023936888203024864)","('NON-ESG', 0.01392480731010437)"
Line 662,The forward-looking statements included in this communication are made only as of the date of this communication.,"('Customer_Privacy', 0.36956143379211426)","('Business_Model_Resilience', 0.17825496196746826)","('Human_Rights_And_Community_Relations', 0.057266246527433395)","('NON-ESG', 0.36956143379211426)","('NON-ESG', 0.17825496196746826)","('NON-ESG', 0.057266246527433395)"
Line 663,We undertake no obligation to update the forward-looking statements to reflect subsequent events or circumstances.47Appendices48 Texas Instruments 2022 2021 Corporate Citizenship Report TABLE OF CONTENTS CEO LETTER TI AT A GLANCE OUR COMMITMENT RESPONSIBLE BUSINESS PRACTICES WORKPLACE GIVING & VOLUNTEERING APPENDICES ENVIRONMENTAL SUSTAINABILITY Task Force on Climate-Related Financial Disclosures The Financial Stability Board created the Task Force on Climate-related Financial Disclosures (TCFD) to improve and increase reporting of climate-related financial information.,"('Physical_Impacts_Of_Climate_Change', 0.9410304427146912)","('Business_Model_Resilience', 0.015912353992462158)","('GHG_Emissions', 0.004918226972222328)","(['Climate Strategy'], 0.9410304427146912)","('NON-ESG', 0.015912353992462158)","('NON-ESG', 0.004918226972222328)"
Line 664,We undertake no obligation to update the forward-looking statements to reflect subsequent events or circumstances.47Appendices48 Texas Instruments 2022 2021 Corporate Citizenship Report TABLE OF CONTENTS CEO LETTER TI AT A GLANCE OUR COMMITMENT RESPONSIBLE BUSINESS PRACTICES WORKPLACE GIVING & VOLUNTEERING APPENDICES ENVIRONMENTAL SUSTAINABILITY Task Force on Climate-Related Financial Disclosures The Financial Stability Board created the Task Force on Climate-related Financial Disclosures (TCFD) to improve and increase reporting of climate-related financial information.,"('Physical_Impacts_Of_Climate_Change', 0.9414432048797607)","('Business_Model_Resilience', 0.01091135386377573)","('GHG_Emissions', 0.008246386423707008)","(['Climate Strategy'], 0.9414432048797607)","('NON-ESG', 0.01091135386377573)","('NON-ESG', 0.008246386423707008)"
Line 665,"This index includes information that is not material to TI, but may be considered important to TI and our stakeholders.","('Management_Of_Legal_And_Regulatory_Framework', 0.34658268094062805)","('Human_Rights_And_Community_Relations', 0.11810749024152756)","('Business_Model_Resilience', 0.09905479103326797)","('NON-ESG', 0.34658268094062805)","('NON-ESG', 0.11810749024152756)","('NON-ESG', 0.09905479103326797)"
Line 666,Governance Subtopic Description Response Board oversight Describe the boards oversight of climate-related risks and opportunities.,"('Physical_Impacts_Of_Climate_Change', 0.9433931708335876)","('Business_Model_Resilience', 0.011758208274841309)","('Systemic_Risk_Management', 0.007904366590082645)","(['Climate Strategy'], 0.9433931708335876)","('NON-ESG', 0.011758208274841309)","('NON-ESG', 0.007904366590082645)"
Line 667,"See Board Oversight of Environmental, Social and Governance (ESG) Matters and TIs 2022 CDP Climate Change response .","('Physical_Impacts_Of_Climate_Change', 0.9408884644508362)","('Business_Model_Resilience', 0.012584560550749302)","('GHG_Emissions', 0.00632524723187089)","(['Climate Strategy'], 0.9408884644508362)","('NON-ESG', 0.012584560550749302)","('NON-ESG', 0.00632524723187089)"
Line 668,Managements role Describe managements role in assessing and managing climate-related risks and opportunities.,"('Physical_Impacts_Of_Climate_Change', 0.9348944425582886)","('Business_Model_Resilience', 0.015513655729591846)","('Systemic_Risk_Management', 0.010116271674633026)","(['Climate Strategy'], 0.9348944425582886)","('NON-ESG', 0.015513655729591846)","('NON-ESG', 0.010116271674633026)"
Line 669,See Board Oversight of ESG Matters and TIs 2022 CDP Climate Change response .,"('Physical_Impacts_Of_Climate_Change', 0.9503796696662903)","('Business_Model_Resilience', 0.009629717096686363)","('GHG_Emissions', 0.0046594105660915375)","(['Climate Strategy'], 0.9503796696662903)","('NON-ESG', 0.009629717096686363)","('NON-ESG', 0.0046594105660915375)"
Line 670,"Strategy Subtopic Description Response Risks and opportunities Describe the climate-related risks and opportunities the organization has identified over the short, medium and long term.","('Physical_Impacts_Of_Climate_Change', 0.9402071237564087)","('Business_Model_Resilience', 0.014934774488210678)","('Systemic_Risk_Management', 0.006195444148033857)","(['Climate Strategy'], 0.9402071237564087)","('NON-ESG', 0.014934774488210678)","('NON-ESG', 0.006195444148033857)"
Line 671,See TIs 2022 CDP Climate Change response .,"('Physical_Impacts_Of_Climate_Change', 0.940416693687439)","('Business_Model_Resilience', 0.01132170483469963)","('GHG_Emissions', 0.008550782687962055)","(['Climate Strategy'], 0.940416693687439)","('NON-ESG', 0.01132170483469963)","('NON-ESG', 0.008550782687962055)"
Line 672,"Impact on organization Describe the impact of climate-related risks and opportunities on the organizations business, strategy and financial planning.","('Physical_Impacts_Of_Climate_Change', 0.9538553357124329)","('Business_Model_Resilience', 0.00949219148606062)","('GHG_Emissions', 0.0036863251589238644)","(['Climate Strategy'], 0.9538553357124329)","('NON-ESG', 0.00949219148606062)","('NON-ESG', 0.0036863251589238644)"
Line 673,See TIs 2022 CDP Climate Change response .,"('Physical_Impacts_Of_Climate_Change', 0.940416693687439)","('Business_Model_Resilience', 0.01132170483469963)","('GHG_Emissions', 0.008550782687962055)","(['Climate Strategy'], 0.940416693687439)","('NON-ESG', 0.01132170483469963)","('NON-ESG', 0.008550782687962055)"
Line 674,"Resilience of strategy Describe the resilience of the organizations strategy, taking into consideration different climate-related scenarios, including a 2C or lower scenario.","('Business_Model_Resilience', 0.9161498546600342)","('Physical_Impacts_Of_Climate_Change', 0.012545125558972359)","('Product_Design_And_Lifecycle_Management', 0.006979331374168396)","(['Human Capital Development', 'Innovation Management'], 0.9161498546600342)","('NON-ESG', 0.012545125558972359)","('NON-ESG', 0.006979331374168396)"
Line 675,See TIs 2022 CDP Climate Change response .,"('Physical_Impacts_Of_Climate_Change', 0.940416693687439)","('Business_Model_Resilience', 0.01132170483469963)","('GHG_Emissions', 0.008550782687962055)","(['Climate Strategy'], 0.940416693687439)","('NON-ESG', 0.01132170483469963)","('NON-ESG', 0.008550782687962055)"
Line 676,Risk management Subtopic Description Response Risk assessment processes Describe the organizations processes for identifying and assessing climate-related risks.,"('Physical_Impacts_Of_Climate_Change', 0.9459332823753357)","('Business_Model_Resilience', 0.013169152662158012)","('Systemic_Risk_Management', 0.005049990024417639)","(['Climate Strategy'], 0.9459332823753357)","('NON-ESG', 0.013169152662158012)","('NON-ESG', 0.005049990024417639)"
Line 677,See TIs 2022 CDP Climate Change response .,"('Physical_Impacts_Of_Climate_Change', 0.940416693687439)","('Business_Model_Resilience', 0.01132170483469963)","('GHG_Emissions', 0.008550782687962055)","(['Climate Strategy'], 0.940416693687439)","('NON-ESG', 0.01132170483469963)","('NON-ESG', 0.008550782687962055)"
Line 678,Risk-management processes Describe the organizations processes for managing climate-related risks.,"('Physical_Impacts_Of_Climate_Change', 0.9481790065765381)","('Business_Model_Resilience', 0.010860148817300797)","('GHG_Emissions', 0.004905256442725658)","(['Climate Strategy'], 0.9481790065765381)","('NON-ESG', 0.010860148817300797)","('NON-ESG', 0.004905256442725658)"
Line 679,See TIs 2022 CDP Climate Change response .,"('Physical_Impacts_Of_Climate_Change', 0.940416693687439)","('Business_Model_Resilience', 0.01132170483469963)","('GHG_Emissions', 0.008550782687962055)","(['Climate Strategy'], 0.940416693687439)","('NON-ESG', 0.01132170483469963)","('NON-ESG', 0.008550782687962055)"
Line 680,"Integration into overall risk management Describe how processes for identifying, assessing and managing climate-related risks are integrated into the organizations overall risk management.","('Physical_Impacts_Of_Climate_Change', 0.9325882792472839)","('Business_Model_Resilience', 0.01719117909669876)","('Systemic_Risk_Management', 0.01023075357079506)","(['Climate Strategy'], 0.9325882792472839)","('NON-ESG', 0.01719117909669876)","('NON-ESG', 0.01023075357079506)"
Line 681,See TIs 2022 CDP Climate Change response .,"('Physical_Impacts_Of_Climate_Change', 0.940416693687439)","('Business_Model_Resilience', 0.01132170483469963)","('GHG_Emissions', 0.008550782687962055)","(['Climate Strategy'], 0.940416693687439)","('NON-ESG', 0.01132170483469963)","('NON-ESG', 0.008550782687962055)"
Line 682,Metrics and targets Subtopic Description Response Climate-related metrics Disclose the metrics used by the organization to assess climate-related risks and opportunities in line with its strategy and risk-management process.,"('Physical_Impacts_Of_Climate_Change', 0.9343428015708923)","('Business_Model_Resilience', 0.019135603681206703)","('Systemic_Risk_Management', 0.007247363217175007)","(['Climate Strategy'], 0.9343428015708923)","('NON-ESG', 0.019135603681206703)","('NON-ESG', 0.007247363217175007)"
Line 683,TI has not defined metrics to assess climate-related risks at this time.,"('Physical_Impacts_Of_Climate_Change', 0.9480418562889099)","('Business_Model_Resilience', 0.009911686182022095)","('GHG_Emissions', 0.005157312378287315)","(['Climate Strategy'], 0.9480418562889099)","('NON-ESG', 0.009911686182022095)","('NON-ESG', 0.005157312378287315)"
Line 684,"Scope 1, 2 and 3 GHG emissions Disclose scope 1, scope 2, and if appropriate, scope 3 GHG emissions and the related risks.","('GHG_Emissions', 0.9650918245315552)","('Air_Quality', 0.003907789010554552)","('Ecological_Impacts', 0.003567803418263793)","(['Operational Eco-Efficiency'], 0.9650918245315552)","('NON-ESG', 0.003907789010554552)","('NON-ESG', 0.003567803418263793)"
Line 685,See the GHG Emissions section of TIs 2021 Corporate Citizenship Report and TIs 2022 CDP Climate Change response .,"('GHG_Emissions', 0.9610787630081177)","('Physical_Impacts_Of_Climate_Change', 0.0065809255465865135)","('Air_Quality', 0.00467727892100811)","(['Operational Eco-Efficiency'], 0.9610787630081177)","('NON-ESG', 0.0065809255465865135)","('NON-ESG', 0.00467727892100811)"
Line 686,Climate-related targets Describe the targets used by the organization to manage climate-related risks and opportunities and performance against targets.,"('Physical_Impacts_Of_Climate_Change', 0.9441589713096619)","('Business_Model_Resilience', 0.012545633129775524)","('GHG_Emissions', 0.006378648336976767)","(['Climate Strategy'], 0.9441589713096619)","('NON-ESG', 0.012545633129775524)","('NON-ESG', 0.006378648336976767)"
Line 687,See the GHG Emissions section of TIs 2021 Corporate Citizenship Report and TIs 2022 CDP Climate Change response .49 Texas Instruments 2022 2021 Corporate Citizenship Report TABLE OF CONTENTS CEO LETTER TI AT A GLANCE OUR COMMITMENT RESPONSIBLE BUSINESS PRACTICES WORKPLACE GIVING & VOLUNTEERING APPENDICES ENVIRONMENTAL SUSTAINABILITY Sustainability Accounting Standards Board TI uses the Sustainability Accounting Standards Board (SASB) Standards on topics deemed significant to semiconductor companies.,"('GHG_Emissions', 0.9494378566741943)","('Physical_Impacts_Of_Climate_Change', 0.011984930373728275)","('Air_Quality', 0.005768142640590668)","(['Operational Eco-Efficiency'], 0.9494378566741943)","('NON-ESG', 0.011984930373728275)","('NON-ESG', 0.005768142640590668)"
Line 688,"This index includes information that is not material to TI, but may be considered important to TI and to our stakeholders.","('Management_Of_Legal_And_Regulatory_Framework', 0.3238332271575928)","('Business_Model_Resilience', 0.10741367936134338)","('Systemic_Risk_Management', 0.08522763848304749)","('NON-ESG', 0.3238332271575928)","('NON-ESG', 0.10741367936134338)","('NON-ESG', 0.08522763848304749)"
Line 689,Subtopic Indicator Description Response GHG emissionsTC-SC-110a.1Gross global scope 1 greenhouse gas (GHG) emissions and the amount of total emissions from perfluorinated compounds.,"('GHG_Emissions', 0.9695867896080017)","('Ecological_Impacts', 0.003814518917351961)","('Air_Quality', 0.003279684577137232)","(['Operational Eco-Efficiency'], 0.9695867896080017)","('NON-ESG', 0.003814518917351961)","('NON-ESG', 0.003279684577137232)"
Line 690,See the GHG Emissions section of TIs 2021 Corporate Citizenship Report or TIs 2022 CDP Climate Change response for GHG data.,"('GHG_Emissions', 0.96808260679245)","('Air_Quality', 0.004256864544004202)","('Physical_Impacts_Of_Climate_Change', 0.0029286048375070095)","(['Operational Eco-Efficiency'], 0.96808260679245)","('NON-ESG', 0.004256864544004202)","('NON-ESG', 0.0029286048375070095)"
Line 691,"C-SC-110a.2Discussion of long- and short-term strategy or plan to manage scope 1 emissions, emissions reduction targets and an analysis of performance against those targets.","('GHG_Emissions', 0.8130800724029541)","('Air_Quality', 0.0757402628660202)","('Energy_Management', 0.020435653626918793)","(['Operational Eco-Efficiency'], 0.8130800724029541)","('NON-ESG', 0.0757402628660202)","('NON-ESG', 0.020435653626918793)"
Line 692,See TIs 2022 CDP Climate Change response .,"('Physical_Impacts_Of_Climate_Change', 0.940416693687439)","('Business_Model_Resilience', 0.01132170483469963)","('GHG_Emissions', 0.008550782687962055)","(['Climate Strategy'], 0.940416693687439)","('NON-ESG', 0.01132170483469963)","('NON-ESG', 0.008550782687962055)"
Line 693,"Energy management in manufacturingTC-SC-130a.1 Total energy consumed, percentage grid electricity and percentage renewable energy.","('Energy_Management', 0.9803905487060547)","('Management_Of_Legal_And_Regulatory_Framework', 0.001946025644429028)","('Air_Quality', 0.0017054416239261627)","(['Operational Eco-Efficiency'], 0.9803905487060547)","('NON-ESG', 0.001946025644429028)","('NON-ESG', 0.0017054416239261627)"
Line 694,"In 2021, TI consumed 11,448,000 gigajoules of energy.","('Energy_Management', 0.9756537079811096)","('Water_And_Wastewater_Management', 0.0022554548922926188)","('Management_Of_Legal_And_Regulatory_Framework', 0.0022453335113823414)","(['Operational Eco-Efficiency'], 0.9756537079811096)","('NON-ESG', 0.0022554548922926188)","('NON-ESG', 0.0022453335113823414)"
Line 695,See the Energy section of TIs 2021 Corporate Citizenship Report for additional data.,"('Employee_Engagement_Inclusion_And_Diversity', 0.7965623736381531)","('Business_Model_Resilience', 0.03705112636089325)","('Human_Rights_And_Community_Relations', 0.020254220813512802)","(['Talent Attraction & Retention'], 0.7965623736381531)","('NON-ESG', 0.03705112636089325)","('NON-ESG', 0.020254220813512802)"
Line 696,"Water management TC-SC-140a.1Total water withdrawn, total water consumed, and percentage of each in regions with high or extremely high baseline water stress.","('Water_And_Wastewater_Management', 0.9777812361717224)","('GHG_Emissions', 0.002097819000482559)","('Waste_And_Hazardous_Materials_Management', 0.001582579337991774)","([], 0.9777812361717224)","('NON-ESG', 0.002097819000482559)","('NON-ESG', 0.001582579337991774)"
Line 697,"In 2021, TI consumed 3,227 thousand cubic meters of water and withdrew 19,977 thousand cubic meters.","('Water_And_Wastewater_Management', 0.9678579568862915)","('Energy_Management', 0.004714502487331629)","('GHG_Emissions', 0.0034714227076619864)","([], 0.9678579568862915)","('NON-ESG', 0.004714502487331629)","('NON-ESG', 0.0034714227076619864)"
