,Sentence,ESG BERT Topic 1,ESG BERT Topic 2,ESG BERT Topic 3,Mapped Criteria Topic 1,Mapped Criteria Topic 2,Mapped Criteria Topic 3
Line 980,"TI reports water usage data to local, state, federal and international regulatory agencies.62 Texas Instruments 2022 2021 Corporate Citizenship Report TABLE OF CONTENTS CEO LETTER TI AT A GLANCE OUR COMMITMENT RESPONSIBLE BUSINESS PRACTICES WORKPLACE GIVING & VOLUNTEERING APPENDICES ENVIRONMENTAL SUSTAINABILITY (Megaliters) 2018 2019 2020 2021 Change in water storage (megaliters)250 0 0 0 Water withdrawal (total megaliters) 18,155 17,664 18,560 19,977 Surface26 Ground26 Sea Produced Third party132 1,517 0 0 16,5060 1,409 0 0 16,2550 1,408 0 0 17,1520 1,838 0 0 18,139 Fresh (1,000 mg/L total dissolved solids)27 18,155 17,664 18,560 19,977 Other (1,000 mg/L total dissolved solids)270 0 0 0 Water withdrawal in water-stressed regions (total megaliters) 3,352 2,674 2,692 2,518 Surface26 Ground26 Sea Produced Third party0 40 0 0 3,3120 44 0 0 2,6300 35 0 0 2,6580 27 0 0 2,490 Fresh (1,000 mg/L total dissolved solids)273,352 2,674 2,692 2,518 Other (1,000 mg/L total dissolved solids)270 0 0 0 Water discharge (total megaliters) 15,643 14,617 15,646 16,750 Surface26 Ground26 Sea Third party1,068 0 0 14,575953 0 0 13,664989 0 0 14,6581,039 0 0 15,711 Fresh (1,000 mg/L total dissolved solids)27Unknown Unknown Unknown Unknown Other (1,000 mg/L total dissolved solids)27Unknown Unknown Unknown Unknown Water discharge (water-stressed areas, megaliters) 2,860 2,278 2,310 2,132 Fresh (1,000 mg/L total dissolved solids)27Unknown Unknown Unknown Unknown Other (1,000 mg/L total dissolved solids)27Unknown Unknown Unknown Unknown Water consumption (total megaliters)282,512 3,047 2,914 3,227 Water consumption (water-stressed areas)28491 396 382 386Water use 25 There is a small amount of water storage (relative to overall usage) in facilities systems, but the year-over-year change is not significant.","('Water_And_Wastewater_Management', 0.9758790135383606)","('Energy_Management', 0.003085784614086151)","('GHG_Emissions', 0.002043740125373006)","([], 0.9758790135383606)","('NON-ESG', 0.003085784614086151)","('NON-ESG', 0.002043740125373006)"
Line 981,"26 This does not include once-through cooling water, which is pumped from on-site wells at our Freising, Germany, site and used only for heat rejection.","('Water_And_Wastewater_Management', 0.8704196810722351)","('Energy_Management', 0.051183681935071945)","('Waste_And_Hazardous_Materials_Management', 0.013145601376891136)","([], 0.8704196810722351)","('NON-ESG', 0.051183681935071945)","('NON-ESG', 0.013145601376891136)"
Line 982,This water returns to the original aquifer.,"('Water_And_Wastewater_Management', 0.9674578309059143)","('Ecological_Impacts', 0.005060187540948391)","('GHG_Emissions', 0.004729671869426966)","([], 0.9674578309059143)","('NON-ESG', 0.005060187540948391)","('NON-ESG', 0.004729671869426966)"
Line 983,27 TI does not monitor total dissolved solids continuously at all sites.,"('Water_And_Wastewater_Management', 0.6961947679519653)","('Waste_And_Hazardous_Materials_Management', 0.09750942885875702)","('GHG_Emissions', 0.041921887546777725)","([], 0.6961947679519653)","('NON-ESG', 0.09750942885875702)","('NON-ESG', 0.041921887546777725)"
Line 984,28 TI calculates consumption as water withdrawn minus water discharged.,"('Water_And_Wastewater_Management', 0.973361074924469)","('Energy_Management', 0.003527800552546978)","('GHG_Emissions', 0.002624067710712552)","([], 0.973361074924469)","('NON-ESG', 0.003527800552546978)","('NON-ESG', 0.002624067710712552)"
Line 985,"Richardson, Texas63 Texas Instruments 2022 2021 Corporate Citizenship Report TABLE OF CONTENTS CEO LETTER TI AT A GLANCE OUR COMMITMENT RESPONSIBLE BUSINESS PRACTICES WORKPLACE GIVING & VOLUNTEERING APPENDICES ENVIRONMENTAL SUSTAINABILITY Environment standards Biodiversity Indicator Description Response 304-1Operational sites owned, leased, managed in, or adjacent to protected areas and areas of high biodiversity value outside protected areasTIs worldwide semiconductor design, manufacturing and assembly/test sites are located in industrial areas, inner-city areas, suburban areas and areas surrounded by agricultural farmlands.","('Ecological_Impacts', 0.9803962707519531)","('GHG_Emissions', 0.0027318093925714493)","('Water_And_Wastewater_Management', 0.0014800357166677713)","([], 0.9803962707519531)","('NON-ESG', 0.0027318093925714493)","('NON-ESG', 0.0014800357166677713)"
Line 986,"Richardson, Texas63 Texas Instruments 2022 2021 Corporate Citizenship Report TABLE OF CONTENTS CEO LETTER TI AT A GLANCE OUR COMMITMENT RESPONSIBLE BUSINESS PRACTICES WORKPLACE GIVING & VOLUNTEERING APPENDICES ENVIRONMENTAL SUSTAINABILITY Environment standards Biodiversity Indicator Description Response 304-1Operational sites owned, leased, managed in, or adjacent to protected areas and areas of high biodiversity value outside protected areasTIs worldwide semiconductor design, manufacturing and assembly/test sites are located in industrial areas, inner-city areas, suburban areas and areas surrounded by agricultural farmlands.","('Business_Model_Resilience', 0.10667501389980316)","('Water_And_Wastewater_Management', 0.10457591712474823)","('Supply_Chain_Management', 0.0998535007238388)","('NON-ESG', 0.10667501389980316)","('NON-ESG', 0.10457591712474823)","('NON-ESG', 0.0998535007238388)"
Line 987,"One 69-acre fabrication site in South Portland, Maine, is located in the Long Creek Watershed Management District.","('Ecological_Impacts', 0.8182036280632019)","('Water_And_Wastewater_Management', 0.11204639077186584)","('GHG_Emissions', 0.013181764632463455)","([], 0.8182036280632019)","('NON-ESG', 0.11204639077186584)","('NON-ESG', 0.013181764632463455)"
Line 988,TI complies with state and federal regulations protecting this terrestrial and freshwater ecosystem.,"('Ecological_Impacts', 0.6855936646461487)","('Water_And_Wastewater_Management', 0.2438286989927292)","('GHG_Emissions', 0.010961157269775867)","([], 0.6855936646461487)","('NON-ESG', 0.2438286989927292)","('NON-ESG', 0.010961157269775867)"
Line 989,"Other TI sites also adhere to rigorous air emission, water and wastewater goals, and requirements to manage the companys impact on biodiversity.","('Air_Quality', 0.968319296836853)","('GHG_Emissions', 0.0052321613766252995)","('Ecological_Impacts', 0.002207494806498289)","([], 0.968319296836853)","('NON-ESG', 0.0052321613766252995)","('NON-ESG', 0.002207494806498289)"
Line 990,We contribute to biodiversity by planting indigenous trees where we have sites and participating in community cleanup events in locations worldwide.,"('Ecological_Impacts', 0.7933455109596252)","('Human_Rights_And_Community_Relations', 0.12818269431591034)","('GHG_Emissions', 0.010386168025434017)","([], 0.7933455109596252)","('NON-ESG', 0.12818269431591034)","('NON-ESG', 0.010386168025434017)"
Line 991,"Environment standards Emissions Indicator Description Response 103-1 to 103-3 Disclosure of management approachSee the Air Emissions and GHG Emissions sections of TIs 2021 Corporate Citizenship Report, ESH Disclosure of Management Approach in this GRI Index and TIs 2022 CDP Climate Change response to learn more about how we manage emissions.","('Air_Quality', 0.8977751135826111)","('GHG_Emissions', 0.056715838611125946)","('Physical_Impacts_Of_Climate_Change', 0.0050904154777526855)","([], 0.8977751135826111)","('NON-ESG', 0.056715838611125946)","('NON-ESG', 0.0050904154777526855)"
Line 992,"We conduct routine monitoring and audits to comply with air quality and GHG emission regulations and reporting requirements that vary by country, state and municipality.","('Air_Quality', 0.9560489654541016)","('GHG_Emissions', 0.014865345321595669)","('Physical_Impacts_Of_Climate_Change', 0.002397767035290599)","([], 0.9560489654541016)","('NON-ESG', 0.014865345321595669)","('NON-ESG', 0.002397767035290599)"
Line 993,We must report U.,"('Management_Of_Legal_And_Regulatory_Framework', 0.5920054912567139)","('Business_Ethics', 0.05789047107100487)","('GHG_Emissions', 0.051069505512714386)","([], 0.5920054912567139)","('NON-ESG', 0.05789047107100487)","('NON-ESG', 0.051069505512714386)"
Line 994,S. GHG emissions to the U.,"('GHG_Emissions', 0.9663544297218323)","('Ecological_Impacts', 0.004223819822072983)","('Air_Quality', 0.003219981910660863)","(['Operational Eco-Efficiency'], 0.9663544297218323)","('NON-ESG', 0.004223819822072983)","('NON-ESG', 0.003219981910660863)"
Line 995,S. Environmental Protection Agency (EPA) to comply with its mandatory reporting requirements.,"('Ecological_Impacts', 0.6995397806167603)","('Management_Of_Legal_And_Regulatory_Framework', 0.08889006078243256)","('GHG_Emissions', 0.06894606351852417)","([], 0.6995397806167603)","('NON-ESG', 0.08889006078243256)","('NON-ESG', 0.06894606351852417)"
Line 996,"The EPA requires that the semiconductor industry (among other industries) measure and report annual fluorinated GHG emissions (such as sulfur hexafluoride, perfluorocarbons [PFCs] and hydrochlorofluorocarbons) as well as GHG emissions from combustion sources.","('GHG_Emissions', 0.9691882133483887)","('Air_Quality', 0.003839971497654915)","('Ecological_Impacts', 0.0033011464402079582)","(['Operational Eco-Efficiency'], 0.9691882133483887)","('NON-ESG', 0.003839971497654915)","('NON-ESG', 0.0033011464402079582)"
Line 997,We also voluntarily report our GHG emissions data to the World Semiconductor Council (as part of the U.,"('GHG_Emissions', 0.9657838344573975)","('Air_Quality', 0.0049175177700817585)","('Ecological_Impacts', 0.0035453466698527336)","(['Operational Eco-Efficiency'], 0.9657838344573975)","('NON-ESG', 0.0049175177700817585)","('NON-ESG', 0.0035453466698527336)"
Line 998,"S. industry report), the CDP and in our annual Corporate Citizenship Report.","('Business_Model_Resilience', 0.37766191363334656)","('Management_Of_Legal_And_Regulatory_Framework', 0.07419329136610031)","('Employee_Engagement_Inclusion_And_Diversity', 0.06485667824745178)","('NON-ESG', 0.37766191363334656)","('NON-ESG', 0.07419329136610031)","('NON-ESG', 0.06485667824745178)"
Line 999,TI reports U.,"('Management_Of_Legal_And_Regulatory_Framework', 0.4643682837486267)","('Competitive_Behavior', 0.04867289587855339)","('Business_Ethics', 0.04306315258145332)","('NON-ESG', 0.4643682837486267)","('NON-ESG', 0.04867289587855339)","('NON-ESG', 0.04306315258145332)"
Line 1000,S. air emissions data to federal and state regulators.,"('Air_Quality', 0.9776636362075806)","('Water_And_Wastewater_Management', 0.0017281121108680964)","('Energy_Management', 0.0016434835270047188)","([], 0.9776636362075806)","('NON-ESG', 0.0017281121108680964)","('NON-ESG', 0.0016434835270047188)"
Line 1001,We also report chemical releases and pollution prevention activities to the EPAs Toxic Release Inventory.,"('Waste_And_Hazardous_Materials_Management', 0.7547263503074646)","('Ecological_Impacts', 0.06630812585353851)","('Water_And_Wastewater_Management', 0.0458034947514534)","([], 0.7547263503074646)","('NON-ESG', 0.06630812585353851)","('NON-ESG', 0.0458034947514534)"
Line 1002,"Boundaries We measure scope 1 and 2 GHG emissions from TI-owned and leased sites larger than 50,000 square feet.","('GHG_Emissions', 0.9666895270347595)","('Air_Quality', 0.005195352714508772)","('Physical_Impacts_Of_Climate_Change', 0.0027714348398149014)","(['Operational Eco-Efficiency'], 0.9666895270347595)","('NON-ESG', 0.005195352714508772)","('NON-ESG', 0.0027714348398149014)"
Line 1003,This accounts for 97% of our total square footage and more than 99% of our equivalent carbon dioxide emissions.,"('GHG_Emissions', 0.9286080598831177)","('Air_Quality', 0.020479563623666763)","('Energy_Management', 0.007769516669213772)","(['Operational Eco-Efficiency'], 0.9286080598831177)","('NON-ESG', 0.020479563623666763)","('NON-ESG', 0.007769516669213772)"
Line 1004,"We do not report data from subcontractors, supplier manufacturing facilities or facilities smaller than 50,000 square feet.","('Supply_Chain_Management', 0.8502823710441589)","('Energy_Management', 0.015647729858756065)","('Product_Design_And_Lifecycle_Management', 0.015364338643848896)","(['Supply Chain Management'], 0.8502823710441589)","('NON-ESG', 0.015647729858756065)","('NON-ESG', 0.015364338643848896)"
Line 1005,305-1 Direct (scope 1) GHG emissionsSee the GHG Emissions section of TIs 2021 Corporate Citizenship Report for scope 1 data.,"('GHG_Emissions', 0.9673860669136047)","('Air_Quality', 0.004509578924626112)","('Ecological_Impacts', 0.003272928996011615)","(['Operational Eco-Efficiency'], 0.9673860669136047)","('NON-ESG', 0.004509578924626112)","('NON-ESG', 0.003272928996011615)"
Line 1006,"The gases included in our data calculations include carbon dioxide (CO2), methane (CH4), nitrous oxide (N2O), hydrochlorofluorocarbons (HFCs), PFCs, sulfur hexafluoride (SF6) and nitrogen trifluoride (NF3).","('GHG_Emissions', 0.9333474040031433)","('Air_Quality', 0.010607762262225151)","('Ecological_Impacts', 0.009400676935911179)","(['Operational Eco-Efficiency'], 0.9333474040031433)","('NON-ESG', 0.010607762262225151)","('NON-ESG', 0.009400676935911179)"
Line 1007,We calculate scope 1 GHG emissions using relevant guidelines from the Intergovernmental Panel on Climate Change (IPCC) and the EPAs Mandatory Reporting Rule and published emission factors.,"('GHG_Emissions', 0.9627020359039307)","('Air_Quality', 0.008181620389223099)","('Management_Of_Legal_And_Regulatory_Framework', 0.003274816321209073)","(['Operational Eco-Efficiency'], 0.9627020359039307)","('NON-ESG', 0.008181620389223099)","('NON-ESG', 0.003274816321209073)"
Line 1008,"Our methodology includes accepted quantification methods, emission factors and global warming potential.","('Air_Quality', 0.719977617263794)","('GHG_Emissions', 0.1750440150499344)","('Energy_Management', 0.021507099270820618)","([], 0.719977617263794)","('NON-ESG', 0.1750440150499344)","('NON-ESG', 0.021507099270820618)"
Line 1009,"For more information, see TIs 2022 CDP Climate Change response.64 Texas Instruments 2022 2021 Corporate Citizenship Report TABLE OF CONTENTS CEO LETTER TI AT A GLANCE OUR COMMITMENT RESPONSIBLE BUSINESS PRACTICES WORKPLACE GIVING & VOLUNTEERING APPENDICES ENVIRONMENTAL SUSTAINABILITY Environment standards Emissions cont'd.","('Physical_Impacts_Of_Climate_Change', 0.9429203867912292)","('Business_Model_Resilience', 0.014660445041954517)","('Supply_Chain_Management', 0.004945062566548586)","(['Climate Strategy'], 0.9429203867912292)","('NON-ESG', 0.014660445041954517)","('NON-ESG', 0.004945062566548586)"
Line 1010,Indicator Description Response 305-2 Energy indirect (scope 2) GHG emissionsSee the GHG Emissions section of TIs 2021 Corporate Citizenship Report for scope 2 data and our response to indicator 305-1.,"('GHG_Emissions', 0.9689062237739563)","('Air_Quality', 0.0037226704880595207)","('Ecological_Impacts', 0.0033699413761496544)","(['Operational Eco-Efficiency'], 0.9689062237739563)","('NON-ESG', 0.0037226704880595207)","('NON-ESG', 0.0033699413761496544)"
Line 1011,"The gases included in our data calculations include CO2, CH4 and N2O.","('GHG_Emissions', 0.9406681656837463)","('Air_Quality', 0.008015567436814308)","('Energy_Management', 0.005843278951942921)","(['Operational Eco-Efficiency'], 0.9406681656837463)","('NON-ESG', 0.008015567436814308)","('NON-ESG', 0.005843278951942921)"
Line 1012,We have not made any significant emissions changes that triggered base-year emissions recalculations.,"('GHG_Emissions', 0.5414947271347046)","('Air_Quality', 0.27316203713417053)","('Energy_Management', 0.06423219293355942)","(['Operational Eco-Efficiency'], 0.5414947271347046)","('NON-ESG', 0.27316203713417053)","('NON-ESG', 0.06423219293355942)"
Line 1013,The EPAs GHG Mandatory Monitoring and Reporting Requirements (MRR) Final Rule is our source of the emissions factors and global warming potential rates.,"('GHG_Emissions', 0.9668565392494202)","('Air_Quality', 0.004412974696606398)","('Management_Of_Legal_And_Regulatory_Framework', 0.003053592285141349)","(['Operational Eco-Efficiency'], 0.9668565392494202)","('NON-ESG', 0.004412974696606398)","('NON-ESG', 0.003053592285141349)"
Line 1014,Scope 2 location-based electricity emission factors are from the U.,"('Air_Quality', 0.9720089435577393)","('Critical_Incident_Risk_Management', 0.0031415289267897606)","('GHG_Emissions', 0.00289295450784266)","([], 0.9720089435577393)","('NON-ESG', 0.0031415289267897606)","('NON-ESG', 0.00289295450784266)"
Line 1015,S. EPA eGRID for U.,"('Management_Of_Legal_And_Regulatory_Framework', 0.6014093160629272)","('GHG_Emissions', 0.14995846152305603)","('Air_Quality', 0.04256654158234596)","([], 0.6014093160629272)","('NON-ESG', 0.14995846152305603)","('NON-ESG', 0.04256654158234596)"
Line 1016,S. sites and the International Energy Agency for all international sites.,"('Management_Of_Legal_And_Regulatory_Framework', 0.7858198285102844)","('GHG_Emissions', 0.02802828885614872)","('Competitive_Behavior', 0.02062961645424366)","([], 0.7858198285102844)","('NON-ESG', 0.02802828885614872)","('NON-ESG', 0.02062961645424366)"
Line 1017,Scope 2 market- based factors are Green E residual mix for U.,"('Competitive_Behavior', 0.4473688006401062)","('Systemic_Risk_Management', 0.18250060081481934)","('Business_Model_Resilience', 0.10158860683441162)","('NON-ESG', 0.4473688006401062)","('NON-ESG', 0.18250060081481934)","('NON-ESG', 0.10158860683441162)"
Line 1018,S. locations and AIB Residual mix for our Freising location.,"('Systemic_Risk_Management', 0.3591853976249695)","('Customer_Welfare', 0.12152725458145142)","('Supply_Chain_Management', 0.0934448167681694)","('NON-ESG', 0.3591853976249695)","('NON-ESG', 0.12152725458145142)","('NON-ESG', 0.0934448167681694)"
Line 1019,All calculations for scope 2 emissions follow either U.,"('GHG_Emissions', 0.9077930450439453)","('Air_Quality', 0.03325219824910164)","('Management_Of_Legal_And_Regulatory_Framework', 0.010698853991925716)","(['Operational Eco-Efficiency'], 0.9077930450439453)","('NON-ESG', 0.03325219824910164)","('NON-ESG', 0.010698853991925716)"
Line 1020,S. EPA MMR or IPCC Tier 2 requirements.,"('Management_Of_Legal_And_Regulatory_Framework', 0.849968433380127)","('GHG_Emissions', 0.025341100990772247)","('Ecological_Impacts', 0.017841802909970284)","([], 0.849968433380127)","('NON-ESG', 0.025341100990772247)","('NON-ESG', 0.017841802909970284)"
Line 1021,"For more information, see TIs 2022 CDP Climate Change response.","('Physical_Impacts_Of_Climate_Change', 0.9428179860115051)","('Business_Model_Resilience', 0.010707235895097256)","('GHG_Emissions', 0.00852995365858078)","(['Climate Strategy'], 0.9428179860115051)","('NON-ESG', 0.010707235895097256)","('NON-ESG', 0.00852995365858078)"
Line 1022,305-4 GHG emissions intensityOur normalized GHG emissions intensity ratio in 2021 was 0.27.,"('GHG_Emissions', 0.9601110219955444)","('Air_Quality', 0.00808898638933897)","('Management_Of_Legal_And_Regulatory_Framework', 0.0036126363556832075)","(['Operational Eco-Efficiency'], 0.9601110219955444)","('NON-ESG', 0.00808898638933897)","('NON-ESG', 0.0036126363556832075)"
Line 1023,The ratio equals the emissions intensity in 2021 divided by the emissions intensity in 2005.,"('GHG_Emissions', 0.640376627445221)","('Air_Quality', 0.24504153430461884)","('Energy_Management', 0.026359718292951584)","(['Operational Eco-Efficiency'], 0.640376627445221)","('NON-ESG', 0.24504153430461884)","('NON-ESG', 0.026359718292951584)"
Line 1024,"We calculate the intensity using both scope 1 and scope 2 emissions, with CO2, CH4, N2O, HFCs, PFCs, SF6 and NF3 as the numerator and the number of chips produced within TI as the denominator.","('GHG_Emissions', 0.9352208971977234)","('Air_Quality', 0.021587317809462547)","('Management_Of_Legal_And_Regulatory_Framework', 0.00531131261959672)","(['Operational Eco-Efficiency'], 0.9352208971977234)","('NON-ESG', 0.021587317809462547)","('NON-ESG', 0.00531131261959672)"
Line 1025,305-5 Reduction of GHGsTIs normalized scope 1 and scope 2 emissions were down by 12.9% from 2020 to 2021.,"('GHG_Emissions', 0.9671206474304199)","('Air_Quality', 0.0035015414468944073)","('Ecological_Impacts', 0.0033422489650547504)","(['Operational Eco-Efficiency'], 0.9671206474304199)","('NON-ESG', 0.0035015414468944073)","('NON-ESG', 0.0033422489650547504)"
Line 1026,See the GHG Emissions section of TIs 2021 Corporate Citizenship Report and TIs 2022 CDP Climate Change response for more information about emission reductions.,"('GHG_Emissions', 0.9629119634628296)","('Air_Quality', 0.007974715903401375)","('Physical_Impacts_Of_Climate_Change', 0.0033760068472474813)","(['Operational Eco-Efficiency'], 0.9629119634628296)","('NON-ESG', 0.007974715903401375)","('NON-ESG', 0.0033760068472474813)"
Line 1027,305-6 Emissions of ozone-depleting substances (ODSs)See the Waste and Material Management section of TIs 2021 Corporate Citizenship Report for more information about ODSs.,"('Waste_And_Hazardous_Materials_Management', 0.9824700355529785)","('Air_Quality', 0.0015001064166426659)","('Water_And_Wastewater_Management', 0.001443422050215304)","([], 0.9824700355529785)","('NON-ESG', 0.0015001064166426659)","('NON-ESG', 0.001443422050215304)"
Line 1028,"TI does not allow the use of Class I and Class II ODSs, except in closed-loop refrigeration systems if the refrigeration system equipment was purchased or acquired before the ODS refrigerants elimination date.","('Energy_Management', 0.67942875623703)","('Product_Design_And_Lifecycle_Management', 0.10133156180381775)","('Water_And_Wastewater_Management', 0.026208078488707542)","(['Operational Eco-Efficiency'], 0.67942875623703)","('NON-ESG', 0.10133156180381775)","('NON-ESG', 0.026208078488707542)"
Line 1029,We do store some refrigerant gases for maintaining refrigeration systems for our chillers.,"('Energy_Management', 0.7766602635383606)","('Product_Design_And_Lifecycle_Management', 0.08212696760892868)","('Water_And_Wastewater_Management', 0.015636742115020752)","(['Operational Eco-Efficiency'], 0.7766602635383606)","('NON-ESG', 0.08212696760892868)","('NON-ESG', 0.015636742115020752)"
Line 1030,"305-7Nitrogen oxides (NOx), sulfur oxides (SOx) and other significant air emissionsSee the Air Emissions section of TIs 2021 Corporate Citizenship Report for U.","('Air_Quality', 0.9788669943809509)","('GHG_Emissions', 0.002081500133499503)","('Critical_Incident_Risk_Management', 0.001700240420177579)","([], 0.9788669943809509)","('NON-ESG', 0.002081500133499503)","('NON-ESG', 0.001700240420177579)"
Line 1031,S. air emissions data.65 Texas Instruments 2022 2021 Corporate Citizenship Report TABLE OF CONTENTS CEO LETTER TI AT A GLANCE OUR COMMITMENT RESPONSIBLE BUSINESS PRACTICES WORKPLACE GIVING & VOLUNTEERING APPENDICES ENVIRONMENTAL SUSTAINABILITY Environment standards Materials Indicator Description Response 306-1 Waste generation and significant waste-related impacts See the Waste and Materials Management section of TIs 2021 Corporate Citizenship Report for information on waste stream activities.,"('Waste_And_Hazardous_Materials_Management', 0.980717122554779)","('Air_Quality', 0.0024997827131301165)","('Water_And_Wastewater_Management', 0.0014425115659832954)","([], 0.980717122554779)","('NON-ESG', 0.0024997827131301165)","('NON-ESG', 0.0014425115659832954)"
Line 1032,"306-2 Management of significant waste-related impactsTI applies a three-step approach to waste and materials management: examine what we need, reuse what we can and recycle what is allowed.","('Waste_And_Hazardous_Materials_Management', 0.9838162064552307)","('Air_Quality', 0.0011438443325459957)","('Product_Design_And_Lifecycle_Management', 0.0011234647827222943)","([], 0.9838162064552307)","('NON-ESG', 0.0011438443325459957)","('NON-ESG', 0.0011234647827222943)"
Line 1033,Most of the materials we need are for fabricating semiconductors.,"('Supply_Chain_Management', 0.33775079250335693)","('Product_Design_And_Lifecycle_Management', 0.214899942278862)","('Waste_And_Hazardous_Materials_Management', 0.15643692016601562)","('NON-ESG', 0.33775079250335693)","('NON-ESG', 0.214899942278862)","('NON-ESG', 0.15643692016601562)"
Line 1034,"When purchasing materials and chemicals, we consider the resulting waste and whether an opportunity exists to reuse existing materials, purchase recycled materials or use environmentally friendly items instead.","('Waste_And_Hazardous_Materials_Management', 0.91713947057724)","('Product_Design_And_Lifecycle_Management', 0.029486848041415215)","('Water_And_Wastewater_Management', 0.005514653865247965)","([], 0.91713947057724)","('NON-ESG', 0.029486848041415215)","('NON-ESG', 0.005514653865247965)"
Line 1035,See the Waste and Materials Management section of TIs 2021 Corporate Citizenship Report for information on our waste diversion goal and activities.,"('Waste_And_Hazardous_Materials_Management', 0.9839411377906799)","('Data_Security', 0.0011363623198121786)","('Product_Design_And_Lifecycle_Management', 0.001100333989597857)","([], 0.9839411377906799)","('NON-ESG', 0.0011363623198121786)","('NON-ESG', 0.001100333989597857)"
Line 1036,"We also follow strict standards and protocols for responsibly purchasing, transporting, tracking and disposing of chemicals safely.","('Waste_And_Hazardous_Materials_Management', 0.46645405888557434)","('Product_Quality_And_Safety', 0.21285319328308105)","('Product_Design_And_Lifecycle_Management', 0.10094361007213593)","('NON-ESG', 0.46645405888557434)","('NON-ESG', 0.21285319328308105)","('NON-ESG', 0.10094361007213593)"
